codigoParlamentar,CodigoMateria,Ementa,IndicadorAutorPrincipal,AnoMateria,AutoriasSigla
6335,161277,"Dispõe sobre o Plano Nacional de Prevenção e Enfrentamento à Violência contra a Mulher, de que trata a Lei nº 13.675, de 11 de junho de 2018, que disciplina a organização e o funcionamento dos órgãos responsáveis pela segurança pública, nos termos do § 7º do art. 144 da Constituição Federal; cria a Política Nacional de Segurança Pública e Defesa Social (PNSPDS); institui o Sistema Único de Segurança Pública (Susp); altera a Lei Complementar nº 79, de 7 de janeiro de 1994, a Lei nº 10.201, de 14 de fevereiro de 2001, e a Lei nº 11.530, de 24 de outubro de 2007; e revoga dispositivos da Lei nº 12.681, de 4 de julho de 2012.",Sim,2023,PL
6335,161319,"Requer, nos termos dos arts. 336, II, e 338, IV, do Regimento Interno do Senado Federal, urgência para o PL 4224/2021, que “institui medidas de proteção à criança e ao adolescente contra a violência nos estabelecimentos educacionais ou similares; prevê a Política Nacional de Prevenção e Proteção ao Abuso e Exploração Sexual da Criança e do Adolescente; e altera o Decreto-Lei nº 2.848, de 7 de dezembro de 1940 (Código Penal), e as Leis nºs 8.072, de 25 de julho de 1990 (Lei dos Crimes Hediondos), e 8.069, de 13 de julho de 1990 (Estatuto da Criança e do Adolescente)”.",Sim,2023,REQ
6335,161275,"Requer, nos termos do art. 58, § 2º, II, da Constituição Federal e do art. 93, I, do Regimento Interno do Senado Federal, a realização de audiência pública, para instruir o PL nº 610, de 2021, que “institui a Campanha Nacional de Incentivo à Doação de Cabelo a Pessoas Carentes em Tratamento de Câncer e Vítimas de Escalpelamento”.",Sim,2023,REQ
6335,161075,"Requer a realização de diligência externa no território indígena Yanomami, no Estado de Roraima, com o objetivo de visitar as comunidades indígenas Yanomami, Ye’kwana e Sanöma da região de Auaris.",Sim,2023,REQ
6335,161318,Requer oitiva da Comissão de Segurança Pública sobre o PL 2234/2022.,Não,2023,RQS
6335,161317,Requer oitiva da Comissão de Assuntos Sociais sobre o PL 2234/2022.,Não,2023,RQS
6335,161316,Requer oitiva da Comissão de Assuntos Econômicos sobre o PL 2234/2022.,Não,2023,RQS
6335,161269,Dispõe sobre o regime jurídico aplicável ao Banco Central.,Não,2023,PEC
6335,161166,"Requer que sejam prestadas, pela Senhora Ministra de Estado dos Povos Indígenas, Sonia Guajajara, informações sobre a delegação do Ministério dos Povos Indígenas para a Conferência do Clima das Nações Unidas - COP28.",Sim,2023,REQ
6335,161165,"Requer que sejam prestadas, pela Senhora Ministra de Estado do Meio Ambiente e Mudança do Clima, Marina Silva, informações sobre a delegação do Ministério do Meio Ambiente e Mudança do Clima para a Conferência do Clima das Nações Unidas - COP28.",Sim,2023,REQ
6335,161494,Acrescenta o § 7º ao art. 220 da Constituição Federal para dispor sobre a proteção da liberdade de imprensa.,Não,2023,PEC
6335,161478,"Altera a Lei nº 14.232, de 28 de outubro de 2021, para determinar a publicação periódica de relatórios do Registro Unificado de Dados e Informações sobre Violência contra as Mulheres.",Sim,2023,PL
6335,161350,"Altera o Regimento Interno do Senado Federal, para ampliar de seis para doze meses o prazo para o exercício do cargo de líder e vice-líder da bancada feminina e explicitar que a escolha se dará mediante eleição.",Não,2023,PRS
6335,161349,"Altera a Resolução nº 9, de 2013, para dispor sobre a eleição da Procuradora Especial da Mulher.",Não,2023,PRS
6335,161140,"Altera a Lei nº 11.771, de 17 de setembro de 2008, que dispõe sobre a Política Nacional de Turismo, define as atribuições do Governo Federal no planejamento, desenvolvimento e estímulo ao setor turístico; revoga a Lei nº 6.505, de 13 de dezembro de 1977, o Decreto-Lei nº 2.294, de 21 de novembro de 1986, e dispositivos da Lei nº 8.181, de 28 de março de 1991; e dá outras providências, para estabelecer as obrigações das organizadoras de eventos de lazer e entretenimento de grande porte.",Sim,2023,PL
6335,161321,"Requer, nos termos do art. 58, § 2º, II, da Constituição Federal e do art.93, incisos I e II, do Regimento Interno do Senado Federal, a realização de audiência pública com o objetivo de instruir o PL 826/2019, que “institui o Programa Nacional de Vacinação em Escolas Públicas” e debater a obrigatoriedade de vacinação contra Covid-19 em crianças, em virtude eventual inclusão da vacina no Programa Nacional de Imunização (PNI)",Não,2023,REQ
6335,161373,"Requer voto de repúdio à Venezuela pelo escalonamento da tensão ora existente entre a Venezuela e a Guiana por força da disputa territorial envolvendo região de Essequibo, buscando respeito aos tratados internacionais, à integridade territorial da Guiana e clamando por uma solução política, consensual, pacífica e duradoura para o conflito.",Não,2023,RQS
6335,161064,Requer urgência na tramitação da MSF 77/2023.,Sim,2023,REQ
6335,161214,"Requer, nos termos do art. 58, § 2º, II, da Constituição Federal e do art. 93, I, do Regimento Interno do Senado Federal, a inclusão do nome da Dra. Ângela Gandra nos debates sobre o ""homescholling"", em aditamento ao Requerimento nº 125, de 2023 – CE, aprovado para instruir o PL nº 1338/2022.",Sim,2023,REQ
6335,161448,"Requer a retirada da Emenda nº 61-S ao PL nº 2331/2022, que “altera a Medida Provisória nº 2.228-1, de 6 de setembro de 2001, e a Lei nº 12.485, de 12 de setembro de 2011, para incluir a oferta de serviços de vídeo sob demanda ao público brasileiro como fato gerador da Contribuição para o Desenvolvimento da Indústria Cinematográfica Nacional – CONDECINE”.",Sim,2023,REQ
6335,161010,"Acrescenta o inciso XIX ao art. 49, modifica o § 4º e acrescenta o § 8º ao art. 231 da Constituição Federal, para dispor sobre a competência para aprovar a demarcação de terras indígenas e seus efeitos.",Não,2023,PEC
6335,160732,"Requer informações a Senhora Ministra de Estado das Mulheres, Cida Gonçalves, sobre a campanha ""Brasil sem Misoginia"", lançada em 25 de outubro do corrente ano por este Ministério das Mulheres.",Sim,2023,RQS
6335,160704,"Requer, nos termos do art. 58, § 2º, II, da Constituição Federal e do art. 93, II, do Regimento Interno do Senado Federal, a realização de audiência pública, com o objetivo de instrução de Projeto que institui o dia nacional da MIELOMENINGOCELE.",Não,2023,REQ
6335,160728,"Altera a Constituição Federal, para estabelecer programação orçamentária mínima para o Ministério da Defesa e dispor sobre projetos estratégicos para a Defesa Nacional, e acrescenta artigo ao Ato das Disposições Constitucionais Transitórias, para estabelecer regra de transição.",Não,2023,PEC
6335,160960,"Acrescenta o inciso XIX ao art. 49; modifica o §4º e acrescenta o §8º, ambos no Art. 231, da Constituição Federal.",Não,2023,PEC
6335,160771,"Requer inserção em ata de voto de repúdio à Secretária Nacional de Planejamento e Finanças do Partido dos Trabalhadores, nomeada para o Conselho de Administração da Itaipu Binacional, Gleide Andrade de Oliveira, pelas mensagens publicadas em rede social alegando que Israel é ""uma vergonha para humanidade"" e não merece ser Estado.",Não,2023,RQS
6335,160976,"Altera o inciso XLII do art. 5º da Constituição Federal, para prever a inafiançabilidade e a imprescritibilidade dos crimes que envolvam pedofilia.",Não,2023,PEC
6335,160956,"Altera os incisos XVIII e XIX do art. 7° da Constituição Federal, para ampliar a duração da licença-maternidade, licença paternidade e adotante.",Não,2023,PEC
6335,160772,Requer realização de sessão especial para comemorar os sessenta anos da imigração sul coreana no Brasil.,Não,2023,RQS
6335,160965,Requer a realização de Sessão de Debate Temático destinado a discutir a real situação enfrentada pelo Estado de Israel no momento atual da guerra contra o Hamas.,Não,2023,RQS
6335,160718,"Requer, nos termos do art. 58, § 2º, II, da Constituição Federal e do art. 93, II, do Regimento Interno do Senado Federal, que na Audiência Pública objeto do REQ 111/2023 - CAS, com o objetivo de debater os riscos impostos pelo uso dos dispositivos eletrônicos para fumar (DEFs), sejam incluídas as convidadas que especifica.",Não,2023,REQ
6335,160684,Acrescenta o inciso LXXX ao art. 5º da Constituição Federal para tornar imprescritível o crime de tráfico de crianças e adolescentes.,Não,2023,PEC
6335,160917,"Requer, nos termos do art. 58, § 2º, II, da Constituição Federal e do art.93, incisos I e II, do Regimento Interno do Senado Federal, a realização de audiência pública com o objetivo de instruir o PL 826/2019, que “institui o Programa Nacional de Vacinação em Escolas Públicas” e debater a obrigatoriedade de vacinação contra Covid-19 em crianças, em virtude eventual inclusão da vacina no Programa Nacional de Imunização (PNI).",Não,2023,REQ
6335,160679,"Requer a realização de Sessão de Debates Temáticos, a ser realizada em data oportuna, a fim de discutir os desafios e propostas do Brasil para a COP 28.",Não,2023,RQS
6335,160901,"Altera a Lei nº 10.257, de 10 de julho de 2001 (Estatuto da Cidade), para incluir diretriz de política urbana relativa à construção, instalação, sinalização, higienização e conservação de equipamentos de uso coletivo.",Sim,2023,PL
6335,160735,Requer a realização de Sessão Especial destinada a comemorar o Dia Nacional do Delegado de Polícia.,Não,2023,RQS
6335,160933,Altera as regras e o rito das súmulas vinculantes.,Não,2023,PEC
6335,160608,"Acrescenta § 3º e 4º ao art. 150 do Regimento Interno do Senado Federal, para garantir, em comissão parlamentar de inquérito, o mesmo tempo de leitura do relatório do relator para a leitura de cada um dos relatórios de eventuais votos em separado e para estipular prazo mínimo entre a apresentação de relatório, ainda que parcial, e sua votação pelo colegiado.",Não,2023,PRS
6335,160456,"Requer a realização de Sessão Especial destinada a celebrar o ""Outubro Rosa - Mês de conscientização sobre o câncer de mama"".",Não,2023,RQS
6335,160275,"Institui a Frente Parlamentar Mista da Inteligência Artificial, Tecnologia da Informação, Segurança Cibernética e Combate à Desinformação (Frente Parlamentar da Segurança Digital).",Não,2023,PRS
6335,160443,Requer a inclusão de convidado para participação na Audiência Pública objeto do REQ 150/2023 - CAE.,Sim,2023,REQ
6335,160430,"Requer inserção em ata de voto de solidariedade ao Estado de Israel e, ao mesmo tempo, de repúdio ao ataque do Hamas sofrido desde o dia 07 de outubro de 2023.",Não,2023,RQS
6335,160374,Atribui mandato de quinze anos e exigência de idade mínima de cinquenta anos aos Ministros do Supremo Tribunal Federal e promove modificações no processo de escolha dos membros dessa Corte e dos Tribunais Superiores.,Não,2023,PEC
6335,160604,Requer a realização de Sessão Especial destinada a celebrar o dia da Bíblia.,Não,2023,RQS
6335,160677,"Requer que sejam prestadas, pelo Senhor Ministro de Estado da Fazenda, Fernando Haddad, informações sobre a exposição “O Grito”, em exibição na Galeria Principal da CAIXA Cultural Brasília de 17 de outubro a 17 de dezembro.",Sim,2023,RQS
6335,160674,"Altera a Lei Complementar nº 101, de 4 de maio de 2000, para dispor sobre a concessão de empréstimos com recursos públicos a países estrangeiros.",Não,2023,PLP
6335,160597,"Requer voto de repúdio ao juiz da 12ª Vara Criminal de Cuiabá, Wladymir Perri, por ter decretado voz de prisão a uma mãe depois de se expressar contra um homem acusado de matar seu filho.",Não,2023,RQS
6335,160654,"Requer, nos termos do art. 222 do Regimento Interno do Senado Federal, inserção em ata de voto de repúdio ao juiz da 12ª Vara Criminal de Cuiabá, Wladymir Perri, por ter decretado voz de prisão a uma mãe depois de se expressar contra um homem acusado de matar seu filho.",Não,2023,RQS
6335,160605,Requer voto de solidariedade ao Programa Mais Médicos e aos Médicos Brasileiros Formados no Exterior em razão de campanha difamatória veiculada na mídia.,Não,2023,RQS
6335,160337,"Requer, nos termos do art. 93, I, do Regimento Interno do Senado Federal, a realização de audiência pública, com o objetivo de instruir o PL 2524/2022, que “estabelece regras relativas à economia circular do plástico; altera a Lei nº 9.605, de 12 de fevereiro de 1998, para dar coercitividade à nova Lei, tipificando condutas relativas ao seu descumprimento; e altera a Lei nº 14.119, de 13 de janeiro de 2021, para incluir as atividades das cooperativas e associações de catadores de materiais reutilizáveis e recicláveis no Programa Federal de Pagamento por Serviços Ambientais”.",Não,2023,REQ
6335,160615,"Altera a Lei nº 11.634, de 27 de dezembro de 2007, que dispõe sobre o direito da gestante ao conhecimento e a vinculação à maternidade onde receberá assistência no âmbito do Sistema Único de Saúde, para garantir à mulher cuja gestação termine em abortamento ou em morte perinatal o direito a permanecer em área distinta daquela onde estão alojadas as mães acompanhadas de nascituros.",Sim,2023,PL
6335,160593,Altera o art. 159 da Constituição Federal para instituir compensação financeira em prol do Fundo de Participação dos Municípios no intuito de assegurar a esse Fundo participação percentual no produto interno bruto igual à observada no exercício de 2022.,Não,2023,PEC
6335,160441,"Altera a Lei nº 8.069, de 13 de julho de 1990, que dispõe sobre o Estatuto da Criança e do Adolescente e dá outras providências, para dispor sobre o direito da criança e do adolescente à saúde mental.",Sim,2023,PL
6335,160411,"Requer, nos termos do art. 58, § 2°, II e V, da Constituição Federal, que seja convidada a Exma. Sra. Simone Tebet, Ministra de Estado do Planejamento e Orçamento, a comparecer a esta Comissão, a fim de prestar informações sobre sua fala na Comissão de Mista de Orçamento (CMO), no Congresso Nacional (CN), referente à liberação de empréstimo de US$ 1 bilhão à Argentina pela CAF.",Não,2023,REQ
6335,160166,"Requer a realização de Sessão Especial, no dia 17/10/2023, em homenagem aos 10 anos de criação da Procuradoria Especial da Mulher do Senado Federal.",Não,2023,RQS
6335,160148,Altera o §1º do art. 231 da Constituição Federal para definir marco temporal de demarcação das terras tradicionalmente ocupadas pelos povos indígenas.,Não,2023,PEC
6335,160656,"Requer, nos termos do art. 58, § 3º, da Constituição Federal e dos arts. 74, III, e 145 do Regimento Interno do Senado Federal, a constituição de uma Comissão Parlamentar de Inquérito para investigar o seguinte fato determinado: “Os efeitos da responsabilidade jurídica socioambiental da empresa Braskem S.A decorrente do maior acidente ambiental urbano já constatado no País, Caso Pinheiro/Braskem, em Maceió, Alagoas.",Não,2023,RQS
6335,159994,Requer a criação da Subcomissão Municipalista no âmbito da Comissão de Assuntos Econômicos (CAE).,Não,2023,REQ
6335,160175,Requer a retirada do Requerimento Nº 400/2023.,Sim,2023,REQ
6335,160045,"Requer, nos termos do art. 58, § 2º, II, da Constituição Federal e do art. 93, II, do Regimento Interno do Senado Federal, adir o cronograma das reuniões de trabalhos ao Requerimento nº 70/2023-CAS, que trata da realização de diligências e audiência pública em Pernambuco, acerca dos prédios-caixão com problemas estruturais para verificar in loco e debater a real situação das condições dos moradores, sejam inquilinos ou proprietários, em situação de vulnerabilidade social absoluta.",Não,2023,REQ
6335,160544,"Requer, nos termos do art. 58, § 3º, da Constituição Federal e do §1° do art. 76, combinado com o art. 152, do Regimento Interno do Senado Federal, a prorrogação por mais 57 (cinquenta e sete) dias da duração da Comissão Parlamentar de Inquérito criada a partir do Requerimento nº 292/2023 destinada a investigar a liberação, pelo Governo Federal, de recursos públicos para ONGs, e OSCIPs, bem como a utilização, por essas entidades, desses recursos e de outros por elas recebidos do exterior, a partir do ano de 2002 até a data de 1º de janeiro de 2023, a concentração desses recursos em atividades-meio, de forma a descumprir os objetivos para os quais esses recursos foram destinados originalmente, o desvirtuamento dos objetivos da ação dessas entidades, operando inclusive contra interesses nacionais, casos de abuso de poder, com intromissão dessas entidades em funções institucionais do poder público e a aquisição, a qualquer título, de terras por essas entidades.",Não,2023,RQS
6335,159933,"Altera o art. 101 da Constituição Federal, para determinar a realização de arguição pública, pelo Senado Federal, dos Ministros do Supremo Tribunal Federal a cada oito anos.",Não,2023,PEC
6335,160011,"Altera o art. 5º da Constituição Federal, para prever como mandado de criminalização a posse e o porte de entorpecentes e drogas afins sem autorização ou em desacordo com determinação legal ou regulamentar.",Não,2023,PEC
6335,160095,"Requer a realização de Sessão Especial, no dia 5/10/2023, em comemoração aos 35 anos da promulgação da Constituição Federal de 1988.",Sim,2023,RQS
6335,160083,"Altera o inciso IV do art. 8º da Constituição Federal, para vedar, salvo prévia aquiescência individual dos membros das categorias profissionais e econômicas, a cobrança de contribuições de trabalhadores ou empregadores não filiados ao respectivo sindicato.",Não,2023,PEC
6335,160055,"Requer a realização de Sessão Especial, a fim de comemorar o aniversário de quarenta anos de criação da obra social Nossa Senhora da Gloria “Fazenda Esperança”.",Não,2023,RQS
6335,160194,Dispõe sobre a realização de plebiscito para decidir sobre a legalização do aborto.,Não,2023,PDL
6335,160221,"Requer a realização de audiência pública, com o objetivo de debater a criação do Dia Nacional do Povo Mestiço, a ser comemorado no dia 27 de junho de cada ano.",Sim,2023,REQ
6335,159686,"Requer, nos termos do art. 58, § 2º, II, da Constituição Federal e do art. 93, II, do Regimento Interno do Senado Federal, que na Audiência Pública objeto do REQ 85/2023 - CAS sejam incluídas convidadas.",Não,2023,REQ
6335,160004,"Requer, nos termos do art. 58, § 2º, II, da Constituição Federal e do art. 93, II, do Regimento Interno do Senado Federal, que na Audiência Pública objeto do REQ 85/2023 - CAS, sejam incluídos os convidados que especifica.",Não,2023,REQ
6335,160054,"Requer, nos termos dos arts. 336, II, e 338, IV, do Regimento Interno do Senado Federal, urgência para o PLC 90/2018, que ""altera dispositivos da Lei nº 11.947, de 16 de junho de 2009, para determinar que os Estados, os Municípios e o Distrito Federal forneçam recursos financeiros a fim de possibilitar o pleno funcionamento do Conselho de Alimentação Escolar (CAE) e aprovem normas complementares para operação do Programa Nacional de Alimentação Escolar (PNAE)""",Sim,2023,REQ
6335,160031,"Requer a realização de Sessão de Debates Temáticos com o objetivo de discutir o acordo de livre comércio Mercosul/UE, bem como debater sobre as medidas unilaterais protecionistas sob a égide de políticas ambientais e de mudanças climáticas que a União Europeia informou que submeteria a um protocolo adicional ao acordo.",Não,2023,RQS
6335,159966,"Modifica o art. 95 da Constituição Federal, para dispor sobre a vedação dos magistrados de atuar em processos patrocinados direta ou indiretamente por cônjuges, companheiros ou parentes até o segundo grau.",Não,2023,PEC
6335,159924,Acrescenta o art. 124 ao Ato das Disposições Constitucionais Transitórias para aumentar temporariamente a parcela do produto da arrecadação dos impostos sobre renda e proventos de qualquer natureza e sobre produtos industrializados devida ao Fundo de Participação dos Municípios.,Não,2023,PEC
6335,159578,"Requer, nos termos do art. 58, § 2º, II, da Constituição Federal e do art. 93, II, do Regimento Interno do Senado Federal, que na Audiência Pública objeto do REQ 66/2023 - CDH, sejam incluídos as convidados que especifica.",Não,2023,REQ
6335,159653,"Requer, nos termos do art. 58, § 2°, II e V, da Constituição Federal, que seja convidada a Senhora Nísia Verônica Trindade Lima, Ministra de Estado da Saúde, a comparecer a esta Comissão, a fim de prestar informações sobre a homologação, pelo Ministério da Saúde, da Resolução 715 de 20 de julho de 2023,que dispõe sobre as orientações estratégicas para o Plano Plurianual e para o Plano Nacional de Saúde provenientes da 17ª Conferência Nacional de Saúde e sobre as prioridades para as ações e serviços públicos de saúde aprovadas pelo Conselho Nacional de Saúde, que prevê a legalização do aborto e da maconha.",Não,2023,REQ
6335,159168,"Requer, nos termos do art. 58, § 2º, II, da Constituição Federal e do art. 93, II, do Regimento Interno do Senado Federal, a realização de audiência pública, com o objetivo de debater as condições insalubres dos trabalhadores do setor bancário.",Não,2023,REQ
6335,159416,"Requer a realização de Sessão Especial, em outubro, a fim de comemorar o aniversário de 25 anos da Associação Nacional dos Procuradores Municipais.",Não,2023,RQS
6335,159748,Requer a realização de Sessão Especial em alusão ao Dia Nacional do Estagiário.,Sim,2023,RQS
6335,159747,"Requer a realização de Sessão Especial em alusão ao Dia Internacional do Farmacêutico, comemorado no dia 25 de setembro.",Sim,2023,RQS
6335,159537,"Requer, nos termos do art. 199 do Regimento Interno do Senado Federal, a realização de Sessão Especial, no dia 30/10/2023, a fim de celebrar o 40º Aniversário da Associação Brasileira de Automação - GS1 Brasil.",Não,2023,RQS
6335,159167,"Requer nos termos do art. 93, I, do Regimento Interno do Senado Federal, a realização de audiência pública, com o objetivo de instruir o PL 1217/2023, que “dispõe sobre a proteção das pessoas com deficiência que não têm o necessário discernimento para os atos da vida civil”.",Não,2023,REQ
6335,159462,"Requer, nos termos do art. 58, § 2º, II, da Constituição Federal e do art. 93, II, do Regimento Interno do Senado Federal, a realização de audiência pública, no âmbito desta Comissão, com o objetivo de discutir o PL nº 3.696, de 2023, que “Altera a Medida Provisória nº 2.228-1, de 6 de setembro de 2001, que estabelece princípios gerais da Política Nacional do Cinema; a Lei nº 12.485, de 12 de setembro de 2011, que dispõe sobre a comunicação audiovisual de acesso condicionado; a Lei nº 11.437, de 28 de dezembro de 2006, que altera a destinação de receitas decorrentes da Contribuição para o Desenvolvimento da Indústria Cinematográfica Nacional – CONDECINE; a Lei nº 5.070, de 7 de julho de 1966, que cria o Fundo de Fiscalização das Telecomunicações e dá outras providências; a Lei nº 8.977, de 6 de janeiro de 1995, que dispõe sobre o Serviço de TV a Cabo e dá outras providências; e a Lei nº 9.472, de 16 de julho de 1997, para prorrogar o prazo de obrigatoriedade de exibição comercial de obras cinematográficas brasileiras e para prorrogar a política de cotas de tela na TV paga e dá outras providências”.",Não,2023,REQ
6335,159325,"Altera a Constituição Federal, para disciplinar a tramitação de projetos de resolução referentes ao regimento interno das Casas Legislativas.",Não,2023,PEC
6335,159321,Requer Homenagem de pesar pelo falecimento de Osvaldo Arns.,Não,2023,RQS
6335,159788,"Requer, nos termos dos arts. 336, III, e 338, III, do Regimento Interno do Senado Federal, urgência para o PRS 11/2019.",Não,2023,RQS
6335,159381,Requer voto de pesar pelo falecimento do ex-Deputado Eduardo Barbosa.,Sim,2023,RQS
6335,159176,Requer licença saúde,Sim,2023,REQ
6335,159536,Recurso para que a Emenda 18 ao PL 2384/2023 seja submetida ao Plenário.,Não,2023,R.S
6335,159190,"Requer seja demando à Polícia Federal a remessa, no prazo de 10 (dez) dias úteis, da relação dos nomes, dos dados de qualificação e de contato das pessoas que contracenaram com o repórter fotográfico Adriano Machado no 3º Andar do Palácio do Planalto, na tarde do dia 8 de janeiro de 2023, especificamente na cena do arrombamento de uma porta de vidro, que está gravada em imagens das câmeras internas do prédio disponibilizadas a esta CPMI.",Sim,2023,REQ
6335,159499,"Altera dispositivos da Lei nº 12.852, de 5 de agosto de 2013, que institui o Estatuto da Juventude, para dispor sobre o direito do jovem ao voluntariado.",Sim,2023,PL
6335,159715,Requer a criação de sessão especial fim de celebrar a amizade e as relações diplomáticas Brasil-Bahrein.,Não,2023,RQS
6335,159327,"Requer, nos termos dos arts. 336, II, e 338, II, do Regimento Interno do Senado Federal, urgência para o PL 2801/2022.",Sim,2023,RQS
6335,159529,"Requer, nos termos do art. 93, inciso I, do Regimento Interno do Senado Federal, a realização de audiência pública para instruir o PL nº 4168, de 2021, que “reconhece o cristianismo como manifestação cultural nacional”.",Sim,2023,REQ
6335,159500,"Requer a realização de audiência pública para discutir a Política Nacional de Prevenção da Automutilação e do Suicídio, instituída pela Lei nº 13.819, de 26 de abril de 2019.",Sim,2023,REQ
