codigoParlamentar,CodigoMateria,Ementa,IndicadorAutorPrincipal,AnoMateria,AutoriasSigla
3830,124116,Fixa alíquota máxima para cobrança do Imposto sobre Operações Relativas à Circulação de Mercadorias e sobre Prestações de Serviços de Transporte Interestadual e Intermunicipal e de Comunicação (ICMS) incidente nas operações internas com querosene de aviação.,Não,2015,PRS
3830,164610,"Requer urgência para o Projeto de Decreto Legislativo nº 307/2024, nos termos dos arts. 336, II, e 338, II, do Regimento Interno do Senado Federal.",Sim,2024,RQS
3830,164429,"Requer urgência para o Projeto de Lei nº 1818/2022, nos termos dos arts. 336, II, e 338,II, do Regimento Interno do Senado Federal.",Não,2024,RQS
3830,164607,"Requer urgência para o Projeto de Decreto Legislativo nº 266/2024, nos termos dos arts. 336, II, e 338, II, do Regimento Interno do Senado Federal.",Sim,2024,RQS
3830,162272,"Requer licença para desempenhar missão oficial, a fim de participar do Seminário: “Atualização do Código Civil Brasileiro - Diálogo com o Novo Código Civil Argentino.”, em Buenos Aires, Argentina.",Sim,2024,REQ
3830,162646,"Requer, nos termos do art. 93, I, do Regimento Interno do Senado Federal, que na Audiência Pública objeto do REQ 11/2024 - CCDD, com o objetivo de instruir o PL 2628/2022, que “dispõe sobre a proteção de crianças e adolescentes em ambientes digitais” seja incluído o convidado que especifica.",Sim,2024,REQ
3830,162839,Requer licenças de 01/04/24 a 09/04/24,Sim,2024,REQ
3830,163791,"Requer que seja convidada a Senhora Marina Silva, Ministra do Meio Ambiente e Mudança do Clima, a comparecer à Comissão de Constituição, Justiça e Cidadania",Sim,2024,REQ
3830,163300,"Autoriza regime extraordinário fiscal, financeiro e de contratações para atender necessidades decorrentes de calamidade pública ambiental regional ou local.",Não,2024,PEC
3830,162413,Requer a realização de Sessão Especial destinada a celebrar os 50 anos da Codevasf.,Sim,2024,RQS
3830,162099,"Altera os arts. 42, 93, 128 e 142 da Constituição Federal, para vedar o uso da aposentadoria como sanção quando do cometimento de infração disciplinar.",Não,2024,PEC
3830,162318,"Requer, licença em 06/02/24 e 21/02/24, nos termos dos arts. 13 e 215, I, “b”, do Regimento Interno do Senado Federal.",Sim,2024,REQ
3830,162500,"Requer criação de Comissão Parlamentar de Inquérito, composta de 11 membros titulares e 7 membros suplentes, para, no prazo de 180 dias, apurar fatos relacionados às denúncias e suspeitas de manipulação de resultados no futebol brasileiro, envolvendo jogadores, dirigentes e empresas de apostas.",Não,2024,RQS
3830,163036,Requer licença dia 12.03.2024.,Sim,2024,REQ
3830,161646,"Requer licença em 12/12/2023, nos termos dos arts. 13 e 215, I, “b”, do Regimento Interno do Senado Federal.",Sim,2023,REQ
3830,161269,Dispõe sobre o regime jurídico aplicável ao Banco Central.,Não,2023,PEC
3830,161307,Abre novo prazo de parcelamento especial de débitos dos municípios com seus Regimes Próprios de Previdência Social dos Servidores Públicos e com o Regime Geral de Previdência Social.,Não,2023,PEC
3830,160512,"Requer, licença no dia 26/09/2023, nos termos dos arts. 13 e 215, I, “b”, do Regimento Interno do Senado Federal.",Sim,2023,REQ
3830,160514,"Requer, Licença 05/09/2023, nos termos dos arts. 13 e 215, I, “b”, do Regimento Interno do Senado Federal.",Sim,2023,REQ
3830,160513,"Requer, licença em 03/10/2023, nos termos dos arts. 13 e 215, I, “b”, do Regimento Interno do Senado Federal.",Sim,2023,REQ
3830,160358,"Requer licença para desempenhar missão oficial, a fim de participar da Inauguração da Casa da Cidadania da Língua, em Coimbra, Portugal, e do Fórum Internacional Esfera, em Paris, França.",Sim,2023,REQ
3830,160656,"Requer, nos termos do art. 58, § 3º, da Constituição Federal e dos arts. 74, III, e 145 do Regimento Interno do Senado Federal, a constituição de uma Comissão Parlamentar de Inquérito para investigar o seguinte fato determinado: “Os efeitos da responsabilidade jurídica socioambiental da empresa Braskem S.A decorrente do maior acidente ambiental urbano já constatado no País, Caso Pinheiro/Braskem, em Maceió, Alagoas.",Não,2023,RQS
3830,160011,"Altera o art. 5º da Constituição Federal, para prever como mandado de criminalização a posse e o porte de entorpecentes e drogas afins sem autorização ou em desacordo com determinação legal ou regulamentar.",Não,2023,PEC
3830,160053,"Requer licença para desempenhar missão oficial, em Nova Iorque, Estados Unidos, com ônus para o Senado Federal.",Sim,2023,REQ
3830,159512,Requer licença para missão no exterior de 30.08 a 04.09.2023.,Sim,2023,REQ
3830,159817,"Requer licença, no dia 15/08/2023, para desempenhar missão política ou cultural de interesse parlamentar.",Sim,2023,REQ
3830,158971,Requer licença nos dias 01 e 02.08.2023.,Sim,2023,REQ
3830,158568,"Acrescenta § 8º ao art. 218 da Constituição Federal, estabelecendo o incremento gradual do montante aplicado em ciência, tecnologia e inovação até, no mínimo, 2,5% do produto interno bruto.",Não,2023,PEC
3830,158281,"Requer licença para desempenhar missão oficial, em Lisboa, Portugal, com ônus para o Senado Federal.",Sim,2023,REQ
3830,158004,Requer seja inserida em ata moção de apoio ao Reino do Marrocos.,Não,2023,RQS
3830,157776,Requer licença nos dias 17 e 23.05.2023,Sim,2023,REQ
3830,156581,Dispõe sobre a atualização monetária dos repasses de recursos federais aos Municípios.,Não,2023,PEC
3830,156754,"Requer licença de 18 a 23.04.2023, com ônus para o Senado Federal, para participar do evento ""Brasil Conference London"", em Londres.",Sim,2023,REQ
3830,156571,Altera o art. 144 da Constituição Federal para identificar a Polícia Hidroviária Federal como órgão do sistema de segurança pública.,Não,2023,PEC
3830,156685,Desarquivamento da PEC nº 9/2017 e do PLC nº 25/2018.,Não,2023,RQS
3830,156678,Desarquivamento do PL nº 3278/2021.,Não,2023,RQS
3830,156424,Altera a Constituição Federal para instituir a parcela mensal de valorização por tempo de exercício dos magistrados e membros do Ministério Público.,Não,2023,PEC
3830,157258,"Altera o art. 130 da Constituição Federal e acrescenta-lhe parágrafo, de modo a aprimorar o regramento e consolidar balizas institucionais necessárias ao bom funcionamento do Ministério Público de Contas brasileiro.",Não,2023,PEC
3830,156625,Desarquivamento do PLC 159/2017,Sim,2023,RQS
3830,156391,"Modifica os arts. 60, 61, 62 e 64 da Constituição Federal, para dispor sobre a iniciativa de proposições pelo Presidente da República.",Não,2023,PEC
3830,156325,"Realização de sessão especial, no dia 16/05/2023, com a finalidade de celebrar os 75 anos da criação do Estado de Israel.",Não,2023,RQS
3830,156106,Requer licença dia 07.03.2023,Sim,2023,REQ
3830,155992,"Desarquivamento das seguintes proposições, na forma do art. 332, § 1º, do Regimento Interno: PL 4101/2021, PL 3084/2021, PL 2733/2021, PL 2727/2021, PL 2606/2021, PL 2562/2021, PL 2097/2021, PL 526/2021, PL 525/2021, PL 524/2021, PEC 76/2019, PLC 64/2018.",Não,2023,RQS
3830,156502,Desarquivamento do PLS nº 98/2015.,Sim,2023,RQS
3830,155958,Desarquivamento da PEC nº 7 de 2018.,Não,2023,RQS
3830,156092,"Requeiro, nos termos do art. 332, § 1º, do Regimento Interno do Senado Federal, o desarquivamento do PLC 29/2017, que “dispõe sobre normas de seguro privado; revoga dispositivos da Lei nº 10.406, de 10 de janeiro de 2002 (Código Civil);e dá outras providências”",Não,2023,RQS
3830,155991,"Desarquivamento das seguintes proposições: PLC 162/2015, PLC 88/2018, PLC 90/2018, PEC 38/2015, PLC 134/2017.",Não,2023,RQS
3830,155987,"Desarquivamento de proposições, na forma do art. 332, § 1º, do Regimento Interno.",Não,2023,RQS
3830,156418,Desarquivamento da PEC nº 8/2018.,Sim,2023,RQS
3830,154305,"Realização de sessão de debates temáticos, em data a ser definida, a fim de debater o PL nº 1293/2021.",Não,2022,RQS
3830,155158,"Submete à apreciação do Senado Federal, nos termos do art. 130-A , inciso V, da Constituição Federal, a indicação do Senhor ENGELS AUGUSTO MUNIZ, para ser reconduzido ao cargo do Conselho Nacional do Ministério Público - CNMP, na vaga reservada ao Senado Federal.",Não,2022,OFS
3830,155165,"Submete à apreciação do Senado Federal, nos termos do art. 103-B, inciso XIII, da Constituição Federal, combinado com o art. 6º, § 1º, da Resolução do Senado Federal n° 7, de 2005, o nome do Senhor LUIZ FERNANDO BANDEIRA DE MELLO FILHO, para ser reconduzido ao cargo do Conselho Nacional de Justiça - CNJ, na vaga destinada ao Senado Federal.",Não,2022,OFS
3830,154107,"Destaque para votação em separado da Emenda nº 40860018, apresentada ao PLN nº 5/2022.",Sim,2022,RQN
3830,152767,"Realização de Sessão de Debates Temáticos a fim de discutir o PL nº 6204/2019, e o tema da Desjudicialização da Execução Civil no Brasil.",Não,2022,RQS
3830,134999,Urgência para o Projeto de Lei da Câmara nº 141/2018.,Não,2018,RQS
3830,130409,"Submete à apreciação do Senado Federal, nos termos do art. 130-A, inciso VI, da Constituição Federal, e de acordo com a Resolução nº 7, de 2005, do Senado Federal, a indicação do Senhor LUIZ FERNANDO BANDEIRA DE MELLO FILHO, para compor o Conselho Nacional do Ministério Público, na vaga destinada ao Senado Federal.",Não,2017,OFS
3830,155216,Requer licença dia 23.11.2022,Sim,2022,REQ
3830,155024,Requer licença dia 05.10.2022,Sim,2022,REQ
3830,154870,Institui o piso salarial nacional do Fisioterapeuta e do Terapeuta Ocupacional.,Não,2022,PEC
3830,154748,Altera o art. 40 da Constituição Federal para incluir os guardas municipais no sistema de aposentadoria especial.,Não,2022,PEC
3830,154260,"Acrescenta o art. 105-A à Constituição Federal, para dispor sobre a súmula vinculante do Superior Tribunal de Justiça.",Não,2022,PEC
3830,154003,"Requeremos, nos termos do art. 58, § 3º, da Constituição Federal e dos arts. 74, III, e 145 do Regimento Interno do Senado Federal, a constituição de uma Comissão Parlamentar de Inquérito composta de 11 (onze) membros titulares e número de membros suplentes igual à metade dos titulares mais um, para, no prazo de 120 (cento e vinte) dias, com limite de despesas de R$ 110.000,00 (cento e dez mil reais), apurar eventual irregularidade e crimes na condução de obras e edificações, bem como responsabilidade de agentes e ex-agentes públicos relativamente às ações e omissões que resultaram na existência de obras públicas iniciadas e não-concluídas, no período de 2006 até o ano de 2018, e, ainda, possíveis irregularidades no Programa de Financiamento Estudantil - Fies, no mesmo período.",Não,2022,RQS
3830,153294,Encaminha laudo relativo à licença médica,Sim,2022,REQ
3830,153376,Requer licença no dia 31.05.2022,Sim,2022,REQ
3830,153531,"Altera a Constituição Federal para estabelecer que a União prestará auxílio financeiro aos Estados e ao Distrito Federal, com o objetivo de compensar perdas de arrecadação decorrentes da redução das alíquotas relativas ao Imposto sobre Circulação de Mercadorias e sobre Prestações de Serviços de Transporte Interestadual e Intermunicipal e de Comunicação – ICMS, incidente sobre o óleo diesel combustível e o gás liquefeito de petróleo, derivado de petróleo e de gás natural.",Não,2022,PEC
3830,153244,Requer licença no período de 17 a 18.05.2022.,Sim,2022,REQ
3830,153518,Altera o art. 225 da Constituição Federal para estabelecer diferencial de competitividade para os biocombustíveis.,Não,2022,PEC
3830,153183,"Requer retirada da emenda nº 01 de autoria do Senador Davi Alcolumbre, registrada no SEDOL nº SF/17990.46243-86.",Sim,2022,RQS
3830,152715,Altera o art. 199 da Constituição Federal para dispor sobre as condições e os requisitos para a coleta e o processamento de plasma humano.,Não,2022,PEC
3830,152387,Realização de Sessão Especial para homenagear os 49 anos da Embrapa.,Não,2022,RQS
3830,151585,"Altera a Emenda Constitucional nº 109, de 15 de março de 2021, para dispor sobre a concessão temporária de auxílio diesel a caminhoneiros autônomos, de subsídio para aquisição de gás liquefeito de petróleo pelas famílias de baixa renda brasileiras e de repasse de recursos da União com vistas a garantir a mobilidade urbana dos idosos, mediante a utilização dos serviços de transporte público coletivo, e autorizar a União, os Estados, o Distrito Federal e os Municípios a reduzirem os tributos sobre os preços de diesel, biodiesel, gás e energia elétrica, bem como outros tributos de caráter extrafiscal.",Não,2022,PEC
3830,151504,"Realização de Sessão de Debates Temáticos, no dia 07/02/2022, a fim de homenagear e relembrar as vítimas do holocausto e realizar a cerimônia do Yom HaShoá, ""Dia da Lembrança do Holocausto"".",Não,2022,RQS
3830,155698,"Requer apreciação pelo Plenário do Projeto de Lei do Senado nº 9, de 2017.",Não,2021,R.S
3830,150988,Dispõe sobre a incorporação tecnológica em saúde.,Não,2021,PEC
3830,150967,"Altera os arts. 100 e 166 da Constituição Federal, para prever meios alternativos de utilização dos valores decorrentes de precatórios e vedar a inclusão de emendas ao projeto de lei orçamentária nas hipóteses que especifica, e o art. 107 do Ato das Disposições Constitucionais Transitórias para excepcionar do Teto de Gastos as despesas que especifica.",Não,2021,PEC
3830,150820,Introduz a renda básica como direito social e altera o Ato das Disposições Constitucionais Transitórias para viabilizar a garantia de renda às famílias.,Não,2021,PEC
3830,150295,Requer licença no dia 23.09.2021.,Sim,2021,REQ
3830,150383,"Altera o inciso I do art. 56 da Constituição Federal, para prever que a investidura de parlamentar no cargo de chefe de missão diplomática de caráter permanente não dá ensejo à perda de seu mandato.",Sim,2021,PEC
3830,150462,"Autorização para desempenho de missão parlamentar, a fim de participar dos eventos de “25 anos de CPLP e Fórum Economia” e “IX Fórum Jurídico de Lisboa”, em Lisboa, Portugal.",Sim,2021,REQ
3830,149811,"Requer licença para desempenhar missão política ou cultural de interesse parlamentar, sem ônus para o Senado Federal, no meu Estado, em 01/07/2021. ...",Sim,2021,REQ
3830,149776,Sessão Especial para homenagear os paratletas que se destacaram na Paraolimpíada de Tóquio/Japão.,Não,2021,RQS
3830,149859,Requer licença dia 16.09.2021,Sim,2021,REQ
3830,149926,"Modifica o art. 3º da Emenda Constitucional nº 97, de 2017.",Não,2021,PEC
3830,149851,Requer licença dia 15.09.2021,Sim,2021,REQ
3830,149925,Inclui o §3° ao art. 28; e o §6° ao art. 77 da Constituição Federal.,Não,2021,PEC
3830,149279,Institui a Emenda das Oportunidades.,Não,2021,PEC
3830,148957,Requer licença para atividade política de interesse parlamentar no dia 30.06.2021,Sim,2021,REQ
3830,149082,"Dá nova redação ao inc. III, do § 10, e ao § 11, do art. 34, do Ato Das Disposições Constitucionais Transitórias.",Não,2021,PEC
3830,148979,Requer licença no dia 01.07.2021.,Sim,2021,REQ
3830,149009,Requer retirada do REQ 00184/2021.,Sim,2021,REQ
3830,147274,"Requer adição de assinatura ao requerimento registrado no SEDOL nº SF/21969.54647-34, de autoria do Senador Jader Barbalho.",Sim,2021,RQS
3830,147421,Requer licença para atividade política de interesse parlamentar.,Sim,2021,REQ
3830,147192,"Altera a Lei nº 4.320, de 17 de março de 1964, que estatui Normas Gerais de Direito Financeiro para elaboração e controle dos orçamentos e balanços da União, dos Estados, dos Municípios e do Distrito Federal, para determinar a identificação, na publicidade oficial de obras públicas, da autoria de emenda parlamentar inserida na Lei Orçamentária Anual.",Sim,2021,PL
3830,147649,Adição de assinatura ao RQS nº 1097/2021.,Sim,2021,RQS
3830,147635,Moção de Apelo à Comunidade Internacional relativa ao processo de vacinação contra a COVID-19 no Brasil.,Não,2021,RQS
3830,146066,"Requeiro, nos termos dos arts. 13 e 215, I, “b”, do Regimento Interno do Senado Federal, em face do que dispõe o art. 55, III, da Constituição Federal, licença para desempenhar missão política ou cultural de interesse parlamentar, sem ônus para o Senado Federal, em Brasília-DF, de 08/12/2020 a 10/12/2020, a fim de cumprir agenda político-institucional na Residência Oficial.",Sim,2020,REQ
3830,145980,"Denomina ""Estúdio Carlos Alberto Pereira"" o estúdio da TV Senado situado no Salão Azul.",Sim,2020,PRS
3830,145714,"Requer licença para desempenhar missão política ou cultural de interesse parlamentar, sem ônus para o Senado Federal (RISF, arts. 13 e 215, I, b; CF, art. 55, III)",Sim,2020,REQ
3830,145604,"Requeiro, nos termos dos arts. 13 e 215, I, “b”, do Regimento Interno do Senado Federal, em face do que dispõe o art. 55, III, da Constituição Federal, licença para desempenhar missão política ou cultural de interesse parlamentar, sem ônus para o Senado Federal, em Brasília-DF, em 25/11/2020, a fim de participar de reunião com o Excelentíssimo Senhor Ministro da Saúde, Eduardo Pazuello, bem como com o Excelentíssimo Senhor Presidente da República, Jair Bolsonaro.",Sim,2020,REQ
3830,145651,"Indicação do nome do Sr. LUIZ FERNANDO BANDEIRA DE MELLO FILHO para compor o Conselho Nacional de Justiça - CNJ, na vaga destinada ao Senado Federal.",Sim,2020,OFS
3830,145492,"Requeiro, nos termos dos arts. 13 e 215, I, “b”, do Regimento Interno do Senado Federal, em face do que dispõe o art. 55, III, da Constituição Federal, licença para desempenhar missão política ou cultural de interesse parlamentar, sem ônus para o Senado Federal, em Brasília-DF, em 18/11/2020, a fim de participar de audiências externas.",Sim,2020,REQ
3830,145393,"Requeiro, nos termos dos arts. 13 e 215, I, “b”, do Regimento Interno do Senado Federal, em face do que dispõe o art. 55, III, da Constituição Federal, licença para desempenhar missão política ou cultural de interesse parlamentar, sem ônus para o Senado Federal, em Brasília-DF, em 04/11/2020, a fim de participar de reunião com o Excelentíssimo Senhor Bento Albuquerque, Ministro de Estado de Minas e Energia.",Sim,2020,REQ
3830,145093,"Requeiro, nos termos dos arts. 13 e 215, I, “b”, do Regimento Interno do Senado Federal, em face do que dispõe o art. 55, III, da Constituição Federal, licença para desempenhar missão política ou cultural de interesse parlamentar, sem ônus para o Senado Federal, em Brasília-DF, em 01/10/2020, a fim de cumprir agenda político-institucional na Residência Oficial e no Senado Federal.",Sim,2020,REQ
3830,145027,"Requeiro, nos termos dos arts. 13 e 215, I, “b”, do Regimento Internodo Senado Federal, em face do que dispõe o art. 55, III, da Constituição Federal,licença para desempenhar missão política ou cultural de interesse parlamentar,sem ônus para o Senado Federal, em Brasília-DF, em 29/09/2020, a fim de participarda Reunião semipresencial de instalação e eleição da Comissão Mista de Orçamento,na Câmara dos Deputados, além de Reunião com o Presidente Jair Bolsonaro, noPalácio do Planalto.",Sim,2020,REQ
3830,145136,"Requeiro, nos termos dos arts. 13 e 215, I, “b”, do Regimento Interno do Senado Federal, em face do que dispõe o art. 55, III, da Constituição Federal, licença para desempenhar missão política ou cultural de interesse parlamentar, sem ônus para o Senado Federal, em Brasília-DF, em 07/10/2020, a fim de participar de reunião com o Excelentíssimo Senhor Presidente da República, Jair Bolsonaro, bem como Ministros e Senadores, realizado no Palácio do Planalto.",Sim,2020,REQ
3830,144782,"Requeiro, nos termos dos arts. 13 e 215, I, “b”, do Regimento Interno doSenado Federal, em face do que dispõe o art. 55, III, da Constituição Federal, licençapara desempenhar missão política ou cultural de interesse parlamentar, sem ônuspara o Senado Federal, em Brasília, DF, em 17/09/2020, a fim de cumprir agendana Residência Oficial.",Sim,2020,REQ
3830,145094,"Requeiro, nos termos dos arts. 13 e 215, I, “b”, do Regimento Interno do Senado Federal, em face do que dispõe o art. 55, III, da Constituição Federal, licença para desempenhar missão política ou cultural de interesse parlamentar, sem ônus para o Senado Federal, em Brasília-DF, em 06/10/2020, a fim de cumprir agenda político-institucional na Residência Oficial e no Senado Federal.",Sim,2020,REQ
3830,145493,"Requeiro, nos termos dos arts. 13 e 215, I, “b”, do Regimento Interno do Senado Federal, em face do que dispõe o art. 55, III, da Constituição Federal, licença para desempenhar missão política ou cultural de interesse parlamentar, sem ônus para o Senado Federal, em Brasília-DF, em 19/11/2020, a fim de participar de reunião com o Excelentíssimo Senhor Presidente da República, Jair Bolsonaro, realizada no Palácio do Planalto.",Sim,2020,REQ
3830,144509,"Requeiro, nos termos dos arts. 13 e 215, I, “b” do Regimento Interno doSenado Federal, em face do que dispõe o art. 55, III da Constituição Federal, licençapara desempenhar missão política ou cultural de interesse parlamentar, sem ônuspara o Senado Federal, em Brasília, DF, em 30/07/2020, a fim de cumprir agendana Residência Oficial.",Sim,2020,REQ
3830,144423,"Requeiro, nos termos dos arts. 13 e 215, I, “b” do Regimento Internodo Senado Federal, em face do que dispõe o art. 55, III da Constituição Federal,licença para desempenhar missão política ou cultural de interesse parlamentar,sem ônus para o Senado Federal, em Brasília, DF, em 27/08/2020, a fim de participar da Solenidade de Posse dos Ministros Humberto Eustáquio Soares Martins e Jorge Mussi, nos cargos, respectivamente, de Presidente e de Vice-Presidente do Superior Tribunal de Justiça e do Conselho da Justiça Federal, conforme agenda em anexo.",Sim,2020,REQ
3830,144681,"Requeiro, nos termos dos arts. 13 e 215, I, “b” do Regimento Interno do Senado Federal, em face do que dispõe o art. 55, III da Constituição Federal, licença para desempenhar missão política ou cultural de interesse parlamentar, sem ônus para o Senado Federal, em Brasília, DF, em 09/09/2020, a fim de cumprir agenda na Residência Oficial.",Sim,2020,REQ
3830,144680,"Requeiro, nos termos dos arts. 13 e 215, I, “b” do Regimento Interno do Senado Federal, em face do que dispõe o art. 55, III da Constituição Federal, licença para desempenhar missão política ou cultural de interesse parlamentar, sem ônus para o Senado Federal, em Brasília, DF, em 03/09/2020, a fim de cumprir agenda na Residência Oficial.",Sim,2020,REQ
3830,144311,"Convite ao Senhor Paulo Guedes, Ministro da Economia, para que compareça ao Senado Federal, a fim de comentar suas declarações sobre a votação de Veto pelo Senado Federal, no dia de ontem, 19 de agosto.",Sim,2020,RQS
3830,144679,"Requeiro, nos termos dos arts. 13 e 215, I, “b” do Regimento Interno do Senado Federal, em face do que dispõe o art. 55, III da Constituição Federal,licença para desempenhar missão política ou cultural de interesse parlamentar,sem ônus para o Senado Federal, em Brasília, DF, em 01/09/2020, a fim de participar da Cerimônia de Lançamento do Programa Norte Conectado, realizado no palácio do Planalto, bem como da Solenidade de Posse de Suas Excelências os Senhores Ministros Mauro Campbell Marques e Raul Araújo Filho, nos cargos de Ministro Efetivo e Ministro Substituto do Tribunal Superior Eleitoral, realizado naquele Tribunal.",Sim,2020,REQ
3830,144678,"Requeiro, nos termos dos arts. 13 e 215, I, “b” do Regimento Interno do Senado Federal, em face do que dispõe o art. 55, III da Constituição Federal, licença para desempenhar missão política ou cultural de interesse parlamentar, sem ônus para o Senado Federal, em Brasília, DF, em 05/08/2020, a fim de cumprir agenda na Residência Oficial.",Sim,2020,REQ
3830,144676,"Requeiro, nos termos dos arts. 13 e 215, I, “b” do Regimento Interno do Senado Federal, em face do que dispõe o art. 55, III da Constituição Federal, licença para desempenhar missão política ou cultural de interesse parlamentar, sem ônus para o Senado Federal, em Brasília, DF, em 16/07/2020, a fim de cumprir agenda na Residência Oficial.",Sim,2020,REQ
3830,143980,"Requer licença para desempenhar missão política ou cultural de interesse parlamentar, sem ônus para o Senado Federal, no meu Estado, em 04/06/2020, a fim de desempenhar Missão Política.",Sim,2020,REQ
3830,143567,Requer licença para desempenho de agenda política,Sim,2020,REQ
3830,143668,Requer justificar ausência das sessões dos dias 22 e 23 de julho,Sim,2020,REQ
3830,143014,Denomina  “Hospital  Universitário Dr.  Papaléo Paes”  o Hospital  Universitário  da  Universidade Federal do Amapá – HU UNIFAP.,Sim,2020,PL
3830,142388,"a fim de cumprir agenda como Presidente do Senado Federal, conforme documento em anexo.",Sim,2020,REQ
3830,141442,"Requeiro, nos termos do art. 43, I do Regimento Interno do SenadoFederal, em face do que dispõem os arts. 55, III, e 56, II da Constituição Federal,licença saúde, de 20/03/2020 a 03/04/2020.",Sim,2020,REQ
