codigoParlamentar,CodigoMateria,Ementa,IndicadorAutorPrincipal,AnoMateria,AutoriasSigla
3830,128716,"Susta o Decreto nº 7.860, de 6 de dezembro de 2012, que “Cria a Comissão Nacional para Assuntos de Praticagem, com o objetivo de elaborar propostas sobre regulação de preços, abrangência das zonas e medidas de aperfeiçoamento relativas ao serviço de praticagem; e altera o Decreto nº 2.596, de 18 de maio de 1998”.",Sim,2017,PDS
3830,128679,"Acrescenta o § 8º ao art. 218 da Constituição Federal para instituir o Plano Nacional de Ciência, Tecnologia e Inovação.",Não,2017,PEC
3830,128622,"Altera a Constituição Federal, para estabelecer que a submissão de pessoa a condição análoga à escravidão constitui crime imprescritível.",Não,2017,PEC
3830,120006,"Altera a redação do art. 14 da Constituição Federal, inserindo incisos que criam dois novos institutos da democracia participativa, o Direito de Revogação e o Veto Popular.",Não,2015,PEC
3830,120289,"Altera o Título VIII, Capítulo II, Seção II, - ""Da Saúde"" -, da Constituição da República Federativa do Brasil de 1988, a fim de acrescentar o art. 198-A à Constituição Federal para instituir, no âmbito da administração pública federal, a carreira de Médico de Estado.",Não,2015,PEC
3830,122031,"Acrescenta o § 6º ao art. 167 da Constituição Federal, para proibir a criação, por lei, de encargo financeiro aos Estados, ao Distrito Federal e aos Municípios, decorrente da prestação de serviços públicos, sem a previsão da correspondente transferência de recursos financeiros, nos termos que especifica.",Não,2015,PEC
3830,122324,"Altera o inciso XVIII do art. 7º da Constituição Federal, para dispor sobre a licença-maternidade em caso de parto prematuro.",Não,2015,PEC
3830,122575,"Altera a alínea ""a"" do inciso IX do § 2º do art. 155 da Constituição Federal, para dispor que incide o Imposto sobre Operações Relativas à Circulação de Mercadorias e sobre Prestações de Serviços de Transporte Interestadual e Intermunicipal e de Comunicação na entrada de bem proveniente do exterior, ainda que a importação seja relativa à operação de arrendamento mercantil com ou sem possibilidade de transferência ulterior de propriedade.",Não,2015,PEC
3830,122690,"Altera o art. 37 da Constituição Federal, para restringir a quantidade de cargos em comissão na administração pública e estabelecer processo seletivo público.",Não,2015,PEC
3830,122734,"Altera o Artigo 62, § 1°, da Constituição Federal, que dispõe sobre as vedações à edição de medidas provisórias.",Não,2015,PEC
3830,123417,"Dá nova redação aos arts. 21, 22, 32, 144 e 167 da Constituição Federal, para reestruturar os órgãos de segurança pública.",Não,2015,PEC
3830,123909,"Acrescenta os arts. 101 e 102 ao Ato das Disposições Constitucionais Transitórias para instituir a desvinculação de receitas dos Estados, do Distrito Federal e dos Municípios.",Não,2015,PEC
3830,123978,"Altera a Seção IX do Capítulo I do Título IV da Constituição Federal para estabelecer que a Controladoria-Geral da União é instituição permanente, sob a forma de autarquia em regime especial, vinculada à Presidência da República, dotada de autonomia administrativa e financeira e cuja organização será disciplinada na forma de lei complementar, aplicando-se, no que couberem, as disposições sobre sua organização, composição e fiscalização aos órgãos e entidades congêneres das demais unidades da Federação.",Não,2015,PEC
3830,124219,Institui novo regime especial de pagamento de precatórios no Ato das Disposições Constitucionais Transitórias.,Não,2015,PEC
3830,124331,Cria o Fundo Nacional de Desenvolvimento Regional e o Fundo de Auxilio a Convergência das Alíquotas Interestaduais do Imposto sobre Operações Relativas à Circulação de Mercadorias e sobre Prestações de Serviços de Transporte Interestadual e Intermunicipal e de Comunicações.,Não,2015,PEC
3830,126473,"Altera os §§ 1º, 2º e 3º, do art. 17 da Constituição Federal e a ele acrescenta os §§ 5º, 6º, 7º e 8º, para autorizar distinções entre partidos políticos, para fins de funcionamento parlamentar, com base no seu desempenho eleitoral.",Não,2016,PEC
3830,127262,"Acrescenta o § 7º ao art. 225 da Constituição Federal, para permitir a realização das manifestações culturais registradas como patrimônio cultural brasileiro que não atentem contra o bem-estar animal.",Não,2016,PEC
3830,128196,Altera o art. 2º da Constituição Federal para estabelecer vedação absoluta à ocupação de funções de chefia de Poder por réus em processo penal.,Não,2017,PEC
3830,128252,"Altera a Constituição Federal, para garantir a participação de pessoas de ambos os sexos nas listas tríplices e sêxtuplas destinadas à escolha dos membros dos tribunais judiciários, dos tribunais de contas e dos Procuradores-Gerais do Ministério Público.",Não,2017,PEC
3830,128140,"Altera o art. 86 para assegurar imunidade relativa aos possíveis ocupantes do cargo de Presidente da República, assim como para garantir a independência e a harmonia entre os Poderes.",Não,2017,PEC
3830,128412,"Requerem, nos termos do art. 58, §3º, da Constituição Federal, e dos arts. 145 a 153 do Regimento Interno do Senado Federal, a criação de uma Comissão Parlamentar de Inquérito, composta de sete membros titulares e cinco suplentes, para, no prazo de cento e vinte dias, com limite de despesas de R$ 100.000,00 ( cem mil reais), investigar a contabilidade da previdência social, esclarecendo com precisão as receitas e as despesas do sistema, bem como todos os desvios de recursos, sejam anistias, desonerações, desvinculações, sonegação ou qualquer outro meio que propicie a retirada de fontes da previdência, focando não somente nos valores, mas também nos beneficiários desses desvios.",Não,2017,RQS
3830,128399,"Altera a Lei nº 9.605, de 12 de fevereiro de 1998, para agravar a pena para quem extrair recursos minerais sem a competente autorização, permissão, concessão ou licença, ou em desacordo com a obtida.",Sim,2017,PLS
3830,128384,"Requer a redistribuição do PLS 407/2016, para que também tramite para análise da CCJ.",Sim,2017,RQS
3830,128382,"Requer a redistribuição do PLS 412/2016, para que também tramite para análise da CCJ.",Sim,2017,RQS
3830,128389,"Requer a redistribuição do PLS 413/2016, para que também tramite para análise da CCJ.",Sim,2017,RQS
3830,128035,Altera o § 1º do art. 31 e o art. 75 da Constituição Federal para estabelecer os Tribunais de Contas como órgãos permanentes e essenciais ao controle externo da administração pública.,Não,2017,PEC
3830,120120,"Acrescenta §§ 2º e 3º ao art. 1º da Lei nº 9.965, de 27 de abril de 2000, que restringe a venda de esteróides ou peptídeos anabolizantes e dá outras providências.",Sim,2015,PLS
3830,122178,Dispõe sobre a obrigatoriedade de estabelecimentos comerciais realizarem análises químicas e microbiológicas de alimentos colocados à venda para o consumidor final.,Sim,2015,PLS
3830,127272,"Requer, nos termos dos incisos I e XI do art. 90, combinado com o art. 102-A e do item 12 da alínea C do inciso II do art. 255, do RISF, seja redistribuído para análise, também, pela Comissão de Meio Ambiente, Defesa do Consumidor e Fiscalização e Controle, do Projeto de Lei do Senado nº 392, de 2013.",Sim,2016,RQS
3830,127375,"Requer, nos termos do art. 258 do RISF, sejam apensados os Projetos de Lei do Senado nºs 59 e 264, de 2014; 162, de 2013 (já apensado aos Projetos de Lei do Senado nºs 752, de 2011; 63, de 2012; 179, de 2012; 175, de 2013 e 652, de 2015); 182, de 2012; 522, de 2007, 620, de 2011 e o Projeto de Lei da Câmara nº 118, de 2013.",Sim,2016,RQS
3830,119651,"Requer, nos termos do art. 332, § 1º, do RISF, a continuidade da tramitação das seguintes proposições: PEC 66/2013; PRS 41/2008; e PLS 66, 68, 76 e 658/2007; 300/2010; 433/2011; 378/2012; 178 e 254/2013.",Não,2015,RQS
3830,119659,"Requer, nos termos do art. 322, § 1º do RISF, o desarquivamento do PRS nº 84, de 2007.",Não,2015,RQS
3830,119682,"Requer, nos termos do art. 332 do Regimento Interno do Senado Federal, o desarquivamento das Propostas de Emenda à Constituição nºs 68 e 70, de 2007; e dos Projetos de Lei do Senado nºs 465 e 470, de 2007, todas de autoria do Senador Alvaro Dias.",Não,2015,RQS
3830,119688,"Requer, nos termos do art. 332, § 1º, do RISF, o desarquivamento do PLS 568/2009.",Não,2015,RQS
3830,119718,"Requerem, nos termos do art. 332, § 1º, do Regimento Interno do Senado Federal, a continuidade da tramitação do Projeto de Lei da Câmara nº 85, de 2009.",Não,2015,RQS
3830,119776,"Requer, nos termos do art. 332, § 1º, do RISF, o desarquivamento dos Prohjetos de Lei do Senado nºs 48, de 2009; 180, 205 e 251, de 2010.",Não,2015,RQS
3830,119777,"Requer, nos termos do art. 332, do Regimento Interno do Senado Federal, o desarquivamento do Projeto de Lei da Câmara nº 69, de 2010.",Não,2015,RQS
3830,119789,"Requerem, nos termos do art. 58 § 3º da Constituição Federal e dos arts. 145 a 155 do Regimento Interno do Senado Federal, a criação de uma comissão parlamentar de inquérito, composta de sete membros titulares e cinco suplentes, para, no parazo de cento e oitenta dias, investigar as irregularidades e os crimes relacionados aos procedimentos médicos de colocação de órteses e próteses no País, desde a indicação e execução dos procedimentos até a cobrança pelos produtos e serviços prestados.",Não,2015,RQS
3830,119790,"Requerem, nos termos do § 3º do art. 58 da Constituição Federal e do art. 145 do Regimento Interno do Senado Federal, a criação de comissão parlamentar de inquérito, composta por onze senadores titulares e seis suplentes, para investigar, no prazo de cento e oitenta dias, irregularidades praticadas pelo HSBC na abertura de contas na Suíça.",Não,2015,RQS
3830,125523,"Requer, com âmparo no disposto nos §§ 3º a 5º do art. 91, RISF, que o PLS 356/2012 seja submetido ao Plenário do Senado Federal.",Sim,2016,R.S
3830,119919,"Requer, nos termos do § 1º do art. 332, do RISF, o desarquivamento e consequente continuidade da tramitação do Projeto de Lei do Senado nº 102, de 2007 - Complementar.",Não,2015,RQS
3830,119921,"Requer, nos termos do § 1º, do art. 332, do RISF, o desarquivamento dos Projetos de Lei do Senado nºs 206, 273, 276, 284, 285, 289, 497, de 2007; 221 ,337, 339, 340,de 2008; 209, 214, 388, 389, 390, 391, 392, 396, 399, de 2009; e 194, de 2010.",Não,2015,RQS
3830,119922,"Requer, nos termos do § 1º do art. 332, do RISF, o desarquivamento do Projeto de Resolução nº 17, de 2009.",Não,2015,RQS
3830,120145,"Requerem, nos termos do art. 332, § 1º do RISF, o desarquivamento do PLC 160/2009.",Não,2015,RQS
3830,120153,"Requerem, nos termos do art. 332 do Regimento Interno do Senado federal, o desarquivamento da Proposta de Emenda à Constituição nº 73, de 2013.",Não,2015,RQS
3830,121045,"Requeiro, nos termos regimentais, aditamento ao RDR 07, de 2015, que convida o Ministro de Estado da Integração Nacional para prestar informações sobre o andamento das obras de interligação das águas do Rio São Francisco, aprovado por este colegiado em 11 de março de 2015, para que a presente Audiência seja realizada em conjunto com a Comissão de Meio Ambiente, Defesa do Consumidor e Fiscalização e Controle – CMA; e a Comissão Temporária para acompanhamento das Obras da Transposição e Revitalização da Bacia Hidrográfica do Rio São Francisco – CTBHSF",Sim,2015,RDR
3830,120233,"Requer, nos termos do art. 332, § 1º, do RISF, a continuidade de tramitação das seguintes proposições legislativas: PLS nº 205, de 2007; PRS nº 18, de 2005; PECs nº 27 e 28, de 2010.",Não,2015,RQS
3830,120265,"Requer, nos termos do art. 255, inciso II, alínea ""c"", item 12, do Regimento Interno do Senado Federal, que sobre o Projeto de Lei do Senado nº 422, de 2014, da Senadora Kátia Abreu, além da Comissão constante do despacho inicial, seja ouvida também a Comissão de Assuntos Econômicos.",Sim,2015,RQS
3830,120380,"Requer, nos termos do art. 332, § 1º, do Regimento Interno do Senado Federal, o desarquivamento da PEC nº 45, de 2009.",Não,2015,RQS
3830,120385,"Requer, nos termos do art. 332, § 1º, do Regimento Interno do Senado Federal, a continuidade da tramitação da PEC nº 45, de 2009.",Não,2015,RQS
3830,120519,"Requer, nos termos do art. 332, § 1º, do RISF, a continuidade da tramitação dos seguintes projetos: PLC nº 130, de 2009; PLS nº 581, de 2007 e PLS nº 466, de 2009.",Não,2015,RQS
3830,125461,"Requeiro a Vossa Excelência, nos termos do art. 58 da Carta Política de 1988 e do art. 93 do Regimento Interno do Senado Federal, ouvido o Plenário desta Comissão, que sejam convidados para integrar o rol dos oradores objeto do Requerimento nº 12/2016-CI, do Senador Garibaldi Alves Filho, os representantes da Associação Brasileira das Empresas Aéreas (ABEAR) e da Secretaria Nacional do Consumidor (SENACON).

",Sim,2016,RQI
3830,120939,"Requerem, nos termos do art. 58, § 3º, da Constituição Federal e dos arts 74, III, e 145 do Regimento Interno do Senado Federal, a constituição de uma Comissão Parlamentar de Inquérito composta de 11 (onze) membros titulares e 7 (sete) membros suplentes, para, no prazo de 120 (cento e vinte) dias, com limite de despesas de R$ 100.000,00 (cem mil reais), apurar as denúncias de que julgamentos realizados no âmbito do CARF - Conselho Administrativo de Recursos Fiscais foram manipulados para, em descompasso com a lei, anular autuações fiscais ou reduzir substancialmente os tributos cobrados, resultando em sonegação fiscal da ordem de até R$ 19.000.000.000,00 (dezenove bilhões de reais).


",Não,2015,RQS
3830,121471,"Requer, nos termos do art. 258, do RISF, o apensamento e a tramitação conjunta dos Projetos de Lei da Câmara nºs 71, de 2014 e 48, de 2014, por versarem sobre matéria correlata.",Sim,2015,RQS
3830,126341,"Requerimento para a realização de Audiência Pública, nesta Comissão de Desenvolvimento Regional e Turismo, com a finalidade de instruir matéria sob sua apreciação, mais particularmente o PLC nº 147, de 2015, que “Estabelece condições e requisitos para a classificação de estâncias; revoga as Leis nºs 2.661, de 3 de dezembro de 1955, e 4.458, de 6 de novembro de 1964; e dá outras providências”.",Sim,2016,RDR
3830,121499,"Requerem, nos termos do art. 58, § 3º, da Constituição da República Federativa do Brasil e do art. 145 do Regimento Interno do Senado Federal, a criação de Comissão Parlamentar de Inquérito, composta por 7 (sete) membros titulares e 7 (sete) suplentes, obedecido o princípio  da proporcionalidade partidária, com a finalidade de, no prazo de 180 (cento e oitenta) dias, com limite de despesa fixado em R$ 100.000,00 (cem mil reais), investigar a Confederação Brasileira de Futebol (CBF) e o Comitê Organizador Local da Copa do Mundo FIFA Brasil 2014 (COL), em especial  quanto a possíveis irregularidades em contratos feitos para a realização de partidas da seleção brasileira e de campeonatos organizados pela CBF, assim como para a realização da Copa das Confederações FIFA 2013 e da Copa do Mundo FIFA 2014.",Não,2015,RQS
3830,122327,Requer a oitiva da CMA sobre o PLS 19/2014.,Sim,2015,RQS
3830,122861,Requer a oitiva da CCJ sobre o PLS 142/2014.,Sim,2015,RQS
3830,122865,"Requer a revisão do despacho inicial da Mesa sobre o PLC nº 93, de 2015, para que a proposição seja redistribuida para apreciação, também, da Comissão de Assuntos Econômicos - CAE.",Sim,2015,RQS
3830,123073,"Requer, a revisão do despacho inicial da Mesa sobre o PLS nº 447, de 2015, para que a proposição seja redidtribuída para apreciação, também, pela Comissão de Assuntos Econômicos.",Sim,2015,RQS
3830,123520,"Requerem, nos termos dos artigos 154, III e § 5º; 199 e 200, todos do Regimento Interno do Senado Federal, a realização de Sessão Especial em homenagem ao centésimo quinquagésimo sexto aniversário da Igreja Presbiteriana do Brasil - IPB e centésimo quadragésimo quinto aniversário da Universidade Presbiteriana Mackenzie, a ocorrer em 19 de outubro de 2015; sendo sugerida a mesma data (segunda-feira).",Não,2015,RQS
3830,123565,"Requer, nos termos regimentais, em aditamento ao Requerimento nº 1153, de 2015, que a Sessão Solene Especial anteriormente marcada para o dia 19 de outubro do corrente, seja remarcada para o dia 16 de novembro de 2015, as 11 horas no Plenário do Senado Federal.",Não,2015,RQS
3830,123782,"Requerem, nos termos do art. 76, § 1º, I c/c art. 152, do RISF, a prorrogação de duração da Comissão Parlamentar de Inquérito de Assassinato de Jovens, criada nos termos do Requerimento nº 115, de 2015, composta por 11(onze) membros titulares e 7(sete) suplentes, para que prossigam, no prazo de prorrogação, as investigações referentes ao assassinato de jovens no Brasil.",Não,2015,RQS
3830,123844,"Requer, nos termos do art. 258 do IR, a tramitação em conjunto dos Projetos de Lei do Senado nºs 162/2013 (que já tramita em conjunto com os PLS nº 175, de 2013; 752, de 2011; 69 e 179, de 2012) e 652/2015, por versarem sobre a mesma matéria.",Sim,2015,RQS
3830,124337,"Requer, em aditamento aos RQS 93/2015 e RQS 1032/2015, nos termos do art. 58, § 3º , da Constituição Federal, combinado com o art. 152, RISF, a prorrogação  por 180 dias, da CPI destinada a investigar as irregularidas e os crimes relacionados aos procedimentos médicos de colocação de órteses e próteses no país.",Não,2015,RQS
3830,124990,"Requer, nos termos do art. 199, do Regimento Interno do Senado Federal, a realização de sessão especial no dia 10 de março de 2016, para comemoração do DIA MUNDIAL DO RIM.",Não,2016,RQS
3830,125597,"Requer, nos termos do art. 258, RISF, a tramitação conjunta dos seguintes projetos: PLS 537/2013 e PLS 626/2015, ambos complementares, por versarem sobre a mesma matéria. (Já tramitam em conjunto com o PLS 537/2013 os PLS 102/2007 e PLS 180/2013)
",Sim,2016,RQS
3830,122082,"Convoca plebiscito sobre a redução da maioridade penal, de dezoito para dezesseis anos, nos casos de crimes hediondos.",Não,2015,PDS
3830,123173,"Susta o Decreto nº 8.515, de 3 de setembro de 2015, que “Delega competência ao Ministro de Estado da Defesa para a edição de atos relativos a pessoal militar”.",Sim,2015,PDS
3830,119897,"Convoca plebiscito sobre a instituição de prisão perpétua para os crimes relacionados à pedofilia, ao narcotráfico e à corrupção ativa.",Não,2015,PDS
3830,120116,"Susta os efeitos da Resolução Homologatória da ANEEL nº 1.857, de 27 de fevereiro de 2015, que Homologa as quotas anuais definitivas da Conta de Desenvolvimento Energético – CDE para o ano de 2015 e dá outras providências.",Sim,2015,PDS
3830,119690,"Altera os §§ 1º e 2º do art. 14 da Constituição Federal, para tornar o voto facultativo.",Não,2015,PEC
3830,119756,"Altera o caput do art. 5º da Constituição Federal, para nele inserir o direito fundamental ao meio ambiente ecologicamente equilibrado.",Não,2015,PEC
3830,119779,"Altera o inciso XVI do art. 37 da Constituição Federal para permitir que profissionais da engenharia e arquitetura possam exercer, cumulativamente, dois cargos públicos.",Não,2015,PEC
3830,119837,"Altera a Constituição Federal para prever que a criança e o adolescente serão responsabilizados pelos crimes de natureza hedionda, que cometerem na medida de sua capacidade de entendimento e de autodeterminação, a ser averiguada no caso concreto, nos termos da lei.",Não,2015,PEC
3830,119858,"Dá nova redação ao inciso V do § 3º do art. 14 da Constituição, para dispor sobre a candidatura de pessoas não filiadas a partidos políticos.",Não,2015,PEC
3830,120027,Altera a Constituição Federal para incluir os tribunais de contas na jurisdição do Conselho Nacional de Justiça.,Não,2015,PEC
3830,120161,"Altera o art. 142 da Constituição da República Federativa do Brasil de 1988, para conceder às forças armadas a atribuição de proteger os recursos minerais, hídricos, vegetais e de fauna presentes em território nacional.",Não,2015,PEC
3830,120162,"Altera a Constituição Federal, para estabelecer o mandato de cinco anos dos Chefes do Poder Executivo e proibir a reeleição.",Não,2015,PEC
3830,120338,Altera a Constituição Federal para disciplinar a aplicação do subsídio como espécie remuneratória.,Não,2015,PEC
3830,120386,"Altera a Constituição Federal, para estabelecer o mandato de seis anos dos Chefes do Poder Executivo e membros do Poder Legislativo, proibir a reeleição e estabelecer eleições unificadas.",Não,2015,PEC
3830,120462,"Altera o art. 175 Constituição Federal, para determinar que as concessões e permissões de serviços públicos sejam normatizados por lei complementar.",Não,2015,PEC
3830,120499,"Altera os artigos 52 e 84 da Constituição Federal, para dispor sobre a indicação de dirigentes de Agências Reguladoras.",Não,2015,PEC
3830,120501,Altera a Constituição Federal para ampliar a duração da licença-maternidade e licença-paternidade.,Não,2015,PEC
3830,120520,"Altera o art. 173 da Constituição Federal para limitar, no máximo, a quatro anos o mandato dos dirigentes, membros de conselho de administração e fiscal de empresas públicas e sociedades de economia mista, vedando-lhes a recondução ou a participação em outro conselho, em qualquer tempo.",Não,2015,PEC
3830,120699,"Altera a Constituição Federal, para estabelecer a coincidência das eleições, fixar o mandato de cinco anos dos chefes do Poder Executivo e dos membros do Poder Legislativo, vedar a reeleição e alterar a data da posse dos chefes do Poder Executivo.",Não,2015,PEC
3830,120772,"Altera os arts. 14, 27, 28, 29, 44, 46 e 82 da Constituição Federal, para unificar os mandatos de chefe do Poder Executivo e os mandatos parlamentares em cinco anos, vedando a reeleição para os cargos de Presidente da República, Governadores e Prefeitos.",Não,2015,PEC
3830,121043,"Altera os arts. 49, 52, 73, 75, 84, 101 e 104 da Constituição Federal, para estabelecer que os ministros do Supremo Tribunal Federal, do Superior Tribunal de Justiça, do Tribunal de Contas da União, bem como os conselheiros dos Tribunais de Contas dos Estados e dos Municípios, sejam selecionados mediante concurso público de provas e títulos e nomeados para mandatos de cinco anos.",Não,2015,PEC
3830,121220,"Altera os arts. 52 e 153 da Constituição Federal, para estabelecer condições para o exercício da faculdade do Poder Executivo de alterar a alíquota do Imposto sobre Produtos Industrializados.",Não,2015,PEC
3830,121302,"Estabelece a coincidência de eleições a partir do ano de 2024, reduz de oito para seis anos o mandato de senador, estabelece o mandato de seis anos para todos os cargos eletivos e põe fim ao instituto da reeleição para os cargos do Poder Executivo.",Não,2015,PEC
3830,121320,"Acrescenta os §§ 2º, 3º, 4º e 5º ao art. 52 da Constituição Federal, para estabelecer prazos para a escolha e nomeação das autoridades definidas no inciso III e tornar crime de responsabilidade o seu descumprimento.",Não,2015,PEC
3830,121326,"Altera o § 9º do art. 144 da Constituição Federal, para instituir adicional de periculosidade para os servidores policiais.",Não,2015,PEC
3830,124783,"Requer, nos termos do inciso IV do § 7º do art. 154 do Regimento Interno do Senado Federal, a realização de sessão de debate temático para avaliar as reais dimensões da epidemia do vírus zika no Brasil, bem como averiguar os meios para conter a propagação do mosquito Aedes aegypti em território nacional.",Não,2016,RQS
3830,125022,"Requer, nos termos regimentais, a criação de Comissão Especial, composta por 14 (quatorze) membros titulares e igual número de suplentes, para formular proposta de adoção de sistema de governo de matriz parlamentarista.",Não,2016,RQS
3830,119866,Requer informações ao Ministro de Estado da Educação sobre o Edital nº 26/2014-Programa Jovens Talentos para Ciência.,Sim,2015,RQS
3830,125449,"Requer, nos termos do Regimento Interno do Senado Federal, a realização de Sessão Especial, no dia 30 de maio de 2016, às 10 horas, em homenagem aos Missionários da Imagem Peregrina de Nossa Senhora de Fátima, que realizaram o 23º Encontro da Mãe com o Filho, no Santuário Menino Jesus de Praga, situado em Brazlândia, cidade satélite do Distrito Federal.",Não,2016,RQS
3830,125474,"Requer, nos termos do disposto no art. 40, do Regimento Interno do Senado Federal,  licença para participar da Programação da Diligência Sub-comissão Especial do Senado Federal para o Acompanhamento das obras de Belo Monte.",Sim,2016,RQS
3830,125532,"Requer, na forma do disposto no art. 222, § 1º, do Regimento Interno do Senado Federal, seja incluída nos anais da Casa Voto de Censura ao Secretário-Geral da União de Nações Sul-Americanas, Ernesto Samper, por ter afirmado que o Bloco é contra o processo de impeachment e que a presidente tem legitimidade para terminar o mandato.",Não,2016,RQS
3830,120122,Requer informações ao Ministro de Estado da Saúde sobre o Programa Mais Médicos.,Sim,2015,RQS
3830,120193,"Requerem, nos termos do art. 199 do Regimento Interno do Senado Federal, a realização de Sessão Especial do Senado Federal, no dia 26 de maio do corrente ano, às 11 horas, destinada à entrega do Diploma José Ermírio de Moraes aos agraciados, em sua 6ª Premiação, conforme a Resolução nº 35, de 2009.",Não,2015,RQS
