codigoParlamentar,CodigoMateria,Ementa,IndicadorAutorPrincipal,AnoMateria,AutoriasSigla
581,143092,Retirada de assinatura do RQS nº 1207/2020.,Sim,2020,RQS
581,143204,Informações ao Ministro de Estado da Controladoria-Geral da União (CGU) sobre a decisão da CGU de que seriam sigilosos os pareceres dos ministérios enviados para orientar o Presidente da República na sanção ou veto a projetos de lei aprovados pelo Congresso Nacional.,Sim,2020,RQS
581,143192,"Susta a Portaria nº 340, de 22 de junho de 2020, do Ministério da Justiça e Segurança Pública.",Não,2020,PDL
581,143213,Adição de assinatura ao PDL n° 314/2020.,Sim,2020,RQS
581,142862,Adição de assinatura a emendas relacionadas às PEC 18/2020 e PEC 19/2020.,Sim,2020,RQS
581,142801,Adição de assinatura a emenda (s) relacionada (s) à PEC 18/2020.,Sim,2020,RQS
581,142922,Adição de assinatura a emenda (s) relacionada (s) à PEC 18/2020.,Sim,2020,RQS
581,143196,"Dispõe sobre medidas temporárias emergenciais destinadas ao setor elétrico para enfrentamento do estado de calamidade pública reconhecido pelo Decreto Legislativo nº 6, de 20 de março de 2020, e da emergência de saúde pública de importância internacional decorrente da pandemia de coronavírus (covid-19)",Sim,2020,PL
581,143168,Adição de assinatura ao RQS nº 1207/2020.,Sim,2020,RQS
581,142971,"Altera o art. 225 da Constituição Federal para incluir, entre as incumbências do Poder Público, o estímulo a práticas de pagamento por serviços ambientais e a oferta de incentivos para a geração de empregos e formação de recursos humanos em atividades que contribuam para a qualidade ambiental.",Sim,2020,PEC
581,142612,Adição de assinatura ao PDL nº 287/2020.,Sim,2020,RQS
581,142205,"Adição de assinatura à PEC 23/2020, tendo como primeira signatária a Senadora Rose de Freitas.",Sim,2020,RQS
581,142183,"Altera a Lei nº 7.998, de 11 de janeiro de 1990, para incluir empreendimentos de economia solidária no rol de beneficiários dos recursos do Fundo de Amparo ao Trabalhador.",Sim,2020,PL
581,142182,"Altera a Lei nº 8.036, de 11 de maio de 1990, para incluir empreendimentos de economia solidária no rol de beneficiários dos recursos do Fundo de Garantia por Tempo de Serviço (FGTS).",Sim,2020,PL
581,142016,"Acrescenta o art. 115 ao Ato das Disposições Constitucionais Transitórias (ADCT) para dispor sobre o adiamento das eleições municipais para Prefeito, Vice-Prefeito e Vereador, previstas para 4 de outubro de 2020, para o dia 6 de dezembro do mesmo ano, em decorrência das medidas para o enfrentamento da pandemia da Covid-19 declarada pela Organização Mundial da Saúde.",Não,2020,PEC
581,142494,"Adição de assinatura ao PDL nº 270/2020, de autoria do Senador Rogério Carvalho.",Sim,2020,RQS
581,142404,"Altera a Lei nº 12.512, de 14 de outubro de 2011, que institui o Programa de Apoio à Conservação Ambiental; altera as Leis nºs 10.696, de 2 de julho de 2003, 10.836, de 9 de janeiro de 2004, e 11.326, de 24 de julho de 2006, para ampliar o alcance do Programa.",Sim,2020,PL
581,143419,"Realização de sessão especial, em data oportuna, a fim de
celebrar os 120 anos de nascimento do educador Anísio Teixeira",Sim,2020,RQS
581,142584,"Adição de assinatura o SEDOL nº SF/20548.69357-93, autoria da Senadora Soraya Thronicke.",Sim,2020,RQS
581,142486,"Susta, nos termos do art. 49, V, da Constituição Federal, as Portarias nºs 1.266 a 1.579, todas de 5 de junho de 2020 e assinadas pela da Sra. Damares Regina Alves, Ministra de Estado da Mulher, da Família e dos Direitos Humanos, que anulam as Portarias editadas principalmente nos anos de 2003 e 2004 e que declaram a condição de anistiado político a diversos brasileiros vítimas dos regimes totalitários que vigeram na República Federativa do Brasil, ante a ausência de comprovação da existência de perseguição exclusivamente política no ato concessivo.",Não,2020,PDL
581,142368,"Susta a Portaria nº 13.474, de 2 de junho de 2020, da Secretaria Especial de Fazenda, do Ministério da Economia, que abre ao Orçamento Fiscal da União, em favor da Presidência da República, crédito suplementar no valor de R$ 83.904.162,00, para reforço de dotação constante da Lei Orçamentária vigente.",Não,2020,PDL
581,142367,"Adição de assinatura ao Projeto de Decreto Legislativo nº 257/2020, de autoria do Senador Rogério Carvalho.",Sim,2020,RQS
581,142169,"Dispõe sobre prioridade para recebimento da restituição do imposto de renda, de que trata o art. 16 da Lei nº 9.250, de 26 de dezembro de 1995, durante o período de Emergência em Saúde Pública de Importância Nacional (Espin), em razão da pandemia do Covid19.",Sim,2020,PL
581,142168,"Institui linha de crédito emergencial de custeio, no âmbito do Programa Nacional de Fortalecimento da Agricultura Familiar (Pronaf) no período da pandemia do COVID 19, e dá outras providências.",Sim,2020,PL
581,142602,"Susta a Portaria nº 545, de 16 de junho de 2020, do Ministério da Educação, que revoga a Portaria Normativa MEC nº 13, de 11 de maio de 2016.",Não,2020,PDL
581,142081,"Sugere, ao Ministro da Educação, Sr. Abraham Weintraub, a prorrogação das inscrições
do Exame Nacional do Ensino Médio (Enem) durante a pandemia do novo coronavírus.",Sim,2020,INS
581,142207,"Altera a Lei nº 9.605, de 12 de fevereiro de 1998, que dispõe sobre as sanções penais e administrativas derivadas de condutas e atividades lesivas ao meio ambiente, e dá outras providências, para aumentar as penas aplicadas aos crimes ambientais praticados na vigência de reconhecimento de estado de emergência ou de calamidade pública.",Sim,2020,PL
581,142221,"Adição de assinatura à proposta de emenda à constituição registrada no SEDOL nº SF/20966.24649-50, de autoria do Senador Rogério Carvalho.",Sim,2020,RQS
581,141983,Altera o Ato das Disposições Constitucionais Transitórias para modificar regras fiscais em decorrência do surto de COVID-19.,Não,2020,PEC
581,141950,"Altera a Lei nº 13.982, de 2 de abril de 2020, para prever concessão automática do auxílio emergencial quando cessar o benefício do seguro-desemprego.",Sim,2020,PL
581,141879,"Sugere, ao Senhor Presidente do Banco Central do Brasil, na qualidade de chefe da autoridade de regulação bancária, solicitar informações e fiscalização sobre a linha de crédito ofertada pelo Governo Federal aos pequenos e médios empresários, nos termos do art. 14 da Medida Provisória nº 944, de 2020.",Sim,2020,INS
581,141752,"Altera a Lei nº 13.979, de 6 de fevereiro de 2020, para dispor sobre uso compulsório de leitos privados disponíveis, de qualquer espécie, pelos entes federativos para a internação de pacientes acometidos de Síndrome Aguda Respiratória Grave ou com suspeita ou diagnóstico de COVID-19, e dá outras providências.",Não,2020,PL
581,141671,Informações ao Ministro de Estado das Relações Exteriores sobre a recente decisão de não endossar a Resolução da Assembleia-Geral da ONU sobre o coronavírus.,Sim,2020,RQS
581,141899,Tramitação conjunta do PL 675/2020 com o PL 1722/2020.,Sim,2020,RQS
581,141756,"Altera a Lei nº 13.979, de 6 de fevereiro de 2020, para dispor sobre uso compulsório de leitos privados disponíveis, de qualquer espécie, pelos entes federativos para a internação de pacientes acometidos de Síndrome Aguda Respiratória Grave ou com suspeita ou diagnóstico de COVID-19, e dá outras providências.",Não,2020,PL
581,141744,Altera o art. 155 da Constituição Federal para vedar a instituição do ITCD sobre as transmissões e doações às organizações da sociedade civil e aos institutos de pesquisa sem fins lucrativos.,Não,2020,PEC
581,141829,"Cria o Programa Brasil Solidário (PBS) com a finalidade de prover recursos humanos de caráter solidário e temporário, para o enfrentamento da emergência de saúde pública e de economia decorrente da pandemia internacional de coronavírus de 2019.",Sim,2020,PL
581,141677,"Altera a Lei 13.982, de 2 de abril de 2020, para dispor sobre a prorrogação do auxílio emergencial de que trata a referida Lei.",Sim,2020,PL
581,141717,Autoriza o Poder Executivo Federal a adquirir o controle da EMBRAER S/A.,Sim,2020,PL
581,141897,"Susta o Decreto n° 10.344, de 11 de maio de 2020, que altera o Decreto nº 10.282, de 20 de março de 2020, que regulamenta a Lei nº 13.979, de 6 de fevereiro de 2020, para definir os serviços públicos e as atividades essenciais.",Não,2020,PDL
581,141874,"Susta a Portaria Interministerial n° 1.634/GM-MD, de 22 de abril de 2020, que estabelece os quantitativos máximos de munições passíveis de aquisição pelos integrantes dos órgãos e instituições previstos nos incisos I a VII e X do caput art. 6º da Lei nº 10.826, de 2003, pelas pessoas físicas autorizadas a adquirir ou portar arma de fogo, e pelos demais agentes autorizados por legislação especial a portar arma de fogo.",Não,2020,PDL
581,141878,"Susta o Despacho nº 4.410/2020 do Ministério do Meio Ambiente com efeito vinculante ao Ministério e entidades a ele vinculadas, publicado no Diário Oficial da União de 06 de abril de 2020, que dispõe que o regime de uso consolidado das Áreas de Preservação Permanente (APP) instituído pelo Código Florestal de 2012 (Lei 12.651/12), nos termos dos arts. 61-A e 61-B, incide sobre o Bioma Mata Atlântica.",Não,2020,PDL
581,141638,Voto de repúdio ao Presidente da República.,Não,2020,RQS
581,141622,"Cria Fundos Garantidores solidários no âmbito da política de desenvolvimento regional, para apoio e desenvolvimento de micro, pequenas e médias empresas.",Não,2020,PEC
581,141655,Voto de solidariedade à Democracia.,Não,2020,RQS
581,141660,Cria Programa de Apoio Emergencial às Pesquisas sobre Doenças Virais e ao Combate ao Coronavírus - Covid-19.,Sim,2020,PL
581,141548,"Dispõe sobre o Regime de Emergência Fiscal para combate aos efeitos da propagação do covid-19 pelos Estados, Distrito Federal e Municípios.",Não,2020,PL
581,141566,"Institui o Fundo Anticíclico de Combate à Pobreza – FACP; estabelece limites para a taxa de pobreza infantil; prevê que o FACP seja fonte de recursos para políticas de assistência social em caso de descumprimento dos limites de pobreza, bem como para premiação financeira de entes federativos que tenham avanços relevantes na área social; e dá outras providências.",Não,2020,PEC
581,141499,"Estabelece vedação à inclusão de pessoas em cadastros de proteção ao crédito ou similares, durante o estado de calamidade pública reconhecido pelo Congresso Nacional.",Sim,2020,PL
581,141440,"Dispõe sobre medidas emergenciais de amparo aos agricultores familiares do Brasil para mitigar os impactos socioeconômicos da pandemia do COVID19, durante o período de vigor do estrado de calamidade pública no país, e dá outras providências.",Não,2020,PL
581,141411,"Dispõe sobre a suspensão dos descontos de prestações em folha de pagamento referentes a empréstimos consignados contratados por empregados, aposentados e pensionistas.",Sim,2020,PL
581,141172,"Suspende processos judiciais com pedido de ordem de despejo, cobrança e execução de valores oriundos de contrato com garantia hipotecária, alienação fiduciária, aluguel ou dívidas dessa natureza durante o estado de calamidade pública reconhecido pelo Congresso Nacional.",Sim,2020,PL
581,141138,"Indicação, a ser encaminhada ao Senhor Ministro de Estado-Chefe da Casa Civil, na qualidade de Coordenador do Comitê de Crise para Supervisão e Monitoramento dos Impactos da Covid-19, para sugerir e solicitar, ao Presidente da República, a adoção de Medida Provisória, para dispor, de forma especial, a respeito do controle de preço de produtos e serviços ligados ao controle da Pandemia do COVID-19 no território Brasileiro.",Sim,2020,INS
581,146459,Requer a apreciação do PLS 232/2016 pelo Plenário do Senado Federal.,Não,2020,R.S
581,141355,"Suspende o pagamento das parcelas dos financiamentos imobiliários contratados juntos ao Sistema Financeiro de Habitação, inclusive Minha Casa Minha Vida.",Sim,2020,PL
581,141180,Suspende a exigibilidade do recolhimento dos impostos e contribuições federais do Regime Especial Unificado de Arrecadação de Tributos e Contribuições devidos pelas Microempresas e Empresas de Pequeno Porte - Simples Nacional durante o estado de calamidade pública reconhecido pelo Congresso Nacional.,Sim,2020,PL
581,141135,"Proíbe o corte de fornecimento dos serviços públicos de energia elétrica, telefonia, gás e de água e esgoto, prestados ao consumidor, durante o estado de calamidade pública reconhecido pelo Congresso Nacional.",Sim,2020,PL
581,141096,"Altera o art. 5º da Constituição Federal, para incluir o acesso à internet entre os direitos fundamentais.",Não,2020,PEC
581,141299,"Autoriza o Poder Executivo a conceder subvenções econômicas, com a finalidade de garantia de emprego, em decorrência da Emergência em Saúde Pública Decorrente do Coronavírus, de que trata a Lei nº 13.979, de 6 de fevereiro de 2020.",Sim,2020,PL
581,141158,"Cria a Linha Emergencial de Capital de Giro destinada à manutenção da produção, do emprego e da massa salarial.",Sim,2020,PL
581,141300,"Cria a Linha de Garantia de Capital de Giro e Emprego (LGCGE) destinada à manutenção da produção, do emprego e da massa salarial.",Sim,2020,PL
581,140872,"Realização de Sessão de debates temáticos, em data oportuna, para discutir a criação do Conselho Nacional da Amazônia Legal.",Não,2020,RQS
581,141021,"Requer, nos termos do art. 73, § 1º, c/c art. 76, § 1º, I, do Regimento Interno do Senado Federal, prorrogação, no prazo de 180 (cento e oitenta dias), da Subcomissão Temporária do Grande Impulso para a Sustentabilidade.",Sim,2020,REQ
581,140892,Realização de Sessão de Debate Temático sobre a Importância de Garantir a Permanência do Fundeb (Fundo de Manutenção e Desenvolvimento do Ensino Fundamental e de Valorização do Magistério).,Não,2020,RQS
581,141080,Requer a realização de audiência pública com o objetivo de debater a gestão associada de serviços públicos por meio de Consórcios Públicos.,Sim,2020,REQ
581,140787,"Altera a Lei nº 12.431, de 24 de junho de 2011, para estender os benefícios concedidos a debêntures de infraestrutura e pesquisa, desenvolvimento e inovação, a debêntures objeto de distribuição pública para financiamento de projetos de investimentos sustentáveis.",Sim,2020,PL
581,140994,"Realização de sessão de debates temáticos destinada a debater sobre o Tema: "" Proteção de Dados e Autoridade Nacional de Proteção de Dados (ANPD)"".",Não,2020,RQS
581,140873,Homenagem de pesar pelo falecimento do Sr. Ernesto Cardenal.,Sim,2020,RQS
581,140783,"Requeiro, nos termos do art. 58, § 2°, II e V da Constituição Federal, que
seja convidado o Exmo. Sr. Onyx Lorenzoni, Ministro da Cidadania, a comparecer a esta Comissão, a fim de prestar informações sobre a fila de brasileiros que esperam pelo Bolsa Família.",Sim,2020,REQ
581,140749,"Realização de Sessão Especial, em 04/12/2020, destinada a comemorar o Dia do Perito Criminal.",Não,2020,RQS
581,140732,Informações ao Ministro de Estado da Economia.,Sim,2020,RQS
581,140733,Oitiva da CMA sobre o PL nº 4146/2019.,Sim,2020,RQS
581,141070,"Realização de sessão especial, em data oportuna, destinada a homenagear o Dia Nacional da Imigração Judaica.",Sim,2020,RQS
581,140754,"Susta o Decreto nº 10.235, de 11 de fevereiro de 2020, que altera o Decreto nº 4.703, de 21 de maio de 2003, que dispõe sobre o Programa Nacional da Diversidade Biológica - PRONABIO e a Comissão Nacional da Biodiversidade e revoga o caput, inciso III, alíneas “a” a “e” do inciso X, incisos XII, XV, XVII do art. 6º e incisos VI a XX do caput do art. 7º do Decreto nº 4.703/2003.",Não,2020,PDL
581,141252,Institui Contribuição de Intervenção no Domínio Econômico incidente sobre a importação e comercialização de agrotóxicos e afins (Cide-Agrotóxico).,Sim,2020,PL
581,140619,"Susta o Decreto nº 10.224, de 5 de fevereiro de 2020, que revoga o Decreto nº 3.524, de 26 de junho de 2000 e o Decreto nº 6.985, de 20 de outubro de 2009, que regulamenta a Lei nº 7.797, de 10 de julho de 1989, que cria o Fundo Nacional do Meio Ambiente.",Não,2020,PDL
581,141246,"Altera a Lei nº 7.827, de 27 de setembro de 1989, que regulamenta o art. 159, inciso I, alínea c, da Constituição Federal, institui o Fundo Constitucional de Financiamento do Norte – FNO, o Fundo Constitucional de Financiamento do Nordeste – FNE e o Fundo Constitucional de Financiamento do Centro-Oeste – FCO, e dá outras providências, para estabelecer tratamento preferencial aos empreendimentos de economia solidária .",Sim,2020,PL
581,140929,"Realização de sessão especial, em 3 de abril de 2020, destinada a celebrar o Dia do Idoso e do Dia do Aposentado.",Não,2020,RQS
581,141084,"Susta a Instrução Normativa nº 7, de 21 de Fevereiro de 2020 do Instituto Brasileiro do Meio Ambiente e do Recursos Naturais Renováveis (IBAMA) que estabelece controle a posteriori para a exportação de madeiras, indicadas no Anexo II.",Não,2020,PDL
581,140620,Estabelece regras de recolhimento compulsório sobre recursos das instituições do Sistema Financeiro Nacional,Não,2020,PL
581,140604,"Requer realização de audiência pública, com o objetivo de instruir o Projeto de Lei nº 5.028 de 2019, que Institui a Política Nacional de Pagamento por Serviços Ambientais; altera as Leis nos 8.629, de 25 de fevereiro de 1993, e 8.212, de 24 de julho de 1991; e dá outras providências. Este encontro, que integrará um ciclo de três audiências, pretende debater os “exemplos de provedores de serviços ambientais” com os convidados que relaciona.",Não,2020,REQ
581,140603,"Requer a realização de audiência pública, com o objetivo de debater a grave situação vivida pela população dos estados do Espírito Santo, Minas Gerais e Rio Janeiro nos últimos meses em decorrência das chuvas e consequentes inundações que culminaram em lamentáveis perdas de vidas humanas e consideráveis prejuízos às famílias e aos municípios atingidos, avaliando causas, consequências e medidas emergenciais e estruturais para enfrentar os eventos climáticos extremos, especialmente as enchentes e deslizamentos de terras em áreas urbanas.",Não,2020,REQ
581,140310,Estabelece alíquota para cobrança do Imposto sobre Operações Relativas à Circulação de Mercadorias e sobre Prestações de Serviços de Transporte Interestadual e Intermunicipal e de Comunicação (ICMS) nas operações interestaduais relativas à carne bovina.,Não,2019,PRS
581,140580,"Requer licença para participar de evento na Universidade de Columbia, em Nova Iorque, Estados Unidos da América.",Sim,2020,REQ
581,140276,"Solicitamos, nos termos do art. 58, § 2º, I, da Constituição Federal e do art. 91, § 3º, do Regimento Interno do Senado Federal, que o PLS 166/2018, que altera o Código de Processo Penal para disciplinar a prisão após a condenação em segunda instância, deliberado terminativamente pela Comissão de Constituição, Justiça e Cidadania, seja apreciado pelo Plenário do Senado Federal.",Não,2019,R.S
581,140265,"Realização de sessão especial, em data oportuna, destinada a homenagear o Senhor Divaldo Franco, pelas obras religiosas e sociais prestadas ao longo de sua vida e entrega da Comenda Zilda Arns.",Não,2019,RQS
581,140340,Acrescenta o inciso X ao art. 170 e o inciso VIII ao § 1º do art. 225 da Constituição Federal.,Não,2019,PEC
581,140606,"Requer, nos termos do art. 93, I, do Regimento Interno do Senado Federal, a realização de audiência pública, com o objetivo de instruir o Projeto de Lei nº 5.028 de 2019, que Institui a Política Nacional de Pagamento por Serviços
Ambientais; altera as Leis nos 8.629, de 25 de fevereiro de 1993, e 8.212, de 24 de julho de 1991; e dá outras providências. Este encontro, que integrará um ciclo de três audiências, pretende debater os “aspectos Econômico-Financeiros e Jurídicos” com os convidados que relaciona.",Não,2020,REQ
581,140605,"Requer realização de audiência pública, com o objetivo de instruir o Projeto de Lei nº 5.028 de 2019, que Institui a Política Nacional de Pagamento por Serviços Ambientais; altera as Leis nos 8.629, de 25 de fevereiro de 1993, e 8.212, de 24 de julho de 1991; e dá outras providências. Este encontro, que integrará um ciclo de três audiências, pretende debater “experiências de Pagamentos por Serviços Ambientais” com os convidados que relaciona.",Não,2020,REQ
581,140440,"Requer a realização de audiência pública, em conjunto com a Comissão de Relações Exteriores e Defesa Nacional, com o objetivo de discutir e analisar a criação do Conselho da Amazônia e as políticas governamentais para a região, com a presença do Exmo. Sr. Hamilton Mourão,Vice-presidente da República.",Não,2020,REQ
581,140410,Requer Apreciação de Matéria pelo Plenário do PLS 166/2018,Não,2019,R.S
581,140271,Altera o inciso XVIII do art. 7º da Constituição Federal e revoga o inciso XIX da Constituição Federal e o § 1º do art. 10 do Ato das Disposições Constitucionais Transitórias para dispor sobre a licença parental compartilhada.,Não,2019,PEC
581,139995,"Convocação do Exmo. Sr. Ministro de Estado da Economia, Paulo Roberto Nunes Guedes, para que compareça ao Plenário, a fim de prestar informações sobre declarações dadas em entrevista coletiva na cidade de Washington/EUA, no dia 25 de novembro de 2019, relacionadas a medidas antidemocráticas (AI-5).",Não,2019,RQS
581,140056,"Altera o Código Brasileiro de Aeronáutica, para dispor sobre a obrigação de o transportador, em caso de cancelamento pelo usuário de transporte, reembolsar o valor integral pago pelo bilhete de passagem.",Sim,2019,PL
581,140131,Retificação do objeto do RQS 932/2019.,Não,2019,RQS
581,140078,"Altera o Regimento Interno do Senado Federal, para prever a possibilidade da instituição de comissão temporária para examinar o mérito de propostas de emenda à Constituição.",Sim,2019,PRS
581,139916,Altera os arts. 49 e 225 da Constituição Federal para que o Congresso Nacional decida previamente sobre o corte e a supressão de vegetação da Floresta Amazônica.,Não,2019,PEC
581,140071,"Altera a Lei nº 12.813, de 16 de maio de 2013, para estabelecer a obrigatoriedade da divulgação da declaração de bens dos agentes públicos submetidos à lei de conflito de interesses.",Sim,2019,PL
581,140053,Auditoria  do TCU  ao  Ministério da Economia.,Sim,2019,RQS
581,140077,"Criminaliza a apologia ao retorno da ditadura militar, tortura ou a pregação de rupturas institucionais.",Sim,2019,PL
581,140073,"Altera o art. 17 da Constituição Federal, para dispor que os partidos políticos são pessoas jurídicas de direito público.",Não,2019,PEC
581,139917,"Insere o § 3o no art. 20 e o inciso VIII no § 1º do art. 225 da Constituição Federal, para instituir o Fundo Nacional para Emergências Ambientais, e acrescenta o art. 115 no Ato das Disposições Constitucionais Transitórias, para estabelecer a fonte de recursos para o Fundo.",Não,2019,PEC
581,140075,"Altera a Resolução do Senado Federal nº 93, de 1970 – Regimento Interno do Senado Federal, com o objetivo de ampliar os comportamentos vedados aos senadores e as hipóteses de desacato ao Senado Federal.",Não,2019,PRS
581,139933,"Autorização para desempenho de missão parlamentar, a fim de participar da 25ª Conferência das Partes da Convenção-Quadro das Nações Unidas sobre Mudança do Clima,COP-25, em Madri, na Espanha.",Sim,2019,RQS
581,139657,Altera a Constituição Federal para instituir o Fundo Nacional de Responsabilidade por Poluição Causada por Incidentes com Hidrocarbonetos.,Não,2019,PEC
581,139636,"Requeiro, nos termos dos arts. 216 e 217 do Regimento Interno do Senado Federal, que sejam prestadas, pelo Senhor Ministro de Estado das Relações Exteriores, Ernesto Araújo, informações a respeito da Ata Bilateral Relativa à Contratação de Potência da Usina Hidrelétrica de Itaipu, firmada entre Brasil e Paraguai, em 24 de maio de 2019: Nesses termos, requisita-se: 1. texto integral do acordo negociado; 2. motivos que levaram a que as negociações fossem cercadas de sigilo; 3. autoridades brasileiras que participaram das negociações; 4. razões que motivaram o governo brasileiro a pedir a revisão da potência contratada pelo Paraguai; 5. principais empecilhos encontrados na negociação; 6. estimativas sobre o encarecimento da energia utilizada pelo Paraguai e eventual redução do custo da energia consumida no Brasil, em razão da revisão da energia contratada; 7. repercussões dessas negociações nas relações bilaterais Brasil/ Paraguai e nas próximas tratativas relativas ao Anexo C do Tratado de Itaipu; 8. demanda de autoridades brasileiras pelo encaminhamento do acordo; e 9. empresas que poderiam ser beneficiadas por tal revisão.",Sim,2019,REQ
581,139940,Informações ao Senhor Presidente do Banco Central do Brasil.,Sim,2019,RQS
