codigoParlamentar,CodigoMateria,Ementa,IndicadorAutorPrincipal,AnoMateria,AutoriasSigla
581,149667,"Requer, nos termos do art. 93, I, do Regimento Interno do Senado Federal, a realização de audiência pública, em conjunto com a Comissão de Agricultura e Reforma Agrária, com o objetivo de instruir o PL 510/2021, que “altera a Lei n° 11.952, de 25 de junho de 2009, que dispõe sobre a regularização fundiária das ocupações incidentes em terras situadas em áreas da União; a Lei n° 8.666, de 21 de junho de 1993, que institui normas para licitações e contratos da administração pública; a Lei nº 6.015, de 31 de dezembro de 1973, que dispõe
sobre os registros públicos; a Lei nº 13.240, de 30 de dezembro de 2015, que dispõe sobre a administração, a alienação, a transferência de gestão de imóveis da União e seu uso para a constituição de fundos; e a Lei nº 10.304, de 5 de novembro de 2001, que Transfere ao domínio dos Estados de Roraima e do Amapá terras pertencentes à União, a fim de ampliar o alcance da regularização fundiária e dar outras providências”.",Sim,2021,REQ
581,149615,"Requer audiência da Comissão de Constituição, Justiça e Cidadania sobre o PL 591/2021.",Sim,2021,RQS
581,149614,Requer audiências da Comissão de Desenvolvimento Regional e Turismo e da Comissão de Serviços de Infraestrutura sobre o PL 591/2021.,Sim,2021,RQS
581,149617,Audiência da Comissão de Meio Ambiente sobre o PL nº 3844/2020.,Sim,2021,RQS
581,149610,Audiência da CMA sobre o PL nº 2916/2021.,Sim,2021,RQS
581,149737,"Requer, nos termos do art. 93, I, do Regimento Interno do Senado Federal, a realização de audiência pública com os nomes que apresenta, em conjunto com a Comissão de Agricultura e Reforma Agrária, com o objetivo de instruir o PL 2633/2020, que “altera as Leis nos 11.952, de 25 de junho de 2009, 14.133, de 1o de abril de 2021 (Lei de Licitações e Contratos Administrativos), e 6.015, de 31 de dezembro de 1973, a fim de ampliar o alcance da regularização fundiária; e dá outras providências”.",Sim,2021,REQ
581,149890,Requer audiência da Comissão de Meio Ambiente sobre o PL nº 3216/2021.,Sim,2021,RQS
581,149699,Sessão Especial para homenagear o Dia do Profissional de Educação Física,Não,2021,RQS
581,149645,"Requer licença para se ausentar do País em missão oficial em Washington DC, EUA, de 20 a 22 de setembro do corrente ano.",Sim,2021,REQ
581,149611,Audiência da CMA sobre o PL nº 2922/2021.,Sim,2021,RQS
581,149665,"Requer, nos termos do art. 58, § 2º, II, da Constituição Federal e do art. 93, II, do Regimento Interno do Senado Federal, que na Audiência Pública objeto do REQ 41/2021 - CMA seja incluído o seguinte convidado que relaciona,",Não,2021,REQ
581,149626,"Requer, nos termos do art. 93, I, do Regimento Interno do Senado Federal, a realização de audiência pública, com o objetivo de instruir o PL 2847/2021, que “amplia o Parque Nacional da Chapada dos Veadeiros, localizado nos Municípios de Alto Paraíso de Goiás, Cavalcante, Nova Roma, Teresina de Goiás e São João da Aliança, Estado de Goiás.”",Não,2021,REQ
581,149492,"Requer, nos termos do art. 58, § 2º, II, da Constituição Federal e do art. 93, II, do Regimento Interno do Senado Federal, a realização de audiência pública, com o objetivo de debater a pesca de arrasto no litoral do Rio Grande do Sul com os convidados que relaciona.",Não,2021,REQ
581,149619,"Sugere, ao Ministro de Estado do Meio Ambiente, que encaminhe para apreciação do Congresso Nacional Acordo Regional sobre Acesso à Informação, Participação Pública e Acesso à Justiça em Assuntos Ambientais na América Latina e no Caribe (Acordo de Escazú), assinado pelo Brasil em 2018, com vistas à sua posterior ratificação.",Sim,2021,INS
581,150392,"Altera a Emenda Constitucional nº 109, de 15 de março de 2021, com vistas a vedar a utilização dos recursos do Fundo Nacional de Desenvolvimento Científico e Tecnológico para amortização da dívida pública.",Sim,2021,PEC
581,149618,Audiência da CMA sobre o PL nº 1539/2021.,Sim,2021,RQS
581,149803,"Requer, nos termos do art. 58, § 2º, II, da Constituição Federal e do art. 93, II, do Regimento Interno do Senado Federal, a realização de audiência pública, com o objetivo de debater e discutir a renovação da concessão da FCA (Ferrovia Centro Atlântica S/A) e os impactos da conexão ferroviária do NE.",Sim,2021,REQ
581,149739,"Institui o Programa Agente Jovem Ambiental e altera a Lei nº 9.795, de 27 de abril de 1999, que “dispõe sobre a educação ambiental, institui a Política Nacional de Educação Ambiental e dá outras providências”, para tratar de programa para formação e atuação de jovens agentes ambientais “Lei Alfredo Sirkis”.",Sim,2021,PL
581,149578,"Requer, nos termos do art. 93, I, do Regimento Interno do Senado Federal, a realização de audiência pública, em conjunto com a Comissão de Agricultura e Reforma Agrária, com o objetivo de instruir o PL 2159/2021, que “dispõe sobre o licenciamento ambiental; regulamenta o inciso IV do § 1º do art. 225 da Constituição Federal; altera as Leis nºs 9.605, de 12 de fevereiro de 1998, e 9.985, de 18 de julho de 2000; revoga dispositivo da Lei nº 7.661, de 16 de maio de 1988; e dá outras providências”, com os convidados que relaciona.",Sim,2021,REQ
581,149829,Realização de Sessão Especial para a conscientização sobre a importância da doação de órgãos.,Não,2021,RQS
581,149776,Sessão Especial para homenagear os paratletas que se destacaram na Paraolimpíada de Tóquio/Japão.,Não,2021,RQS
581,149613,Audiência da CMA sobre o PL nº 2703/2021.,Sim,2021,RQS
581,149431,"Sessão de Debates Temáticos, a ser realizada em data oportuna, a fim de debater a Proposta de Emenda à Constituição n° 13, de 2021.",Não,2021,RQS
581,149424,Requer oitiva da CCJ ao PL 591/2021.,Sim,2021,RQS
581,149291,"Requer audiência pública, tendo por convidados o Senhor Walton Alencar Rodrigues, Ministro do Tribunal de Contas da União, e o Senhor Alexandre Carlos Leite de Figueiredo, Secretário da Secretaria de Fiscalização de Infraestrutura de Petróleo e Gás Natural do Tribunal de Contas da União, para que apresentem os achados no âmbito da auditoria operacional objeto do Processo TC 003.245/2020-9, sobre o tema do novo mercado de refino de combustíveis e impactos sobre o abastecimento.",Sim,2021,REQ
581,149491,"Altera os arts. 10 e 19 da Emenda Constitucional nº 103, de 2019, para dispor sobre o tempo de contribuição das mulheres.",Não,2021,PEC
581,149417,"Realização de Sessão de Debates Temáticos, em data oportuna, a fim de debater os resultados apresentados em relatório do IPCC e os impactos e recomendações para o Brasil.",Sim,2021,RQS
581,149425,Requer oitiva da CAE ao PL 591/2021.,Sim,2021,RQS
581,149276,"Requer, nos termos do art. 58, § 2º, II, da Constituição Federal e do art. 93, II, do Regimento Interno do Senado Federal, a realização de audiência pública, com o objetivo de debater e analisar legislações entre parlamentos da América Latina referente ao enfrentamento da emergência climática no bojo da COP 26. 
Os países representados trarão suas principais políticas públicas e legislações referentes ao clima e proteção da biodiversidade da região, bem como será objeto de discussão novas perspectivas para os mercados de carbono no continente.",Sim,2021,REQ
581,149458,"Realização de Sessão de Debates Temáticos a fim de discutir o Projeto de Lei nº 1.869, de 2021.",Não,2021,RQS
581,149437,"Voto de pesar pelo falecimento do Dr. Sebastião Antonio Loureiro de Souza e Silva, professor de medicina e fundador do Instituto de Saúde Coletiva da UFBA.",Sim,2021,RQS
581,149428,Audiência da Comissão de Meio Ambiente sobre o PL 1869/2021.,Sim,2021,RQS
581,149390,Urgência para o PDL nº 342/2021.,Não,2021,RQS
581,149371,Realização de sessão especial em comemoração ao Dia do Advogado.,Não,2021,RQS
581,149758,"Define como Instituições permanentes de Estado as entidades responsáveis pela produção das estatísticas nacionais, das avaliações nacionais da qualidade da educação e das avaliações das políticas públicas; e define ritos para indicação de seus dirigentes.",Não,2021,PEC
581,149397,Realização de sessão de Debates Temáticos sobre o Projeto de Lei de Conversão da Medida Provisória nº 1.045/2021.,Não,2021,RQS
581,149321,"Informações ao Exmo. Sr. Ministro de Estado do Meio Ambiente, Joaquim Álvaro Pereira Leite, sobre a execução da Política Nacional de Resíduos Sólidos (PNRS) e sobre o Plano Nacional de Resíduos Sólidos (Planares).",Sim,2021,RQS
581,149340,Sessão Especial em Homenagem aos Atletas Olímpicos da Olimpíada de Tóquio 2021/2020.,Não,2021,RQS
581,148707,"Requer, nos termos do art. 58, § 2º, II, da Constituição Federal e do art. 93, II, do Regimento Interno do Senado Federal, em aditamento ao REQ 11/2021-CMA, que tem por objeto a realização de audiência pública para debater o Projeto de Lei nº 3.729, de 2004, que dispõe sobre o licenciamento ambiental e dá outras providências, que seja incluída, como convidada, a Sra. Mônica Sodré - Diretora-Executiva da RAPS.",Não,2021,REQ
581,148956,"Requer, nos termos do art. 58, § 2º, II, da Constituição Federal e do art. 93, II, do Regimento Interno do Senado Federal, a realização de audiência pública, com o objetivo de instruir o PL 490/2007, que “altera a Lei n° 6.001, de 19 de dezembro de 1973, que dispõe sobre o Estatuto do Índio”.",Sim,2021,REQ
581,149051,"Constituição de uma Comissão Temporária Externa composta de 11 (onze) membros titulares com a mesma quantidade de membros suplentes para, no prazo de 180 (cento e oitenta) dias, averiguar as causas e efeitos da crise hidroenergética que assola o País, acompanhar a atuação da Câmara de Regras Excepcionais para Gestão Hidroenergética (CREG), criada pela Medida Provisória nº 1.055, de 28 de junho de 2021, e propor soluções que garantam a segurança energética e a modicidade tarifária do Sistema Elétrico Brasileiro (SEB).",Não,2021,RQS
581,149038,Retirada do RQS nº 1742/2021.,Sim,2021,RQS
581,149033,Informações ao Ministro de Estado de Meio Ambiente sobre medidas para controle e prevenção do desmatamento ilegal na Amazônia.,Sim,2021,RQS
581,149036,Cria o Programa de Modernização Veicular e Mobilidade Elétrica – MoVE Brasil; dispõe sobre as medidas de incentivo à transição para um transporte não poluente e sobre a instalação de estações de recarga de veículos elétricos; e dá outras providências.,Sim,2021,PL
581,149037,"Altera a Lei nº 12.305, de 2 de agosto de 2010 (Política Nacional de Resíduos Sólidos) para dispor sobre a responsabilidade de divulgação do balanço de massa dos resíduos sólidos por fabricantes, importadores, distribuidores e comerciantes.",Sim,2021,PL
581,149041,Cria o Programa de Modernização Veicular e Mobilidade Elétrica – MoVE Brasil; dispõe sobre as medidas de incentivo à transição para um transporte não poluente e sobre a instalação de estações de recarga de veículos elétricos; e dá outras providências.,Sim,2021,PL
581,149144,"Prorrogação, por mais 90 (noventa) dias, da duração da Comissão Parlamentar de Inquérito criada a partir dos Requerimentos nºs 1371/2021 e  1372/2021.",Não,2021,RQS
581,148998,"Requer, nos termos do art. 58, § 2º, II, da Constituição Federal e do art. 93, II, do Regimento Interno do Senado Federal, a realização de audiência pública, com o objetivo de debater o PL 490/2007, que “altera a Lei n° 6.001, de 19 de dezembro de 1973, que dispõe sobre o Estatuto do Índio”.",Sim,2021,REQ
581,149042,Retirada de tramitação do PL nº 2445/2021.,Sim,2021,RQS
581,149034,"Informações ao Ministro de Estado de Ciência, Tecnologia e Inovações sobre as medidas de comando e controle do desmatamento dos biomas brasileiros realizados com auxílio dos dados produzidos pelo Instituto Nacional de Pesquisas Espaciais (INPE).",Sim,2021,RQS
581,149087,"Voto de repúdio ao Sr. Iverson de Souza Araújo, conhecido como DJ Ivis, pelas agressões praticadas contra a Sra. Pamella Holanda.",Não,2021,RQS
581,149022,"Informações ao Ministro de Estado da Ciência, Tecnologia e Inovações.",Sim,2021,RQS
581,148852,Voto de Pesar e apresentação de condolências aos familiares e amigos de todos os cidadãos afetados pelo falecimento de quinhentos mil brasileiros em decorrência da Covid-19 (Sars-CoV-2).,Não,2021,RQS
581,148588,"Realização de sessão de debates temáticos, em data oportuna, a fim de debater a educação ambiental para uma nova geração ecológica.",Sim,2021,RQS
581,148939,"Voto de aplauso ao saudoso ITAMAR FRANCO, engenheiro, Prefeito, Senador, Governador, Presidente da República, exemplo de homem público, pelo transcurso do aniversário de 91 anos do seu nascimento, em 28 de junho de 2021.",Não,2021,RQS
581,148621,"Informações ao Ministro de Estado da Justiça e Segurança Pública  sobre a Licitação nº 03/21, que trata da aquisição do sistema de espionagem Pegasus, desenvolvido pela empresa israelense NSO Group, assim como sobre seu uso e pessoas envolvidas na aquisição.",Sim,2021,RQS
581,148565,"Requer, nos termos do art. 58, § 2º, II, da Constituição Federal e do art. 93, II, do Regimento Interno do Senado Federal, a realização de audiência pública, com o objetivo de debater a importância da alimentação saudável e os modelos possíveis para uma agricultura sustentável. A audiência será parte das atividades da Campanha ""Junho Verde"", instituído pela Resolução do Senado Federal nº 14, de 25 de setembro de 2020, para promover a conscientização da sociedade sobre a importância da preservação dos recursos naturais e do meio ambiente.",Sim,2021,REQ
581,148853,"Realização de Sessão de Debates Temáticos, a ser realizada em data oportuna, a fim de debater sobre o impacto fiscal do PL nº 4728, de 2020.",Não,2021,RQS
581,148933,"Altera o Ato das Disposições Constitucionais Transitórias para aumentar, até 31 de dezembro de 2021, o limite de moratória e parcelamento de débitos previdenciários dos entes federativos, e de suas autarquias e fundações públicas, vencidos até a promulgação desta Emenda Constitucional para 240 (duzentos e quarenta) meses.",Não,2021,PEC
581,148611,"Altera o art. 473 da Consolidação das Leis do Trabalho (CLT), aprovada pelo Decreto Lei nº 5.452, de 1º maio de 1943, para determinar a concessão de abono do dia em que comprovar a ausência motivada para vacinação do trabalhador, de dependente menor e dependente maior de idade com deficiência, nos termos da Lei nº 13.146, de 6 de julho de 2015.",Sim,2021,PL
581,148768,"Altera Lei nº 14.161, de 2 de junho de 2021, para contemplar no Pronampe as cooperativas com ingressos anuais decorrentes de operações com atos cooperativos e não cooperativos de até R$ 4,8 milhões (quatro milhões e oitocentos mil reais) ao ano.",Sim,2021,PL
581,148767,"Realização de Sessões de Debates Temáticos, em junho, a fim de debater sobre a situação da Educação no País e as saídas para o pós crise Covid-19.",Não,2021,RQS
581,148911,"Requer, nos termos do art. 58, § 2°, II e V, da Constituição Federal, que seja convidado o Senhor Joaquim Álvaro Pereira Leite, Ministro de Estado de Meio Ambiente, a comparecer a esta Comissão, a fim de prestar informações sobre os planos, direcionamentos e ações previstos para a gestão da pasta.",Sim,2021,REQ
581,148344,"Dispõe sobre apoio financeiro da União aos Estados, ao Distrito Federal e aos Municípios para garantir ações emergenciais voltadas ao setor cultural; altera a Lei Complementar nº 101, de 4 de maio de 2000 para vedar a limitação de empenho e movimentação das despesas relativas a aquisição de produtos e serviços vinculados à execução do Fundo Nacional de Cultura, e não contabilizar na meta de resultado primário as transferências previstas nesta Lei Complementar; vedar a imposição de limites à execução orçamentária e financeira da programação orçamentária relativa às fontes vinculadas ao Fundo Nacional de Cultura; e vedar a alocação de recursos do Fundo Nacional de Cultura em reservas de contingência de natureza primária ou financeira.",Não,2021,PLP
581,148794,Audiência da Comissão de Meio Ambiente sobre o PL nº 2159/2021.,Sim,2021,RQS
581,148649,"Requer que sejam realizados estudos, no âmbito da Comissão do Meio Ambiente, para elaboração de arcabouço legislativo compreensivo que apresente ao país um Plano Nacional de Desenvolvimento Sustentável.",Sim,2021,REQ
581,148554,"Realização, em data oportuna, de sessão de debates temáticos acerca da MPV nº 1031/2021.",Não,2021,RQS
581,148648,Requer realização de Audiência Pública na CMA para debater uma Transição Justa: Estratégias para uma Recuperação Sustentável,Sim,2021,REQ
581,147789,"Requer, nos termos do art. 96-B do Regimento Interno do Senado Federal, que a Comissão de Meio Ambiente avalie a Política Nacional de Mudanças do Clima, instituída pela Lei nº 12.187, de 29 de dezembro de 2009, e também os compromissos assumidos pelo Brasil, no âmbito do Acordo de Paris, durante a 21ª Conferência das Partes da Convenção Quadro de Mudanças Climáticas da ONU em 2015, ratificado pelo Congresso Nacional em agosto de 2016, e promulgado pelo Presidente da República no Dia Mundial do Meio Ambiente, por meio do Decreto Federal nº 9.073 de 5 de junho 2017, com foco especial na avaliação do que estabelece o inciso III do art. 6º da referida lei, que trata dos Planos de Ação para Prevenção e Controle do Desmatamento nos biomas, em face dos aumentos expressivos de desmatamentos e queimadas ilegais nos biomas Cerrado, Amazônia e Pantanal, no exercício de 2021.",Sim,2021,REQ
581,148681,"Susta, nos termos do inciso V do art. 49 da Constituição Federal, a Portaria nº 118, de 31 de maio de 2021, da Fundação Cultural Palmares, que “revoga a Instrução Normativa nº 1, de 31 de outubro de 2018”, da mesma Instituição.",Não,2021,PDL
581,148964,"Altera o Capítulo IV – Dos Direitos Políticos, do Título II – Dos Direitos e Garantias Fundamentais da Constituição para estabelecer cota de vagas para candidatos negros nas eleições para o poder legislativo, e cota para candidaturas para cada sexo, e para dispor sobre a destinação dos recursos públicos do Fundo Partidário e do Fundo Especial de Financiamento de Campanha e o tempo de rádio e televisão.",Não,2021,PEC
581,148426,Esta Lei institui a Política de Atenção Integral às vítimas e familiares de vítimas da Pandemia da COVID-19.,Sim,2021,PL
581,148340,"Susta os efeitos das Instruções Normativas Conjuntas nºs 1, de 12 de abril de 2021, e 2, de 26 de abril de 2021, do Ministério do Meio Ambiente, do Instituto Brasileiro do Meio Ambiente e dos Recursos Naturais Renováveis e do Instituto Chico Mendes de Conservação da Biodiversidade, que regulamentam o processo administrativo federal para apuração de infrações administrativas por condutas e atividades lesivas ao meio ambiente.",Não,2021,PDL
581,148537,Altera o art. 13 da Constituição Federal para incluir a língua brasileira de sinais como um dos idiomas oficiais da República Federativa do Brasil.,Não,2021,PEC
581,148387,"Realização de Sessão de Debates Temáticos, em data oportuna, a fim de debater uma estratégia nacional para o
retorno seguro às atividades educacionais presenciais.",Não,2021,RQS
581,148397,"Altera o Ato das Disposições Constitucionais Transitórias para aumentar o limite de moratória e parcelamento para 240 (duzentos e quarenta) meses para débitos dos entes federativos com seus regimes próprios de previdência, enquanto perdurarem os efeitos de estado de calamidade pública em razão da pandemia causado pelo COVID.",Não,2021,PEC
581,148381,"Realização de Sessão de Debates Temáticos, em data oportuna, a fim de discutir o PL nº 4.909/2020.",Não,2021,RQS
581,148272,"Informações ao Ministro de Estado do Meio Ambiente sobre a possibilidade da interrupção das atividades das brigadas de incêndio do Instituto Chico Mendes de Conservação da Biodiversidade (Instituto Chico Mendes), a partir do dia 1º de maio de 2021, pela falta de recursos orçamentários.",Sim,2021,RQS
581,148450,"Susta, nos termos do inciso V do art. 49 da Constituição Federal, a Portaria nº 115, de 19 de abril de 2021, do Secretário de Aquicultura e Pesca do Ministério da Agricultura, Pecuária e Abastecimento, que aprova o Plano para a Retomada Sustentável da Atividade de Pesca de Arrasto na Costa do Rio Grande do Sul.",Não,2021,PDL
581,148383,"Realização de Sessão de Debates Temáticos, em data oportuna, a fim de debater a situação do Mercosul.",Não,2021,RQS
581,148415,"Susta, nos termos do art. 49, V, da Constituição Federal, os efeitos da Portaria ME/SED/SG nº 4.975 que dispõe sobre os procedimentos para a aplicação do limite remuneratório de que tratam o inciso XI e o § 10 do art. 37 da Constituição Federal sobre a remuneração, provento ou pensão percebidos cumulativamente por servidor, empregado ou militar, aposentado, inativo ou beneficiário de pensão e demais providências.",Não,2021,PDL
581,148255,"Realização de Sessão de Debates Temáticos, no dia 10/05/2021, a fim de debater uma estratégia nacional para o retorno seguro às aulas presenciais.",Não,2021,RQS
581,147863,"Retirada da Emenda nº 3 - PLEN, apresentada ao PL nº 5638/2020.",Sim,2021,RQS
581,148029,"Inclui, na Constituição Federal, o direito à qualidade do ar entre os direitos e garantias fundamentais.",Não,2021,PEC
581,148013,"Requer que sejam prestadas, pelo Senhor Ministro-Chefe do Gabinete de Segurança Institucional (GSI), Augusto Heleno Ribeiro Pereira, informações sobre o Processo Administrativo Disciplinar, iniciado pela Corregedoria da ABIN que afastou servidor, supostamente responsável pelo fornecimento de informações confidenciais à imprensa, conforme noticiado na imprensa.",Sim,2021,REQ
581,147826,Adição de assinatura ao RQS nº 1238/2021.,Sim,2021,RQS
581,147855,"Requer, nos termos do art. 96-B do Regimento Interno do Senado Federal, que a Comissão de Meio Ambiente avalie a atuação do governo federal nas políticas de combate ao desmatamento e de prevenção e controle dos incêndios florestais, no exercício de 2021.",Sim,2021,REQ
581,148193,"Informações ao Ministro de Economia relativas ao estágio de análise do Projeto “Plantando Resiliência Climática em Comunidades Rurais do Nordeste” (Planting Climate Resilience in Rural Communities of the Northeast – PCRP), com discriminação do cronograma de implementação e execução do projeto, as etapas restantes e etapas já concluídas do projeto.",Sim,2021,RQS
581,148036,Informações ao Ministro de Estado da Educação.,Sim,2021,RQS
581,148047,Dispõe sobre o Regime Especial de Contribuição Patronal Previdenciária dos Municípios – SIMPLES Municipal.,Sim,2021,PLP
581,147854,"Requer, nos termos do art. 96-B do Regimento Interno do Senado Federal, que a Comissão de Meio Ambiente avalie a atuação do governo federal nas políticas relacionadas à produção, conservação e distribuição dos recursos hídricos no país, em especial a Política Nacional de Recursos Hídricos, no exercício de 2021.",Sim,2021,REQ
581,147832,Adição de assinatura ao PRS nº 24/2021.,Sim,2021,RQS
581,147809,"Voto de censura ao senhor Filipe Garcia Martins Pereira, Assessor-Chefe da Secretaria de Especial de Assuntos Estratégicos da Presidência da República.",Não,2021,RQS
581,147866,"Altera a Lei 7.716, de 05 de janeiro de 1989, para incluir aos crimes capitulados no art. 20, a hipótese de apologia a ideologia ou ação de grupo supremacista branco, ou outro congênere, com causa de aumento de pena quando cometido por servidor público ou com finalidade de atentar contra as instituições democráticas.",Sim,2021,PL
581,147831,"Susta a realização das sabatinas dos Chefes de Missão Diplomática, previstas no art.52, IV, da Constituição Federal e no art. 383, III, do Regimento Interno do Senado Federal. .",Não,2021,PRS
581,148128,Informações a Ministra de Estado da Agricultura sobre as medidas adotadas pelo órgão ministerial sob seu comando a respeito da sobreposição de imóveis rurais registrados no Cadastro Ambiental Rural (CAR) a terras indígenas.,Sim,2021,RQS
581,148127,"Informações ao Ministro de Estado de Meio Ambiente acerca de políticas públicas sobre mudança do clima, em especial sobre o programa de mercado voluntário de carbono denominado Programa Floresta +, instituído pelo Ministério do Meio Ambiente (MMA) por meio da Portaria MMA nº 288/2020.",Sim,2021,RQS
581,148051,Dispõe sobre a assistência médica e fisioterapêutica às pessoas recuperadas da infecção pelo novo coronavírus (SARS-CoV-2).,Sim,2021,PL
581,147928,"Altera a Lei nº 14.042, de 19 de agosto de 2020, para ampliar o prazo de carência do Programa Emergencial de Acesso a Crédito (Peac).",Sim,2021,PL
581,147515,"Sessão Especial, a ser realizada em data oportuna, a fim de comemorar os noventa anos do ex-Presidente da República Fernando Henrique Cardoso.",Não,2021,RQS
581,147339,Adição de assinatura à PEC nº 11/2021.,Sim,2021,RQS
581,147551,Adição de assinatura ao RQS nº 1026/2021.,Sim,2021,RQS
581,147609,"Altera a Lei nº 1.079, de 10 de abril de 1950, para tipificar crime de responsabilidade contra o direito à saúde.",Sim,2021,PL
581,147213,Informações ao Ministro de Estado do Meio Ambiente.,Sim,2021,RQS
