codigoParlamentar,CodigoMateria,Ementa,IndicadorAutorPrincipal,AnoMateria,AutoriasSigla
581,147062,Adição de assinatura ao PDL nº 96/2021.,Sim,2021,RQS
581,147566,Realização de sessão de debates temáticos para debater a viabilidade da suspensão temporária das patentes das vacinas contra a COVID-19.,Não,2021,RQS
581,147558,Adição de assinatura ao RQS nº 1067/2021.,Sim,2021,RQS
581,147474,Adição de assinatura ao RQS nº 1001/2021.,Sim,2021,RQS
581,147110,"Realização de sessão especial,  destinada a homenagear o PROVID.",Não,2021,RQS
581,147113,Adição de assinatura ao RQS nº 732/2021,Sim,2021,RQS
581,147490,Sessão especial a fim de comemorar o centenário do educador Paulo Freire.,Não,2021,RQS
581,147302,"Informações ao Ministro de Estado das Relações Exteriores acerca da recente viagem de comitiva oficial do governo brasileiro a Israel, integrada pelo próprio ministro do MRE; o secretário especial de Comunicação Social, Fábio Wajngarten; o assessor especial da Presidência Filipe Martins; os deputados Eduardo Bolsonaro (PSL-SP) e Hélio Lopes (PSL-RJ); o embaixador Kenneth Félix Haczynski da Nóbrega; o secretário de Ciência e Tecnologia do Ministério da Saúde, Hélio Angotti Neto; e o secretário de Políticas de Pesquisa e Desenvolvimento do Ministério da Ciência e Tecnologia, Marcelo Marcos Morales.",Sim,2021,RQS
581,147199,Urgência para o PL nº 5638/2020.,Não,2021,RQS
581,147222,Adição de assinatura ao PDL nº 110/2021,Sim,2021,RQS
581,147441,Institui a Política Nacional de Promoção da Alimentação e dos Produtos da Sociobiodiversidade de Povos e Comunidades Tradicionais e dá outras providências.,Sim,2021,PL
581,147240,"Informações ao Ministro de Estado das Relações Exteriores acerca da viagem do Deputado Eduardo Bolsonaro aos Estados Unidos da América, ocorrida no início de janeiro do corrente ano.",Sim,2021,RQS
581,147219,"Susta os efeitos da Portaria nº 124, de 4 de março de 2021, do Secretário Nacional de Fomento e Incentivo à Cultura, da Secretaria Especial de Cultura, do Ministério do Turismo.",Não,2021,PDL
581,147461,"Institui moratória para os débitos tributários relativos ao Simples Nacional, altera a Lei Complementar nº 123, de 14 de dezembro de 2006, em decorrência da Emergência de Saúde Pública de Importância Nacional (ESPIN) do novo Coronavírus - Covid-19.",Sim,2021,PLP
581,147221,Adição de assinatura ao RQS nº 794/2021,Sim,2021,RQS
581,147047,"Susta a Instrução Normativa Conjunta nº 1, de 22 de fevereiro de 2021, da Fundação Nacional do Índio (FUNAI) e do Instituto Brasileiro do Meio Ambiente e dos Recursos Naturais Renováveis (IBAMA), que dispõe sobre os procedimentos a serem adotados durante o processo de licenciamento ambiental de empreendimentos ou atividades localizados ou desenvolvidos no interior de Terras Indígenas cujo empreendedor seja organizações indígenas.",Não,2021,PDL
581,147187,Informações ao  Ministro de Estado da Defesa  sobre a saída das Forças Armadas das ações de fiscalização ambiental na Amazônia.,Sim,2021,RQS
581,147186,"Informações ao Ministro de Estado do Meio Ambiente informações sobre as ações de controle e fiscalização do Instituto Brasileiro do Meio Ambiente e dos Recursos Naturais Renováveis (IBAMA), tendo em vista a previsão orçamentária do órgão para este ano e o vulto das ações estratégicas para o cumprimento dos compromissos ambientais assumidos pelo País.",Sim,2021,RQS
581,147185,"Informações ao Ministro de Estado do Meio Ambiente sobre o Programa Floresta +, para pagamento por serviços ambientais.",Sim,2021,RQS
581,147635,Moção de Apelo à Comunidade Internacional relativa ao processo de vacinação contra a COVID-19 no Brasil.,Não,2021,RQS
581,147084,"Realização de sessão especial, destinada ao Dia internacional da Mulher.",Não,2021,RQS
581,147112,Adição de assinatura ao RQS nº 708/2021.,Sim,2021,RQS
581,147797,"Altera a Lei nº 9.795, de 1999, que dispõe sobre a Política Nacional de Educação Ambiental, para instituir a Campanha Junho Verde.",Sim,2021,PL
581,148410,"Altera o texto permanente da Constituição Federal e o Ato das Disposições Constitucionais Transitórias para estabelecer vedações ao aumento de tributação na União, nos Estados, no Distrito Federal e nos Municípios que não sejam destinados exclusivamente ao combate de estado de calamidade nacional.",Não,2021,PEC
581,147687,Adição de assinatura ao RQS nº 1097/2021.,Sim,2021,RQS
581,147038,"Susta a Resolução nº 4 , de 22 de janeiro de 2021, da Fundação Nacional do Índio – Funai - que define novos critérios específicos de heteroidentificação que serão observados pela FUNAI.",Não,2021,PDL
581,146926,Adição de assinatura a Emenda(s) à PEC nº 186/2019.,Sim,2021,RQS
581,147041,Adição de assinatura ao PDL nº 95/2021.,Sim,2021,RQS
581,146979,Adição de assinatura a Emenda(s) à PEC nº 186/2019.,Sim,2021,RQS
581,147013,Informações ao Ministro de Estado do Meio Ambiente sobre a forma como vêm sendo conduzidas audiências públicas virtuais durante a pandemia em processos de licenciamento ambiental.,Sim,2021,RQS
581,147012,Informações ao Ministro de Estado do Meio Ambiente sobre o Plano Nacional e o Plano Operativo para o Controle do Desmatamento Ilegal e Recuperação da Vegetação Nativa 2020-2023.,Sim,2021,RQS
581,146858,Adição de assinatura a Emenda(s) à PEC nº 186/2019.,Sim,2021,RQS
581,146609,Adição de assinatura ao PDL 74/2021.,Sim,2021,RQS
581,146360,Dispõe sobre suspensão de execução de contragarantias pela União de dívidas decorrentes de contratos de operações de crédito celebrados entre instituições multilaterais e Estados e Municípios.,Sim,2021,PLP
581,146359,"Dispõe sobre suspensão dos pagamentos pelos Estados, Distrito Federal e Municípios, devidos no exercício financeiro de 2021, referentes a operações de crédito interno celebradas com o sistema financeiro.",Sim,2021,PLP
581,146835,Adição de assinatura a Emenda(s) à PEC nº 186/2019.,Sim,2021,RQS
581,146840,Adição de assinatura a Emenda(s) à PEC nº 186/2019.,Sim,2021,RQS
581,146474,Adição de assinatura à PEC nº 2/2021.,Sim,2021,RQS
581,146774,Adição de assinatura a Emenda(s) à PEC nº 186/2019.,Sim,2021,RQS
581,146768,"Retirada das Emendas nºs 3 - PLEN, 6 - PLEN e 8 - PLEN, apresentadas ao PL nº 317/2021.",Sim,2021,RQS
581,146611,Adição de assinatura ao PDL nº 72/2021.,Sim,2021,RQS
581,146407,Insere art. 175-A na Constituição para determinar que pelo menos 70% dos recursos obtidos com outorgas onerosas de obras e serviços de transportes sejam reinvestidos no próprio setor.,Não,2021,PEC
581,146582,Adição de assinatura ao PDL nº 55/2021.,Sim,2021,RQS
581,146551,"Susta o Decreto 10.630, de 12 de fevereiro de 2021, que altera o Decreto nº 9.847, de 25 de junho de 2019, que regulamenta a Lei nº 10.826, de 22 de dezembro de 2003, para dispor sobre a aquisição, o cadastro, o registro, o porte e a comercialização de armas de fogo e de munição e sobre o Sistema Nacional de Armas e o Sistema de Gerenciamento Militar de Armas.",Não,2021,PDL
581,146581,Adição de assinatura ao PDL nº 57/2021.,Sim,2021,RQS
581,146603,"Susta o Edital de Convocação nº 02/2020 – CGPLI, do Ministério da Educação (MEC) em cooperação com o Fundo Nacional de Desenvolvimento da Educação (FNDE), que tem como objeto a seleção e aquisição de obras didáticas destinadas aos estudantes, professores e gestores da educação infantil; de obras literárias destinadas aos estudantes e professores da educação infantil; e de obras pedagógicas de preparação para alfabetização baseada em evidências.",Não,2021,PDL
581,146556,"Susta o Decreto 10.627, de 12 de fevereiro de 2021, que altera o Anexo I ao Decreto nº 10.030, de 30 de setembro de 2019, que aprova o Regulamento de Produtos Controlados.",Não,2021,PDL
581,146217,Adição de assinatura à PEC nº 1/2021.,Sim,2021,RQS
581,146738,"Altera o Ato das Disposições Constitucionais Transitórias, dispondo sobre o pagamento de auxílio emergencial, e dá outras providências.",Não,2021,PEC
581,146781,Adição de assinatura a Emenda(s) à PEC nº 186/2019.,Sim,2021,RQS
581,146728,Adição de assinatura a Emenda(s) à PEC nº 186/2019.,Sim,2021,RQS
581,146555,"Susta o Decreto 10.628, de 12 de fevereiro de 2021, que Altera o Decreto nº 9.845, de 25 de junho de 2019, que regulamenta a Lei nº 10.826, de 22 de dezembro de 2003, para dispor sobre a aquisição, o cadastro, o registro e a posse de armas de fogo e de munição.",Não,2021,PDL
581,146613,"Susta o Decreto 10.629, de 12 de fevereiro de 2021, que altera o Decreto nº 9.846, de 25 de junho de 2019, que regulamenta a Lei nº 10.826, de 22 de dezembro de 2003, para dispor sobre o registro, o cadastro, e a aquisição de armas e de munições por caçadores, colecionadores e atiradores.",Não,2021,PDL
581,146606,Adição de assinatura ao PDL nº 58/2021.,Sim,2021,RQS
581,145793,Adição de assinatura ao PL nº 5454/2020.,Sim,2020,RQS
581,146183,"Informações ao Ministro de Estado das Relações Exteriores sobre a proibição de que ministros de Estado brasileiros possam se reunir ou manter diálogo com o embaixador da República Popular na China no Brasil, Sr. Yang Wanming.",Sim,2021,RQS
581,146119,Adição de assinatura ao PDL nº 577/2020.,Sim,2020,RQS
581,145791,Dispõe sobre a elaboração do Plano Nacional de Imunização para a Covid-19 (PNIC19) e dá outras providências.,Não,2020,PL
581,146072,Dispõe sobre o pagamento de auxílio emergencial e a tributação de lucros e dividendos.,Sim,2020,PL
581,145497,"Voto de repúdio ao grupo de Supermercados Carrefour do Brasil por mais um ato de brutal violência cometido pela equipe de segurança contratada pela rede de supermercados, que espancou até a morte João Alberto Silveira Freitas, um homem negro de 40 anos.",Não,2020,RQS
581,145862,Requer realizar atos de fiscalização e controle para fins de apuração de graves fatos reportados pela imprensa nacional,Sim,2020,REQ
581,145861,"Requer a convocação do Ministro de Estado Chefe do Gabinete de Segurança Institucional, Sr. Augusto Heleno Ribeiro Pereira",Sim,2020,REQ
581,145646,"Adição de assinatura à Emenda nº 18, de autoria do Senador Rogério Carvalho, oferecida ao PL 4023, de 2020.",Sim,2020,RQS
581,146073,"Sugere, ao Ministério da Economia, que adote imediatas providências sobre o anúncio da Mercedes-Benz, do encerramento da produção de automóveis em sua fábrica de Iracemápolis, no Estado de São Paulo.",Sim,2020,INS
581,145716,"Susta a Portaria Interministerial nº 3, de 25 de novembro de 2020, do Ministério da Educação e do Ministério da Economia, que altera parâmetros operacionais do Fundo de Manutenção e Desenvolvimento da Educação Básica e de Valorização dos Profissionais da Educação – Fundeb, para o exercício de 2020.",Sim,2020,PDL
581,146155,Informações ao Ministro de Estado do Meio Ambiente sobre a destinação de recursos do Fundo Nacional do Meio Ambiente (FNMA) e do Fundo Nacional sobre Mudança do Clima (Fundo Clima) para o projeto Lixão Zero.,Sim,2021,RQS
581,146086,Informações ao Ministro de Estado do Turismo sobre análise e aprovação de projetos culturais para acesso ao financiamento pela Lei de Incentivo à Cultura.,Sim,2020,RQS
581,146120,"Susta, nos termos do inciso V do art. 49 da Constituição Federal, o Decreto nº 10.576, de 14 de dezembro de 2020, que dispõe sobre a cessão de uso de espaços físicos em corpos d’água de domínio da União para a prática da aquicultura.",Não,2020,PDL
581,145929,"Adição de assinatura às Emendas nºs 26 a 32 - PLEN, apresentadas ao PL nº 4372/2020.",Sim,2020,RQS
581,146031,"Susta os efeitos do Decreto nº 10.578 de 15 de dezembro de 2020, que dispõe sobre a dissolução societária do Centro Nacional de Tecnologia Eletrônica Avançada S.A. e a publicização das atividades direcionadas à pesquisa científica, ao desenvolvimento tecnológico e à inovação no setor de microeletrônica.",Sim,2020,PDL
581,146020,Adição de assinatura ao RQS nº 2983/2020.,Sim,2020,RQS
581,145932,Retirada do PL nº 2963/2019 da pauta da Ordem do Dia de 15.12.2020.,Não,2020,RQS
581,145517,Adição de assinatura ao RQS nº 2724/2020.,Sim,2020,RQS
581,145326,"Voto de repúdio ao advogado Cláudio Gastão da Rosa Filho, ao Juiz Rudson Marcos e ao Promotor de Justiça Thiago Carriço de Oliveira, por distorcerem fatos de um crime de estupro, expondo a vítima a sofrimento e humilhação.",Não,2020,RQS
581,145376,"Adição de assinatura à PEC registrada no SEDOL nº SF/20739.49766-67, de autoria do Senador Izalci Lucas.",Sim,2020,RQS
581,145333,"Adição de assinatura ao Requerimento nº 2621, de 2020, de autoria do Senador Fabiano Contarato.",Sim,2020,RQS
581,145166,"Informações ao Ministro-Chefe do Gabinete de Segurança Institucional da Presidência da República sobre ação de espionagem da Agência Brasileira de Inteligência (ABIN), efetuada na 25ª Conferência do Clima (COP) da Organização das Nações Unidas, que se realizou em dezembro de 2019, na cidade de Madrid (Espanha).",Sim,2020,RQS
581,145047,Adição de assinatura ao RQS 2504/2020.,Sim,2020,RQS
581,144966,"Susta a Resolução do CONAMA – Conselho Nacional do Meio Ambiente, que revoga as Resoluções CONAMA 284/2001, 302/2002 e 303/2002.",Sim,2020,PDL
581,145458,Informações ao Ministro de Estado das Relações Exteriores sobre a retirada do site institucional do Itamaraty de vários discursos do ex-Presidente Luiz Inácio Lula da Silva e do ex-Ministro Celso Amorim.,Sim,2020,RQS
581,145292,"Informações ao Ministro de Estado do Desenvolvimento Regional sobre a execução orçamentária das operações realizadas com carros-pipa no Norte/Nordeste, bem como esclarecimentos sobre a alteração da metodologia de pagamento da citada operação.",Sim,2020,RQS
581,145271,"Susta os efeitos do Decreto n° 10.530, de 26 de outubro de 2020, que “Dispõe sobre a qualificação da política de fomento ao setor de atenção primária à saúde no âmbito do Programa de Parcerias de Investimentos da Presidência da República, para fins de elaboração de estudos de alternativas de parcerias com a iniciativa privada.”",Não,2020,PDL
581,145277,Informações ao Ministro de Estado Presidente do Banco Central do Brasil sobre utilização dos instrumentos de compra de títulos públicos no mercado secundário autorizados pela EC 106/2020.,Sim,2020,RQS
581,144853,"Requeiro, nos termos do art. 222 do Regimento Interno do Senado
Federal, inserção em ata de voto de censura à visita do secretário de Estado dos EUA, Sr. Mike Pompeo, ao Estado de Roraima, pelo comprometimento da estabilidade das nossas fronteiras e do convívio pacífico e respeitoso com os países vizinhos. Requeiro, ainda, que seja enviada cópia do presente voto, conforme dados em anexo.",Sim,2020,REQ
581,144795,"Requeiro, nos termos dos arts. 50, caput, e 58, § 2º, III da Constituição
Federal e dos arts. 90, III, 397, § 1º e 400-A do Regimento Interno do Senado
Federal, a convocação do Senhor Ernesto Araújo, Ministro de Estado das Relações Exteriores, para que compareça a esta Comissão, a fim de prestar informações, em sessão não presencial, acerca da visita do Sr. Mike Pompeo, Secretário de Estado dos EUA, a Roraima, ao apoio do Brasil ao candidato norte-americano no BID, à extensão da cota de importação para o etanol norte-americano e aos rumos gerais da atual política externa brasileira.",Sim,2020,REQ
581,144789,Adição de assinatura ao RQS nº 2275/2020.,Sim,2020,RQS
581,144982,Adição de assinatura ao RQS nº 2463/2020.,Sim,2020,RQS
581,144961,Informações ao Ministro de Estado da Controladoria-Geral da União sobre os documentos elaborados pelo Exército que tratam do rastreamento de produtos controlados.,Sim,2020,RQS
581,145055,Realização de sessão especial destinada ao dia do médico.,Não,2020,RQS
581,144989,Dispõe sobre medidas emergenciais para a regularização da oferta de alimentos da dieta básica da população brasileira e dá outras providências.,Sim,2020,PL
581,144960,"Informações ao Ministro de Estado da Economia sobre repercussões financeiras para os beneficiários legais e para o agente operador (CAIXA), da qualificação do serviço público de loteria denominado apostas de quota fixa, instituído pela Lei nº 13.756, de 12 de dezembro de 2018, no âmbito do Programa de Parcerias de Investimentos da Presidência da República (PPI) e sobre a sua inclusão no Programa Nacional de Desestatização (PND), conforme dispõe o Decreto nº 10.467, de 18 de agosto de 2020.",Sim,2020,RQS
581,144893,"Altera o art. 165 da Constituição Federal e o art. 107 e 110 do Ato das Disposições Constitucionais Transitórias, acrescenta art. 115 ao Ato das Disposições Constitucionais Transitórias, bem como revoga o inciso III do art. 167 da Constituição Federal e a Emenda Constitucional nº 95, de 16 de dezembro de 2016.",Não,2020,PEC
581,144888,"Adição de assinatura ao requerimento registrado no SEDOL nº SF/20936.67477-02, de autoria da Senadora Eliziane Gama.",Sim,2020,RQS
581,144956,"Requeiro, nos termos do art. 74, II do Regimento Interno do Senado Federal, a constituição de uma Comissão Temporária Externa composta de 5 (cinco) membros titulares para, no prazo de 120 (cento e vinte) dias, observar, in loco, as próximas eleições legislativas na Venezuela e estabelecer diálogo com todas as forças políticas daquele país, de modo a contribuir, dentro dos princípios constitucionais que regem a política externa brasileira, para o aprimoramento das nossas relações bilaterais com aquela importante nação vizinha e amiga.",Sim,2020,REQ
581,144978,Voto de solidariedade à atleta Carolina Salgado Collett Solberg.,Não,2020,RQS
581,145276,Adição de assinatura ao PDL nº 468/2020.,Sim,2020,RQS
581,144887,Adição de assinatura à PEC nº 36/2020.,Sim,2020,RQS
581,144651,Adição de assinatura ao PDL nº 396/2020.,Sim,2020,RQS
581,144644,"Susta os efeitos da Portaria nº 493, de 1º de setembro de 2020, “Autoriza o emprego da Força Nacional de Segurança Pública - FNSP, em apoio ao Ministério da Agricultura, Pecuária e Abastecimento, nos Municípios de Prado e Mucuri, no Estado da Bahia”.",Sim,2020,PDL
581,144634,"Informações à Ministra de Estado da Agricultura sobre a solicitação de envio da Força Nacional de Segurança Pública, ao Estado da Bahia, para intervenção em assentamentos do Movimento Sem Terra localizados no estado.",Sim,2020,RQS
581,144489,Adição de assinatura ao RQS nº 2099/2020.,Sim,2020,RQS
581,144359,Informações ao Ministro de Estado da Educação sobre o adiamento de despesas com bolsas internacionais que seriam realizadas no ano de 2020.,Sim,2020,RQS
581,144409,"Altera o art. 150 da Constituição Federal para garantir a imunidade tributária aos livros, jornais, periódicos e o papel destinado a sua impressão.",Não,2020,PEC
581,144482,Adição de assinatura ao RQS nº 2143/2020.,Sim,2020,RQS
581,144610,"Dispõe sobre a comercialização, propaganda, publicidade e promoção comercial de alimentos e bebidas ultraprocessados e uso de frituras e gordura trans em escolas públicas e privadas, em âmbito nacional.",Sim,2020,PL
581,144468,"Adiamento da discussão do PL nº 3267/2019 para que sejam ouvidas CAS, CI e CDH.",Não,2020,RQS
581,144358,"Informações ao Ministro de Estado Chefe da Casa Civil da Presidência da República sobre a nomeação de servidor identificado tão somente pelo respectivo número de matrícula, conforme consta da Portaria nº 370, de 22 de julho de 2020.",Sim,2020,RQS
581,144591,"Informações ao Ministro de Estado da Economia sobre a realização do Censo Demográfico de 2021, a ser conduzido pelo Instituto Brasileiro de Geografia e Estatística - IBGE.",Sim,2020,RQS
581,144590,Informações ao Ministro de Estado do Meio Ambiente sobre providências tomadas pelos órgãos ambientais no “Dia do Fogo”.,Sim,2020,RQS
581,144453,Informações ao Ministro de Estado de Meio Ambiente sobre execução orçamentária do Instituto Brasileiro do Meio Ambiente e dos Recursos Naturais Renováveis.,Sim,2020,RQS
581,144325,Adição de assinatura à PEC nº 31/2020.,Sim,2020,RQS
581,144635,"Informações ao Ministro de Estado da Justiça e Segurança Pública sobre a solicitação de envio da Força Nacional de Segurança Pública, ao Estado da Bahia, para intervenção em assentamentos do Movimento Sem Terra localizados no estado.",Sim,2020,RQS
581,144190,"Adição de assinatura ao Requerimento nº 1914/2020, de autoria do Senador Jean Paul Prates.",Sim,2020,RQS
581,144848,"Altera os art. 5º, 6º e 215 da Constituição para assegurar a todos os residentes no País o acesso à Internet.",Não,2020,PEC
581,144552,"Adição de assinatura à PEC nº 35/2020, de autoria do Senador Paulo Paim.",Sim,2020,RQS
581,144645,"Sustam-se, nos termos do art. 49, V, da Constituição Federal, os efeitos da Portaria nº 2.384/GM/MS, de 8 de setembro de 2020, do Ministro de Estado da Saúde Interino, publicada no Diário Oficial da União de 09 de setembro de 2020, repristinando-se integralmente os efeitos da Portaria nº 2.309/GM/MS, de 28 de agosto de 2020, de modo a atualizar a Lista de Doenças Relacionadas ao Trabalho (LDRT). .",Não,2020,PDL
581,144375,"Adiamento da discussão do PL nº 3267, de 2019 para audiência da CAS, CI e CDH.",Não,2020,RQS
581,144127,Retirada do PL nº  3267/2019 da pauta da Ordem do Dia.,Não,2020,RQS
581,144705,"Retirada da Emenda nº 1 - PLEN, apresentada ao PL nº 3229/2020.",Sim,2020,RQS
581,143710,"Requeremos, nos termos do art. 5 da Resolução 2 de 2013, do Regimento Comum do Congresso Nacional,, a convocação do Ministro da Justiça e Segurança Pública, Sr. André Mendonça, para prestar esclarecimentos acerca das investigações conduzidas pelo seu Ministério de pessoas identificadas como antifascistas.",Não,2020,REQ
581,143904,Adição de assinatura à PEC nº 29/2020.,Sim,2020,RQS
581,144067,Introduz a renda básica como direito social.,Não,2020,PEC
581,143535,"Adição de assinatura à proposta de emenda à Constituição registrada no SEDOL nº SF/20927.58734-06, tendo como primeiro signatário o Senador Fabiano Contarato.",Sim,2020,RQS
581,143536,"Sugere, ao Ministro de Estado da Educação, a homologação do Parecer nº 11, do Conselho Nacional de Educação, bem como a alocação de recursos financeiros e orçamentários, por meio de programas, projetos e ações, para auxiliar os sistemas de ensino da rede pública a fazer frente aos desafios da retomada das aulas presenciais, no contexto da pandemia de covid19.",Não,2020,INS
581,143534,Adição de assinatura à INS nº 53/2020.,Sim,2020,RQS
581,143455,Informações ao Ministro de Estado do Meio Ambiente sobre a política ambiental brasileira.,Sim,2020,RQS
581,143902,"Suspende, por dois anos, a vigência da Emenda Constitucional nº 95, de 15 de dezembro de 2016.",Não,2020,PEC
581,143878,Adição de assinatura ao PL nº 4106/2020.,Sim,2020,RQS
581,143782,"Retirada da emenda nº 3 - PLEN, apresentada ao PLP nº 133/2020.",Sim,2020,RQS
581,143696,"Proposta de Fiscalização e Controle nesta Comissão Mista de Controle das Atividades de Inteligência (CCAI), para realizar atos de fiscalização e controle relativos a investigação promovida pelo Ministério da Justiça e Segurança Pública em relação a pessoas identificadas como antifascistas.",Sim,2020,REQ
581,143852,"Altera a Lei 10.836, de 9 de janeiro de 2004 que cria o Programa Bolsa Família e a Lei 8.742, de 7 de dezembro de 1993, que dispõe sobre a organização da Assistência Social, para ampliar as condições de superação da vulnerabilidade econômica.",Não,2020,PL
581,143821,Adição de assinatura ao RQS nº 1641/2020.,Sim,2020,RQS
581,143676,"Adição de assinatura à proposta de emenda à Constituição registrada no SEDOL nº SF/20190.80130-63, tendo como primeiro signatário o Senador Jader Barbalho.",Sim,2020,RQS
581,143457,Adição de assinatura ao RQS nº 1454/2020.,Sim,2020,RQS
581,143948,"Susta o Decreto nº 10.445, de 30 de julho de2020, que “Aprova a Estrutura Regimental e o Quadro Demonstrativo dos Cargos em Comissão e das Funções de Confiança da Agência Brasileira de Inteligência e remaneja e transforma cargos em comissão e funções de confiança.”",Sim,2020,PDL
581,143802,Voto de solidariedade à República do Líbano em decorrência do acidente ocorrido na zona portuária de Beirute no dia 04/08/2020.,Não,2020,RQS
581,143490,"Realização de sessão de debates temáticos, em data oportuna, a fim de debater sobre os desafios econômicos, sociais e ambientais do Brasil para o período pós-pandemia.",Não,2020,RQS
581,142876,Adição de assinatura a emenda (s) relacionada (s) à PEC 18/2020.,Sim,2020,RQS
581,143167,"Realização de sessão especial, em data oportuna, destinada a celebrar os 100 anos de nascimento de Celso Furtado.",Sim,2020,RQS
581,142705,Adia para o mês de dezembro a realização das eleições municipais previstas para outubro de 2020.,Não,2020,PEC
581,143149,"Institui a Lei de Proteção dos Trabalhadores de Aplicativos de Transporte Individual Privado ou Entrega de Mercadorias (LPTA). Acrescenta art. 609-A à Lei nº 10.406, de 10 de janeiro de 2002, que “institui o Código Civil” e art. 4º-C, à Lei nº 7.998, de 11 de janeiro de 1990, e institui Contribuição de Intervenção no Domínio Econômico – CIDE, regulamentando, no âmbito civil e tributário, o trabalho dos prestadores de serviços com uso de aplicativos de transporte individual privado e dá outras providências.",Sim,2020,PL
