codigoParlamentar,CodigoMateria,Ementa,IndicadorAutorPrincipal,AnoMateria,AutoriasSigla
631,119627,"Suprime o inciso I e o § 3º, ambos do art. 56 da Constiuição Federal, condicionado a posse de Senadores, Deputados Federais, Deputados Estaduais e Vereadores em cargos do Poder Executivo à renúncia ao mandato e dá outras providências.",Não,2015,PEC
631,101950,"Requerem que seja feita audiência pública, com entidades da sociedade civil, destacando OAB, CNBB, e Conselhos de Líderes Religiosos Brasileiros, FENASP, Fórum Evangélico Nacional de Ação Social e Política, através de seu presidente Wilton Acosta, dentre outras, que serão indicadas posteriormente, para  instrução do Projeto de Lei da Câmara nº 122, de 2006, em apreciação nessa Comissão de Direitos Humanos e Legislação Participativa,  antes da votação do parecer sobre a matéria.",Sim,2011,RDH
631,104411,Requer a realização de Audiência Pública para esclarecimento da condenção à morte de um pastor iraniano.,Sim,2012,RDH
631,104412,Requer a realização de Audiência Pública para elucidar fatos cerceamento do exercício de profissionais em decorrência de suas convicções religiosas.,Sim,2012,RDH
631,104791,"Requer aditamento ao Requerimento nº 27-CDH, de 2012, de autoria da Senadora Marta Suplicy.",Sim,2012,RDH
631,104792,"Requer a retirada do Requerimento nº 25-CDH, de 2010.",Sim,2012,RDH
631,104793,"Requer a criação da Subcomissão Temporária, de combate à Pedofilia, Proteção dos Direitos da Criança, do Adolescente, e da Juventude.",Sim,2012,RDH
631,107238,"Requeiro , a  realização de Audiência Pública  para que  sejam ouvidas as autoridades policiais e judiciárias dos Estados do Pará e Maranhão, e de outros Estados, conhecedores do caso,  bem como uma especialista em criminologia, sobre a autoria dos assassinatos de crianças na cidade de Altamira/PA,  e no Maranhão entre os anos de 1989 a 1993 no que ficou conhecido como “Os Emasculados de Altamira”. Senador Magno Malta.",Sim,2012,RDH
631,109227,Requer a realização de audiência pública para expor o trabalho realizado entre os índios Suruwahás no Brasil no ano de 2011.,Sim,2012,RDH
631,112179,"Requer a a realização de audiência pública para expor e debater sobre decisão daquela Entidade de praticar a interrupção da gravidez mais precisamente, da prática do aborto com 12 semanas de gravidez.",Sim,2013,RDH
631,120765,"Requer a realização de Audiência Pública no âmbito da Comissão de Direitos Humanos e Legislação Participativa do Senado Federal (CDH), para discutir a situação dos Ministros de Confissão Religiosa idosos do Brasil.",Não,2015,RDH
631,121138,"Requer a realização de audiências públicas, em número de duas ou mais, se necessário, para discorrerem  e debaterem sobre o Projeto de Lei do Senado, número 470, de 2013, que dispõe sobre o Estatuto da Família.",Sim,2015,RDH
631,123418,"Requer nos termos regimentais a realização de audiência pública nessa Comissão de Direitos humanos e Legislação Participativa, com as autoridades responsáveis pelo Cadastro Nacional de Pessoas Desaparecidas no âmbito do Ministério Público e da Secretaria de Direitos Humanos da Presidência da República, a fim de que sejam identificadas as causas reais do baixo desempenho do Cadastro.",Sim,2015,RDH
631,124299,"Nos termos do artigo 93, inciso II do RISF, requer a realização de audiência pública tendo como convidados Autoridades responsáveis pela política pesqueira,  já que extinto o Ministério da Pesca, algum representante do Ministério da Agricultura que responde pela área e bem como, representante do setor pesqueiro para discutir sobre a situação dos pescadores atingidos pelo desastre ambiental ocorrido em Mariana, Minas Gerais.	
				
",Sim,2015,RDH
631,125062,"Nos termos do art. 58 da Constituição Federal, combinado com o art. 93, inciso II, do Regimento Interno do Senado Federal, requer a Vossa Excelência que, ouvido o plenário desta Comissão, seja realizada audiência pública para discutir a ação das milícias no país  e em especial no Rio de Janeiro, que estão difundindo o terror nos condomínios do programa “Minha Casa, Minha Vida”.",Sim,2016,RDH
631,125134,"Requer, nos termos regimentais, a realização de audiência pública nessa Comissão de Direitos humanos e Legislação Participativa para instruir o Projeto de Lei do Senado, nº 50, de 2013, que dispõe “Altera a Lei nº 11.265, de 3 de janeiro de 2006, que regulamenta a comercialização de alimentos para lactentes e crianças de primeira infância e também a de produtos de puericultura correlatos, para aumentar a segurança de produtos de puericultura e para vedar a produção, a importação, a distribuição e a doação de andador infantil"".",Sim,2016,RDH
631,125921,"Com fundamento no disposto no art. 93, inciso II, do Regimento Interno do Senado Federal, requer a realização de Audiência Pública nesta Comissão de Direitos Humanos e Legislação Participativa, para debater “O crime de estupro no Brasil”.",Não,2016,RDH
631,126324,"Requer, nos termos do inciso II do § 2º do art. 58 da Constituição da República e do art. 93 do Regimento Interno do Senado Federal, que seja realizada audiência pública no âmbito desta Comissão de Direitos Humanos e Legislação Participativa, para discutir mecanismos de proibição de postagens nas redes sociais, por meio da internet, de imagens e vídeos sobre “automutilação” de crianças e adolescentes e a realização de uma campanha para prevenir, orientar e ajudar os pais em todo o Brasil.",Sim,2016,RDH
631,127077,"Altera a Constituição Federal, vedando que os Chefes do Poder Executivo sejam novamente eleitos para o mesmo cargo.",Não,2016,PEC
631,127318,"Altera o art. 22, parágrafo único, da Constituição Federal, para incluir expressa referência ao Distrito Federal.",Não,2016,PEC
631,121139,Institui o Grupo Parlamentar Brasil-Guiné e dá outras providências.,Sim,2015,PRS
631,127320,"Modifica o art. 54 da Constituição Federal, para vedar aos Deputados e Senadores permanecer mais de noventa dias sem filiação partidária, sob pena de perda do mandato.",Não,2016,PEC
631,127439,"Altera o § 9º do art. 37 da Constituição Federal, para submeter a remuneração paga por empresas públicas, sociedades de economia mista e suas subsidiárias aos limites constitucionais impostos à Administração Pública direta.",Não,2016,PEC
631,127442,Altera o § 1º do art. 56 da Constituição Federal para estabelecer que em caso de licença superior a sessenta dias o suplente de Deputado ou Senador será convocado para substituir o titular.,Não,2016,PEC
631,127444,Define o terceiro domingo de outubro como data de realização do segundo turno nas eleições de Presidente e Vice-Presidente da República e Governador e Vice-Governador de Estado.,Não,2016,PEC
631,127446,Altera a redação dos §§ 1º e 2º do art. 14 da Constituição Federal para tornar o voto facultativo.,Não,2016,PEC
631,127597,"Incluiu o art. 17-A no Ato das Disposições Constitucionais Transitórias, para reduzir a quinze mil reais o limite do valor pago a qualquer agente público, mensalmente, pelo prazo de vinte anos.",Sim,2016,PEC
631,127783,"Revoga a Resolução nº 13, de 25 de abril de 2012, do Senado Federal, que estabelece alíquotas do Imposto sobre Operações Relativas à Circulação de Mercadorias e sobre Prestação de Serviços de Transporte Interestadual e Intermunicipal e de Comunicação (ICMS), nas operações interestaduais com bens e mercadorias importadas do exterior e dispõe sobre a compensação dos entes prejudicados pelos seus efeitos e a nulificação do processo legislativo respectivo.",Não,2016,PRS
631,127681,"Altera o inciso XLII do art. 5º da Constituição Federal, para tornar imprescritíveis os crimes de estupro.",Não,2016,PEC
631,127686,"Modifica o inciso II do art. 119 da Constituição Federal, para dispor sobre a aprovação pelo Senado Federal dos advogados escolhidos pelo Supremo Tribunal Federal para compor o Tribunal Superior Eleitoral.",Não,2016,PEC
631,127687,Altera o art. 150 da Constituição Federal para vedar a instituição de impostos sobre medicamentos de uso humano adquiridos por pessoas de baixa renda.,Não,2016,PEC
631,127749,"Dá nova redação ao § 1º do art. 81 da Constituição Federal para determinar a realização de eleição direta aos cargos de Presidente e Vice-Presidente da República, na hipótese de vacância desses cargos nos três primeiros anos do mandato presidencial.",Não,2016,PEC
631,126822,"Altera a Constituição Federal, para disciplinar a composição da Mesa do Senado Federal",Não,2016,PEC
631,126839,"Insere artigo no Ato das Disposições Constitucionais Transitórias, para prever a realização de eleições gerais em 2022.",Não,2016,PEC
631,124021,"Dispõe sobre a aposentadoria compulsória, com proventos proporcionais, nos termos do inciso II do § 1º do art. 40 da Constituição Federal.",Não,2015,PEC
631,124503,"Altera o art. 62 da Constituição Federal, para vedar a edição de medidas provisórias durante o recesso do Congresso Nacional.",Não,2015,PEC
631,124940,"Dá nova redação ao art. 6º da Constituição Federal, para introduzir o direito humano ao acesso à terra e à água como direito fundamental.",Não,2016,PEC
631,125060,Altera a Constituição Federal para instituir o Sistema Parlamentar de Governo.,Não,2016,PEC
631,125620,"Estende as normas especiais para aposentadoria dos professores previstas na Constituição Federal para as regras de transição estabelecidas pelo art. 3º da Emenda Constitucional nº 47, de 2005.",Não,2016,PEC
631,125725,"Acrescenta § 5º ao art. 86 da Constituição Federal, estabelecendo ao Senado Federal a instrução e julgamento do procedimento de impeachment.",Não,2016,PEC
631,125726,Acrescente o art. 6º-A à Constituição Federal para instituir os serviços públicos essenciais.,Não,2016,PEC
631,125727,Acrescenta o art. 86-A à Constituição Federal para dispor sobre a revogação do mandato do chefe do Poder Executivo.,Não,2016,PEC
631,125728,"Acrescenta § 6º ao art. 86 da Constituição Federal, para responsabilizar o chefe do Poder Executivo reeleito por atos conexos realizados entre os seus mandatos.",Não,2016,PEC
631,126004,"Altera o art. 37 da Constituição Federal, para dispor sobre concursos públicos para preenchimento de cargos e empregos públicos.",Não,2016,PEC
631,126383,"Acrescenta o art. 101 ao Ato das Disposições Constitucionais Transitórias para reservar cadeiras parlamentares para pessoas com deficiência na Câmara dos Deputados, nas assembleias legislativas e na Câmara Legislativa do Distrito Federal e nas câmaras municipais nas quatro legislaturas subsequentes.",Não,2016,PEC
631,122308,"Acrescenta artigo ao Ato das Disposições Transitórias da Constituição para reservar vagas para cada gênero na Câmara dos Deputados, nas Assembleias Legislativas, na Câmara Legislativa do Distrito Federal e nas Câmaras Municipais, nas três legislaturas subsequentes.",Não,2015,PEC
631,122332,"Modifica o art. 144 da Constituição Federal, para determinar que o Diretor-Geral da Polícia Federal tenha a designação de Delegado-Geral de Polícia Federal, e dá outras providências.",Não,2015,PEC
631,122879,"Acrescenta o § 2º ao art. 101 da Constituição Federal, e renomeia o parágrafo único para tratar da vacância no Supremo Tribunal Federal.",Não,2015,PEC
631,122964,"Acrescenta o art. 88-A à Constituição Federal, para estabelecer a obrigação de elaboração de plano anual de metas e de relatório anual de avaliação pelos órgãos subordinados diretamente à Presidência da República.",Não,2015,PEC
631,123356,"Altera os arts. 20, 159, 198 e 212 da Constituição Federal, para suavizar as transferências da União para os Municípios decorrentes da exploração de recursos minerais e hídricos e do Fundo de Participação dos Municípios, bem como para suavizar o piso para as despesas com educação e saúde.",Não,2015,PEC
631,121423,"Altera o “caput” do artigo 93 da Constituição Federal, para estabelecer iniciativa parlamentar concorrente na propositura de lei complementar que institui o Estatuto da Magistratura.",Não,2015,PEC
631,121425,"Altera o art. 21 da Constituição Federal, transferindo para a União a exploração dos serviços de transporte rodoviário de passageiros entre os municípios do Entorno do Distrito Federal e Brasília.",Não,2015,PEC
631,121677,"Altera o art. 175 da Constituição Federal, para estabelecer a obrigação do prestador de serviços públicos de disponibilizar informações, metas e indicadores sobre a qualidade do serviço.",Não,2015,PEC
631,121678,"Altera o art. 146 da Constituição Federal e acrescenta o art. 88-A ao Ato das Disposições Constitucionais Transitórias, para introduzir regramento para o imposto de que trata o art. 156, III, aplicável sobre serviços que especifica.",Não,2015,PEC
631,121684,"Altera o arts. 119, 120 e 121 da Constituição Federal, para vedar o exercício da advocacia dos juízes eleitorais oriundos da advocacia e ampliar o tempo do respectivo mandato, vedando a recondução.",Não,2015,PEC
631,122216,Acrescenta o § 22 ao art. 40 da Constituição Federal para isentar o servidor aposentado por invalidez e o pensionista inválido beneficiários do regime próprio de previdência de se submeterem a exame médico-pericial após completarem sessenta anos de idade.,Sim,2015,PEC
631,123911,"Altera o art. 49, IX, da Constituição Federal de 1988, para estabelecer prazo de cento e vinte dias para julgamento das contas anuais do Presidente da República, sob pena de sobrestamento da pauta do Congresso Nacional.",Não,2015,PEC
631,100121,"Requerem, nos termos do art. 160 do Regimento Interno do Senado Federal, que o tempo destinado aos oradores do Período do Expediente da sessão do dia 30 de junho de 2011 seja dedicado a homenagear Éder Jofre e Anderson Silva, os maiores lutadores brasileiros de todos os tempos, além de outros detentores de título de campeão em diversas modalidades de luta.",Sim,2011,RQS
631,100631,"Requer, nos termos do art. 218 do Regimento Interno do Senado Federal, a inserção em ata de voto de pesar pelo falecimento do ex-prefeito de São Mateus (ES) Amocim Leite, ocorrido no dia 24 de maio de 2011.",Sim,2011,RQS
631,102494,"Requer autorização para participar do seminário intitulado ""O avanço do consumo de drogas na Argentina"", a ser realizado em 6 de outubro de 2011, na Câmara dos Deputados da República Argentina, na cidade de Buenos Aires, para o qual foi convidado na condição de palestrante; e seja autorizada sua ausência dos trabalhos da Casa, no período de 5 a 7 de outubro de 2011.",Sim,2011,RQS
631,103012,"Requer, nos termos do art. 218 do Regimento Interno do Senado Federal, inserção em ata de voto de pesar pelo falecimento do ex-prefeito Hélio Humberto Lima, do município de Atílio Vivácqua - ES, ocorrido no dia 24 de setembro de 2011.",Sim,2011,RQS
631,104416,"Requer, nos termos do artigo 218, do Regimento Interno do Senado Federal, inserção em ata de Voto de Pesar, pelo falecimento do pastor Valtir Pereira da Silva, professor e escritor, e diretor de Seminário Teológico, ocorrido no dia 28 de fevereiro de 2012, em Vitória (ES), bem como o encaminhamento do referido voto à família do falecido e à sua Igreja.",Sim,2012,RQS
631,104758,"Requerem, nos termos do art. 218 do Regimento Interno do Senado Federal, a inserção em ata de Voto de Pesar pelo falecimento do Pastor ETEVALDO ROCHA TRISTÃO, presidente de honra do Ministério Batista Betel, ocorrido no dia 25 de março de 2012, em Vila Velha, Espírito Santo.",Sim,2012,RQS
631,105780,"Requerem, nos termos do artigo 154, inciso III, § 5º, do Regimento Interno do Senado Federal, a realização de sessão especial, no dia 05 de novembro de 2012, segunda-feira, às 11 horas, para comemoração dos 63 anos da criação da Associação dos Magistrados do Brasil - AMB.",Não,2012,RQS
631,105882,"Requerem, nos termos do art. 199 do Regimento Interno do Senado Federal, a realização de sessão especial, no dia 11 de junho de 2012, dedicada a entregar à sociedade a Lei nº 12.650, de 17 de maio de 2012, ""Lei Joanna Maranhão"", proposta pela CPI da Pedofilia e sancionada pela presidente da República.",Sim,2012,RQS
631,106010,"Requerem, em aditamento ao Requerimento 497, de 2012, aprovado em 30 de maio de 2012, que a Sessão Especial solicitada nos termos do art. 199 do RISF, a ser realizada em 11 de junho de 2012, dedicada a entregar a sociedade a Lei nº 12.650, de 17 de maio de 2012, ""Lei Joana Maranhão"", seja adiada para data a ser definida posteriormente.",Sim,2012,RQS
631,99054,"Requer, nos termos do art. 222 do Regimento Interno do Senado Federal, a inserção em ata de voto de aplauso à UFC - Ultimate Fighting Championship e seus principais executivos Lorenzo Fertita, Dana White e Jaime Pollack em virtude do incentivo oferecido por essa associação esportiva aos atletas brasileiros.",Sim,2011,RQS
631,99328,"Requerem, nos termos do art. 199 do Regimento Interno do Senado Federal, a realização de sessão especial, em data a ser posteriormente designada, destinada a comemorar o êxito dos dois períodos de Governo em que o cidadão Luiz Inácio Lula da Silva esteve à frente da Presidência da República.",Sim,2011,RQS
631,99352,"Requerem, nos termos do art. 160 do Regimento Interno do Senado Federal, que o tempo destinado aos oradores do Expediente da sessão de 14 de abril de 2011 seja dedicado a homenagear o lutador Anderson da Silva.",Sim,2011,RQS
631,99457,"Requerem, nos termos do art. 160 do Regimento Interno do Senado Federal, que o tempo destinado aos oradores do Período do Expediente da Sessão do dia 30 de março de 2011 seja dedicado a homenagear o maior pugilista brasileiro de todos os tempos, Éder Jofre.",Sim,2011,RQS
631,103132,"Altera o Código de Trânsito Brasileiro, para estabelecer penalidades e medidas administrativas mais rigorosas nos casos de embriaguez ao volante e de recusa do condutor em se submeter a teste de alcoolemia, entre outras providências.",Sim,2011,PLS
631,104952,"Altera o caput do art. 17 da Lei n° 9.648, de 27 de maio de 1998, o art. 1º da Lei n° 8.001, de 13 de março de 1990, e o art. 5° da Lei n° 7.990, de 28 de dezembro de 1989, com o objetivo de alterar a distribuição de compensação financeira pela exploração de recursos hídricos para fins de geração de energia elétrica.",Sim,2012,PLS
631,112051,Proíbe a utilização de logomarca diversa do Brasão da República Federativa do Brasil na publicidade oficial da administração pública federal.,Sim,2013,PLS
631,112409,"Altera a Lei nº 9.503, de 23 de setembro de 1997 - Código de Trânsito Brasileiro - CTB, estabelecendo que fica facultado aos jovens entre 16 e 18 anos a obtenção da Carteira Nacional de Habilitação.",Sim,2013,PLS
631,113150,"Altera os §§ 2º e 3º do art. 306 do Código de Trânsito Brasileiro, para estabelecer a possibilidade de utilização do exame toxicológico como meio de prova de condução de veículo automotor sob influência de outra substância psicoativa que determine dependência.",Sim,2013,PLS
631,114251,"Altera a redação do art. 28 da Lei nº 7.492, de 16 de junho de 1986.",Sim,2013,PLS
631,114648,"Altera a redação do inciso IX do artigo 10 da Lei nº 4.595, de 31 de dezembro de 1964.",Sim,2013,PLS
631,119360,"Altera a Lei nº. 9.427, de 26 de dezembro de 1996, para determinar às concessionárias e permissionárias de serviço público de distribuição de energia elétrica o uso de isolamento de cabos de fase nas redes aéreas de distribuição de energia convencionais.",Sim,2014,PLS
631,121594,"Acrescenta o §5º na lei 8.904 de 04 de julho de 1.994, que dispõe sobre o Estatuto da Advocacia e da Ordem dos Advogados do Brasil, regulamentando e extinguindo taxas de inscrição para a realização do exame de ordem da OAB.",Não,2015,PLS
631,99755,"Altera os arts. 165, 277 e 306 da Lei nº 9.503, de 23 de setembro de 1997 (Código de Trânsito Brasileiro), para retirar a exigência de dosagem alcoólica.",Sim,2011,PLS
631,99847,"Acrescenta parágrafo único ao art. 16 da Lei nº 11.340, de 7 de agosto de 2006 - ""Lei Maria da Penha"", para afastar a necessidade de realização da audiência para renúncia à representação.",Sim,2011,PLS
631,100918,"Altera o Código Penal e a Lei nº 8.072, de 25 de julho de 1990, para tipificar condutas realizadas contra dispositivos de comunicação ou sistemas informatizados e similares, considerando-as crimes hediondos.",Sim,2011,PLS
631,122106,"Altera a Lei nº 11.340, de 7 de agosto de 2006 (Lei Maria da Penha), para criar o banco de dados de medidas protetivas de urgência e possibilitar ao delegado de polícia o deferimento de determinadas medidas protetivas de urgência, desde o primeiro atendimento à mulher.",Sim,2015,PLS
631,123057,"Altera a Consolidação das Leis do Trabalho (CLT), aprovada pelo Decreto-Lei nº 5.452, de 1º de maio de 1943, para reduzir em 50% (cinquenta por cento) a jornada de trabalho das mães de pessoas com deficiência.",Sim,2015,PLS
631,123295,"Altera a redação do art. 1º da Lei nº 8.072, de 25 de julho de 1990, para incluir no rol dos crimes hediondos a lesão corporal gravíssima, a lesão corporal seguida de morte e o homicídio, quando praticados em razão de briga de torcidas organizadas.",Sim,2015,PLS
631,123620,"Altera o art. 23 da Lei nº 8.666, de 21 de junho de 1993, para determinar que, nas licitações realizadas nas modalidades referidas no caput cujo valor superar os cem mil reais, haja o acompanhamento de um membro do Ministério Público.",Sim,2015,PLS
631,124804,"Altera a Lei nº 8.666, de 21 de junho de 1993, que regulamenta o art. 37, inciso XXI, da Constituição Federal, institui normas para licitações e contratos da Administração Pública e dá outras providências, para instituir o Sistema Unificado de Licitações.",Sim,2016,PLS
631,125666,"Inclui entre as diretrizes e bases da educação nacional, de que trata a Lei nº 9.394, de 20 de dezembro de 1996, o ""Programa Escola sem Partido"".",Sim,2016,PLS
631,125685,"Dispõe sobre a isenção da tarifa de pedágio nas vias federais, exploradas direta ou indiretamente, pelos veículos que transportem pessoas com doença grave ou degenerativa.",Sim,2016,PLS
631,126289,"Acrescenta o § 7º ao art. 3º da Lei nº 11.977, de 7 de julho de 2009, para destinar percentual de unidades construídas no âmbito do Programa Minha Casa, Minha Vida – PMCMV a servidores militares da Polícia Militar, do Corpo de Bombeiros, da Marinha, do Exército, da Aeronáutica, e servidores civis da Polícia Civil, da Polícia Federal, da Polícia Rodoviária Federal e da Polícia Ferroviária Federal.",Sim,2016,PLS
631,126332,"Inclui o art. 27-A na Lei nº 9.504, de 30 de setembro de 1997, e altera o parágrafo único do art. 1º da Lei nº 8.072, de 25 de julho de 1990, para tipificar o crime de “caixa dois” eleitoral e incluir o referido delito e a difamação eleitoral no rol dos crimes hediondos.",Sim,2016,PLS
631,126489,"Altera o art. 151 da Lei nº 8.213, de 24 de julho de 1991, para fazer constar a síndrome de Sjögren e a doença pulmonar obstrutiva crônica na lista de doenças que independem de carência para fins de concessão de auxílio-doença e de aposentadoria por invalidez ao segurado da Previdência Social.",Sim,2016,PLS
631,127622,"Altera a Lei nº 9.096, de 19 de setembro de 1995, para determinar o congelamento dos recursos destinados ao Fundo Partidário pelo prazo de vinte anos.",Sim,2016,PLS
631,54743,Autoriza o Poder Executivo a instituir a Ouvidoria da Polícia Federal.,Sim,2003,PLS
631,60106,"Altera a Lei nº 10201, de 14 de fevereiro de 2001, que institui o Fundo Nacional de Segurança Pública - FNSP, e dá outras providências, para criar condição para o repasse de recursos.",Sim,2003,PLS
631,63899,"Obriga a presença do profissional fisioterapeuta em Academias, nos clubes e agremiações desportivas.",Sim,2003,PLS
631,67614,"Proíbe a exploração de todas as modalidades de jogos de bingo, bem como os jogos em máquinas eletrônicas, eletromecânicas ou mecânicas conhecidas como ""caça-níqueis"", independentemente dos nomes de fantasia, e dá outras providências.",Sim,2004,PLS
631,76222,"Altera o Decreto-Lei nº 667, de 1969, estabelecendo exames periódicos para os membros das Policias Militares e Corpo de Bombeiros dos Estados e Distrito Federal.",Sim,2005,PLS
631,76247,"Altera a Lei nº 9.294, de 15 de julho de 1996, para proibir o uso de produtos de tabaco nos bares, restaurantes, e demais estabelecimentos assemelhados, localizados em todo o território nacional.",Sim,2005,PLS
631,76248,"Acrescente § 5º ao art. 33 da Lei nº 9.504, de 1997, para disciplinar a realizaçaõ de pesquisas de intenção de voto.",Sim,2005,PLS
631,77028,"Altera o art. 2º da Lei nº 8.072, de 25 de julho de 1990, para determinar que o cumprimento da pena privativa de liberdade seja iniciado no regime fechado e estabelecer que a progressão de regime somente pode ser obtida após o cumprimento de dois terços da pena no regime anterior.",Sim,2006,PLS
631,78247,Proíbe a entrada de funcionários nas cadeias e penitenciárias em que trabalhem portando aparelhos celulares ou qualquer outro aparelho de comunicação.,Sim,2006,PLS
631,79472,"Estabelece procedimento de comunicação, aos agentes interessados, dos recursos liberados, decorrentes de emendas parlamentares ao Orçamento da União e dá outras providências.",Sim,2006,PLS
