codigoParlamentar,CodigoMateria,Ementa,IndicadorAutorPrincipal,AnoMateria,AutoriasSigla
5422,137577,"Requer a realização de audiência pública com o objetivo de, em conformidade com o REQ nº 28, de 2019-CI, discutir a questão relativa ao preço de passagens aéreas, franquia de bagagens e abertura de mercado do setor aéreo nacional.",Sim,2019,REQ
5422,137366,Retirada do PDL 401/2019.,Sim,2019,RQS
5422,137695,"Acrescenta § 4º ao art. 102 da Constituição Federal, para estabelecer a necessidade de demonstração da existência de controvérsia constitucional relevante e atual como condição de admissibilidade da ação direta de inconstitucionalidade e da ação declaratória de constitucionalidade.",Não,2019,PEC
5422,137591,"Requer, nos termos do art. 93, I, do Regimento Interno do Senado Federal, a realização de audiência pública, com o objetivo de instruir o PLS 232/2016, que ""dispõe sobre o modelo comercial do setor elétrico, a portabilidade da conta de luz e as concessões de geração de energia elétrica, altera as Leis nº 9.427, de 26 de dezembro de 1996, nº 9.478, de 6 de agosto de 1997, nº 9.648, de 27 de maio de 1998, nº 10.847, de 15 de março de 2004, nº 10.848, de 15 de março de 2004, e nº 12.783, de 11 de janeiro de 2013, e a Medida Provisória nº 2.227, de 4 de setembro de 2001, e dá outras providências"".",Sim,2019,REQ
5422,137328,Susta os efeitos legislativos da Ação Direta de Inconstitucionalidade por Omissão (ADO) nº 26 e do Mandado de Injunção (MI) nº 4.733.,Sim,2019,PDL
5422,137593,"Requer, nos termos do art. 101, inciso V, do Regimento Interno do Senado Federal, manifestação da Comissão de Constituição, Justiça e Cidadania quanto à constitucionalidade e à juridicidade dos projetos de lei que visam à alteração de características ou à inclusão de novos componentes nas relações descritivas da infraestrutura de transportes constantes do anexo da Lei nº 5.917, de 10 de setembro de 1973, que aprova o Plano Nacional de Viação (PNV), em face da edição da Lei nº 12.379, de 6 de janeiro de 2011, que dispõe sobre o Sistema Nacional de Viação (SNV).",Sim,2019,REQ
5422,137353,"Cria o Estatuto dos Colecionadores, Atiradores e Caçadores – CACs, para dispor sobre o exercício das atividades de colecionamento, de tiro desportivo e de caça, em todo o território nacional.",Sim,2019,PL
5422,136802,"Altera o art. 107 do Ato das Disposições Constitucionais Transitórias da Constituição Federal, para estabelecer que seja excluída da base de cálculo e dos limites do Novo Regime Fiscal as transferências a Estados e Municípios advindas do bônus de assinatura resultante da licitação blocos exploratórios de petróleo, gás natural e outros hidrocarbonetos excedente da cessão onerosa, sob modalidade de partilha de produção.",Não,2019,PEC
5422,136912,"Altera o Decreto-Lei nº 2.848, de 7 de dezembro de 1940 (Código Penal), para qualificar o crime de homicídio (art. 121), e majorar o delito de lesão corporal (art. 129), quando praticados em razão de comportamento sexual; e estabelecer, pela instituição do art. 215 - B, do mesmo diploma legal, como tipo penal autônomo, o Crime contra Orientação Sexual.",Sim,2019,PL
5422,137066,"Altera o art. 144 da Constituição Federal, para prever a realização de exame toxicológico por todos os servidores da área de segurança pública.",Não,2019,PEC
5422,137011,"Altera o § 2º do art. 155 da Constituição Federal para excluir da imunidade relativa ao Imposto sobre Operações Relativas à Circulação de Mercadorias e sobre Prestações de Serviços de Transporte Interestadual e Intermunicipal e de Comunicação as operações interestaduais com energia elétrica, bem como dividir em partes iguais a apropriação da receita gerada por essas operações entre os Estados de origem e de destino.",Não,2019,PEC
5422,136815,Acrescenta o art. 138-A ao Regimento Comum do Congresso Nacional para assegurar a membro de uma Casa eleito para a outra o direito de manter ou de retomar a tramitação de proposições de sua autoria em andamento na Casa de origem.,Sim,2019,PRN
5422,137025,Requer apreciação do PLS 191/2017 pelo plenário.,Sim,2019,R.S
5422,136896,Institui a Frente Parlamentar dos Senadores dos Estados do Norte e do Nordeste.,Não,2019,PRS
5422,136812,"Acrescenta o § 4º ao art. 192 da Constituição Federal, para estabelecer limite às taxas juros.",Não,2019,PEC
5422,136967,"Requer a realização de ciclo de audiências públicas, com o propósito de estudar temas pertinentes à Comissão de Serviços de Infraestrutura.",Sim,2019,REQ
5422,136803,Altera a Constituição Federal para prever duração dos mandatos de Ministros do Supremo Tribunal Federal e nova forma de escolha de Ministros de Tribunais Superiores e dos juízes de Tribunais.,Não,2019,PEC
5422,136804,"Altera a Constituição Federal, para incluir as polícias científicas no rol dos órgãos de segurança pública.",Não,2019,PEC
5422,136767,Altera os arts. 153 e 156 da Constituição Federal para estabelecer que passa a ser de competência municipal instituir imposto sobre a propriedade territorial rural.,Não,2019,PEC
5422,136732,"Acrescenta § 13 ao art. 37 e dá nova redação ao inciso II do § 3º do art. 142, ambos da Constituição Federal, para detalhar hipóteses de acumulação de cargos dos servidores civis que menciona, assim como dos militares das forças armadas e dos militares dos Estados, do Distrito Federal e dos Territórios.",Não,2019,PEC
5422,136917,Realização de Sessão de Debates Temáticos destinada a debater a democracia no Brasil.,Não,2019,RQS
5422,136432,"Realização de sessão especial, em 13 de maio de 2019, a homenagear  o codificador  do espiritismo Allan Kardec.",Não,2019,RQS
5422,136230,Desarquivamento dos PLC 116/2014 e PLC 52/2013.,Sim,2019,RQS
5422,136301,Altera o art. 159 da Constituição para aumentar para 26% (vinte e seis por cento) a parcela do produto da arrecadação dos impostos sobre a renda e proventos de qualquer natureza e sobre produtos industrializados destinada ao Fundo de Participação dos Estados e do Distrito Federal e dá outras providências.,Não,2019,PEC
5422,136505,"Requer a realização de diligência externa da Comissão nos Estados de Rondônia e do Amazonas, com o objetivo de verificar as condições operacionais da Ponte do Abunã, das Hidroelétricas de Santo Antônio e Jirau e dos Viadutos de Porto Velho, e para percorrer a BR-319, in loco, no trecho entre Porto Velho e Manaus.",Sim,2019,REQ
5422,136115,Altera o art. 20 da Constituição Federal e o art. 107 do Ato das Disposições Constitucionais Transitórias para vincular as rendas do petróleo à educação e saúde e excluir essas despesas do teto de gastos instituído pelo Novo Regime Fiscal.,Não,2019,PEC
5422,140013,"Realização de sessão especial, em  24 de abril de 2020, para comemorarmos o 60º aniversário de Brasília, a Capital de todos os brasileiros.",Não,2019,RQS
5422,136270,Altera o art. 5º da Constituição Federal para prever regime integralmente fechado para condenados por crimes hediondos cometidos com violência contra a pessoa.,Não,2019,PEC
5422,136145,Desarquivamento da PEC 21/2014.,Não,2019,RQS
5422,136144,Desarquivamento do PLC 76/2011.,Não,2019,RQS
5422,136153,"Modifica o art. 37 da Constituição Federal, para dispor sobre a edição de lei complementar para disciplinar as relações jurídicas dos entes de cooperação com a administração pública, de qualquer dos Poderes da União, dos Estados, do Distrito Federal e dos Municípios.",Não,2019,PEC
5422,135977,"Altera a redação do art. 228 da Constituição Federal, a fim de reduzir a maioridade penal para dezesseis anos.",Não,2019,PEC
5422,135904,Desarquivamento do Projeto de Lei da Câmara nº 34/2013.,Não,2019,RQS
5422,135953,"Altera o inciso XVI do caput do art. 37 da Constituição Federal, para autorizar a acumulação de dois cargos públicos de jornalista.",Não,2019,PEC
5422,135899,Dá nova redação ao inciso IV do art. 206 da Constituição Federal.,Não,2019,PEC
5422,135817,Altera o art. 101 da Constituição Federal para dispor sobre o processo de escolha dos Ministros do Supremo Tribunal Federal e fixar os respectivos mandatos em oito anos.,Não,2019,PEC
5422,136011,Desarquivamento da PEC 40/2017.,Não,2019,RQS
5422,136051,Desarquivamento do PLC 30/2014.,Não,2019,RQS
5422,136005,Desarquivamento do PLC 7/2013.,Não,2019,RQS
5422,136004,Desarquivamento da PEC 63/2013.,Não,2019,RQS
5422,135719,Prescreve a inimputabilidade penal dos menores de dezesseis anos e estabelece as condições para a imputabilidade dos maiores de quinze e menores de dezoito anos.,Não,2019,PEC
5422,135416,Desarquivamento da PEC 17/2012.,Não,2019,RQS
5422,135551,Desarquivamento da PEC 71/2013.,Não,2019,RQS
5422,135388,"Realização de Sessão de debates temáticos, com finalidade de discutir o projeto de lei anticrime, de autoria do Poder Executivo.",Não,2019,RQS
5422,135314,"Requer que seja realizada audiência pública convidando o Ministro de Estado da Infraestrutura, Tarcísio Gomes de Freitas, para apresentar as diretrizes e prioridades da pasta.",Sim,2019,REQ
5422,135156,Urgência para o  PRS 53/2018.,Não,2019,RQS
5422,135163,"Altera a redação do art. 228 da Constituição Federal, para adequar a idade de inimputabilidade penal à nova realidade demográfica brasileira e combater a criminalidade.",Não,2019,PEC
5422,135389,Desarquivamento do Projeto de Lei do Senado nº 194/2014.,Não,2019,RQS
5422,135553,Acrescenta o § 3º ao art. 143 da Constituição Federal para prever que a prestação de serviço militar obrigatório será considerada como título ou critério de desempate em concursos públicos de ingresso nos órgãos previstos no art. 144 da Constituição Federal.,Não,2019,PEC
5422,135379,"Altera o art. 132 da Constituição Federal, para incluir as procuradorias municipais.",Não,2019,PEC
5422,135155,"Altera a redação do art. 201 da Constituição Federal, para extinguir o auxílio-reclusão.",Não,2019,PEC
5422,135594,"Acrescenta o inciso XII-A, ao art. 5º, e o inciso XXX, ao art. 22, da Constituição Federal para incluir a proteção de dados pessoais entre os direitos fundamentais do cidadão e fixar a competência privativa da União para legislar sobre a matéria.",Não,2019,PEC
5422,135357,Desarquivamento do PLC 37/2013,Não,2019,RQS
5422,135124,Desarquivamento da PEC 29/2015.,Não,2019,RQS
5422,135192,"Requer, nos termos do art. 58, § 3º, da Constituição Federal e dos arts. 74, III, e 145 do Regimento Interno do Senado Federal, a constituição de uma Comissão Parlamentar de Inquérito composta de 11 (onze) membros titulares e 7 (sete) membros suplentes, para, no prazo de 180 (cento e oitenta) dias, com limite de despesas de R$ 110.000,00 (cento e dez mil reais), apurar as causas do rompimento da barragem na Mina Córrego do Feijão, da empresa de mineração Vale, em Brumadinho; tendo como objetivo identificar os responsáveis, quais foram as falhas dos órgãos competentes, os autores dos laudos técnicos e adoção das providências cabíveis para evitar novos acidentes.",Não,2019,RQS
5422,151328,"Realização de Sessão de Debates Temáticos, em fevereiro de 2022, a fim de debater a eficiência do Passaporte Sanitário no enfrentamento a Pandemia e seus reflexos nos direitos pessoais, trabalhistas, sociais e religiosos da população.",Não,2021,RQS
5422,150175,"Destaque, para votação em separado, dos arts. 26, 27, 29 e 30, V, do PLS 261/2018, na forma da Emenda nº 52 (Substitutivo), para suprimir as menções ao instituto do concurso aberto.",Sim,2021,RQS
5422,149588,Urgência para a  PEC nº 76/2019.,Não,2021,RQS
5422,149359,"Realização de Sessões de Debates Temáticos, em data a ser designada, a fim de discutir a Proposta de Emenda à Constituição nº 110, de 2019, que reforma o Sistema Tributário Nacional.",Sim,2021,RQS
5422,149387,"Realização de sessão de Debates Temáticos, a ser realizada em data oportuna, a fim de debater sobre a Amazônia, seu marco legal, a importância de sua biodiversidade, dos fluxos de chuva e do comércio exterior.",Sim,2021,RQS
5422,148836,"Destaque, para votação em separado, da Emenda nº 619, oferecida ao PLV nº 7/2021, proveniente da MPV nº 1031/2021.",Sim,2021,RQS
5422,148600,"Destaque para votação em separado da Emenda nº 12 - PLEN, apresentada ao PL  nº 5149/2020.",Sim,2021,RQS
5422,148065,"Destaque para votação em separado da Emenda nº 1 - PLEN, apresentada ao PL nº 1315/2021.",Sim,2021,RQS
5422,147262,Adição de assinatura ao RQS nº 841/2021.,Sim,2021,RQS
5422,147271,Realização de sessão de debate temático acerca do uso de tratamento profilático no combate à Covid-19.,Não,2021,RQS
5422,142462,"Destaque para votação em separado da Emenda nº 988, apresentada à MPV n° 936/2020 - PLV n° 15/2020.",Sim,2020,RQS
5422,141906,"Destaque para votação em separado da Emenda nº 1, oferecida ao PL 675/2020.",Sim,2020,RQS
