codigoParlamentar,CodigoMateria,Ementa,IndicadorAutorPrincipal,AnoMateria,AutoriasSigla
5422,144546,Adição de assinatura ao PEC nº 33/2020.,Sim,2020,RQS
5422,144234,Adição de assinatura à PEC nº 30/2020.,Sim,2020,RQS
5422,144138,"Altera o art. 1º da Constituição Federal, para elencar “a prevenção e o combate à corrupção” como um dos fundamentos da República Federativa do Brasil.",Não,2020,PEC
5422,144407,Informações ao  Ministro de Estado da Infraestrutura.,Sim,2020,RQS
5422,144670,"Altera a Lei nº 9.986, de 18 de julho de 2000, para aperfeiçoar a sistemática de substituição dos dirigentes das agências reguladoras nos casos de impedimento e vacância.",Sim,2020,PL
5422,143955,"Sugere, ao Ministro de Estado da Economia, propor, no âmbito do Conselho Nacional de Política Fazendária (CONFAZ), aumentar o valor máximo de veículo automotor para que pessoas com deficiência se beneficiem de isenções do ICMS.",Sim,2020,INS
5422,143491,"Altera a Lei nº 10.233, de 5 de junho de 2001, para determinar que o transporte terrestre coletivo interestadual e internacional de passageiros desvinculado da exploração da infraestrutura seja realizado por meio de permissão.",Sim,2020,PL
5422,143415,"Dispõe que as instituições financeiras, públicas e privadas, inclusive as suas subsidiárias, ficam dispensadas de observar, em suas contratações e renegociações de operações de crédito realizadas com micro, pequenas e médias empresas, diretamente ou por meio de agentes financeiros, anotações registradas em quaisquer bancos de dados, públicos ou privados, que impliquem restrição ao crédito por parte do proponente, inclusive protesto, enquanto durar o estado de calamidade pública reconhecida pelo Decreto Legislativo nº 6, de 2020.",Sim,2020,PL
5422,143637,"Susta a eficácia dos Pareceres nº 24/2020/DECOR/CGU/AGU, aprovado pelo Advogado-Geral da União mediante o Despacho nº 127, de 27 de março de 2020, e nº 35/2020/DECOR/CGU/AGU, aprovado pelo Despacho nº 211, de 23 de abril de 2020.",Sim,2020,PDL
5422,148030,"Altera a Constituição Federal para dispor sobre os pedidos de vista, declaração de inconstitucionalidade e concessão de medidas cautelares nos tribunais.",Não,2021,PEC
5422,142390,Adição de assinatura à PEC nº 8/2021.,Sim,2020,RQS
5422,141745,"Destaque para votação em separado da Emenda nº 45-PLEN, apresentada ao PL nº 1128/2020.",Sim,2020,RQS
5422,141738,"Sugere a alteração do Decreto nº 6.008, de 29 de dezembro de 2006, para facultar aos Estados do Acre, do Amapá, de Rondônia e de Roraima a indicação de representantes permanentes para compor o Comitê das Atividades de Pesquisa e Desenvolvimento na
Amazônia (CAPDA) e para destinar a esses Estados um percentual mínimo dos recursos geridos pelo CAPDA.",Sim,2020,INS
5422,141634,"Institui o Programa Emergencial Transporte Social visando resguardar o exercício do transporte público rodoviário urbano e semiurbano, durante o período de enfrentamento do estado de calamidade pública reconhecido pelo Decreto Legislativo nº 6, de 20 de março de 2020.",Sim,2020,PL
5422,141446,"Altera a Lei nº 6.938, de 31 de agosto de 1981, para dispor sobre a possibilidade de realização, em processos de licenciamento ambiental, de audiência pública remota durante a emergência de saúde pública relacionada ao coronavírus (Covid-19).",Sim,2020,PL
5422,141199,Dispõe sobre o custeio extraordinário das despesas de energia elétrica de unidades consumidoras alcançadas pela Tarifa Social de Energia Elétrica.,Sim,2020,PL
5422,141101,"Acrescenta o art. 169-A à Constituição Federal, para vedar cortes e contingenciamentos nos orçamentos das instituições de educação superior mantidas pela União.",Não,2020,PEC
5422,140876,Requer Sessão Especial para comemorar do Dia Internacional da Mulher,Não,2020,RQS
5422,140872,"Realização de Sessão de debates temáticos, em data oportuna, para discutir a criação do Conselho Nacional da Amazônia Legal.",Não,2020,RQS
5422,140892,Realização de Sessão de Debate Temático sobre a Importância de Garantir a Permanência do Fundeb (Fundo de Manutenção e Desenvolvimento do Ensino Fundamental e de Valorização do Magistério).,Não,2020,RQS
5422,140866,Requer licença para desempenhar missão no Estado.,Sim,2020,REQ
5422,140993,"Criação de Comissão destinada a acompanhar as ações de prevenção, controle e enfrentamento tomadas pelo Poder Público em relação ao Coronavírus (COVID-19).",Sim,2020,RQS
5422,140847,"Requer diligência externa nas rodovias BR-364, BR-421 e BR-429.",Sim,2020,REQ
5422,140994,"Realização de sessão de debates temáticos destinada a debater sobre o Tema: "" Proteção de Dados e Autoridade Nacional de Proteção de Dados (ANPD)"".",Não,2020,RQS
5422,141007,"Acresce parágrafo único ao art. 1.515 do Código Civil (Lei nº 10.406, de 10 de janeiro de 2002), para assegurar o direito das autoridades religiosas de se recusarem a celebrar casamentos por motivo de crença, inclusive no caso de casamento entre pessoas do mesmo sexo.",Sim,2020,PL
5422,140854,Solicita recurso para que o PL 3113/2019 (exame toxicológico para porte e posse de arma) tramite no Plenário,Não,2020,R.S
5422,141065,"Requeiro, nos termos do art. 93, I do Regimento Interno do Senado Federal, a realização de audiência pública, com o objetivo de instruir a PEC 186/2019, que altera o texto permanente da Constituição e o Ato das Disposições Constitucionais Transitórias, dispondo sobre medidas permanentes e emergenciais de controle do crescimento das despesas obrigatórias e de reequilíbrio fiscal no âmbito dos Orçamentos Fiscal e da Seguridade Social da União, e dá outras providências. Proponho para a audiência a presença dos seguintes convidados:
• Senhor PAULO HARTUNG, Ex-Governador do Espírito Santo;
• Senhora ANA CARLA ABRÃO COSTA, Ex-Secretária da Fazenda do Goiás;
• Senhor AOD CUNHA DE MORAES JUNIOR, Ex-Secretário da Fazenda do Rio Grande do Sul;
• Senhor SAMUEL PESSÔA, Físico e Professor de Economia, Pesquisador do FGV;
• Senhor JOSÉ MÁRCIO CAMARGO, Doutor em Economia pelo MIT, Professor da PUC-Rio;
• Senhor ROBERTO ELLERY, doutor em economia pela UnB;
• Senhor RAFAEL TAJRA FONTELES, Secretário de Fazenda do Piaui;
• Senhor GEORGE ANDRÉ PALERMO SANTORO, Secretário de Fazenda de Alagoas;
• Senhora CRISTIANE ALKMIN JUNQUEIRA SCHMIDT, Secretária de Fazenda do Goiás;
• Senhor MARCO AURÉLIO CARDOSO, Secretário de Fazenda do Rio Grande do Sul;
• Senhor RENÊ DE OLIVEIRA GARCIA JUNIOR, Secretário de Fazenda do Paraná;
• Senhor ROGÉRIO LUIZ GALLO, Secretário de Fazenda do Mato Grosso;
• Senhor WALDERY RODRIGUES JUNIOR, Secretário Especial de Fazenda do Ministério da Economia;
• Senhor JEFERSON LUIS BITTENCOURT, Secretário Especial Adjunto de Fazenda do Ministério da Economia;
• Senhor ESTEVES PEDRO COLNAGO JUNIOR, Chefe da Assessoria Especial de Relações Institucionais do Ministério da Economia;
• Senhor BRUNO FUNCHAL, Diretor de Programa da Secretaria Especial de Fazenda do Ministério da Economia;
• Senhor CAIO MEGALE, Diretor de Programa da Secretaria Especial de Fazenda do Ministério da Economia;
• Senhor FILIPE BARROS, Ministério da Economia;
• Senhor MARCOS MENDES.",Não,2020,REQ
5422,140992,"Requer a criação de comissão temporária externa para acompanhar as ações de prevenção, controle e enfrentamento tomadas pelo Poder Público em relação ao coronavírus (COVID-19) e as consequências sobre o território nacional.",Sim,2020,REQ
5422,140745,Requer licença para desempenha missão política ou cultura de interesse parlamentar.,Sim,2020,REQ
5422,140296,Informações ao Ministro de Estado das Relações Exteriores.,Sim,2019,RQS
5422,140599,"Requer diligência externa na BR-364/RO, com o objetivo de averiguar as condições da rodovia e a qualidade dos serviços dos contratos das obras de manutenção disponibilizadas aos usuários.",Sim,2020,REQ
5422,140421,"Realização de sessão especial, em 8 de outubro de 2020, destinada a comemorar os 43 anos de criação do Estado do Mato Grosso do Sul.",Não,2020,RQS
5422,140671,Requer apreciação pelo Plenário de matéria sujeita à deliberação terminativa do PL 3617/2019.,Sim,2020,R.S
5422,140276,"Solicitamos, nos termos do art. 58, § 2º, I, da Constituição Federal e do art. 91, § 3º, do Regimento Interno do Senado Federal, que o PLS 166/2018, que altera o Código de Processo Penal para disciplinar a prisão após a condenação em segunda instância, deliberado terminativamente pela Comissão de Constituição, Justiça e Cidadania, seja apreciado pelo Plenário do Senado Federal.",Não,2019,R.S
5422,140184,"Altera o art. 39 da Constituição Federal para vedar o pagamento de auxílio, ajuda ou qualquer outra forma de retribuição a título de reembolso de despesas efetuadas com moradia a senador, deputado federal, deputado estadual, deputado distrital e vereador.",Não,2019,PEC
5422,140234,"Realização de sessão especial, em 19/10/2020, destinada a comemorar o Dia do Professor.",Não,2019,RQS
5422,140240,"Altera os arts. 28, 29 e 77 da Constituição Federal, para definir as datas de realização do primeiro e segundo turno das eleições.",Não,2019,PEC
5422,140059,"Altera os arts. 102 e 105 da Constituição, transformando os recursos extraordinário e especial em ações revisionais de competência originária do Supremo Tribunal Federal e do Superior Tribunal de Justiça",Não,2019,PEC
5422,140081,"Insere o § 3º no art. 20 da Constituição Federal para prover recursos para fundo de prevenção e recuperação de danos ambientais provocados por atividades de extração, transporte e processamento de recursos petrolíferos e minerais.",Não,2019,PEC
5422,139889,Requer Realização de Audiência Pública Para debater os serviços da Enel no Estado de Goiás,Não,2019,REQ
5422,139918,Requer diligência externa em Machadinho do Oeste sobre a UHE Tabajara.,Sim,2019,REQ
5422,140073,"Altera o art. 17 da Constituição Federal, para dispor que os partidos políticos são pessoas jurídicas de direito público.",Não,2019,PEC
5422,140153,Altera a Constituição Federal para instituir o Sistema Parlamentarista de Governo.,Não,2019,PEC
5422,139620,"Altera as Leis nos 8.989, de 24 de fevereiro de 1995, e 8.383, de 30 de dezembro de 1991, para prever isenção do Imposto sobre Produtos Industrializados (IPI) em relação a motocicletas adquiridas por mototaxistas, bem como isenção do Imposto sobre Operações de Crédito, Câmbio e Seguro, ou Relativas a Títulos ou Valores Mobiliários (IOF), no tocante ao financiamento para aquisição desses veículos.",Sim,2019,PL
5422,139766,"Requer a realização de audiência pública, com o objetivo de discutir a estratégia de desinvestimentos da Petrobras em refinarias.",Sim,2019,REQ
5422,139378,"Cria nova hipótese para destinação dos recursos arrecadados da contribuição de intervenção no domínio econômico relativa às atividades de importação ou comercialização de petróleo e seus derivados, gás natural e seus derivados e álcool combustível, bem como institui o Fundo Nacional para Transportes Urbanos.",Não,2019,PEC
5422,139392,Altera o art. 107 do Ato das Disposições Constitucionais Transitórias da Constituição Federal para excluir do Novo Regime Fiscal as despesas primárias custeadas com a contribuição de que trata o §5º do art. 212 da Constituição Federal.,Não,2019,PEC
5422,139589,"Requer a realização de audiência pública, com o objetivo de discutir a proposta da Agência Nacional de Energia Elétrica (ANEEL) de alterar o modelo de incentivos da geração distribuída de energia elétrica.",Sim,2019,REQ
5422,139230,"Autorização para desempenho de missão parlamentar, a fim de participar do XXXIV Congresso Científico Internacional de Inovação e Atualização Tecnológica de Neurologia, Defrologia e Áreas Básicas na Universidade Cristiana de Bolívia - UCEBOL, em Santa Cruz de La Sierra, na Bolívia.",Sim,2019,RQS
5422,138894,Acrescenta artigo ao Ato das Disposições Constitucionais Transitórias para alterar a duração do mandato dos prefeitos e vereadores eleitos em 2020 e viabilizar a coincidência geral dos mandatos a partir de 2026.,Não,2019,PEC
5422,139024,Tramitação conjunta dos PLC 145/2015 e PL 3813/2019.,Sim,2019,RQS
5422,139093,"Requer que sejam prestadas, pelo Senhor Ministro de Estado de Infraestrutura, Tarcísio Gomes de Freitas, informações sobre a suspensão do uso de equipamentos medidores de velocidade estáticos, móveis e portáteis em vias públicas, conforme despacho do Presidente da República publicado no Diário Oficial da União (DOU), no dia 15 de agosto de 2019, na seção nº 157.",Sim,2019,REQ
5422,138874,"Altera o § 9º do art. 166 da Constituição da República, para que parte dos recursos das emendas individuais seja destinada à Educação.",Não,2019,PEC
5422,139090,"Requer que sejam prestadas, pelo Senhor Ministro de Estado das Relações Exteriores, Ernesto Henrique Fraga Araújo, informações sobre as negociações envolvendo o Tratado entre a República Federativa do Brasil e a República do Paraguai para o Aproveitamento Hidrelétrico dos Recursos Hídricos do Rio Paraná, pertencentes em condomínio aos dois Países, desde e inclusive o Salto Grande de Sete Quedas ou Salto de Guaíra até a Foz do Rio Iguaçu (Tratado de Itaipu, aprovado pelo Decreto Legislativo nº 23, de 26 de abril de 1973), especialmente no tocante à revisão do anexo C, a ocorrer até 2023:.",Sim,2019,REQ
5422,138962,"Requer que sejam prestadas, pelo Senhor Ministro de Estado de Minas e Energia e das Relações Exteriores, Bento Costa Lima Leite de Albuquerque Júnior e Ernesto Henrique Fraga Araújo, informações sobre as negociações envolvendo o Tratado entre a República Federativa do Brasil e a República do Paraguai para o Aproveitamento Hidrelétrico dos Recursos Hídricos do Rio Paraná, pertencentes em condomínio aos dois Países, desde e inclusive o Salto Grande de Sete Quedas ou Salto de Guaíra até a Foz do Rio Iguaçu (Tratado de Itaipu, aprovado pelo Decreto Legislativo nº 23, de 26 de abril de 1973), especialmente no tocante à revisão do anexo C, a ocorrer até 2023:.",Sim,2019,REQ
5422,138961,"Requer a realização de diligência externa nas regiões com gargalo de infraestrutura de abastecimento energético, em suas diversas fontes, bem como com empreendimentos energéticos que possibilitarão a segurança energética no curto e médio prazo, com o objetivo de realizar diligências em empreendimentos do setor energético em construção ou recém-concluídos, para verificar, respectivamente, o cumprimento dos cronogramas de obras e a conexão à infraestrutura existente, tendo em vista o atingimento dos objetivos de segurança energética do País.",Sim,2019,REQ
5422,138897,"Altera o § 3º do art. 46 da Constituição Federal, para dispor sobre os suplentes de Senador.",Não,2019,PEC
5422,138896,"Altera a Constituição Federal para limitar as hipóteses de iniciativa legislativa exclusiva de tribunais e do Procurador-Geral da República, e estabelece a obrigatoriedade de os Conselhos Nacionais de Justiça e do Ministério Público, anualmente, enviarem relatório de suas atividades à Câmara do Deputados e ao Senado Federal.",Não,2019,PEC
5422,139099,"Requer que sejam prestadas, pelo Senhor Ministro de Estado da Justiça e Segurança Pública, Sérgio Fernando Moro, informações sobre a suspensão do uso de equipamentos medidores de velocidade estáticos, móveis e portáteis em vias públicas, conforme despacho do Presidente da República publicado no Diário Oficial da União (DOU), no dia 15 de agosto de 2019, na seção nº 157.",Sim,2019,REQ
5422,139183,"Autorização para desempenho de missão parlamentar, a fim de participar do workshop: ""Theory and Tools of the Harvard Negotiation Project"", em Cambridge/MA, EUA.",Sim,2019,RQS
5422,139091,"Requer que sejam prestadas, pelo Senhor Ministro de Estado de Minas, Bento Costa Lima Leite de Albuquerque Júnior, informações sobre as negociações envolvendo o Tratado entre a República Federativa do Brasil e a República do Paraguai para o Aproveitamento Hidrelétrico dos Recursos Hídricos do Rio Paraná, pertencentes em condomínio aos dois Países, desde e inclusive o Salto Grande de Sete Quedas ou Salto de Guaíra até a Foz do Rio Iguaçu (Tratado de Itaipu, aprovado pelo Decreto Legislativo nº 23, de 26 de abril de 1973), especialmente no tocante à revisão do anexo C, a ocorrer até 2023:.",Sim,2019,REQ
5422,138806,"Altera o art. 302 do Decreto-Lei nº 3.689, de 3 de outubro de 1941 (Código de Processo Penal), para estabelecer que se considera em flagrante delito quem subtrair coisa móvel que seja rastreada em tempo real, enquanto for possível o acompanhamento de sua localização.",Sim,2019,PL
5422,138797,"Requer que sejam prestadas, pelo Senhor Ministro de Estado de Minas e Energia, Bento Costa Lima Leite de Albuquerque Junior, informações sobre o montante financeiro envolvido na resolução da questão do risco hidrológico pela via judicial e o montante financeiro resultante da solução do risco hidrológico pela via legislativa com a aprovação do PL 3.975/2019 (PL nº 10.985/19 na Câmara dos Deputados), levando em conta os efeitos retroativos e o contido no PL a respeito de elegibilidade do deslocamento por razão elétrica; efeitos da antecipação de Garantia Física das Usinas Estruturantes; e atrasos de transmissão – restrição ao escoamento da energia em função de atraso na entrada em operação. Ainda, é necessário identificar o eventual impacto a ser suportado pelo consumidor cativo com a resolução da questão pela via legislativa, com a aprovação da Lei, uma vez que a discussão do risco hidrológico atualmente diz respeito aos consumidores pertencentes ao Mercado Livre. Por fim, em caso de êxito dos geradores na demanda judicial, qual o efeito para os consumidores para o futuro? E, em caso de insucesso judicial, qual o efeito futuro para o consumidor? Em relação ao PL, qual o efeito para o futuro e qual o tratamento para o passado, em relação aos consumidores?.",Sim,2019,REQ
5422,138555,"Permite que os Estados, o Distrito Federal e os Municípios adotem em seus regimes próprios de previdência social as mesmas regras aplicáveis ao regime próprio da União; modifica renúncias previdenciárias; prevê benefício da Seguridade Social à criança vivendo em situação de pobreza; e dá outras providências.",Não,2019,PEC
5422,138795,"Requer a realização de audiência pública, com o objetivo de debater as consequências econômicas e ações de mitigação a serem tomadas pela Agência Nacional do Petróleo, Gás Natural e Biocombustíveis (ANP) e a Petrobras S.A. por conta dos ataques às instalações petrolíferas da Arábia Saudita, o que imediatamente impactou o preço do petróleo no mundo.",Sim,2019,REQ
5422,138794,"Requer a realização de diligência externa no estado de Rondônia, com o objetivo de verificar os procedimentos adotados pela empresa Energisa e averiguar eventuais irregularidades na troca de relógios medidores do consumo de energia elétrica no estado de Rondônia, em conjunto com a Agência Nacional de Energia Elétrica (ANEEL).",Sim,2019,REQ
5422,138792,"Realização de sessão especial, em 27 de setembro próximo, destinada a homenagear o ex-Governador Joaquim Roriz.",Não,2019,RQS
5422,138536,"Altera o Ato das Disposições Constitucionais Transitórias para acrescentar o inciso V ao § 6º do art. 107 e o art. 115, a fim de garantir aplicação de percentual do Produto Interno Bruto para investimentos.",Não,2019,PEC
5422,138314,"Requer que sejam prestadas, pelo Ministro de Estado do Meio Ambiente, Ricardo Salles, informações sobre o ""Fundo Amazônia"".",Sim,2019,REQ
5422,138503,Voto de aplauso aos atletas da delegação brasileira e ao Comitê Paralímpico do Brasil.,Não,2019,RQS
5422,138789,"Oitiva da Comissão de Constituição, Justiça e Cidadania sobre o Projeto de Lei do Senado nº 332, de 2015.",Sim,2019,RQS
5422,138448,"Requer a realização de audiência pública com o Advogado-Geral da União, Ministro André Mendonça, para conhecer a atuação da Advocacia-Geral da União na defesa judicial e viabilização de políticas públicas de infraestrutura.",Sim,2019,REQ
5422,140409,"Solicitamos, nos termos do art. 58, § 2º, I, da Constituição Federal e do art. 91, § 3º, do Regimento Interno do Senado Federal, que o PL 1540/2019, que altera a Lei nº 8.036, de 11 de maio de 1990, que dispõe sobre o Fundo de Garantia do Tempo de Serviço (FGTS), para permitir o saque do saldo do FGTS para o pagamento de curso de nível superior e de cirurgias essenciais à saúde, deliberado terminativamente pela Comissão de Assuntos Sociais, seja apreciado pelo Plenário do Senado Federal.",Não,2019,R.S
5422,138332,"Denomina “Ponte Paulo Nunes Leal”, a nova travessia sobre o Rio Madeira, na BR-364, do km 937,6 ao km 938,8, em Abunã, Distrito de Porto Velho - RO.",Sim,2019,PL
5422,138316,"Requer, nos termos do art. 58, § 2º, II, da Constituição Federal e do art.93, II, do Regimento Interno do Senado Federal, a realização de audiência pública, com o objetivo de debater o desaparecimento do recém nascido Nicolas Naitz, ocorrido em uma maternidade particular do Estado de Rondônia.
Proponho para a audiência a presença dos seguintes convidados:
1. Marciele Naitz Sampaio Pereira, mãe de Nicolas Naitz; 2. Sra. Petrúcia de Melo Andrade, Secretaria Nacional dos Direitos da Criança e do Adolescente;
3. Delegado Titular da Delegacia Especializada de Proteção à Criança e ao Adolescente da Policia Civil do Estado de Rondônia – DEPCA/RO; 
4. Representante da Policia Federal; 5. Representante da Associação Brasileira de Busca e Defesa à Criança Desaparecida – ABCD (Conhecida como ""Mães da Sé"").",Sim,2019,REQ
5422,137935,"Altera os arts. 37 e 87 da Constituição Federal, para disciplinar a vedação do nepotismo na Administração Pública.",Não,2019,PEC
5422,138189,Tramitação conjunta dos PL nºs 4240 e 860/2019.,Sim,2019,RQS
5422,138166,RECURSO AO PLENARIO PL467/2019,Não,2019,R.S
5422,140404,"Requer a apreciação pelo plenário do Senado Federal do PLS 342, de 2018",Não,2019,R.S
5422,137942,"Requeiro, nos termos do art. 93, I, do Regimento Interno do Senado Federal, que na Audiência Pública objeto do RQS 11/2019, do RQS 43/2019, do RQS 44/2019 e do RQS 45/2019, com o objetivo de instruir o PL 1864/2019, que altera o Decreto-Lei nº 2.848, de 7 de dezembro de 1940 - Código Penal, o Decreto-Lei nº 3.689, de 3 de outubro de 1941 - Código de Processo Penal, a Lei nº 7.210, de 11 de julho de 1984 - Lei de Execução Penal, a Lei nº 8.072, de 25 de julho de 1990, a Lei nº 8.429, de 2 de junho de 1992, a Lei nº 9.296, de 24 de julho de 1996, a Lei nº 9.613, de 3 de março de 1998, a Lei nº 10.826, de 22 de dezembro de 2003, a Lei nº 11.343, de 23 de agosto de 2006, a Lei nº 11.671, de 8 de maio de 2008, a Lei nº 12.037, de 1º de outubro de 2009, a Lei nº 12.850, de 2 de agosto de 2013, e a Lei nº 13.608, de 10 de janeiro de 2018, para estabelecer medidas contra a corrupção, o crime organizado e os crimes praticados com grave violência a pessoa, sejam incluídos os seguintes convidados:
1. Márcio Gaspar Barandier - Presidente da Comissão de Direito Penal do Instituto dos Advogados Brasileiros (IAB)
2. Ricardo Pieri Nunes - Vice-Presidente da Comissão de Direito Penal do Instituto dos Advogados Brasileiros (IAB)",Sim,2019,REQ
5422,137215,Requer recurso para Plenário para o PLS 19/2017,Não,2019,R.S
5422,137235,"Requer, nos termos do art. 93, I, do Regimento Interno do Senado Federal, que na Audiência Pública objeto do REQ 34/2019 - CDH, com o objetivo de instruir o PL 1615/2019, sejam incluídos os seguintes convidados:
1. Silvya Helena Caprario - Arquiteta e Urbanista, Presidente da APDVISC – Associação de Pessoas com Deficiência Visual de Santa Catarina; 2. Paulo Henrique de Morais Júnior – Advogado, Consultor Jurídico da APDVISC - Associação de Pessoas com Deficiência Visual de Santa Catarina.",Sim,2019,REQ
5422,137595,"Requer, nos termos do art.90, inciso XIII e art. 142 do Regimento Interno do Senado Federal, a realização de diligência externa em São Paulo-SP, com o objetivo de debater soluções para a desoneração das tarifas de energia elétrica dos brasileiros.",Sim,2019,REQ
5422,137365,"Retirada, em caráter definitivo, da Emenda nº 1 - Plen (Substitutiva) apresentada ao PDL nº 233, de 2019.",Sim,2019,RQS
5422,137699,Altera o Sistema Tributário Nacional e dá outras providências.,Não,2019,PEC
5422,137322,Susta os efeitos legislativos da Ação Direta de Inconstitucionalidade por Omissão (ADO) nº 26 e do Mandado de Injunção (MI) nº 4.773.,Sim,2019,PDL
5422,137430,"Altera o art. 5º da Lei nº 10.826, de 22 de dezembro de 2003, para considerar, para fins de posse de arma de fogo, que a residência ou domicílio compreende toda a extensão do imóvel rural.",Sim,2019,PL
5422,137234,"Requer a realização de audiência pública com o objetivo de, em conformidade com o Requerimento nº 28, de 2019-CI, realizar debate para soluções quanto à desoneração tarifária na conta de energia elétrica do consumidor.",Sim,2019,REQ
5422,137184,"Autorização para desempenho de missão parlamentar, a fim de estreitar os laços entre os Poderes Legislativos Peruano e brasileiro, em Lima, Peru.",Sim,2019,RQS
