codigoParlamentar,CodigoMateria,Ementa,IndicadorAutorPrincipal,AnoMateria,AutoriasSigla
5905,143711,"Acrescenta § 9º ao art. 428 da Consolidação das Leis do Trabalho (CLT), aprovada pelo Decreto-Lei nº 5.452, de 1º maio de 1943, e parágrafo único ao art. 11 da Lei nº 11.788, de 25 de setembro de 2008, para permitir a prorrogação dos prazos dos estágios e dos contratos de aprendizagem, para até a duração total de três anos, durante o estado de calamidade pública reconhecido pelo Decreto Legislativo nº 6, de 20 de março de 2020, e da emergência de saúde pública de importância internacional decorrente do coronavírus (covid-19) e dá outras providências.",Não,2020,PL
5905,143740,Adição de assinatura ao PL nº 4014/2020.,Sim,2020,RQS
5905,143524,Altera o art. 128 da Constituição Federal para modificar a forma de escolha do Procurador-Geral da República.,Não,2020,PEC
5905,143960,"Acrescenta o art. 60-A ao Ato das Disposições Constitucionais Transitórias, para dispor sobre a utilização no âmbito dos Estados e dos Municípios de recursos provenientes de precatórios relativos à complementação da União ao Fundo de Manutenção e Desenvolvimento do Ensino Fundamental e de Valorização do Magistério (FUNDEF).",Sim,2020,PEC
5905,143292,"Susta os efeitos da Resolução Homologatória nº 2.684, de 28 de abril de 2020, da Agência Nacional de Energia Elétrica, que homologa o resultado da Revisão Tarifária Extraordinária da Equatorial Alagoas Distribuidora de Energia S.A. (Equatorial Alagoas) e suspende a aplicação das tarifas resultantes da Revisão Tarifária Extraordinária da Equatorial Alagoas Distribuidora de Energia S.A. (Equatorial Alagoas) até o dia 30 de junho de 2020.",Sim,2020,PDL
5905,143345,Adição de assinatura à PEC nº 25/2020.,Sim,2020,RQS
5905,143143,Adição de assinatura ao RQS nº 3088/2020.,Sim,2020,RQS
5905,143017,"Retirada da Emenda n° 61-PLEN, apresentada ao PL nº 2.630/2020.",Sim,2020,RQS
5905,142318,"Altera o § 5º da Lei nº. 8.666, de 1993, para destinar saldos de convênio ao combate da pandemia da Covid-19.",Sim,2020,PL
5905,142181,"Dispõe sobre a prorrogação da redução da jornada de trabalho e da suspensão temporária do contrato de trabalho previstas na Medida Provisória nº. 936, de 2020.",Sim,2020,PL
5905,142180,"Altera a Lei nº 9.394, de 20 de dezembro de 1996, que estabelece as diretrizes e bases da educação nacional, para obrigar os Estados e o Distrito Federal a criarem espaços compartilhados de estudos para alunos do ensino médio na situação que especifica.",Sim,2020,PL
5905,142179,Cria o Índice Nacional de Eficiência de Gastos da Pandemia – INEG-P.,Sim,2020,PL
5905,142178,"Altera a Lei nº 13.979, de 6 de fevereiro de 2020, para suspender a inscrição de pessoas físicas e jurídicas no Cadastro Informativo de créditos não quitados do setor público federal (Cadin) durante o estado de calamidade pública decorrente da covid-19.",Sim,2020,PL
5905,142177,Institui a Política Nacional de Combate à Pobreza (PNCP).,Sim,2020,PL
5905,142176,Institui a Política Nacional de Gestão Pública.,Sim,2020,PL
5905,142016,"Acrescenta o art. 115 ao Ato das Disposições Constitucionais Transitórias (ADCT) para dispor sobre o adiamento das eleições municipais para Prefeito, Vice-Prefeito e Vereador, previstas para 4 de outubro de 2020, para o dia 6 de dezembro do mesmo ano, em decorrência das medidas para o enfrentamento da pandemia da Covid-19 declarada pela Organização Mundial da Saúde.",Não,2020,PEC
5905,142387,"Altera a Lei nº 13.979, de 6 de fevereiro de 2020, que dispõe sobre as medidas para enfrentamento da emergência de saúde pública de importância internacional decorrente do coronavírus responsável pelo surto de 2019, para criar o Plano Nacional de Gestão ao Combate ao Coronavírus.",Sim,2020,PL
5905,142639,Estende o pagamento do auxílio emergencial durante o período de enfrentamento da emergência de saúde pública de importância internacional da Covid-19.,Sim,2020,PL
5905,142356,"Dispõe sobre o regime especial de assistência social, para vigorar durante o estado de calamidade pública decorrente da pandemia da covid-19.",Sim,2020,PL
5905,142355,"Inclui, entre as competências privativas do Banco Central do Brasil, a de regulamentar e incentivar a utilização de fintechs como instrumento de inovação no sistema financeiro nacional e como ferramenta de operacionalização de políticas públicas e de desburocratização; e estabelece que o auxílio emergencial implementado pela Lei nº 13.982, de 2 de abril de 2020, poderá ser operacionalizado e pago por fintechs.",Sim,2020,PLP
5905,142262,"Adição de assinatura à proposta de emenda à constituição registrada no SEDOL nº SF/20353.03386-43, de autoria do Senador Randolfe Rodrigues.",Sim,2020,RQS
5905,141807,"Dispõe sobre o Regime Jurídico Emergencial e Transitório da Lei nº 11.101, de 9 de fevereiro de 2005, no período da pandemia do Coronavírus (Covid-19), bem como disciplina regras de incentivo às microempresas e às empresas de pequeno porte.",Sim,2020,PL
5905,141868,Dispõe sobre a redução das taxas de juros praticadas pelas instituições financeiras e da limitação da utilização dos recursos recebidos por essas instituições em virtude da ocorrência de calamidade pública reconhecida pelo Congresso Nacional.,Sim,2020,PL
5905,141869,"Institui o Financiamento Simplificado Especial Temporário – FSET, para conceder alívio temporário da carga tributária para as pequenas e microempresas optantes do Simples Nacional.",Sim,2020,PLP
5905,141870,"Altera a Lei nº 4.320, de 17 de março de 1964, e a Lei nº 8.666, de 21 de junho de 1993, para dispor sobre a liquidação provisória e o pagamento antecipado da despesa pública em caso de decretação oficial de estado de calamidade pública.",Sim,2020,PLP
5905,141622,"Cria Fundos Garantidores solidários no âmbito da política de desenvolvimento regional, para apoio e desenvolvimento de micro, pequenas e médias empresas.",Não,2020,PEC
5905,141613,"Institui a moratória em contratos essenciais, bancários, securitários e planos privados de assistência à saúde em favor dos consumidores afetados economicamente pela pandemia de coronavírus (COVID-19).",Sim,2020,PL
5905,141590,Retirada do PL nº 636/2020.,Sim,2020,RQS
5905,141610,Retirada do PL 1200/2020.,Sim,2020,RQS
5905,141566,"Institui o Fundo Anticíclico de Combate à Pobreza – FACP; estabelece limites para a taxa de pobreza infantil; prevê que o FACP seja fonte de recursos para políticas de assistência social em caso de descumprimento dos limites de pobreza, bem como para premiação financeira de entes federativos que tenham avanços relevantes na área social; e dá outras providências.",Não,2020,PEC
5905,141328,"Institui a moratória em contratos essenciais, bancários, securitários e educacionais em favor dos consumidores afetados economicamente pela pandemia de coronavírus (COVID-19).",Sim,2020,PL
5905,141131,"Sugere aos Excelentíssimos Senhores Ministro da Economia e Ministro da Ciência, Tecnologia, Inovações e Comunicações a adoção de medidas urgentes para alteração do anexo III do decreto 6233/2007, com a inclusão dos insumos vinculados aos módulos/painéis fotovoltaicos, de modo a incluí- los ao Programa de Apoio ao Desenvolvimento Tecnológico da Indústria de
Semicondutores e Display (PADIS).",Sim,2020,INS
5905,141234,"Altera o art. 9º do Decreto-Lei nº 4.657, de 4 de setembro de 1942 (Lei de Introdução às normas do Direito Brasileiro), para introduzir a adoção integral do princípio da autonomia da vontade nos contratos internacionais.",Sim,2020,PL
5905,141133,Dispõe sobre a criação de Delegacias Especializadas de Atendimento à Mulher.,Sim,2020,PL
5905,141195,"Altera a Lei nº 8.987, de 13 de fevereiro de 1995, para estabelecer limitação à interrupção de serviços públicos em regime de concessão ou permissão, bem como à elevação de suas tarifas durante o período em for caracterizada pandemia por declaração da Organização Mundial da Saúde ou decretada calamidade pública federal reconhecida pela Congresso Nacional.",Sim,2020,PL
5905,140892,Realização de Sessão de Debate Temático sobre a Importância de Garantir a Permanência do Fundeb (Fundo de Manutenção e Desenvolvimento do Ensino Fundamental e de Valorização do Magistério).,Não,2020,RQS
5905,140908,"Realização de sessão especial, em 16 de novembro de 2020, destinada a homenagear a Sociedade Teosófica no Brasil.",Não,2020,RQS
5905,140906,"Realização de sessão especial, em 13/07/2020, destinada a  comemorar os 63 anos de Fundação da Nova Acrópole.",Não,2020,RQS
5905,140839,"Requer, nos termos do art. 58, § 2º, II da Constituição Federal e do art. 93, II do Regimento Interno do Senado Federal, a realização de audiência pública, com o objetivo de debater as obras paradas de UBSs. Proponho para a audiência a presença dos seguintes convidados: Senhor Luiz Henrique Mandetta, Ministro da Saúde, representando Ministério da Saúde; Senhor Representante, representando Ministério da Economia; Senhor Representante, representando Controladoria-Geral da União; Senhor Representante, representando Tribunal de Contas da União; Senhor Representante, representando Associação dos Membros dos Tribunais de Contas do Brasil; Senhor Representante, representando Associação Nacional do Ministério Público de Contas; Senhor Representante, representando Confederação Nacional de Municípios; Senhor Representante, representando Associação dos Municípios de Alagoas; Senhor Representante, representando Transparência Brasil; Senhor Representante, representando Conselho Nacional de Justiça; Senhor Representante, representando Procuradoria-Geral da República; Senhor Representante, representando Fundo Nacional de Saúde.",Sim,2020,REQ
5905,140837,"Requer, nos termos do art. 58, § 2º, II da Constituição Federal e do art. 93, II do Regimento Interno do Senado Federal, a realização de audiência pública, com o objetivo de debater as políticas públicas para educação básica com ênfase na primeira infância; problema do analfabetismo: causas, números, recorte por região, possíveis soluções; custo educação/obrigações por ente federado; e, por fim, Cenários futuros. Proponho para a audiência a presença dos seguintes convidados: Exmo. Sr. Abraham Weintraub, Ministro da Educação, representando Ministério da Educação; Senhora Priscila Fonseca da Cruz, Presidente, representando Todos pela Educação; Senhora Alcione Albanesi, Presidente, representando Amigos do Bem; Senhor Luiz Miguel Martins Garcia, Presidente, representando UNDIME; Senhora Professora; Senhor Promotor de Justiça de Alagoas; Senhor Defensor Público de Alagoas; Senhora Viviane Senna, Presidente, representando Instituto Ayrton Senna; Senhor Karine Silva dos Santos, Presidente, representando FNDE.",Sim,2020,REQ
5905,140831,"Requer licença para desempenhar missão oficial, em São Petersburgo, Rússia, com ônus para o Senado Federal, de 5 a 7 de março de 2020.",Sim,2020,REQ
5905,141095,Dispõe sobre a criação de Delegacias Especializadas de Atendimento à Mulher.,Sim,2020,PL
5905,140907,"Realização de sessão especial, em 17 de setembro próximo, destinada a homenagear a abordagem terapêutica Constelação Familiar.",Não,2020,RQS
5905,140838,"Requer, nos termos do art. 58, § 2º, II da Constituição Federal e do art. 93, II do Regimento Interno do Senado Federal, a realização de audiência pública, com o objetivo de debater acerca das falhas apontadas pela auditoria feita por técnicos do Tribunal de Contas da União nos programas e planos a respeito de Políticas sobre Drogas. Proponho para a audiência a presença do Exmo. Sr. José Múcio Monteiro, presidente do Tribunal de Contas da União.",Sim,2020,REQ
5905,140836,"Requer, nos termos do art. 58, § 2º, II da Constituição Federal e do art. 93, II do Regimento Interno do Senado Federal, a realização de audiência pública, com o objetivo de debater os 30 anos do Código de Defesa do Consumidor.",Sim,2020,REQ
5905,140835,"Requer, nos termos do art. 58, § 2º, II da Constituição Federal e do art. 93, II do Regimento Interno do Senado Federal, a realização de audiência pública, com o objetivo de discutir as políticas públicas de defesa do consumidor para o ano de 2020 com a presença do Comitê Nacional de Defesa dos Direitos Fundamentais dos Consumidores, do Ministério da Justiça e da Secretaria Nacional do Consumidor.",Sim,2020,REQ
5905,140905,"Realização de sessão especial, em 2 de abril próximo, destinada a homenagear o médium Francisco Cândido Xavier.",Não,2020,RQS
5905,140727,"Requer, nos termos do art. 58, § 2º, II da Constituição Federal e do art. 93, II do Regimento Interno do Senado Federal, a realização de audiência pública, com o objetivo de debater sobre a Organização Internacional Nova Acrópole (OINA). Proponho para a audiência a presença dos seguintes convidados: Senhor Luis Carlos Marques, Diretor Nacional da Nova Acrópole Brasil; Senhora Lucia Helena Galvão, Professora da Nova Acrópole do Brasil; Senhora Renata Peluso, Professora da Nova Acrópole do Brasil; Senhora Kelly Aguiar, Diretora Nacional de imagem da Nova Acrópole do Brasil.",Não,2020,REQ
5905,140865,"Requer, nos termos do art. 58, § 2º, II da Constituição Federal e do art. 93, II do Regimento Interno do Senado Federal, a realização de audiência pública, com o objetivo de debater a política de cancelamento e remarcação de viagens no âmbito das companhias aéreas e cruzeiros. Proponho para a audiência a presença dos seguintes convidados: Senhor Filipe Vieira, Presidente da PROCONSBRASIL; Senhor Luciano Benetti Timm, Secretário Nacional do Consumidor, representando o Ministério da Justiça; Senhor Marcelo Álvaro Antônio, Ministro do Turismo; Senhor Presidente da LATAM; Senhor Presidente da GOL LINHAS AÉREAS; Senhor Presidente da AZUL; Senhor Presidente do Grupo Costa Cruzeiros; Senhor Presidente da MSC Cruzeiros; Senhor Presidente do Grupo Royal Caribbean; Senhor Presidente da CVC; Senhor Presidente da TAP Linhas Aéreas; Senhor João Gabbardo, Secretário-Executivo do Ministério da Saúde; Senhor Milton Hênio Neto de Gouveia Vasconcelos, da ABIH Alagoas.",Sim,2020,REQ
5905,140672,"Realização de sessão especial, em 11 de setembro próximo, destinada a comemorar os 30 anos do Código de Defesa do Consumidor.",Sim,2020,RQS
5905,140354,"Sugere à Excelentíssima Senhora Ministra da Agricultura, Pecuária e Abastecimento a adoção de medidas urgentes para garantir o auxílio emergencial para todos os integrantes das comunidades tradicionais de pescadores artesanais e marisqueiras alagoanas atingidos pelo desastre ambiental do vazamento de óleo.",Sim,2019,INS
5905,140352,Sugere ao Excelentíssimo Senhor Ministro da Cidadania a adoção de medidas urgentes para garantir o auxílio emergencial para todos os integrantes das comunidades tradicionais de pescadores artesanais e marisqueiras alagoanas pelo desastre ambiental do vazamento de óleo.,Sim,2019,INS
5905,140059,"Altera os arts. 102 e 105 da Constituição, transformando os recursos extraordinário e especial em ações revisionais de competência originária do Supremo Tribunal Federal e do Superior Tribunal de Justiça",Não,2019,PEC
5905,140069,"Requer a realização de audiência pública, com o objetivo de debater a decisão do Tribunal de Contas na União, que veda pagamento de salários de professores com recursos dos precatórios do Fundo de Manutenção e Desenvolvimento do Ensino Fundamental e de Valorização do Magistério (FUNDEF) .",Sim,2019,REQ
5905,139916,Altera os arts. 49 e 225 da Constituição Federal para que o Congresso Nacional decida previamente sobre o corte e a supressão de vegetação da Floresta Amazônica.,Não,2019,PEC
5905,140073,"Altera o art. 17 da Constituição Federal, para dispor que os partidos políticos são pessoas jurídicas de direito público.",Não,2019,PEC
5905,139917,"Insere o § 3o no art. 20 e o inciso VIII no § 1º do art. 225 da Constituição Federal, para instituir o Fundo Nacional para Emergências Ambientais, e acrescenta o art. 115 no Ato das Disposições Constitucionais Transitórias, para estabelecer a fonte de recursos para o Fundo.",Não,2019,PEC
5905,140153,Altera a Constituição Federal para instituir o Sistema Parlamentarista de Governo.,Não,2019,PEC
5905,139657,Altera a Constituição Federal para instituir o Fundo Nacional de Responsabilidade por Poluição Causada por Incidentes com Hidrocarbonetos.,Não,2019,PEC
5905,139488,"Requer a realização de audiência pública, com o objetivo de discutir a intenção da Agência Nacional de Energia Elétrica (ANEEL) de acabar com o incentivo à utilização de energia fotovoltaica.",Não,2019,REQ
5905,139735,"Altera o art. 102 da Constituição Federal, para restringir a possibilidade de interposição de recurso extraordinário no âmbito do direito penal.",Não,2019,PEC
5905,139829,"Requer, nos termos do art. 58, § 2º, II, da Constituição Federal e do art. 93, II, do Regimento Interno do Senado Federal, a realização de audiência pública, com o objetivo de debater o Programa de Apoio ao Desenvolvimento Tecnológico
da Indústria de Semicondutores e Displays - PADIS com foco na produção de células fotovoltaicas.",Sim,2019,REQ
5905,139790,"Requer, nos termos do art. 58, § 2º, II, da Constituição Federal e do art. 93, II, do Regimento Interno do Senado Federal, a realização de audiência pública, com o objetivo de debater o novo marco legal dos planos de saúde, o superendividamento do consumidor, as novas tecnologias e a economia do compartilhamento. Propõe para a audiência a presença dos seguintes convidados: 1. Um representante da PROCONSBRASIL; 2. Um representante do Ministério da Saúde; 3. Um representante da Qualicorp; 4. Um representante do IDEC; 5. Um representante do BRASILCON; 6. Um representante da QUOD; 7. Um representante do NUBANK; 8. Um representante da UBER; 9. Um representante do IDP; 10. Um especialista em economia",Sim,2019,REQ
5905,139626,Aperfeiçoa e harmoniza as instituições e regras fiscais em vigor no País para uma gestão fiscal responsável e de qualidade.,Não,2019,PEC
5905,139831,"Requer, nos termos do art. 58, § 2º, II, da Constituição Federal e do art. 93, II, do Regimento Interno do Senado Federal, a realização de audiência pública, com o objetivo de discutir o compartilhamento da licença maternidade entre os pais com enfoque na questão previdenciária e na necessidade de transparência em relação aos gastos públicos que tal medida poderia gerar. A partir da discussão, entende que é necessária a reavaliação da legislação brasileira que trabalha apenas com a licença da mãe, não dando concretude ao art. 226, § 5º, da Constituição Federal, que determina que cabem a ambos os genitores os direitos e deveres referentes à sociedade conjugal, dentre eles a criação dos filhos.",Sim,2019,REQ
5905,139747,Modifica o art. 129 da Constituição Federal para disciplinar o compartilhamento sigiloso de informações entre Ministério Público e autoridades administrativas.,Não,2019,PEC
5905,139825,"Autorização para desempenho de missão parlamentar, a fim de participar das reuniões das Comissões Permanentes e da LXIX Sessão Plenária do Parlamento do Mercosul, em Montevidéu, Uruguai.",Sim,2019,RQS
5905,139705,"Criação de Comissão Parlamentar de Inquérito composta de 11 (onze) membros titulares e 7 (sete) membros suplentes, para, no prazo de 120 (cento e vinte) dias, proceder investigações a respeito das causas da ampliação dos índices do desmatamento na Amazônia Legal no período entre 1º de janeiro de 2018 e 27 de agosto de 2019, assim como o aumento dos índices de queimadas na Amazônia Legal nesse período e, ainda, sobre questões relacionadas ao Fundo Amazônia, organizações não governamentais - ONGs - e organizações da sociedade civil de interesse público - OSCIPs.",Não,2019,RQS
5905,139830,"Requer, nos termos do art. 58, § 2º, II, da Constituição Federal e do art. 93, II, do Regimento Interno do Senado Federal, a realização de audiência pública, com o objetivo de debater a melhoria do Sistema Nacional de Defesa do Consumidor a partir da experiência do direito comparado do direito peruano.",Sim,2019,REQ
5905,139489,"Retirada do Requerimento nº 672, de 2019, apresentado aos PLC 168/2017, PLS 518/2018, PL 3136/2019, PL 3314/2019 e PL 3476/2019.",Sim,2019,RQS
5905,139197,"Requer, nos termos do art. 58, § 2º, II, da Constituição Federal e do art. 93, II, do Regimento Interno do Senado Federal, a realização de audiência pública, com o objetivo de discutir a regulamentação de criptoativos. Propõe para a audiência a presença dos seguintes convidados: 1. Um representante do Banco Central; 2. Um representante da Federação Brasileira de Bancos - FEBRABAN; 3. Um representante da Unidade de Inteligência Financeira - UIF; 4. Um representante da Ministério da Economia; 5. Um representante da Secretaria Nacional do Consumidor; 6. Um representante da Receita Federal; 7. Um representante da Associação Brasileira de Criptomoedas e Blockchain - ABCB; 8. Um representante do IDEC; 9. Dr. Danilo Doneda - especialista em direito digital; 10. Um especialista em Direito Digital, Direito das Startups e em Blockhain; e 11. Deputado Federal João Henrique Caldas.",Sim,2019,REQ
5905,139232,"Autorização para desempenho de missão parlamentar, a fim de participar da Semana de Defesa do Consumidor, em Lima, no Peru.",Sim,2019,RQS
5905,139608,"Sugere ao Excelentíssimo Senhor Ministro da Saúde a adoção de medidas urgentes para regulamentar a Lei nº 13.685/2018 e a Lei nº 12.662/2012, para estabelecer a notificação compulsória de malformações congênitas.",Sim,2019,INS
5905,139606,"Dispõe sobre a obrigatoriedade da divulgação de informações relativas a promoção ou patrocínio de eventos artísticos, culturais e esportivos com recursos públicos, e dá outras providências.",Sim,2019,PL
5905,139302,"Requer, nos termos regimentais, em aditamento ao Requerimento nº 30, de 2019, da realização de audiência pública relativa ao PLS 98/2017 que dispõe sobre o fracionamento de medicamentos. Convida os representantes dos seguintes órgãos: Ana Navarrete - Instituto Brasileiro de Defesa do Consumidor; Célia Chaves - Federação Nacional dos Farmacêuticos; e Hessem Miranda Neiva - Instituto para Práticas Seguras no uso de Medicamentos – ISMP.",Não,2019,REQ
5905,139318,"Requer, nos termos do art. 58, § 2º, II, da Constituição Federal e do art. 93, II, do Regimento Interno do Senado Federal, a realização de audiência pública, com o objetivo de debater a suspensão das ações publicitárias de divulgação do pacote anticrime do Ministério da Justiça e Segurança Pública, bem como, a normativa referente à publicidade oficial. Propõe para a audiência a presença dos seguintes convidados: 1. Sr. Vital do Rêgo Filho, Ministro do Tribunal de Contas da União; 2. Sr. Lucas Rocha Furtado, Subprocurador-Geral do Ministério Público junto ao Tribunal de Contas da União; 3. Sr. Sérgio Moro, Ministro de Estado da Justiça e Segurança Pública; e 4. Sr. Fabio Wajngarten, Secretário Especial de Comunicação Social da Presidência da República.",Não,2019,REQ
5905,139268,Dispõe sobre as normas gerais relativas a realização de concursos públicos.,Sim,2019,PL
5905,139003,"Autorização para desempenho de missão parlamentar, a fim de participar, como membro da representação brasileira, da LXVII Sessão Ordinária do Parlamento do Mercosul, em Montevidéu, Uruguai.",Sim,2019,RQS
5905,138995,"Altera a Lei nº 8.685, de 20 de julho de 1993, que cria mecanismos de fomento à atividade audiovisual e dá outras providências, para ampliar o prazo de aplicação dos mecanismos de incentivo à produção de obras audiovisuais brasileiras de produção independente.",Sim,2019,PL
5905,139116,Dispõe sobre a instituição de regimes próprios de previdência social.,Não,2019,PEC
5905,139063,Cria a seguridade social da criança.,Não,2019,PEC
5905,138860,"Requer, em nome da Liderança do Bloco PSDB/PSL, nos termos do art. 312, II, e parágrafo único do Regimento Interno do Senado Federal, destaque para votação em separado da Emenda nº 9 oferecida ao PL 3832/2019.",Sim,2019,REQ
5905,138555,"Permite que os Estados, o Distrito Federal e os Municípios adotem em seus regimes próprios de previdência social as mesmas regras aplicáveis ao regime próprio da União; modifica renúncias previdenciárias; prevê benefício da Seguridade Social à criança vivendo em situação de pobreza; e dá outras providências.",Não,2019,PEC
5905,138740,"Modifica os arts. 53, 86, 96, 102, 105 e 108 da Constituição Federal, para prever a possibilidade de renúncia ao foro por prerrogativa de função.",Não,2019,PEC
5905,138762,"Altera o art. 205 da Constituição Federal, para definir a educação como vetor do progresso do País.",Não,2019,PEC
5905,139734,"Criação da Comissão Parlamentar de Inquérito composta de 11 (onze) membros titulares e 7 (sete) membros suplentes, destinada a apurar o desmatamento e o aumento dos índices de queimadas na Amazônia Legal.",Não,2019,RQS
5905,138588,"Requer a realização de audiência pública com o objetivo de debater o Programa de Apoio ao Desenvolvimento Tecnológico da Indústria de Semicondutores e Displays - PADIS, com foco na produção de células
fotovoltaicas.",Sim,2019,REQ
