codigoParlamentar,CodigoMateria,Ementa,IndicadorAutorPrincipal,AnoMateria,AutoriasSigla
5732,136065,"Requer, nos termos do art. 93, I, do Regimento Interno do Senado Federal, a realização de audiência pública, com o objetivo de instruir o PLS
215/2017, que obriga que os produtos cosméticos e alimentícios comercializados que possuem substâncias comprovadamente cancerígenas informem o risco de desenvolvimento da doença em suas embalagens. Proponho para a audiência a presença dos seguintes convidados:
1. Representante da Associação Brasileira da Indústria de Higiene Pessoal e Cosméticos (ABIHPEC);
2. Representante da Associação Brasileira da Indústria de Alimentos (ABIA);
3. Representante da Agência Nacional de Vigilância Sanitária (ANVISA).",Sim,2019,REQ
5732,136523,Cria os Fundos das Regiões Metropolitanas.,Não,2019,PEC
5732,136429,Justificações de ausência em votação nominal ocorrida no dia 16 de abril de 2019.,Não,2019,RQS
5732,136593,"Altera o art. 791-A do Decreto-Lei nº 5.452, de 1º de maio de 1943 (Consolidação das Leis do Trabalho), e o art. 98 da Lei nº 13.105, de 16 de março de 2015 (Código de Processo Civil), para dispor sobre os percentuais de fixação de honorários advocatícios nas demandas trabalhistas, e sobre a exigibilidade dos ônus da sucumbência para o beneficiário da justiça gratuita quando este houver obtido em juízo, ainda que em outro processo, créditos capazes de suportar as despesas.",Sim,2019,PL
5732,136594,"Acrescenta § 3º ao art. 156 da Lei nº 8.112, de 11 de dezembro de 1990, que dispõe sobre o regime jurídico dos servidores públicos civis da União, das autarquias e das fundações públicas federais, para dispor sobre a obrigatoriedade da atuação de defesa técnica na defesa dos direitos do servidor público em processo administrativo disciplinar.",Sim,2019,PL
5732,136165,Revoga a não incidência de ICMS na exportação de produtos não-industrializados e semielaborados.,Não,2019,PEC
5732,136144,Desarquivamento do PLC 76/2011.,Não,2019,RQS
5732,136141,"Altera o § 6º do art. 107 do Ato das Disposições Constitucionais Transitórias, para retirar da base de cálculo do teto de gastos as despesas de investimentos públicos ou outras despesas que contribuam diretamente para a formação bruta de capital fixo.",Não,2019,PEC
5732,136450,Autorização para desempenho de missão no exterior no período de 28 a 30 de abril do corrente.,Sim,2019,RQS
5732,135973,"Altera o art. 93, II, b, da Constituição Federal, para modificar a lista de promoção de entrância para entrância de magistrados e de acesso aos tribunais de segundo grau.",Não,2019,PEC
5732,135904,Desarquivamento do Projeto de Lei da Câmara nº 34/2013.,Não,2019,RQS
5732,136008,Desarquivamento do PLS 75/2017.,Não,2019,RQS
5732,135880,"Acrescenta artigo à Lei nº 13.777, de 20 de dezembro de 2018 (Lei da Multipropriedade Imobiliária), para ampliar para um ano o prazo de sua vacatio legis.",Sim,2019,PL
5732,135901,Desarquivamento das PEC 12/2013 e 37/2007.,Não,2019,RQS
5732,136051,Desarquivamento do PLC 30/2014.,Sim,2019,RQS
5732,135998,Desarquivamento do PLC nº 105/2013.,Não,2019,RQS
5732,136005,Desarquivamento do PLC 7/2013.,Não,2019,RQS
5732,136004,Desarquivamento da PEC 63/2013.,Não,2019,RQS
5732,135903,Desarquivamento da PEC nº 105/2015.,Não,2019,RQS
5732,135580,"Institui, no âmbito do Senado Federal, a Frente Parlamentar da Advocacia no Senado Federal.",Sim,2019,PRS
5732,135504,Altera a Constituição Federal para autorizar a União a reter recursos do Fundo de Participação dos Estados e do Distrito Federal e transferi-los aos Municípios na hipótese de ausência de repasse do Imposto sobre Operações relativas à Circulação de Mercadorias e sobre Prestação de Serviços de Transporte Interestadual e Intermunicipal e de Comunicação (ICMS) e do Imposto sobre Propriedade de Veículos Automotores (IPVA).,Não,2019,PEC
5732,135486,"Altera a Resolução do Senado Federal nº 93, de 27 de novembro de 1970 - Regimento Interno do Senado Federal, para estabelecer a votação por maioria absoluta nas eleições da Mesa.",Sim,2019,PRS
5732,135360,"Adiamento da votação do PLS 796/2015 para oitiva da Comissão de Constituição, Justiça e Cidadania.",Não,2019,RQS
5732,135400,"Dá nova redação aos §§ 1º, 2º e 3º do art. 14 da Constituição Federal, para facultar a participação do estrangeiro domiciliado no Brasil em eleições municipais.",Não,2019,PEC
5732,135391,Acrescenta o inciso IX ao art. 200 da Constituição Federal.,Não,2019,PEC
5732,135546,Desarquivamento do PLS 609/2015-Complementar.,Não,2019,RQS
5732,135388,"Realização de Sessão de debates temáticos, com finalidade de discutir o projeto de lei anticrime, de autoria do Poder Executivo.",Não,2019,RQS
5732,135341,Institui o Grupo Parlamentar Brasil-Reino Unido.,Sim,2019,PRS
5732,135156,Urgência para o  PRS 53/2018.,Não,2019,RQS
5732,135609,"Altera o art. 156 da Constituição Federal, para estabelecer critérios ambientais para a cobrança do Imposto sobre Propriedade Predial e Territorial Urbana e desonerar a parcela do imóvel com vegetação nativa.",Não,2019,PEC
5732,135289,Desarquivamento das seguintes proposições: PEC 7/2014; PEC 21/2013; PLS 26/2014 - Complementar; PLS 45/2014; PLS 84/2014; PLS 91/2014; PLS 170/2014; PLS 221/2014; PLS 368/2014; PLS 386/2013; PLS 426/2013; PLS 140/2011; PLS 274/2011; PLS 523/2011; PLS 230/2009 - Complementar; PLS 260/2008; PRS 37/2011; PDS 117/2014.,Não,2019,RQS
5732,135389,Desarquivamento do Projeto de Lei do Senado nº 194/2014.,Não,2019,RQS
5732,135553,Acrescenta o § 3º ao art. 143 da Constituição Federal para prever que a prestação de serviço militar obrigatório será considerada como título ou critério de desempate em concursos públicos de ingresso nos órgãos previstos no art. 144 da Constituição Federal.,Não,2019,PEC
5732,135379,"Altera o art. 132 da Constituição Federal, para incluir as procuradorias municipais.",Não,2019,PEC
5732,135613,Inclui o § 4º-A ao art. 37 da Constituição Federal.,Não,2019,PEC
5732,135488,Desarquivamento da PEC 47/2012,Não,2019,RQS
5732,135612,Desarquivamento da PEC 22/2017.,Não,2019,RQS
5732,135594,"Acrescenta o inciso XII-A, ao art. 5º, e o inciso XXX, ao art. 22, da Constituição Federal para incluir a proteção de dados pessoais entre os direitos fundamentais do cidadão e fixar a competência privativa da União para legislar sobre a matéria.",Não,2019,PEC
5732,135357,Desarquivamento do PLC 37/2013,Não,2019,RQS
5732,135172,Urgência para o Projeto de Lei do Senado nº 395/2019.,Não,2019,RQS
5732,135120,Acrescenta ao art. 57 o §4º-A para dispor sobre o voto aberto na eleição das mesas no congresso.,Não,2019,PEC
5732,135123,Desarquivamento do PLC 8/2013.,Não,2019,RQS
5732,135192,"Requer, nos termos do art. 58, § 3º, da Constituição Federal e dos arts. 74, III, e 145 do Regimento Interno do Senado Federal, a constituição de uma Comissão Parlamentar de Inquérito composta de 11 (onze) membros titulares e 7 (sete) membros suplentes, para, no prazo de 180 (cento e oitenta) dias, com limite de despesas de R$ 110.000,00 (cento e dez mil reais), apurar as causas do rompimento da barragem na Mina Córrego do Feijão, da empresa de mineração Vale, em Brumadinho; tendo como objetivo identificar os responsáveis, quais foram as falhas dos órgãos competentes, os autores dos laudos técnicos e adoção das providências cabíveis para evitar novos acidentes.",Não,2019,RQS
5732,135125,Desarquivamento do PLS 224/2016.,Não,2019,RQS
5732,135118,"Modifica o art. 37 da Constituição Federal, para suspender o transcurso do prazo de validade de concurso público na hipótese de o Poder Público suspender as nomeações por falta de recursos financeiros.",Não,2019,PEC
5732,145594,"Urgência para o PLP nº 266, de 2020.",Não,2020,RQS
5732,138493,Calendário especial para deliberação da PEC 98/2019.,Não,2019,RQS
