codigoParlamentar,CodigoMateria,Ementa,IndicadorAutorPrincipal,AnoMateria,AutoriasSigla
5732,144947,"Altera a Lei nº 11.051, de 29 de dezembro de 2004, para excluir da base de cálculo da Contribuição para o PIS/Pasep e da Cofins os valores repassados pelas sociedades cooperativas de prestação de serviços de representação comercial aos cooperados pessoas físicas referentes a serviços por eles prestados em nome da cooperativa.",Sim,2020,PL
5732,144946,"Altera a Lei nº 7.210, de 11 de julho de 1984 – Lei de Execução Penal, para prever a possibilidade de remição da pena pela frequência em curso educacional não formal que contribua para a ressocialização do condenado.",Sim,2020,PL
5732,144995,"Altera o art. 90-A da Lei nº 9.099, de 26 de setembro de 1995, para estender sua aplicação aos processos dos crimes de competência da Justiça Militar da União, dos Estados e do Distrito Federal.",Sim,2020,PL
5732,145326,"Voto de repúdio ao advogado Cláudio Gastão da Rosa Filho, ao Juiz Rudson Marcos e ao Promotor de Justiça Thiago Carriço de Oliveira, por distorcerem fatos de um crime de estupro, expondo a vítima a sofrimento e humilhação.",Não,2020,RQS
5732,144893,"Altera o art. 165 da Constituição Federal e o art. 107 e 110 do Ato das Disposições Constitucionais Transitórias, acrescenta art. 115 ao Ato das Disposições Constitucionais Transitórias, bem como revoga o inciso III do art. 167 da Constituição Federal e a Emenda Constitucional nº 95, de 16 de dezembro de 2016.",Não,2020,PEC
5732,144138,"Altera o art. 1º da Constituição Federal, para elencar “a prevenção e o combate à corrupção” como um dos fundamentos da República Federativa do Brasil.",Não,2020,PEC
5732,144219,Adição de assinatura à PEC nº 30/2020.,Sim,2020,RQS
5732,144550,Adição de assinatura ao PEC nº 33/2020.,Sim,2020,RQS
5732,144585,"Altera o § 4º do art. 57 da Constituição Federal, para permitir a recondução dos membros das Mesas da Câmara dos Deputados e do Senado Federal.",Não,2020,PEC
5732,143586,"Realização de Sessão Especial, em data a ser definida, a fim de celebrar o centenário de nascimento do economista e pensador brasileiro Celso Monteiro Furtado.",Não,2020,RQS
5732,143593,Adição de assinatura ao RQS nº 1511/2020.,Sim,2020,RQS
5732,143465,Adição de assinatura à PEC nº 28/2020.,Sim,2020,RQS
5732,143960,"Acrescenta o art. 60-A ao Ato das Disposições Constitucionais Transitórias, para dispor sobre a utilização no âmbito dos Estados e dos Municípios de recursos provenientes de precatórios relativos à complementação da União ao Fundo de Manutenção e Desenvolvimento do Ensino Fundamental e de Valorização do Magistério (FUNDEF).",Não,2020,PEC
5732,142708,Adição de assinatura a emenda (s) relacionada (s) à PEC 18/2020.,Sim,2020,RQS
5732,142676,Adição de assinatura ao RQS nº 830/2020.,Sim,2020,RQS
5732,142695,Adição de assinatura a emenda (s) relacionada (s) à PEC 18/2020.,Sim,2020,RQS
5732,142677,"Realização de Sessão de Debates Temáticos, a ser realizada em data oportuna, a fim de discutir o adiamento do pleito municipal de 2020.",Não,2020,RQS
5732,142021,"Introduz dispositivos ao Ato das Disposições Constitucionais Transitórias, a fim de tornar coincidentes os mandatos eletivos.",Não,2020,PEC
5732,141622,"Cria Fundos Garantidores solidários no âmbito da política de desenvolvimento regional, para apoio e desenvolvimento de micro, pequenas e médias empresas.",Não,2020,PEC
5732,141566,"Institui o Fundo Anticíclico de Combate à Pobreza – FACP; estabelece limites para a taxa de pobreza infantil; prevê que o FACP seja fonte de recursos para políticas de assistência social em caso de descumprimento dos limites de pobreza, bem como para premiação financeira de entes federativos que tenham avanços relevantes na área social; e dá outras providências.",Não,2020,PEC
5732,141096,"Altera o art. 5º da Constituição Federal, para incluir o acesso à internet entre os direitos fundamentais.",Não,2020,PEC
5732,140753,"Realização de Sessão Especial, em 23/11/2020, destinada a comemorar o Dia Nacional da Homeopatia.",Não,2020,RQS
5732,140994,"Realização de sessão de debates temáticos destinada a debater sobre o Tema: "" Proteção de Dados e Autoridade Nacional de Proteção de Dados (ANPD)"".",Não,2020,RQS
5732,140918,"Requeiro, nos termos do art. 93, I do Regimento Interno do Senado Federal, que na Audiência Pública objeto do Req. 155/2019-CCJ, com o objetivo de instruir a PEC 186/2019, seja incluído o seguinte convidado:
Proponho para a audiência a inclusão do Exmo. Sr, Fernando Marcelo Mendes, Juiz Federal, representando a Associação dos Juízes Federais do Brasil - Ajufe.",Sim,2020,REQ
5732,140916,"Requeiro, nos termos do art. 58, § 2º, II, da Constituição Federal e do art. 93, II, do Regimento Interno do Senado Federal, a realização de audiência Pública, com o objetivo de debater a Proposta de Emenda à Constituição nº 186, de 2019.
Proponho para a audiência a presença dos seguintes convidados:
1. Representante da Associação dos Magistrados Brasileiros - AMB;
2. Representante da Associação dos Juízes Federais do Brasil - AJUFE;
3. Representante da Ordem dos Advogados do Brasil - OAB.",Sim,2020,REQ
5732,140675,"Requer, nos termos do art. 58, § 2º, II da Constituição Federal e do art. 93, II do Regimento Interno do Senado Federal, a realização de audiência pública,com o objetivo de debater o importante tema do estabelecimento do nível das águas em represas, tendo em vista o uso e fruição econômico e social nos reservatórios brasileiros.",Sim,2020,REQ
5732,140529,"Realização de Sessão Especial, em 12/03/2020, destinada a celebrar o Dia Mundial do Rim.",Não,2020,RQS
5732,140267,"Realização de sessão especial, em 18/06/2020, destinada a comemorar o Dia do Imigrante Japonês.",Não,2019,RQS
5732,140182,"Votação, em globo, dos dispositivos do Projeto de Lei n° 6.389, de 2019, Substitutivo da Câmara ao Projeto de Lei do Senado no 664, de 2015.",Sim,2019,RQS
5732,140276,"Solicitamos, nos termos do art. 58, § 2º, I, da Constituição Federal e do art. 91, § 3º, do Regimento Interno do Senado Federal, que o PLS 166/2018, que altera o Código de Processo Penal para disciplinar a prisão após a condenação em segunda instância, deliberado terminativamente pela Comissão de Constituição, Justiça e Cidadania, seja apreciado pelo Plenário do Senado Federal.",Não,2019,R.S
5732,140266,"Realização de sessão especial, em 05/03/2020, destinada a comemorar o Dia do Turismo Ecológico.",Não,2019,RQS
5732,140271,Altera o inciso XVIII do art. 7º da Constituição Federal e revoga o inciso XIX da Constituição Federal e o § 1º do art. 10 do Ato das Disposições Constitucionais Transitórias para dispor sobre a licença parental compartilhada.,Não,2019,PEC
5732,139978,"Altera a Lei nº 12.732, de 22 de novembro de 2012, que dispõe sobre o primeiro tratamento de paciente com neoplasia maligna comprovada e estabelece prazo para seu início, para uniformizar o valor das cirurgias oncológicas, a fim de facilitar sua realização em serviços cirúrgicos não pertencentes aos hospitais especializados em oncologia.",Sim,2019,PL
5732,140173,"Altera a Constituição Federal para disciplinar a apreciação dos vetos, separadamente, em cada Casa do Congresso Nacional.",Não,2019,PEC
5732,140105,"Nos termos regimentais, requer urgência para a Mensagem do Senado Federal nº 90, de 2019, que “Propõe, nos termos do art. 52, incisos V, VII e VIII, da Constituição, que seja autorizada a contratação de operação de crédito externo, com garantia da República Federativa do Brasil, no valor de até US$ 118,370,000.00 (cento e dezoito milhões, trezentos e setenta mil dólares dos Estados Unidos da América), entre o Governo do Estado do Paraná e o Banco Interamericano de Desenvolvimento - BID, cujos recursos se destinam ao financiamento parcial do Programa Estadual de Apoio ao Desenvolvimento Urbano e Melhorias de Infraestrutura Municipal - Paraná Urbano III”.",Sim,2019,REQ
5732,140085,"Requeiro, nos termos do art. 58, § 2º, II, da Constituição Federal e do art. 93, II, do Regimento Interno do Senado Federal, a realização de audiência pública,com o objetivo de debater a política de privacidade e segurança de dados pessoais das empresas de telefonia em face da Lei Geral de Proteção de Dados Pessoais.",Sim,2019,REQ
5732,140081,"Insere o § 3º no art. 20 da Constituição Federal para prover recursos para fundo de prevenção e recuperação de danos ambientais provocados por atividades de extração, transporte e processamento de recursos petrolíferos e minerais.",Não,2019,PEC
5732,140060,"Autorização para desempenho de missão parlamentar, a fim de participar da LXX Sessão Ordinária do Parlamento do Mercosul e do Foro da Cadeia Láctea do Mercosul, em Montevidéu, no Uruguai.",Sim,2019,RQS
5732,139704,"Altera arts. 6º, 18, 20, 29-A, 37, 39, 48, 62, 68, 71, 74, 84, 163, 165, 166, 167, 168, 169, 184, 198, 208, 212, 213 e 239 da Constituição Federal e os arts. 35, 107,109 e 111do Ato das Disposições Constitucionais Transitórias; acrescenta à Constituição Federal os arts. 135-A, 163-A, 164-A, 167-A, 167-B, 168-A e 245-A; acrescenta ao Ato das Disposições Constitucionais Transitórias os arts. 91-A, 115, 116 e 117; revoga dispositivos constitucionais e legais e dá outras providências.",Não,2019,PEC
5732,139703,"Institui reserva de lei complementar para criar fundos públicos e extingue aqueles que não forem ratificados até o final do segundo exercício financeiro subsequente à promulgação desta Emenda Constitucional, e dá outras providências.",Não,2019,PEC
5732,139735,"Altera o art. 102 da Constituição Federal, para restringir a possibilidade de interposição de recurso extraordinário no âmbito do direito penal.",Sim,2019,PEC
5732,139816,"Autorização para desempenho de missão parlamentar, a fim de integrar a Comitiva do Excelentíssimo Senhor Presidente da República, em visita a Tóquio, no Japão; Pequim, na China; Abu Dhabi, nos Emirados Árabes Unidos; Doha, no Catar; e, Riade, na Arábia Saudita.",Sim,2019,RQS
5732,139875,"Realização de Sessão especial, em 12 de dezembro próximo, destinada a celebrar o transcurso de 90 anos de atuação, no território nacional brasileiro, das Assembleias de Deus Ministério de Madureira.",Não,2019,RQS
5732,139702,"Altera o texto permanente da Constituição e o Ato das Disposições Constitucionais Transitórias, dispondo sobre medidas permanentes e emergenciais de controle do crescimento das despesas obrigatórias e de reequilíbrio fiscal no âmbito dos Orçamentos Fiscal e da Seguridade Social da União, e dá outras providências.",Não,2019,PEC
5732,139193,"Requer a realização de audiência pública, com o objetivo de debater o PL nº 3178, de 2019, que modifica a Lei nº 12.351, de 22 de dezembro de 2010, que dispõe sobre a exploração e a produção de petróleo, de gás natural e de outros hidrocarbonetos fluidos, sob o regime de partilha de produção, em áreas do pré-sal e em áreas estratégicas, para permitir a licitação com concessão nos blocos em que esse regime for mais vantajoso para o Brasil e instituir a disputa em igualdade de condições nas licitações de partilha da produção.",Não,2019,REQ
5732,139338,"Cria o Sistema do Futebol Brasileiro, mediante tipificação da Sociedade Anônima do Futebol, estabelecimento de normas de governança, controle e transparência, instituição de meios de financiamento da atividade futebolística e previsão de um sistema tributário transitório.",Sim,2019,PL
5732,139436,Informações ao Ministro de Estado da Justiça e Segurança Pública.,Sim,2019,RQS
5732,139463,"Realização de sessão de debates temáticos, no dia 09/12/2019, destinada a celebrar o Dia Internacional de Direitos Humanos e a População Negra.",Não,2019,RQS
5732,139234,"Autorização para desempenho de missão parlamentar, a fim de participar do Workshop: Theory and Tools of the Harvard Negotiation Project, em Cambridge, Massachusetts, nos Estados Unidos.",Sim,2019,RQS
5732,139215,"Requeiro, nos termos do art.113 do Regimento Interno do Senado Federal, que o Projeto de Lei nº 2963 de 2019, que Regulamenta o art. 190 da Constituição Federal, altera o art.1º da Lei nº. 4.131, de 3 de setembro de 1962, o art. 1º da Lei nº 5.868, de 12 de dezembro de 1972 e o art. 6º da Lei nº 9.393, de 19 de dezembro de 1996 e dá outras providências, seja apreciado em Reunião Conjunta das Comissões de Agricultura e Reforma Agrária e de Assuntos Econômicos.",Sim,2019,REQ
5732,139378,"Cria nova hipótese para destinação dos recursos arrecadados da contribuição de intervenção no domínio econômico relativa às atividades de importação ou comercialização de petróleo e seus derivados, gás natural e seus derivados e álcool combustível, bem como institui o Fundo Nacional para Transportes Urbanos.",Não,2019,PEC
5732,139392,Altera o art. 107 do Ato das Disposições Constitucionais Transitórias da Constituição Federal para excluir do Novo Regime Fiscal as despesas primárias custeadas com a contribuição de que trata o §5º do art. 212 da Constituição Federal.,Não,2019,PEC
5732,139390,"Realização de sessão especial, em 20/11/2019, destinada a homenagear o Dia Nacional de Zumbi e da Consciência Negra e a Fundação Cultural Palmares.",Sim,2019,RQS
5732,138894,Acrescenta artigo ao Ato das Disposições Constitucionais Transitórias para alterar a duração do mandato dos prefeitos e vereadores eleitos em 2020 e viabilizar a coincidência geral dos mandatos a partir de 2026.,Não,2019,PEC
5732,139021,"Requeiro, nos termos do art.113 do Regimento Interno do Senado Federal, que o Projeto de Lei nº 2963 de 2019, que Regulamenta o art. 190 da Constituição Federal, altera o art.1º da Lei nº. 4.131, de 3 de setembro de 1962, o art. 1º da Lei nº 5.868, de 12 de dezembro de 1972 e o art. 6º da Lei nº 9.393, de 19 de dezembro de 1996 e dá outras providências, seja apreciado em Reunião Conjunta das Comissões de Assuntos Econômicos e de Agricultura e Reforma Agrária.",Sim,2019,REQ
5732,139039,"Institui, no âmbito do Senado Federal, a Frente Parlamentar de apoio ao Mercado de Varejo e E-commerce",Não,2019,PRS
5732,138897,"Altera o § 3º do art. 46 da Constituição Federal, para dispor sobre os suplentes de Senador.",Não,2019,PEC
5732,138896,"Altera a Constituição Federal para limitar as hipóteses de iniciativa legislativa exclusiva de tribunais e do Procurador-Geral da República, e estabelece a obrigatoriedade de os Conselhos Nacionais de Justiça e do Ministério Público, anualmente, enviarem relatório de suas atividades à Câmara do Deputados e ao Senado Federal.",Não,2019,PEC
5732,139063,Cria a seguridade social da criança.,Não,2019,PEC
5732,139072,"Retirada da Emenda nº 540, apresentada à PEC 6/2019.",Sim,2019,RQS
5732,138749,"Acrescenta inciso LXXIX ao Art. 5º da Constituição Federal, para estabelecer o emprego de meios extrajudiciais de solução de conflitos como um direito fundamental.",Não,2019,PEC
5732,138555,"Permite que os Estados, o Distrito Federal e os Municípios adotem em seus regimes próprios de previdência social as mesmas regras aplicáveis ao regime próprio da União; modifica renúncias previdenciárias; prevê benefício da Seguridade Social à criança vivendo em situação de pobreza; e dá outras providências.",Não,2019,PEC
5732,138645,"Realização de sessão especial, em 1º de novembro próximo, destinada a comemorar a campanha de conscientização do mês do diabetes, o Novembro Azul.",Não,2019,RQS
5732,140409,"Solicitamos, nos termos do art. 58, § 2º, I, da Constituição Federal e do art. 91, § 3º, do Regimento Interno do Senado Federal, que o PL 1540/2019, que altera a Lei nº 8.036, de 11 de maio de 1990, que dispõe sobre o Fundo de Garantia do Tempo de Serviço (FGTS), para permitir o saque do saldo do FGTS para o pagamento de curso de nível superior e de cirurgias essenciais à saúde, deliberado terminativamente pela Comissão de Assuntos Sociais, seja apreciado pelo Plenário do Senado Federal.",Sim,2019,R.S
5732,138355,"Requeiro, nos termos do art. 93, I, do Regimento Interno do Senado Federal, que na Audiência Pública objeto do REQ 68/2019 - CCJ, com o objetivo de instruir a PEC nº 110, de 2019, que dispõe sobre a Reforma Tributária, seja incluído como convidado: Representante da Associação dos Juízes Federais do Brasil – AJUFE.",Sim,2019,REQ
5732,137777,Urgência para o PL nº 1.753/2019.,Não,2019,RQS
5732,138000,"Estabelece como regra transitória mandatos de seis anos para Prefeitos e Vereadores a serem eleitos em 2020, a fim de fazer coincidir as datas dos pleitos de todos os cargos eletivos a partir de 2026.",Não,2019,PEC
5732,138199,"Altera a Lei nº 8.245, de 18 de outubro de 1991, para dispor sobre a locação de imóveis urbanos, e dá outras providências.",Sim,2019,PL
5732,138108,Altera o inciso VIII do art. 93 da Constituição Federal para vedar a aposentadoria compulsória como espécie de pena disciplinar aplicável aos magistrados.,Não,2019,PEC
5732,138450,"Oitiva da Comissão de Assuntos Econômicos sobre o Projeto de Lei nº 2130, de 2019.",Sim,2019,RQS
5732,137932,"Acresce ao Ato das Disposições Constitucionais Transitórias o art. 115, que destina por 15 (quinze) anos 1/3 (um terço) dos recursos de que trata a alínea “c” do inciso II do art.159 da Constituição Federal, a projetos estruturantes, por meio de investimentos públicos e de financiamento de concessões e de parcerias público-privadas no âmbito de cada região; e autoriza determinadas instituições financeiras a ofertar empréstimos com recursos dos fundos constitucionais.",Não,2019,PEC
5732,137805,Requer apreciação do PLS 769/2015 pelo plenário.,Não,2019,R.S
5732,137268,"Altera a Lei nº 9.433, de 8 de janeiro de 1997, que institui a Política Nacional de Recursos Hídricos, cria o Sistema Nacional de Gerenciamento de Recursos Hídricos, regulamenta o inciso XIX do art. 21 da Constituição Federal, e altera o art. 1º da Lei nº 8.001, de 13 de março de 1990, que modificou a Lei nº 7.990, de 28 de dezembro de 1989, para que a proteção ao patrimônio turístico e paisagístico seja verificada na outorga de recursos hídricos para aproveitamento dos potenciais hidrelétricos.",Sim,2019,PL
5732,137699,Altera o Sistema Tributário Nacional e dá outras providências.,Não,2019,PEC
5732,137393,"Requer, nos termos do art. 93, I, do Regimento Interno do Senado Federal, a realização de audiência pública, com o objetivo de instruir o PLC159/2017, que altera a Lei nº 9.503, de 23 de setembro de 1997 (Código de Trânsito Brasileiro), para incluir entre os equipamentos obrigatórios dos veículos extintor de incêndio com carga de pó ABC.",Sim,2019,REQ
5732,137250,"Altera a Lei nº 8.112, de 11 de dezembro de 1990, para inserir hipótese de remoção a pedido, independentemente do interesse da Administração, nos casos de violência doméstica e familiar contra a mulher.",Sim,2019,PL
5732,137408,Altera o Código Penal para prever que o advogado pode ser vítima de crime de desacato.,Sim,2019,PL
5732,137690,Oitiva da CCJ sobre o PLS 375/2016.,Sim,2019,RQS
5732,137232,"Requeiro, nos termos do art. 93, I, do Regimento Interno do SenadoFederal, a realização de audiência pública, com o objetivo de instruir o PL 579/2019,que altera dispositivos da Lei 9.491, de 9 de setembro de 1997, que dispõe sobre procedimentosrelativos ao Programa Nacional de Desestatização.",Sim,2019,REQ
5732,137686,Realização de sessão especial destinada a homenagear o General Eduardo Dias da Costa Villas Bôas.,Não,2019,RQS
5732,137639,"Altera a Lei nº 7.210, de 11 de julho de 1984 – Lei de Execução Penal, para promover efetiva reintegração social do preso, internado e egresso.",Sim,2019,PL
5732,137695,"Acrescenta § 4º ao art. 102 da Constituição Federal, para estabelecer a necessidade de demonstração da existência de controvérsia constitucional relevante e atual como condição de admissibilidade da ação direta de inconstitucionalidade e da ação declaratória de constitucionalidade.",Não,2019,PEC
5732,137242,Acrescenta o art. 733-A à Lei nº 13.105 de 16 de março de 2015 – Código de Processo Civil e dá outras providências.,Sim,2019,PL
5732,136948,"Requer, nos termos do art. 50, § 2º, da Constituição Federal e do art. 216 do Regimento Interno do Senado Federal, que sejam prestadas, pelo Senhor Ministro de Estado da Economia, PAULO GUEDES, informações sobre a matéria versada no Acórdão nº 2973/2016 - TCU - Plenário, que trata de auditoria operacional realizada com o objetivo de avaliar a situação atuarial e financeira dos Regimentos Próprios de Previdência Social (RPPS) de estados, municípios e Distrito Federal (TC-008.368/2016-3).",Sim,2019,REQ
5732,136580,"Altera o art. 9º da Lei nº 8.906, de 4 de julho de 1994 (Estatuto da Advocacia e a Ordem dos Advogados do Brasil - OAB), para prever a duração de três anos para o estágio profissional de advocacia e permitir sua realização a partir do terceiro ano do curso jurídico.",Sim,2019,PL
5732,137066,"Altera o art. 144 da Constituição Federal, para prever a realização de exame toxicológico por todos os servidores da área de segurança pública.",Não,2019,PEC
5732,137042,Dispõe sobre o exercício da Fisioterapia.,Sim,2019,PL
5732,137044,Dispõe sobre a atualização monetária dos repasses de recursos federais aos Municípios.,Não,2019,PEC
5732,136938,"Modifica a Constituição Federal, para permitir a delegação aos Estados da competência da União para explorar portos, aeroportos, ferrovias e energia elétrica; e altera o sistema de repartição de receitas tributárias.",Não,2019,PEC
5732,136667,"Tramitação conjunta do Projeto de Lei do Senado nº 236, de 2012, de Reforma do Código Penal Brasileiro, com as seguintes proposições: PL 556/2019; PL 634/2019; PL 647/2019; PL 648/2019; PL 655/2019; PL 663/2019; PL 847/2019; PL 1030/2019; PL 1199/2019; PL 1544/2019; PL 1545/2019; PL 1546/2019; PL 1642/2019; PLC 24/2015; PLC 27/2015; PLC 33/2015; PLC 39/2015; PLC 140/2017; PLS 1/2015; PLS 4/2012; PLS 14/2016; PLS 28/2018; PLS 35/2015; PLS 41/2013; PLS 42/2016; PLS 54/2015; PLS 63/2015; PLS 64/2015; PLS 65/2015; PLS 66/2015; PLS 67/2016; PLS 71/2015; PLS 71/2018; PLS 73/2015; PLS 79/2018; PLS 82/2015; PLS 88/2018; PLS 92/2015; PLS 92/2016; PLS 93/2016; PLS 98/2016; PLS 101/2011; PLS 101/2016; PLS 103/2016; PLS 106/2016; PLS 112/2018; PLS 121/2015; PLS 125/2011; PLS 130/2016; PLS 135/2015; PLS 148/2015; PLS 160/2015; PLS 177/2015; PLS 178/2015; PLS 179/2018; PLS 181/2015; PLS 188/2015; PLS 190/2018; PLS 206/2015; PLS 209/2018; PLS 223/2018; PLS 229/2014; PLS 264/2018; PLS 287/2018; PLS 291/2015; PLS 297/2015; PLS 298/2018; PLS 306/2016; PLS 310/2017; PLS 314/2016; PLS 314/2018; PLS 316/2018; PLS 327/2016; PLS 357/2013; PLS 367/2011; PLS 368/2018; PLS 376/2015; PLS 380/2015; PLS 381/2018; PLS 384/2018; PLS 395/2018; PLS 416/2014; PLS 424/2017; PLS 436/2015; PLS 443/2017; PLS 449/2015; PLS 450/2018; PLS 455/2016; PLS 460/2016; PLS 461/2016; PLS 469/2015; PLS 469/2017; PLS 471/2018; PLS 473/2017; PLS 479/2018; PLS 503/2018; PLS 504/2018; PLS 512/2018; PLS 513/2018; PLS 518/2015; PLS 520/2011; PLS 533/2018; PLS 562/2015; PLS 653/2011; PLS 658/2015; PLS 669/2015; PLS 671/2015; PLS 787/2015 e SCD 8/2015.",Sim,2019,RQS
5732,136804,"Altera a Constituição Federal, para incluir as polícias científicas no rol dos órgãos de segurança pública.",Não,2019,PEC
5732,136910,"Requeiro, nos termos do artigo 338, inciso IV, do Regimento Interno do Senado Federal, urgência para o PLC nº 109, de 2017.",Sim,2019,REQ
5732,136841,"Autorização para desempenho de missão, a fim de participar da LXIII Sessão Plenária e das reuniões de Comissões Permanentes do Parlasul, em Montevidéu, Uruguai.",Sim,2019,RQS
5732,137068,Voto de aplauso à Lia Cordovil Faraco de Medeiros.,Não,2019,RQS
5732,136878,"Altera a Lei Complementar nº 141, de 13 de janeiro de 2012, a fim de limitar o cômputo dos restos a pagar inscritos ao final do exercício financeiro no cálculo dos recursos mínimos a serem aplicados anualmente em ações e serviços públicos de saúde.",Sim,2019,PLP
5732,136971,"Altera a Lei nº 8.069, de 13 de julho de 1990, que dispõe sobre o Estatuto da Criança e do Adolescente e dá outras providências, para ampliar o rol de doenças neonatais que devem ser obrigatoriamente rastreadas no Brasil.",Sim,2019,PL
5732,136917,Realização de Sessão de Debates Temáticos destinada a debater a democracia no Brasil.,Não,2019,RQS
5732,136122,"Tramitação conjunta dos Projetos de Lei  Complementares nºs 66, 69, 73 e 89, de 2019.",Sim,2019,RQS
5732,136230,Desarquivamento dos PLC 116/2014 e PLC 52/2013.,Não,2019,RQS
5732,136229,Desarquivamento de Projeto de Lei da Câmara n° 31/2014.,Não,2019,RQS
5732,136167,"Altera o art. 62 da Constituição Federal, para dispor sobre o rito legislativo das Medidas Provisórias e dá outras providências.",Não,2019,PEC
5732,136148,Desarquivamento do PLC  nº 75/2014.,Não,2019,RQS
5732,136145,Desarquivamento da PEC 21/2014.,Não,2019,RQS
