codigoParlamentar,CodigoMateria,Ementa,IndicadorAutorPrincipal,AnoMateria,AutoriasSigla
5905,138680,"Altera a Lei nº 6.360, de 23 de setembro de 1976, que dispõe sobre a vigilância sanitária a que ficam sujeitos os medicamentos, as drogas, os insumos farmacêuticos e correlatos, cosméticos, saneantes e outros produtos, e dá outras providências, para obrigar a declaração da presença de lactose em rótulos e embalagens de medicamentos.",Sim,2019,PL
5905,138587,"Requer, nos termos do art. 93, I, do Regimento Interno do Senado Federal, a realização de audiência pública, com o objetivo de instruir o PLS 354/2018, que altera a Lei nº 8.078, de 11 de setembro de 1990, para proibir publicidade de crédito mediante o uso das expressões “parcelamento sem juros”, “gratuito”, “sem acréscimo”, “com taxa zero” e outras de teor semelhante. Propõe para a audiência a presença dos seguintes convidados: Marilena Lazzarini, Presidente do Conselho Diretor do Idec (Instituto Brasileiro de Defesa do Consumidor); José César da Costa, Presidente da Confederação Nacional de Dirigentes Lojistas; Claudio Conz, Presidente Executivo da Anamaco (Associação Nacional dos Comerciantes de Material de Construção); Emerson Luiz Destro, Presidente da ABAD (Associação Brasileira de Atacadistas e Distribuidores); Antonio Eduardo Ripari Neger, representando a AbranetAssociação Brasileira de Internet); Representante do CONAR (Conselho de Nacional Autoregulamentação Publicitária).",Não,2019,REQ
5905,138342,"Realização de sessão de debates temáticos, em 3 de setembro próximo, destinada a debater as iniciativas do atual governo para debelar a grave situação da Amazônia.",Não,2019,RQS
5905,140409,"Solicitamos, nos termos do art. 58, § 2º, I, da Constituição Federal e do art. 91, § 3º, do Regimento Interno do Senado Federal, que o PL 1540/2019, que altera a Lei nº 8.036, de 11 de maio de 1990, que dispõe sobre o Fundo de Garantia do Tempo de Serviço (FGTS), para permitir o saque do saldo do FGTS para o pagamento de curso de nível superior e de cirurgias essenciais à saúde, deliberado terminativamente pela Comissão de Assuntos Sociais, seja apreciado pelo Plenário do Senado Federal.",Não,2019,R.S
5905,138317,"Requer, nos termos do art. 58, § 2º, II, da Constituição Federal e do art. 93, II, do Regimento Interno do Senado Federal, a realização de audiência pública, com o objetivo de discutir com o poder público, representantes de institutos e sociedade organizada sobre as perspectivas e desafios dos negócios de impacto social. Propõe para a audiência a presença dos seguintes convidados: 1. MINISTÉRIO DA ECONOMIA; 2. IABS - INSTITUTO BRASILEIRO DE DESENVOLVIMENTO E SUSTENTABILIDADE; 3. GIFE - ASSOCIAÇÃO DOS INVESTIDORES SOCIAIS DO BRASIL; 4. VOX CAPITAL - INVESTIMENTOS DE IMPACTO; 5. ARTEMÍSIA; 6. FGV; 7. YUNUS NEGÓCIOS SOCIAIS; 8. BNDES; 9. ICE - INSTITUTO DE CIDADANIA EMPRESARIAL; 10. SEBRAE NACIONAL.",Sim,2019,REQ
5905,137961,"Altera a Lei nº 8.078, de 11 de setembro de 1990, para determinar que a aquisição de produto alimentício industrializado contendo em seu interior corpo estranho enseja a compensação por dano moral, ainda que não tenha havido a ingestão do produto pelo consumidor, e dá outra providência.",Sim,2019,PL
5905,137963,"Altera as Leis nº 9.099, de 26 de setembro de 1995, e nº 13.105, de 16 de março de 2015, para estabelecer regras para facilitar o acesso e aumentar a efetividade dos juizados especiais cíveis, inclusive para fomentar e proteger os turistas estrangeiros no Brasil.",Sim,2019,PL
5905,137962,"Altera a Lei n° 13.460, de 26 de junho de 2017, que dispõe sobre participação, proteção e defesa dos direitos do usuário dos serviços públicos da administração pública, para aprimorar as formas de resolução de demandas dos usuários de serviço público",Sim,2019,PL
5905,137960,"Altera a Lei nº 8.078, de 11 de setembro de 1990, para incluir, entre as sanções administrativas, a obrigação de dar, fazer ou não fazer.",Sim,2019,PL
5905,138056,"Tramitação conjunta do Projeto de Lei da Câmara nº 168/2017, do Projeto de Lei do Senado nº 518/2018 e dos Projetos de Lei nºs 3.136, 3.314 e 3.476/2019.",Sim,2019,RQS
5905,137935,"Altera os arts. 37 e 87 da Constituição Federal, para disciplinar a vedação do nepotismo na Administração Pública.",Não,2019,PEC
5905,137808,"Encaminha, nos termos do art. 1º, § 2º a § 5º da Resolução do Senado Federal nº 42, de 2016, a indicação do Senhor DANIEL VELOSO COURI, para ocupar o cargo de Diretor da Instituição Fiscal Independente, em razão do término do mandato de Rodrigo Octávio Orair, a acontecer no dia 24 de julho de 2019.",Sim,2019,OFS
5905,137171,"Requeiro, nos termos do art. 93, I, do Regimento Interno do Senado Federal, a realização de audiência pública, com o objetivo de instruir o PL 1829/2019. Proponho para a audiência a presença dos seguintes convidados:
1. Representante do Ministério do Turismo;
2. Representante do Ministério do Economia;
3. Representante da Associação Brasileira de Resorts (ABR)
4. Representante da Associação Brasileira da Indústria de Hotéis Nacional (ABIH)
5. Representante do Fórum de Operadores Hoteleiros do Brasil (FOHB)
6. Representante do Escritório Central de Arrecadação e Distribuição - ECAD
7. Silvana Cambiaghi, arquiteta especialista em acessibilidade e desenho universal
8. Paula Mafra Lavigne, atriz, produtora e empresária do setor cultural;
9. Roberto Frejat, cantor, compositor e guitarrista brasileiro;
10. Nando Reis, baixista, cantor, violonista e compositor brasileiro",Sim,2019,REQ
5905,137125,"Modifica o art. 84 da Constituição Federal, para vedar indulto e comutação de penas nas situações que especifica.",Não,2019,PEC
5905,137699,Altera o Sistema Tributário Nacional e dá outras providências.,Não,2019,PEC
5905,137604,"Requer, nos termos do art. 58, § 2º, II, da Constituição Federal e do art. 93, II, do Regimento Interno do Senado Federal, a realização de audiência pública, com o objetivo de debater a inflação dos planos de saúde no período entre os anos de 2000 e 2018. Propõe para a audiência a presença dos seguintes convidados: 1. Sra. Ana Carolina Navarrete - IDEC - Instituto Brasileiro de Defesa do Consumidor 2. Sr. Carlos Octávio Ocké-Reis - IPEA - Instituto de Pesquisa Econômica Aplicada 3. Representante da ANS - Agência Nacional de Saúde Suplementar 4. Representante da FenaSaúde - Federação Nacional de Saúde Suplementar.",Sim,2019,REQ
5905,137466,"Requer, nos termos do art. 58, § 2º, II, da Constituição Federal e do art.93, II, do Regimento Interno do Senado Federal, a realização de audiência pública, com o objetivo de discutir o tema: Swap cambial - Rentabilidade ou prejuízos para o País? - Seus impactos para o crescimento da dívida pública interna federal.",Não,2019,REQ
5905,137612,"Realização de sessão especial, em 23 de setembro próximo, destinada a celebrar os 110 anos do Ensino Técnico e Profissionalizante no Brasil.",Não,2019,RQS
5905,137393,"Requer, nos termos do art. 93, I, do Regimento Interno do Senado Federal, a realização de audiência pública, com o objetivo de instruir o PLC159/2017, que altera a Lei nº 9.503, de 23 de setembro de 1997 (Código de Trânsito Brasileiro), para incluir entre os equipamentos obrigatórios dos veículos extintor de incêndio com carga de pó ABC.",Não,2019,REQ
5905,137135,"Requer, nos termos do art. 58, § 2º, II, da Constituição Federal e do art. 93, II, do Regimento Interno do Senado Federal, que na Audiência Pública objeto do REQ 33/2019 - CTFC, seja incluído tambem os representantes das entidades sindicais legítimas das categorias de Transportes de Valores e Trabalhadores da Segurança Privada. Propõe para a audiência a inclusão dos seguintes convidados: 1. Sr. Ruben Schechter - Vice-Presidente Executivo da Federação Nacional das Empresas de Transportes de Valores - FENAVAL e 2. Sr. João Soares - Presidente da Confederação Nacional dos Trabalhadores de Segurança Privada - CONTRASP.",Não,2019,REQ
5905,137254,"Autorização para desempenho de missão parlamentar, a fim de participar da LXIV Sessão Ordinária do Parlamento do Mercosul, em Montevidéu, Uruguai.",Sim,2019,RQS
5905,137733,"Requer aditamento à lista de convidados da audiência pública para instruir o PLC 80/2018 que altera a Lei nº 8.906, de 4 de julho de 1994, que “Dispõe sobre o Estatuto da Advocacia e a Ordem dos Advogados do Brasil (OAB)”, para estabelecer a obrigatoriedade da participação do advogado na solução consensual de conflitos.",Sim,2019,REQ
5905,137534,Requer a retirada do RQS 469/2019,Sim,2019,RQS
5905,137357,"Altera o art. 159 da Lei nº 9.503, de 23 de setembro de 1997 (Código de Trânsito Brasileiro), para incluir na Carteira Nacional de Habilitação as informações sobre o tipo sanguíneo e fator Rh do condutor e sobre a sua condição de doador ou não doador de órgãos e tecidos.",Sim,2019,PL
5905,137354,"Garante a livre associação dos estudantes da educação básica e do ensino superior, em Organizações de Representação Estudantil.",Sim,2019,PL
5905,137351,"Altera a Lei nº 8.078, de 11 de setembro de 1990, para instituir multa diária em caso de não realização da contrapropaganda.",Sim,2019,PL
5905,137358,"Acrescenta o art. 31-A à Lei nº 8.987, de 13 de fevereiro de 1995, para determinar que as concessionárias de serviços públicos ofereçam aos seus usuários a opção de inclusão, nas faturas para cobrança, de nome de cônjuge, companheiro ou outra pessoa, para efeito de comprovação de residência.",Sim,2019,PL
5905,137352,"Estabelece a obrigatoriedade de realização de processo seletivo para a contratação, pelos órgãos e entidades da administração direta dos Poderes da União, de estagiários remunerados.",Sim,2019,PL
5905,137705,"Autorização para desempenho de missão parlamentar, a fim de participar da LXV Sessão Ordinária do Parlamento do Mercosul, em Montevidéu, no Uruguai.",Sim,2019,RQS
5905,137605,"Requer, nos termos do art. 93, I, do Regimento Interno do Senado Federal, a realização de audiência pública, com o objetivo de instruir o PLS 175/2015. Propõe para a audiência a presença dos seguintes convidados: 1. Daniele Correa Cardoso - Coordenadora da Coordenação-Geral do Sistema Nacional de Informações de Defesa do Consumidor da Secretaria Nacional do Consumidor; 2. Paulo Luiz Neto Lôbo - Professor da UFAL; 3. Representante da CNSEG - Confederação Nacional das Empresas de Seguros Gerais, Previdência Privada e Vida, Saúde Suplementar e Capitalização; 4. Representante da ABINEE - Associação Brasileira da Indústria
Elétrica e Eletrônica.",Sim,2019,REQ
5905,137048,"Requer, nos termos do art. 93, I, do Regimento Interno do Senado Federal, a realização de audiência pública, com o objetivo de instruir o SCD 6/2016, que institui o Estatuto da Segurança Privada e da Segurança das Instituições Financeiras; altera as Leis nºs 10.826, de 22 de dezembro de 2003, 10.446, de 8 de maio de 2002, 10.637, de 30 de dezembro de 2002, 10.833, de 29 de dezembro de 2003, e o Decreto-Lei nº 2.848, de 7 de dezembro de 1940 – Código Penal; revoga as Leis nºs 7.102, de 20 de junho de 1983, e 8.863, de 28 de março de 1994, e dispositivos das Leis nºs 11.718, de 20 de junho de 2008, e 9.017, de 30 de março de 1995, e da Medida Provisória nº 2.184-23, de 24 de agosto de 2001; e dá outras providências.",Não,2019,REQ
5905,137305,Prorroga o prazo de vigência do regime especial de pagamento de precatórios previsto no art. 101 do Ato das Disposições Constitucionais Transitórias e dá outras providências.,Não,2019,PEC
5905,137695,"Acrescenta § 4º ao art. 102 da Constituição Federal, para estabelecer a necessidade de demonstração da existência de controvérsia constitucional relevante e atual como condição de admissibilidade da ação direta de inconstitucionalidade e da ação declaratória de constitucionalidade.",Não,2019,PEC
5905,136775,"Altera o inciso XLII do art. 5º da Constituição Federal, para tornar imprescritível o crime de feminicídio.",Não,2019,PEC
5905,137066,"Altera o art. 144 da Constituição Federal, para prever a realização de exame toxicológico por todos os servidores da área de segurança pública.",Não,2019,PEC
5905,137044,Dispõe sobre a atualização monetária dos repasses de recursos federais aos Municípios.,Não,2019,PEC
5905,136615,Autorização para desempenho de missão no exterior no período de 12 a 16 de maio de 2019.,Sim,2019,RQS
5905,136896,Institui a Frente Parlamentar dos Senadores dos Estados do Norte e do Nordeste.,Não,2019,PRS
5905,136938,"Modifica a Constituição Federal, para permitir a delegação aos Estados da competência da União para explorar portos, aeroportos, ferrovias e energia elétrica; e altera o sistema de repartição de receitas tributárias.",Não,2019,PEC
5905,136732,"Acrescenta § 13 ao art. 37 e dá nova redação ao inciso II do § 3º do art. 142, ambos da Constituição Federal, para detalhar hipóteses de acumulação de cargos dos servidores civis que menciona, assim como dos militares das forças armadas e dos militares dos Estados, do Distrito Federal e dos Territórios.",Não,2019,PEC
5905,136913,"Modifica os arts. 93, 97 e 102 da Constituição Federal, para disciplinar os pedidos de vista nos tribunais e dispor sobre a declaração de inconstitucionalidade e a concessão de cautelares por tribunais.",Não,2019,PEC
5905,136917,Realização de Sessão de Debates Temáticos destinada a debater a democracia no Brasil.,Não,2019,RQS
5905,136515,"Requer, nos termos do art. 58, § 2º, II, da Constituição Federal e do art. 93, II, do Regimento Interno do Senado Federal, a realização de audiência pública, com o objetivo de discutir a situação de vazamento de dados do INSS e as práticas abusivas de instituições financeiras na oferta de empréstimos consignados a aposentados e beneficiários do INSS.",Sim,2019,REQ
5905,136296,"Altera o art. 73 da Constituição Federal, para disciplinar a escolha dos Ministros do Tribunal de Contas da União.",Não,2019,PEC
5905,136182,"Requer, nos termos do art. 96-B do Regimento Interno do Senado Federal, que a Comissão de Educação, Cultura e Esporte avalie o Programa Brasil
Alfabetizado; o Programa Nacional de Acesso ao Ensino Técnico e Emprego
(Pronatec), a Bolsa Formação, FIES, Prouni, Programas e projetos relativos à primeira infância; o Bolsa Atleta, a Lei de Incentivo ao Esporte, Programas e projetos relativos ao desporto universitário; Programa do Artesanato Brasileiro, Programa Nacional de Incentivo à Leitura, Programa Nacional Biblioteca da Escola (PNBE), Programa de Apoio ao Desenvolvimento do Audiovisual Brasileiro (PRODAV), programas e projetos relativos ao audiovisual, no exercício de 2019.",Sim,2019,REQ
5905,136326,"Requer, nos termos do art. 58, § 2º, II, da Constituição Federal e do art. 93, II, do Regimento Interno do Senado Federal, que na Audiência Pública objeto do RQS 19/2019, sejam incluídos os seguintes convidados: 1. Representante da Presidência de Governo da Caixa Econômica Federal (VIGOV); 2. Representante da Câmara Brasileira da Indústria da Construção (CBIC).",Sim,2019,REQ
5905,136065,"Requer, nos termos do art. 93, I, do Regimento Interno do Senado Federal, a realização de audiência pública, com o objetivo de instruir o PLS
215/2017, que obriga que os produtos cosméticos e alimentícios comercializados que possuem substâncias comprovadamente cancerígenas informem o risco de desenvolvimento da doença em suas embalagens. Proponho para a audiência a presença dos seguintes convidados:
1. Representante da Associação Brasileira da Indústria de Higiene Pessoal e Cosméticos (ABIHPEC);
2. Representante da Associação Brasileira da Indústria de Alimentos (ABIA);
3. Representante da Agência Nacional de Vigilância Sanitária (ANVISA).",Não,2019,REQ
5905,136230,Desarquivamento dos PLC 116/2014 e PLC 52/2013.,Não,2019,RQS
5905,137054,"Oitiva da Comissão de Transparência, Governança, Fiscalização e Controle e Defesa do Consumidor sobre o Projeto de Lei nº 41, de 2019 - Complementar.",Sim,2019,RQS
5905,136167,"Altera o art. 62 da Constituição Federal, para dispor sobre o rito legislativo das Medidas Provisórias e dá outras providências.",Não,2019,PEC
5905,136476,"Altera a redação do § 2o do art. 1.584 da Lei no 10.406, de 10 de janeiro de 2002 (Código Civil) e acrescenta o art. 699-A à Lei no 13.105, de 16 de março de 2015 (Código de Processo Civil), para estabelecer o risco de violência doméstica ou familiar como causa impeditiva ao exercício da guarda compartilhada, bem como para impor ao juiz o dever de indagar previamente o Ministério Público e as partes sobre situações de violência doméstica ou familiar, envolvendo o casal ou os filhos.",Sim,2019,PL
5905,135874,"Requer, nos termos do art. 102-B do Regimento Interno do Senado Federal, que esta Comissão de Transparência, Governança, Fiscalização e Controle
e Defesa do Consumidor (CTFC), formule consulta ao Tribunal de Contas da União, na pessoa do Exmo. Ministro Raimundo Carreiro, relator do processo nº TC 008.036/2017-9, sobre possíveis soluções para a continuidade da obra de construção
da Unidade Acadêmica do Cabo de Santo Agostinho, em especial sobre a possibilidade de utilização dos recursos orçamentários no montante de R$ 80.351.936,48, que se encontram empenhados na condição de Restos a Pagar não
Processados, para a realização de nova licitação com vistas à conclusão da obra.",Não,2019,REQ
5905,136325,"Requer, nos termos do art. 58, § 2º, II, da Constituição Federal e do art. 93, II, do Regimento Interno do Senado Federal, que na Audiência Pública objeto do RQS 20/2019, sejam incluídos os seguintes convidados: 1. Dr. Igor Brito – Advogado do Instituto Brasileiro de Defesa do Consumidor (IDEC); 2. Representante da Sociedade Brasileira de Oncologia Clínica (SBOC); 3. Representante do Instituto Nacional de Câncer José Alencar Gomes da Silva (INCA).",Sim,2019,REQ
5905,136456,Autorização para desempenho de missão no exterior no período de 26/04/2019 a 30/04/2019.,Sim,2019,RQS
5905,135904,Desarquivamento do Projeto de Lei da Câmara nº 34/2013.,Não,2019,RQS
5905,135745,"Requer, nos termos do art. 58, § 2º, II, da Constituição Federal e do art. 93, II, do Regimento Interno do Senado Federal, que na Audiência Pública objeto do REQ 5/2019 - CTFC, seja incluído o convidado Geraldo Vasconcelos de Castro Junior, da organização S.O.S Pinheiro.",Sim,2019,REQ
5905,136045,"Requer, nos termos do art. 58, § 2º, II, da Constituição Federal e do art. 93, II, do Regimento Interno do Senado Federal, a realização de audiência pública, com o objetivo de discutir acerca das obras não iniciadas, paralisadas e atrasadas de creches e pré-escolas no país, em ciclo de encontros denominado Diálogos de Transparência - Monitoramento de obras de creches e pré-escolas públicas.",Sim,2019,REQ
5905,136033,"Altera o Decreto-Lei nº 2.848, de 7 de dezembro de 1940 - Código Penal, o Decreto-Lei nº 3.689, de 3 de outubro de 1941 - Código de Processo Penal, a Lei nº 7.210, de 11 de julho de 1984 - Lei de Execução Penal, a Lei nº 8.072, de 25 de julho de 1990, a Lei nº 8.429, de 2 de junho de 1992, a Lei nº 9.296, de 24 de julho de 1996, a Lei nº 9.613, de 3 de março de 1998, a Lei nº 10.826, de 22 de dezembro de 2003, a Lei nº 11.343, de 23 de agosto de 2006, a Lei nº 11.671, de 8 de maio de 2008, a Lei nº 12.037, de 1º de outubro de 2009, a Lei nº 12.850, de 2 de agosto de 2013, e a Lei nº 13.608, de 10 de janeiro de 2018, para estabelecer medidas contra a corrupção, o crime organizado e os crimes praticados com grave violência a pessoa.",Não,2019,PL
5905,136028,"Altera a Lei nº 4.737, de 15 de julho de 1965 - Código Eleitoral, para criminalizar o uso de caixa dois em eleições.",Não,2019,PL
5905,135769,"Requer, nos termos do art. 58, § 2º, II, da Constituição Federal e do art. 93, II, do Regimento Interno do Senado Federal, que seja incluído como convidado o Sr.Maurício Mendes, como representante da organização NUDEC, na Audiência Pública objeto do REQ 5/2019 – CTFC, que visa a debater a situação enfrentada pelo bairro do Pinheiro e adjacências, no município de Maceió, Alagoas, que, ainda por causa desconhecida, está sofrendo abalos e danos que têm motivado a desocupação da área pelos moradores.",Sim,2019,REQ
5905,135767,Desarquivamento do PLC 72/2012.,Não,2019,RQS
5905,136034,"Altera o Decreto-Lei nº 3.689, de 3 de outubro de 1941 - Código de Processo Penal, e a Lei nº 4.737, de 15 de julho de 1965 - Código Eleitoral, para estabelecer regras de competência da Justiça Comum e da Justiça Eleitoral.",Não,2019,PLP
5905,135855,"Altera a Lei nº 9.709, de 18 de novembro de 1998, que regulamenta a execução do disposto nos incisos I, II e III do art. 14 da Constituição Federal, para possibilitar a assinatura eletrônica de projetos de lei de iniciativa popular pelos cidadãos brasileiros.",Sim,2019,PL
5905,135676,"Requer, nos termos do art. 58, § 2º, incisos II e V, da Constituição Federal, e dos arts. 90, II, e 93, II, do Regimento Interno do Senado Federal, aditamento ao Requerimento nº 09, de 2019, que trata da realização de audiência pública para “discutir a situação dos alunos que concluíram curso superior em instituições de ensino a distância irregulares e, portanto, não fazem jus a obter registros em seus diplomas de conclusão de curso”, visando a inclusão, como convidados, da Sra. Elizabeth Guedes – Representante da Associação Nacional das Universidades Particulares – ANUP, e do Sr. Ricardo Holz – Representante da Associação Brasileira dos Estudantes de Educação a Distância – ABE-EAD.",Não,2019,REQ
5905,136024,Desarquivamento dos PLS 86/2014 e PLS 324/2014.,Não,2019,RQS
5905,135755,"Requer, nos termos do art. 58, § 2º, II, da Constituição Federal e do art. 93, II, do Regimento Interno do Senado Federal, que na Audiência Pública objeto do RQS 9/2019, que trata da realização de audiência pública para “discutir a situação dos alunos que concluíram curso superior em instituições de ensino a distância irregulares e, portanto, não fazem jus a obter registros em seus diplomas de conclusão de curso”, visando a inclusão, como convidados Sr. Carlos Eduardo Lima Rocha de Oliveira, Conselho Regional de Educação Física de Alagoas.",Sim,2019,REQ
5905,135908,"Requer, nos termos do art. 58, § 2º, II, da Constituição Federal e do art. 93, II, do Regimento Interno do Senado Federal, que na Audiência Pública objeto do REQ 9/2019, seja incluído o seguinte convidado: Deputado Estadual de Alagoas Marcelo Beltrão.",Sim,2019,REQ
5905,135881,"Requer, nos termos do art. 90, inciso XIII e art. 142 do Regimento Interno do Senado Federal, a realização de diligência externa, com a presença de membros da Comissão de Transparência, Governança, Fiscalização e Controle e Defesa do Consumidor, no bairro do Pinheiro e adjacências, no município de Maceió, Alagoas, com o objetivo de, em data oportuna, verificar in loco a área, acompanhar as atividades em curso e checar o andamento das ações a cargo do poder público, tendo em vista que, por causas ainda desconhecidas, estão ocorrendo, no local, abalos, fissuras e afundamentos em imóveis e vias públicas, situação que tem motivado a desocupação da área pelos moradores e empreendedores.",Sim,2019,REQ
5905,135883,"Modifica o art. 121 da Constituição Federal, para estabelecer a separação de processos, nos casos de crimes eleitorais conexos com crimes comuns.",Não,2019,PEC
5905,135721,"Altera o art. 144 da Constituição Federal, para incluir a Força Nacional de Segurança Pública dentre os órgãos de segurança pública.",Não,2019,PEC
5905,135539,Desarquivamento do PLS 249/2013.,Não,2019,RQS
5905,135504,Altera a Constituição Federal para autorizar a União a reter recursos do Fundo de Participação dos Estados e do Distrito Federal e transferi-los aos Municípios na hipótese de ausência de repasse do Imposto sobre Operações relativas à Circulação de Mercadorias e sobre Prestação de Serviços de Transporte Interestadual e Intermunicipal e de Comunicação (ICMS) e do Imposto sobre Propriedade de Veículos Automotores (IPVA).,Não,2019,PEC
5905,135380,Desarquivamento do PLC 13/2013,Não,2019,RQS
5905,135610,"Altera os arts. 115 e 131 Regimento Interno para exigir que constem, das atas das reuniões de comissões, as contribuições recebidas de cidadãos e entidades da sociedade civil em audiência pública e, dos relatórios das proposições nas Comissões, referência às contribuições recebidas por meio dos canais de participação popular abertos na Casa e a opinião do relator sobre a conveniência de sua incorporação ou rejeição.",Sim,2019,PRS
5905,135391,Acrescenta o inciso IX ao art. 200 da Constituição Federal.,Não,2019,PEC
