codigoParlamentar,CodigoMateria,Ementa,IndicadorAutorPrincipal,AnoMateria,AutoriasSigla
5732,136274,Calendário Especial para tramitação da PEC 61/2015.,Sim,2019,RQS
5732,144024,"Destaque para votação em separado, da expressão “destinados à educação e à saúde, nos termos do artigo 2º. da Lei 12.858, de 9 de setembro de 2013”, do PL nº 3975/2019 (ECD).",Sim,2020,RQS
5732,143407,"Destaque para votação em separado da Emenda nº 8-PLEN, apresentada ao PLP nº 9/2020.",Sim,2020,RQS
5732,142001,"Destaque para votação em separado da Emenda nº 10-PLEN, oferecida ao PL 2324/2020.",Sim,2020,RQS
5732,141772,"Destaque para votação em separado, do inciso IV, do § 1º, do art. 65, da Lei Complementar nº 101, de 2000,constante do art. 7º, com a redação dada pelo Substitutivo apresentado ao Projeto de Lei Complementar nº 149, de 2019.",Sim,2020,RQS
5732,140909,Urgência para o PL 6395/2019,Não,2020,RQS
5732,140207,"Calendário especial para a Proposta de Emenda à Constituição nº 48, de 2019.",Não,2019,RQS
5732,139990,Urgência para o Projeto de Lei nº 6176/2019 (Substitutivo-CD).,Não,2019,RQS
5732,139629,Urgência para o PL 1615/2019.,Não,2019,RQS
5732,139726,"Calendário Especial para a Proposta de Emenda à Constituição nº 75, de 2019.",Não,2019,RQS
5732,139291,"Calendário especial para a Proposta de Emenda à Constituição nº 95, de 2019.",Não,2019,RQS
5732,139287,Urgência para o PDL 28/2019.,Não,2019,RQS
5732,138505,"Urgência para o Projeto de Resolução nº 75, de 2019.",Não,2019,RQS
5732,137126,Urgência para o Projeto de Lei nº 3261/2019.,Não,2019,RQS
5732,137162,Urgência para o PLS 26/2014-Complementar,Não,2019,RQS
5732,136607,Urgência para o PLS 163/2018-Complementar.,Não,2019,RQS
5732,136668,Urgência para o Projeto de Decreto Legislativo nº 219/2019.,Não,2019,RQS
5732,137071,"Calendário Especial para a PEC nº 51, de 2019.",Não,2019,RQS
5732,136257,Urgência para o PL 1321/2019.,Não,2019,RQS
5732,135667,"Realização de sessão de debates temáticos, no mês de abril, destinada a debater os problemas do sistema penitenciário brasileiro e apresentar possíveis soluções.",Não,2019,RQS
5732,126775,"Requer, nos termos do art. 132-A, da Resolução nº 01/2006, do Congresso Nacional, destaque para votação em separado da Emenda nº 37510012, apresentada ao PLN 2, de 2016 - LDO.",Sim,2016,RQN
5732,164599,"Institui o Programa de Pleno Pagamento de Dívidas dos Estados (Propag), destinado a promover a revisão dos termos das dívidas dos Estados e do Distrito Federal com a União firmadas no âmbito da Lei nº 9.496, de 11 de setembro de 1997, e das Leis Complementares nos 159, de 19 de maio de 2017, 178, de 13 de janeiro de 2021, e 201, de 24 de outubro de 2023 e prevê instituição de fundo de equalização federativa.",Sim,2024,PLP
5732,164392,"Requer licença para desempenhar missão política ou cultural de interesse parlamentar, nos termos dos arts. 13 e 215, I, “b”, do Regimento Interno do Senado Federal.",Sim,2024,REQ
5732,163378,Requer realização de Sessão de Debates Temáticos destinada a discutir a atual situação financeiro-orçamentária dos Municípios brasileiros. ,Sim,2024,RQS
5732,163999,Institui Comissão de Juristas responsável pela elaboração de anteprojeto de Lei do Processo Estrutural no Brasil.,Sim,2024,ATS
5732,164427,"Requeiro, nos termos dos arts. 13 e 215, I, “b”, do Regimento Interno do Senado Federal, em face do que dispõe o art. 55, III, da Constituição Federal, licença para desempenhar missão política ou cultural de interesse parlamentar, sem ônus para o Senado Federal, em Brasília, DF, de 03/07/2024 a 04/07/2024, a fim de cumprir agenda como Presidente do Senado Federal na Residência Oficial.",Sim,2024,REQ
5732,162369,Requer a realização de Sessão Especial destinada a celebrar os 200 anos de criação do Senado Federal brasileiro.,Sim,2024,RQS
5732,162126,Sessão Solene destinada a comemorar os 35 anos da criação e instalação do Superior Tribunal de Justiça.,Sim,2024,REQ
5732,163350,"Requer inserção em ata de Monção de apoio à Senadora Mara Gabrilli, pela candidatura ao Comitê sobre os Direitos das Pessoas com Deficiência da ONU (CRPD), nos termos do art. 222 do Regimento Interno do Senado Federal.",Não,2024,RQS
5732,162979,Requer realização de Sessão de Debates Temáticos destinada a discutir o anteprojeto elaborado pela Comissão de Juristas responsável pela revisão e atualização do Código Civil. ,Sim,2024,RQS
5732,163297,"Requeiro, s dos arts. 13 e 215, I, “b”, do Regimento Interno do Senado Federal, em face do que dispõe o art. 55, III, da Constituição Federal, licença para desempenhar missão política ou cultural de interesse parlamentar, sem ônus para o Senado Federal, em Brasília, DF, em 24/04/2024, a fim de cumprir agenda como Presidente do Senado Federal na Residência Oficial.",Sim,2024,REQ
5732,163288,Requer a realização de Sessão Especial destinada a celebrar o aniversário de 40 anos da criação da Associação Nacional das Defensoras e dos Defensores Públicos – ANADEP.,Sim,2024,RQS
5732,163381,Institui Comissão Temporária Externa com a finalidade de acompanhar as atividades relativas ao enfrentamento da calamidade ocasionada pelas fortes chuvas que atingiram o Rio Grande do Sul e de apresentar medidas legislativas para auxiliar na superação da situação.,Sim,2024,ATS
5732,162276,"Requeiro, nos termos dos arts. 13 e 40 do Regimento Interno do Senado Federal, em face do que dispõe o art. 55, III, da Constituição Federal, licença para exercer representação a serviço da Casa, sem ônus para o Senado Federal, em Buenos Aires, na Argentina, de 29/02/2024 a 02/03/2024, a fim de participar de encontro na Faculdade de Direito e Ciências Sociais da Universidade Nacional de Buenos Aires sobre a Atualização do Código Civil Brasileiro em Diálogo com o Novo Código Civil Argentino, a convite do Instituto Justiça e Cidadania e da RevistaJustiça & Cidadania",Sim,2024,REQ
5732,162275,"Requeiro, nos termos dos arts. 13 e 215, I, “b”, do Regimento Interno do Senado Federal, em face do que dispõe o art. 55, III, da Constituição Federal, licença para desempenhar missão política ou cultural de interesse parlamentar, sem ônus para o Senado Federal, em Brasília, DF, em 27/02/2024, a fim de cumprir agenda como Presidente do Senado Federal na Residência Oficial.",Sim,2024,REQ
5732,163908,Requer a realização de sessão a fim de comemorar os 150 anos da criação do Tribunal de Justiça de Minas Gerais.,Sim,2024,REQ
5732,163557,Requer a realização de Sessão Especial destinada a realizar a Abertura Oficial da 5ª Semana dos Técnicos Industriais.,Sim,2024,RQS
5732,163811,"Requeiro, nos termos dos arts. 13 e 215, I, “b”, do Regimento Interno do Senado Federal, em face do que dispõe o art. 55, III, da Constituição Federal, licença para desempenhar missão política ou cultural de interesse parlamentar, sem ônus para o Senado Federal, em Brasília, DF, em 22/05/2024, a fim de cumprir agenda como Presidente do Senado Federal na Residência Oficial.",Sim,2024,REQ
5732,161820,Altera o art. 155 da Constituição Federal para conceder imunidade do Imposto sobre a Propriedade de Veículos Automotores a veículos terrestres de passageiros com vinte anos ou mais de fabricação.,Não,2023,PEC
5732,161867,"Requer licença para desempenhar missão política ou cultural de interesse parlamentar, sem ônus para o Senado Federal, em Zurique, na Suíça, de 17/01/2024 a 22/01/2024, a fim de participar do Brazil Economic Forum Zurich – LIDE.",Sim,2024,REQ
5732,161301,"Requer licença para desempenhar missão oficial, a fim de participar da 28ª Conferência das Partes das Nações Unidas sobre Mudança Climática (COP 28), em Dubai, Emirados Árabes Unidos.",Sim,2023,REQ
5732,160540,"Requer realização de Sessão de Debates Temáticos destinada a discutir a Proposta de Emenda à Constituição nº 8, de 2021.
(Sessão de Debates Temáticos realizada em 19/10/2023)",Sim,2023,RQS
5732,160258,"Requer que sejam prestadas, pelo Exmº. Sr. Ministro de Estado da Fazenda, Fernando Haddad, informações detalhadas e específicas sobre os países com tributação favorecida ou regimes fiscais privilegiados (paraísos fiscais) sob a ótica da Receita Federal do Brasil (RFB).",Sim,2023,RQS
5732,160378,"Requer licença para desempenhar missão oficial, a fim de participar da Inauguração da Casa da Cidadania da Língua, em Coimbra, Portugal, e do Fórum Internacional Esfera, em Paris, França.",Sim,2023,REQ
5732,160285,"Requer, nos termos do inciso IV e § 7º do art. 154 do Regimento Interno do Senado Federal, a realização de Sessão de Debates Temáticos, no dia 20/10/2023, a fim de debater políticas de combate à fome, de garantia da segurança alimentar e de redução do desperdício de alimentos.",Sim,2023,RQS
5732,159986,"Requer licença para desempenhar missão oficial, em Nova Iorque, EUA, com ônus para o Senado Federal.",Sim,2023,REQ
5732,160011,"Altera o art. 5º da Constituição Federal, para prever como mandado de criminalização a posse e o porte de entorpecentes e drogas afins sem autorização ou em desacordo com determinação legal ou regulamentar.",Sim,2023,PEC
5732,160140,"Requer que sejam prestadas, pelo Exmo. Sr. Ministro de Estado da Agricultura e Pecuária, Carlos Fávaro, informações sobre o andamento das ações e programas do Ministério para incentivo de aprimoramento genético do rebanho leiteiro tropical nacional, notadamente de pequenos e médios produtores, com a utilização de raças adaptadas à produção leiteira sustentável nos trópicos, como é o caso do Programa Nacional de Melhoramento do Gir Leiteiro (PNMGL).",Sim,2023,RQS
5732,159907,"Reconhece, para os fins do art. 65, § 1º, da Lei Complementar nº 101, de 4 de maio de 2000, a ocorrência do estado de calamidade pública no território do Estado do Rio Grande do Sul em decorrência dos eventos climáticos de chuvas intensas.",Sim,2023,PDL
5732,159159,"Requer criação de Comissão Temporária Interna, para examinar os projetos concernentes ao relatório final aprovado pela Comissão de Juristas sobre Inteligência Artificial.",Sim,2023,RQS
5732,159067,Requerimento de missão política ou cultural de interesse parlamentar para o dia 09 de agosto de 2023.,Sim,2023,REQ
5732,158464,"Requer licença para desempenhar missão oficial, em Lisboa, Portugal, com ônus para o Senado Federal.",Sim,2023,REQ
5732,158582,"Requer a realização de sessão de debates temáticos, a fim de debater o conteúdo e os reflexos na sociedade brasileira do Projeto de Lei nº 798, de 2021, que ""concede novo prazo para adesão ao Regime Especial de Regularização Cambial e Tributária (RERCT) e dispõe sobre a interpretação do § 12 do art. 4º da Lei nº 13.254, de 13 de janeiro de 2016"".",Sim,2023,RQS
5732,158031,"Altera e acrescenta dispositivos à Lei nº 14.193, de 6 de agosto de 2021, a fim de aperfeiçoar a governança das Sociedades Anônimas do Futebol, resguardar os investidores e preservar os direitos dos clubes, dos profissionais do futebol e dos atletas em formação.",Sim,2023,PL
5732,157458,"Requeiro, nos termos do disposto nos arts. 71 e 74, inciso I, do Regimento Interno do Senado Federal, a instituição de Comissão Temporária Interna, composta por nove membros titulares e igual número de suplentes, para, no prazo de até noventa dias, examinar e, se assim se entender, consolidar os anteprojetos apresentados no âmbito da Comissão de Juristas responsável pela elaboração de anteprojetos de proposições legislativas que dinamizem, unifiquem e modernizem o processo administrativo e tributário nacional – CJADMTR, instalada em 17 de março de 2022, tendo seu relatório final aprovado em 6 de setembro de 2022.",Sim,2023,RQS
5732,157494,Sessão Solene destinada a celebrar os 150 anos do nascimento de Alberto Santos Dumont.,Sim,2023,REQ
5732,157233,Dispõe sobre o uso da Inteligência Artificial.,Sim,2023,PL
5732,157592,"Requer licença para desempenhar missão oficial, na Grécia, com ônus para o Senado Federal.",Sim,2023,REQ
5732,156979,"Requer licença para desempenhar missão oficial, em Londres, Reino Unido, com ônus para o Senado Federal.",Sim,2023,REQ
5732,156744,Requerimento de missão com ônus para o Senado Federal.,Sim,2023,REQ
5732,156562,Desarquivamento do PLC nº 80/2018.,Não,2023,RQS
5732,156424,Altera a Constituição Federal para instituir a parcela mensal de valorização por tempo de exercício dos magistrados e membros do Ministério Público.,Sim,2023,PEC
5732,156460,Dispõe sobre crimes de responsabilidade e disciplina o respectivo processo e julgamento.,Sim,2023,PL
5732,156249,"Institui Comissão Especial destinada a debater políticas públicas sobre hidrogênio verde, de modo a fomentar o ganho em escala dessa tecnologia de geração de energia limpa.",Sim,2023,ATS
5732,156092,"Requeiro, nos termos do art. 332, § 1º, do Regimento Interno do Senado Federal, o desarquivamento do PLC 29/2017, que “dispõe sobre normas de seguro privado; revoga dispositivos da Lei nº 10.406, de 10 de janeiro de 2002 (Código Civil);e dá outras providências”",Sim,2023,RQS
5732,155325,Requerimento de justificativa de ausência,Sim,2022,REQ
5732,155414,"Denomina ""Academia Pedro Ricardo Araujo Carvalho"" a academia de treinamento dos servidores da Polícia Legislativa do Senado Federal.",Sim,2022,PRS
5732,155602,"Requeiro, nos termos dos arts. 13 e 215, I, “b”, do Regimento Interno do Senado Federal, em face do que dispõe o art. 55, III, da Constituição Federal, licença para desempenhar missão política ou cultural de interesse parlamentar, sem ônus para o Senado Federal, em Brasília, DF, de 13/12/2022 a 14/12/2022, a fim de cumprir agenda da Presidência do Senado Federal na Residência Oficial.",Sim,2022,REQ
5732,155007,"Requeiro, nos termos dos arts. 13 e 215, I, “b”, do Regimento Interno do Senado Federal, em face do que dispõe o art. 55, III, da Constituição Federal, licença para desempenhar missão política ou cultural de interesse parlamentar, sem ônus para o Senado Federal, em Brasília, DF, em 06/10/2022, a fim de cumprir agenda da Presidência do Senado Federal na Residência Oficial.",Sim,2022,REQ
5732,154741,Dispõe sobre a arbitragem em matéria tributária e aduaneira.,Sim,2022,PL
5732,154740,Dispõe sobre a mediação tributária na União e dá outras providências.,Sim,2022,PL
5732,154739,Dispõe sobre o processo de consulta quanto à aplicação da legislação tributária e aduaneira federal.,Sim,2022,PL
5732,154737,"Estabelece normas gerais relativas a direitos, garantias e deveres dos contribuintes.",Sim,2022,PLP
5732,154734,Sugere ao Poder Executivo Federal que regulamente o regime do conselheiro representante do contribuinte no Conselho Administrativo de Recursos Fiscais - CARF.,Sim,2022,INS
5732,155063,"Requer licença para desempenhar missão no exterior, com ônus para o Senado Federal, em Sharm El-Sheikh, no Egito, de 12/11/2022 a 19/11/2022, a fim de participar da 27ª Conferência da ONU sobre Mudanças Climáticas - COP 27.",Sim,2022,REQ
5732,154736,"Dispõe sobre normas gerais de prevenção de litígio, consensualidade e processo administrativo, em matéria tributária.",Sim,2022,PLP
5732,154744,"Dá nova redação ao art. 11 do Decreto-Lei nº 401, de 30 de dezembro de 1968.",Sim,2022,PL
5732,154743,"Dispõe sobre as custas devidas à União, na Justiça Federal de primeiro e segundo graus e dá outras providências.",Sim,2022,PL
5732,154742,"Dispõe sobre a cobrança da dívida ativa da União, dos Estados, do Distrito Federal, dos Municípios e das respectivas autarquias e fundações de direito público, e dá outras providências.",Sim,2022,PL
5732,154738,Dispõe sobre o processo administrativo tributário federal e dá outras providências.,Sim,2022,PL
5732,154735,Reforma da Lei nº 9.784/99 (Lei de  Processo Administrativo).,Sim,2022,PL
5732,155165,"Submete à apreciação do Senado Federal, nos termos do art. 103-B, inciso XIII, da Constituição Federal, combinado com o art. 6º, § 1º, da Resolução do Senado Federal n° 7, de 2005, o nome do Senhor LUIZ FERNANDO BANDEIRA DE MELLO FILHO, para ser reconduzido ao cargo do Conselho Nacional de Justiça - CNJ, na vaga destinada ao Senado Federal.",Sim,2022,OFS
5732,154592,"Realização de sessão especial, em 19/09/2022, a fim de homenagear a Constelação Familiar.",Não,2022,RQS
5732,154570,"Requer, nos termos do art. 40 do Regimento Interno do Senado Federal, em face do que dispõe o art. 55, III, da Constituição Federal, licença para desempenhar missão no exterior, com ônus para o Senado Federal, em Londres, no Reino Unido, de 31/08/2022 a 05/09/2022, a fim de participar do evento Casa Brasil, a convite do Ministério das Relações Exteriores e da Agência Brasileira de Promoção de Exportações e Investimentos - APEX.",Sim,2022,REQ
5732,154455,"Realização de Sessão de Debates Temáticos, no dia23/08/2022, a fim de debater o PL 2.033/2022, que ""Altera a Lei nº 9.656, de 3 de junho de 1998, que dispõe sobre os planos privados de assistência à saúde, para estabelecer hipóteses de cobertura de exames ou tratamentos de saúde que não estão incluídos no rol de procedimentos e eventos em saúde suplementar."".",Sim,2022,RQS
5732,154666,Sessão de Debates Temáticos sobre o PLC nº 180/2017.,Sim,2022,RQS
5732,154700,"Requeiro, nos termos dos arts. 13 e 215, I, “b”, do Regimento Interno do Senado Federal, em face do que dispõe o art. 55, III, da Constituição Federal, licença para desempenhar missão política ou cultural de interesse parlamentar, sem ônus para o Senado Federal, em Brasília, DF, em 31/08/2022, a fim de cumprir agenda da Presidência do Senado Federal na Residência Oficial.",Sim,2022,REQ
5732,154652,"Requeiro, nos termos dos arts. 13 e 215, I, “b”, do Regimento Interno do Senado Federal, em face do que dispõe o art. 55, III, da Constituição Federal, licença para desempenhar missão política ou cultural de interesse parlamentar, sem ônus para o Senado Federal, em Brasília, DF, em 10/08/2022, a fim de cumprir agenda da Presidência do Senado Federal na Residência Oficial.",Sim,2022,REQ
5732,153427,"Requeiro, nos termos do art. 40 do Regimento Interno do Senado Federal, em face do que dispõe o art. 55, III, da Constituição Federal, licença para desempenhar missão no exterior, com ônus para o Senado Federal, em Lisboa, Portugal, de 23/06/2022 a 28/06/2022, a fim de que possa possa participar dos eventos ""Brasil e Portugal: Perspectivas de Futuro"" e ""X Forum Jurídico de Lisboa: Governança da Ordem Jurídica em Transformação"".",Sim,2022,REQ
5732,153364,"Realização de Sessão Especial, no dia 20/09/2022, a fim de comemorar o cinquentenário da Associação dos Juízes Federais do Brasil - AJUFE.",Sim,2022,RQS
5732,152887,"Acrescenta o art. 879-B à Consolidação das Leis do Trabalho - CLT, aprovada pelo Decreto-Lei nº 5.452, de 1º de maio de 1943, e altera a Lei nº 10.406, de 10 de janeiro de 2002 (Código Civil), para pacificar o entendimento quanto à incidência de correção monetária e juros de mora no ordenamento jurídico pátrio.",Sim,2022,PL
5732,152707,Requerimento de licença saúde.,Sim,2022,REQ
5732,152689,"Autorização para desempenho de missão parlamentar, de 20/04/2022 a 25/04/2022, a fim de participar de visita oficial à cidade de Coimbra, em Portugal, a convite da Câmara Municipal de Coimbra e da Universidade de Coimbra, bem como para receber o Diploma de Honra ao mérito Público, por ocasião da 6ª Edição do World Company Award, na cidade de Monte Carlo, no Principado de Mônaco.",Sim,2022,REQ
5732,152135,"Institui Comissão de Juristas responsável pela elaboração de anteprojeto de lei para atualização da Lei nº 1.079, de 10 de abril de 1950, que define os crimes de responsabilidade e regula o respectivo processo de julgamento.",Sim,2022,ATS
5732,152139,"Institui Comissão de Juristas responsável pela elaboração de anteprojetos de proposições legislativas que dinamizem, unifiquem e modernizem o processo administrativo e tributário nacional.",Sim,2022,ATS
5732,151973,Abertura prazo indicações para o Diploma Bertha Lutz.,Sim,2022,PRM
5732,151880,"Realização de Sessão Especial, a ser realizada em data oportuna, a fim de comemorar os 70 anos de fundação da Rádio Itatiaia.",Sim,2022,RQS
5732,151538,"Informações ao Exmo. Sr. Ministro de Estado de Minas e Energia, sobre as ações do Ministério de Minas e Energia e de suas entidades vinculadas para assegurar, definitivamente, que o nível do reservatório da Usina Hidrelétrica de Furnas não sofra redução para cota inferior a 762 metros.",Sim,2022,RQS
5732,151542,"Informações ao Ministro de Estado do Desenvolvimento Regional, sobre as ações do Ministério de Desenvolvimento Regional e de suas entidades vinculadas para assegurar, definitivamente, que o nível do
reservatório da Usina Hidrelétrica de Furnas não sofra redução para cota inferior a 762 metros.",Sim,2022,RQS
5732,150615,"Autorização para desempenho de missão parlamentar, a fim de participar, em Glasgow, na Escócia e Lisboa, em Portugal, da COP26, bem como dos 25 anos de CPLP e do Fórum de Economia e do IX Fórum Jurídico de Lisboa.",Sim,2021,REQ
5732,150383,"Altera o inciso I do art. 56 da Constituição Federal, para prever que a investidura de parlamentar no cargo de chefe de missão diplomática de caráter permanente não dá ensejo à perda de seu mandato.",Não,2021,PEC
5732,150097,"Requeiro, nos termos do art. 40 do Regimento Interno do Senado Federal, em face do que dispõe o art. 55, III, da Constituição Federal, licença para desempenhar missão no País, com ônus para o Senado Federal, em São Paulo/SP, em 02/09/2021, a fim de cumprir compromisso como Presidente do Senado Federal, conforme agenda em anexo.",Sim,2021,REQ
5732,150098,"Requeiro, nos termos do art. 40 do Regimento Interno do Senado Federal, em face do que dispõe o art. 55, III, da Constituição Federal, licença para desempenhar missão no exterior, com ônus para o Senado Federal, em Roma/Itália, de 05/10/2021 a 11/10/2021, a fim de participar da Sétima Cúpula de Presidentes dos Parlamentos dos Países do G20 (P20), bem como de Reunião Parlamentar PréCOP26, conforme Convite da 7ª Conferência dos Presidentes dos Parlamentos doG20 em anexo. Comunico, nos termos do art. 39, I, do Regimento Interno do Senado Federal, que estarei ausente do País de 05/10/2021 a 11/10/2021, para desempenho desta missão.",Sim,2021,REQ
5732,148939,"Voto de aplauso ao saudoso ITAMAR FRANCO, engenheiro, Prefeito, Senador, Governador, Presidente da República, exemplo de homem público, pelo transcurso do aniversário de 91 anos do seu nascimento, em 28 de junho de 2021.",Sim,2021,RQS
5732,148012,"Restabelece a vigência da Lei nº 13.979, de 5 de fevereiro de 2020.",Sim,2021,PL
5732,147872,"Altera o art. 268 do Código Penal para criar a qualificadora do crime de infração de medida sanitária preventiva durante a vigência de estado de calamidade pública ou situação de emergência, decretados pela União, Estado ou Município em razão de epidemia.",Sim,2021,PL
5732,147279,"Concede novo prazo para adesão ao Regime Especial de Regularização Cambial e Tributária (RERCT) e dispõe sobre a interpretação do § 12 do art. 4º da Lei nº 13.254, de 13 de janeiro de 2016.",Sim,2021,PL
5732,146696,Dispõe sobre a responsabilidade civil relativa a eventos adversos pós-vacinação contra covid-19 e sobre a aquisição e comercialização de vacinas por pessoas jurídicas de direito privado.,Sim,2021,PL
5732,145552,Adição de assinatura ao RQS nº 2795/2020.,Sim,2020,RQS
5732,145549,"Requer, nos termos dos arts. 50, caput, e 58, § 2º, III, da Constituição Federal e dos arts. 90, III, 397, § 1º e 400-A do Regimento Interno do Senado Federal, a convocação do Sr. Bento Costa Lima Leite de Albuquerque Junior, Ministro das Minas e Energia, para que compareça a esta Comissão, a fim de prestar informações sobre o nível das águas na Represa de Furnas, e os motivos de sua drástica redução no mês de novembro de 2020, inclusive, sobre as providências tomadas em razão dos encaminhamentos compromissados por ocasião da Audiência Pública objeto do REQ nº. 3/2020-CI, realizada em 5 de março de 2020.",Sim,2020,REQ
5732,145551,"Requer, nos termos do art. 58, § 2°, V, da Constituição Federal, que as autoridades elencadas sejam convidadas a comparecer a esta Comissão, a fim de prestar informações sobre o nível das águas na Represa de Furnas, e os motivos de sua drástica redução no mês de novembro de 2020, e sobre as providências tomadas em razão dos encaminhamentos compromissados por ocasião da Audiência Pública objeto do REQ nº. 3/2020-CI, realizada em 5 de março de 2020.",Sim,2020,REQ
5732,145398,"Adição de assinatura à Proposta de Emenda à Constituição nº 13, de 2021.",Sim,2020,RQS
5732,144949,"Reabre o prazo de adesão ao Programa Especial de Regularização Tributária (PERT), de que trata a Lei nº 13.496, de 24 de outubro de 2017, e ajusta os seus prazos e modalidades de pagamento.",Sim,2020,PL
5732,144948,Altera o art. 265 do Código de Processo Penal para extinguir a multa por abandono do processo aplicada sumariamente pelo juiz em desfavor do advogado.,Sim,2020,PL
