codigoParlamentar,CodigoMateria,Ementa,IndicadorAutorPrincipal,AnoMateria,AutoriasSigla
5959,149603,"Audiência da Comissão de Transparência, Governança, Fiscalização e Controle e Defesa do Consumidor sobre o PL 2505/2021.",Sim,2021,RQS
5959,149933,Altera as penas e tipifica como atos terroristas as condutas praticadas em nome ou em favor de grupos criminosos organizados.,Sim,2021,PL
5959,149873,"Requer, nos termos dos arts. 50, caput, e 58, § 2º, III, da Constituição Federal e dos arts. 90, III, 397, § 1º e 400-A do Regimento Interno do Senado Federal, a convocação do Exmo. Sr. Rogério Marinho, Ministro do Desenvolvimento Regional, para que compareça a esta Comissão, a fim de prestar informações sobre matéria veiculada no jornal Estado de São Paulo, datada de 20 de setembro de 2021, cujo conteúdo revela que o Ministro Rogério Marinho direcionou R$ 1,4 milhão do chamado orçamento secreto, alocado no Ministério do Turismo, para a obra de um mirante turístico que será construído a 300 metros de um terreno de sua propriedade no município de Monte das Gameleiras, no Estado do Rio Grande do Norte.",Sim,2021,REQ
5959,149458,"Realização de Sessão de Debates Temáticos a fim de discutir o Projeto de Lei nº 1.869, de 2021.",Não,2021,RQS
5959,148964,"Altera o Capítulo IV – Dos Direitos Políticos, do Título II – Dos Direitos e Garantias Fundamentais da Constituição para estabelecer cota de vagas para candidatos negros nas eleições para o poder legislativo, e cota para candidaturas para cada sexo, e para dispor sobre a destinação dos recursos públicos do Fundo Partidário e do Fundo Especial de Financiamento de Campanha e o tempo de rádio e televisão.",Não,2021,PEC
5959,149082,"Dá nova redação ao inc. III, do § 10, e ao § 11, do art. 34, do Ato Das Disposições Constitucionais Transitórias.",Não,2021,PEC
5959,149202,"Altera a Lei nº 9.503, de 23 de setembro de 1997, que institui o Código de Trânsito Brasileiro, para proibir a apreensão e a remoção de veículo que não possua o Certificado de Registro e Licenciamento de Veículos em razão de débitos tributários ou de multas.",Sim,2021,PL
5959,148690,Prorrogação da Comissão Temporária de Acompanhamento da Covid-19 por 120 dias.,Não,2021,RQS
5959,148853,"Realização de Sessão de Debates Temáticos, a ser realizada em data oportuna, a fim de debater sobre o impacto fiscal do PL nº 4728, de 2020.",Não,2021,RQS
5959,148592,Tramitação conjunta do PL nº 872/2021 com o PL nº 5051/2019.,Sim,2021,RQS
5959,148428,"Urgência, nos termos dos arts. 336, II, e 338, II, do Regimento Interno do Senado Federal, para apreciação do PL nº 2564/2020.",Não,2021,RQS
5959,148383,"Realização de Sessão de Debates Temáticos, em data oportuna, a fim de debater a situação do Mercosul.",Não,2021,RQS
5959,147933,Informações ao  Ministro de Estado da Saúde sobre o suprimento de oxigênio medicinal aos serviços de saúde durante a pandemia de covid-19.,Sim,2021,RQS
5959,147706,"Altera os arts. 155 e 157 do Decreto-Lei nº 2.848, de 7 de dezembro de 1940 (Código Penal), para aumentar as penas previstas para o furto e o roubo de vacinas para a Covid-19.",Sim,2021,PL
5959,147101,Adição de assinatura ao RQS nº 1372/2021.,Sim,2021,RQS
5959,147666,Adição de assinatura ao RQS nº 1097/2021.,Sim,2021,RQS
5959,148071,Criação de CPI para apurar desvios de recursos destinados ao combate dos efeitos da Covid 19.,Não,2021,RQS
5959,147476,Convite ao Ministro de Estado da Saúde para comparecer ao Plenário do Senado a fim de prestar informações sobre questões relacionadas à pandemia da Covid-19.,Não,2021,RQS
5959,147783,Requer adição de assinatura,Sim,2021,RQS
5959,147498,Adição de assinatura ao RQS nº 988/2021.,Sim,2021,RQS
5959,147635,Moção de Apelo à Comunidade Internacional relativa ao processo de vacinação contra a COVID-19 no Brasil.,Não,2021,RQS
5959,147459,"Oferece representação contra o Ministro do Supremo Tribunal Federal Alexandre de Moraes, com fundamento no art. 52, inciso II, da Constituição Federal, no art. 41 da Lei nº 1.079, de 1950 e no art. 337, inciso II, do Regimento Interno do Senado Federal.",Não,2021,PET
5959,147039,Adição de assinatura a Emenda(s) à PEC nº 186/2019.,Sim,2021,RQS
5959,146533,Adição de assinatura à PEC nº 2/2021.,Sim,2021,RQS
5959,146725,"Requer adição de assinatura à emenda de autoria do Senador Acir Gurgacz, registrada no SEDOL nº SF/21885.03331-42.",Sim,2021,RQS
5959,146738,"Altera o Ato das Disposições Constitucionais Transitórias, dispondo sobre o pagamento de auxílio emergencial, e dá outras providências.",Não,2021,PEC
5959,146301,Convite ao Ministro de Estado da Saúde para sessão de debate temático.,Não,2021,RQS
5959,146626,"Altera a Lei nº 6.259, de 30 de outubro de 1975, para estabelecer os direitos da pessoa no momento da vacinação e prever que sua obstrução configura crime.",Sim,2021,PL
5959,146287,Adição de assinatura ao RQS nº 97/2021.,Sim,2021,RQS
5959,146726,Adição de assinatura a Emenda(s) à PEC nº 186/2019.,Sim,2021,RQS
5959,146313,"Adição de assinatura ao Ofício 04/2021-GLPODEMOS, de recondução do Senador Álvaro Dias à Liderança do PODEMOS.",Sim,2021,RQS
5959,148070,"Criação de CPI para apurar as ações e omissões do Governo Federal no enfrentamento da pandemia da Covid-19 no Brasil e, em especial, no agravamento da crise sanitária no Amazonas com a ausência de oxigênio para os pacientes internados.",Não,2021,RQS
5959,145932,Retirada do PL nº 2963/2019 da pauta da Ordem do Dia de 15.12.2020.,Não,2020,RQS
5959,146236,"Altera o Decreto-Lei nº 2.848, de 7 de dezembro de 1940 (Código Penal), para tipificar como crime a remuneração e a condição de funcionário público fantasma.",Sim,2021,PL
5959,146044,"Altera os arts. 155, 157, 180 e 180-A do Decreto-lei nº 2.848, de 7 de dezembro de 1940 (Código Penal), para agravar as penas aplicáveis aos crimes de furto, roubo e receptação, bem como aperfeiçoar a redação dos referidos tipos penais.",Sim,2020,PL
5959,146045,"Altera a Lei nº 8.078, de 11 de setembro de 1990 (Código de Defesa do Consumidor), para obrigar o fornecedor a disponibilizar ao consumidor, não sendo o vício sanado no prazo máximo de trinta dias ou não sendo o reparo ocasionado por recall concluído no mesmo dia, automóvel reserva idêntico ou similar ao automóvel com vício, pelo tempo necessário ao reparo.",Sim,2020,PL
5959,145979,"Altera a Lei nº 9.503, de 23 de setembro de 1997, que institui o Código de Trânsito Brasileiro, para dispor sobre a utilização de painéis eletrônicos ao longo das vias.",Sim,2020,PL
5959,145982,"Altera a Lei nº 7.210, de 11 de julho de 1984 – Lei de Execução Penal, para especificar as atividades prioritárias a serem realizadas por meio do trabalho externo do condenado.",Sim,2020,PL
5959,145985,"Altera o art. 8º da Lei nº 12.527, de 18 de novembro de 2011 (Lei de Acesso à Informação), para dispor sobre a divulgação na internet de informações de interesse coletivo ou geral produzidas ou custodiadas pelos órgãos e entidades públicas.",Sim,2020,PL
5959,145966,Adição de assinatura ao RQS nº 2983/2020.,Sim,2020,RQS
5959,146042,Estabelece a imprescritibilidade das bonificações acumuladas em programas de benefícios e recompensas vinculados a cartão de crédito.,Sim,2020,PL
5959,145267,Adição de assinatura ao RQS nº 2553/2020.,Sim,2020,RQS
5959,144924,Requer licença para desempenhar missão política de interesse parlamentar,Sim,2020,REQ
5959,145243,"Inserção em ata de voto de pesar pelo falecimento do comandante e policial civil Renato de Oliveira de Souza, piloto do helicóptero da Força Nacional que caiu no Pantanal mato-grossense, em Poconé, no dia 8 de outubro, bem como a apresentação de condolências a seus familiares.",Não,2020,RQS
5959,145326,"Voto de repúdio ao advogado Cláudio Gastão da Rosa Filho, ao Juiz Rudson Marcos e ao Promotor de Justiça Thiago Carriço de Oliveira, por distorcerem fatos de um crime de estupro, expondo a vítima a sofrimento e humilhação.",Não,2020,RQS
5959,145291,"Adição de assinatura ao requerimento registrado no SEDOL nº SF/20602.64585-93, de autoria do Senador Randolfe Rodrigues.",Sim,2020,RQS
5959,145204,"Altera a Lei nº 9.504, de 30 de setembro de 1997, para vedar, durante a campanha eleitoral, a realização de evento destinado à promoção de candidato que gere aglomeração de pessoas quando estiver decretado estado de emergência de saúde pública.",Sim,2020,PL
5959,144893,"Altera o art. 165 da Constituição Federal e o art. 107 e 110 do Ato das Disposições Constitucionais Transitórias, acrescenta art. 115 ao Ato das Disposições Constitucionais Transitórias, bem como revoga o inciso III do art. 167 da Constituição Federal e a Emenda Constitucional nº 95, de 16 de dezembro de 2016.",Não,2020,PEC
5959,145336,"Adição de assinatura ao Requerimento nº 2621, de 2020, de autoria do Senador Fabiano Contarato.",Sim,2020,RQS
5959,144130,Adição de assinatura à PEC nº 30/2020.,Sim,2020,RQS
5959,144409,"Altera o art. 150 da Constituição Federal para garantir a imunidade tributária aos livros, jornais, periódicos e o papel destinado a sua impressão.",Não,2020,PEC
5959,144162,Adição de assinatura ao RQS nº 1927/2020.,Sim,2020,RQS
5959,144141,Adiamento da discussão do PL nº 3267/2019.,Não,2020,RQS
5959,144478,Adição de assinatura ao RQS nº 2099/2020.,Sim,2020,RQS
5959,144392,"Nos termos do art. 71, inciso IV da Constituição Federal, combinado com o art. 90, inciso X do Regimento Interno do Senado Federal, requer que seja solicitado, ao Tribunal de Contas da União, que realize auditoria de natureza operacional para aferir eficiência, eficácia e efetividade dos sistemas e processos pelos quais se operacionalizam e controlam repasses de recursos públicos federais para os demais entes da Federação, verificando se permitem a adequada fiscalização da aplicação dos valores, com aferição individualizada das condutas dos agentes envolvidos, de forma a permitir responsabilizações por desvios ou mal uso dos recursos.",Sim,2020,REQ
5959,144273,"Requer criação de subcomissão temporária para estudar, discutir e propor aprimoramento na fiscalização de repasses de recursos públicos da União para os demais entes federados, avaliando a distribuição de competências entre os órgãos envolvidos.",Sim,2020,REQ
5959,144135,"Adição de assinatura à Emenda nº 76 - PLEN, apresentada à PEC nº 187/2019.",Sim,2020,RQS
5959,144138,"Altera o art. 1º da Constituição Federal, para elencar “a prevenção e o combate à corrupção” como um dos fundamentos da República Federativa do Brasil.",Não,2020,PEC
5959,144581,Ata de eleição do coordenador de bancada do Rio Grande do Norte,Sim,2020,REQ
5959,144082,"Adição de assinatura à emenda oferecida PEC nº 26/2020, registrada no SEDOL nº SF/20591.09256-70, de autoria do Senador Tasso Jereissati.",Sim,2020,RQS
5959,144375,"Adiamento da discussão do PL nº 3267, de 2019 para audiência da CAS, CI e CDH.",Não,2020,RQS
5959,144105,Adição de assinatura à PEC nº 31/2020.,Sim,2020,RQS
5959,144091,"Adição de assinatura à emenda oferecida PEC nº 26/2020, registrada no SEDOL nº SF/20109.77017-20, de autoria do Senador Alessandro Vieira.",Sim,2020,RQS
5959,143716,"Dispõe sobre medidas de estímulo ao setor de educação privada, com ou sem fins lucrativos, em razão da pandemia de Covid-19, e altera a Lei nº 11.096, de 13 de janeiro de 2005, que dispõe sobre o Programa Universidade para Todos (Prouni), para ampliar o número de bolsas de estudo durante o período de calamidade pública reconhecido pelo Decreto Legislativo nº 6, de 20 de março de 2020.",Não,2020,PL
5959,143725,Adição de assinatura ao PL nº 4021/2020.,Sim,2020,RQS
5959,143519,"Convite ao Sr. Milton Ribeiro, Ministro de Estado da Educação, para comparecer à sessão remota, por meio de videoconferência, para debater suas propostas e os planos para a educação de nosso país, e possibilitar aos senadores a apresentação das propostas que tramitam no Senado.",Não,2020,RQS
5959,143367,"Adição de assinatura à proposta de emenda à Constituição registrada no SEDOL nº SF/20655.93820-02, tendo como primeira signatária a Senadora Rose de Freitas.",Sim,2020,RQS
5959,143902,"Suspende, por dois anos, a vigência da Emenda Constitucional nº 95, de 15 de dezembro de 2016.",Não,2020,PEC
5959,143492,Adição de assinatura ao RQS nº 1475/2020.,Sim,2020,RQS
5959,143960,"Acrescenta o art. 60-A ao Ato das Disposições Constitucionais Transitórias, para dispor sobre a utilização no âmbito dos Estados e dos Municípios de recursos provenientes de precatórios relativos à complementação da União ao Fundo de Manutenção e Desenvolvimento do Ensino Fundamental e de Valorização do Magistério (FUNDEF).",Não,2020,PEC
5959,143935,Adição de assinatura à PEC nº 37/2020.,Sim,2020,RQS
5959,145023,"Altera o art. 14 da Constituição Federal, estabelecendo o afastamento do cargo para o chefe do Poder Executivo que pleiteia a reeleição.",Não,2020,PEC
5959,143524,Altera o art. 128 da Constituição Federal para modificar a forma de escolha do Procurador-Geral da República.,Não,2020,PEC
5959,143115,"Realização de Sessão de Debates Temáticos, a fim de debater sobre o PL nº 2630/2020.",Não,2020,RQS
5959,143191,"Altera a Lei nº 12.527, de 18 de novembro de 2011, para determinar a criação de sítio na rede mundial de computadores no qual sejam consolidadas as informações de interesse coletivo ou geral produzidas ou custodiadas pelos órgãos e entidades públicas.",Sim,2020,PL
5959,142842,Adição de assinatura a emendas relacionadas às PEC 18/2020 e PEC 19/2020.,Sim,2020,RQS
5959,143314,"Adição de assinatura à proposta de emenda à Constituição registrada no SEDOL nº SF/20927.58734-06, tendo como primeiro signatário o Senador Fabiano Contarato.",Sim,2020,RQS
5959,143199,Adição de assinatura à PEC nº 25/2020.,Sim,2020,RQS
5959,142705,Adia para o mês de dezembro a realização das eleições municipais previstas para outubro de 2020.,Não,2020,PEC
5959,142683,Adição de assinatura à PEC nº 23/2020.,Sim,2020,RQS
5959,146115,Convite do presidente da caixa para videoconferência em sessão remota do SF. (Debate Temático),Não,2020,RQS
5959,142827,Adição de assinatura a emenda (s) relacionada (s) à PEC 18/2020.,Sim,2020,RQS
5959,142939,Adição de assinatura à PEC nº 28/2020.,Sim,2020,RQS
5959,142816,Adição de assinatura a emenda (s) relacionada (s) à PEC 18/2020.,Sim,2020,RQS
5959,143058,"Adição de assinatura aos RQS nºs 1220 e 3088/2020, tendo como primeira signatária a Senadora Rose de Freitas.",Sim,2020,RQS
5959,143126,"Convite ao novo Ministro da Educação, Carlos Alberto Decotelli, para comparecer por meio de videoconferência a sessão remota do Plenário do Senado Federal, destinada ao debate temático sobre suas propostas e planos para a educação de nosso país.",Não,2020,RQS
5959,143066,Adição de assinatura ao RQS nº 1207/2020.,Sim,2020,RQS
5959,142505,"Altera a Lei Complementar nº 101, de 4 de maio de 2000, a Lei nº 13.979, de 6 de fevereiro de 2020, e a Lei Complementar nº 173, de 4 de maio de 2020, com o objetivo de dar maior transparência ao uso dos recursos públicos, e dá outras providências.",Sim,2020,PL
5959,142353,Adição de assinatura à PEC nº 8/2021.,Sim,2020,RQS
5959,142397,"Autoriza a renegociação de dívidas rurais de pequenos agricultores familiares, a concessão de crédito rural no âmbito do Pronaf para aqueles mutuários que tenham sido prejudicados em decorrência das medidas de distanciamento social adotadas para mitigar os impactos da pandemia de Covid-19 provocada pelo novo coronavírus (SARS-CoV-2) e dá outras providências.",Sim,2020,PL
5959,142016,"Acrescenta o art. 115 ao Ato das Disposições Constitucionais Transitórias (ADCT) para dispor sobre o adiamento das eleições municipais para Prefeito, Vice-Prefeito e Vereador, previstas para 4 de outubro de 2020, para o dia 6 de dezembro do mesmo ano, em decorrência das medidas para o enfrentamento da pandemia da Covid-19 declarada pela Organização Mundial da Saúde.",Não,2020,PEC
5959,142138,"Autoriza o município de São Gonçalo do Amarante – RN a contratar operação de crédito externo, com garantia da República Federativa do Brasil, com o Fundo Financeiro para o Desenvolvimento da Bacia do Prata – FONPLATA, no valor de até US$ 34.000.000,00 (trinta e quatro milhões de dólares dos Estados Unidos da América).",Sim,2020,PRS
5959,142043,"Determina a contagem em dobro, para fins de aposentadoria, do tempo de contribuição dos servidores públicos civis e militares das áreas de saúde e segurança pública da União, dos Estados, do Distrito Federal e dos Municípios, referente a serviço prestado nas ações de combate à pandemia do Coronavírus SARS-CoV-2 (Covid-19).",Não,2020,PEC
5959,148030,"Altera a Constituição Federal para dispor sobre os pedidos de vista, declaração de inconstitucionalidade e concessão de medidas cautelares nos tribunais.",Não,2021,PEC
5959,142511,"Altera a Lei Complementar nº 101, de 4 de maio de 2000, a Lei nº 13.979, de 6 de fevereiro de 2020, e a Lei Complementar nº 173, de 4 de maio de 2020, com o objetivo de dar maior transparência ao uso dos recursos públicos, e dá outras providências.",Sim,2020,PLP
5959,142514,Retirada do PL n° 3.287/2020.,Sim,2020,RQS
5959,142463,"Altera a Lei nº 10.260, de 12 de julho de 2001, que “dispõe sobre o Fundo de Financiamento ao estudante do Ensino Superior e dá outras providências”, para prever o abatimento do saldo devedor de profissionais de segurança pública.",Sim,2020,PL
5959,141983,Altera o Ato das Disposições Constitucionais Transitórias para modificar regras fiscais em decorrência do surto de COVID-19.,Não,2020,PEC
5959,141714,"Altera a Lei no 8.078, de 11 de setembro de 1990 – Código de Defesa do Consumidor –, para tipificar como crime o aumento abusivo do preço de produtos ou serviços em situações de epidemia, desastres de grandes proporções e calamidade pública.",Sim,2020,PL
5959,141929,"Modifica o art. 144 da Constituição Federal, para determinar que o Diretor-Geral da Polícia Federal tenha a designação de Delegado-Geral de Polícia Federal, e dá outras providências.",Não,2020,PEC
5959,141096,"Altera o art. 5º da Constituição Federal, para incluir o acesso à internet entre os direitos fundamentais.",Não,2020,PEC
5959,141101,"Acrescenta o art. 169-A à Constituição Federal, para vedar cortes e contingenciamentos nos orçamentos das instituições de educação superior mantidas pela União.",Não,2020,PEC
5959,140872,"Realização de Sessão de debates temáticos, em data oportuna, para discutir a criação do Conselho Nacional da Amazônia Legal.",Não,2020,RQS
5959,140771,"Requeiro, nos termos do art. 58, § 2º, II da Constituição Federal e do art. 93, II do Regimento Interno do Senado Federal, que na Audiência Pública objeto do REQ 6/2020 - CAS, seja incluído a convidada: Lúcia de Magalhães Dias, Consultora Jurídica, representando Associação Brasileira de Anunciantes.",Sim,2020,REQ
5959,140892,Realização de Sessão de Debate Temático sobre a Importância de Garantir a Permanência do Fundeb (Fundo de Manutenção e Desenvolvimento do Ensino Fundamental e de Valorização do Magistério).,Não,2020,RQS
5959,140808,Altera o art. 45 da Constituição para conceder ao brasileiro residente no exterior o direito de votar nas eleições majoritárias.,Não,2020,PEC
5959,140744,"Institui o Selo Nacional de Sustentabilidade Empresarial, conferido a empresas que contribuam para a redução dos impactos ao meio ambiente, e altera a Lei nº 8.666, de 21 de junho de 1993, que institui normas para licitações e contratos da Administração Pública e dá outras providências, para dar preferência, como critério de desempate nas licitações, às empresas detentoras do Selo.",Sim,2020,PL
5959,140931,"Altera a Lei nº 9.394, de 20 de dezembro de 1996, que estabelece as diretrizes e bases da educação nacional, para dispor sobre a concessão de bônus em processo seletivo de acesso a cursos de graduação das instituições federais de educação superior.",Sim,2020,PL
5959,140739,"Altera a Lei nº 8.429, de 2 de junho de 1992, com a finalidade de caracterizar a conduta de abandonar bens móveis e imóveis públicos como ato de improbidade administrativa.",Sim,2020,PL
5959,140639,"Altera o inciso XXVIII do art. 22 e acrescenta dispositivos aos arts. 23 e 24 da Constituição Federal, para dispor sobre o regime de competência para legislar sobre defesa e segurança cibernética e fixar a competência comum dos entes federados para zelar pela segurança cibernética dos serviços públicos.",Não,2020,PEC
5959,140672,"Realização de sessão especial, em 11 de setembro próximo, destinada a comemorar os 30 anos do Código de Defesa do Consumidor.",Não,2020,RQS
5959,141028,Oitiva da CAE sobre o  PLC 90/2018.,Sim,2020,RQS
5959,141029,Oitiva da CCJ sobre o  PLC 90/2018.,Sim,2020,RQS
5959,140857,"Solicitamos, nos termos do art. 58, § 2º, I da Constituição Federal e do art. 91, § 3º do Regimento Interno do Senado Federal, que o PL 776/2019, que altera a Lei nº 9.250, de 26 de dezembro de 1995, para permitir a dedução das doações a projeto de pesquisa científica e tecnológica executado por Instituição Científica e Tecnológica (ICT),ou por entidades científicas e tecnológicas privadas, sem fins lucrativos, da base de cálculo do imposto de renda da pessoa física, deliberado terminativamente pela Comissão de Assuntos Econômicos, seja apreciado pelo Plenário do Senado Federal.",Não,2020,R.S
5959,140267,"Realização de sessão especial, em 18/06/2020, destinada a comemorar o Dia do Imigrante Japonês.",Não,2019,RQS
5959,140190,"Realização de sessão especial, em 26/06/2020, destinada a Comemorar o Dia Nacional do Quadrilheiro Junino.",Não,2019,RQS
5959,140597,"Requeiro, nos termos do art. 58, § 2º, II da Constituição Federal e do art. 93, II do Regimento Interno do Senado Federal, a realização de audiência pública, com o objetivo de discutir o PLC 83, de 2015, e os PLS 323 e PLS 443, de 2015, que tramitam em conjunto por regularem a mesma matéria.  As proposições dispõem sobre o Dia Nacional de Prevenção ao Alcoolismo e às Drogas e veda a propaganda de bebidas alcoólicas nos meios de comunicação social.",Sim,2020,REQ
5959,140576,"Acrescenta parágrafos ao art. 166-A da Constituição Federal, para dispor sobre a utilização de economias de recursos da verba indenizatória pelo exercício da atividade parlamentar e outras, para fins de aplicação em políticas públicas de interesse social mediante emendas parlamentares.",Sim,2020,PEC
5959,140443,"Requeiro, nos termos do art. 58, § 2°, II e V da Constituição Federal, que seja convidado o Exmo. Sr. Luiz Henrique Mandetta, Ministro da Saúde, a comparecer a esta Comissão, a fim de prestar informações sobre as medidas que o Ministério da Saúde está tomando para o enfrentamento do Coronavírus no País  .",Sim,2020,REQ
5959,140189,"Realização de sessão especial, em 15/05/2020, destinada a homenagear a Polícia Miliar do Distrito Federal.",Não,2019,RQS
5959,140205,Veda concessão e majoração de isenções e benefícios previdenciários na vigência do regime definido no art. 106 do ADCT.,Não,2019,PEC
5959,140483,"Altera o art. 73 da Lei nº 9.504, de 30 de setembro de 1997, para vedar a celebração de solenidades de inauguração de obras públicas em ano eleitoral e a manifestação de candidatos ou em seu favor em eventos culturais custeados, mesmo que parcialmente, com recursos públicos.",Sim,2020,PL
5959,140192,"Realização de sessão especial, em 21/08/2020, destinada a Comemorar o Dia do Maçom Brasileiro.",Não,2019,RQS
5959,140191,"Realização de sessão especial, em 03/07/2020, destinada a Comemorar o Dia do Bombeiro Militar.",Não,2019,RQS
5959,140266,"Realização de sessão especial, em 05/03/2020, destinada a comemorar o Dia do Turismo Ecológico.",Não,2019,RQS
5959,140184,"Altera o art. 39 da Constituição Federal para vedar o pagamento de auxílio, ajuda ou qualquer outra forma de retribuição a título de reembolso de despesas efetuadas com moradia a senador, deputado federal, deputado estadual, deputado distrital e vereador.",Não,2019,PEC
5959,140340,Acrescenta o inciso X ao art. 170 e o inciso VIII ao § 1º do art. 225 da Constituição Federal.,Não,2019,PEC
5959,140197,"Realização de sessão especial, em 29 de junho de 2020, destinada a comemorar o Dia Nacional da Aviação de Segurança Pública do Brasil.",Não,2019,RQS
5959,140271,Altera o inciso XVIII do art. 7º da Constituição Federal e revoga o inciso XIX da Constituição Federal e o § 1º do art. 10 do Ato das Disposições Constitucionais Transitórias para dispor sobre a licença parental compartilhada.,Não,2019,PEC
5959,140173,"Altera a Constituição Federal para disciplinar a apreciação dos vetos, separadamente, em cada Casa do Congresso Nacional.",Não,2019,PEC
5959,139916,Altera os arts. 49 e 225 da Constituição Federal para que o Congresso Nacional decida previamente sobre o corte e a supressão de vegetação da Floresta Amazônica.,Não,2019,PEC
5959,140081,"Insere o § 3º no art. 20 da Constituição Federal para prover recursos para fundo de prevenção e recuperação de danos ambientais provocados por atividades de extração, transporte e processamento de recursos petrolíferos e minerais.",Não,2019,PEC
