codigoParlamentar,CodigoMateria,Ementa,IndicadorAutorPrincipal,AnoMateria,AutoriasSigla
5959,135118,"Modifica o art. 37 da Constituição Federal, para suspender o transcurso do prazo de validade de concurso público na hipótese de o Poder Público suspender as nomeações por falta de recursos financeiros.",Não,2019,PEC
5959,162850,"Requer urgência para o Projeto de Resolução do Senado nº 72/2023, nos termos dos arts. 336, III e 338, III, do Regimento Interno do Senado Federal.",Não,2024,RQS
5959,163806,"Requer urgência para o Projeto de Lei nº 370/2024, nos termos dos arts. 336, II, e 338, II, do Regimento Interno do Senado Federal.",Não,2024,RQS
5959,164239,"Requer urgência para o Substitutivo da Câmara dos Deputados n° 6/2016, nos termos dos arts. 336, II, e 338, II, do Regimento Interno do Senado Federal.",Não,2024,RQS
5959,164610,"Requer urgência para o Projeto de Decreto Legislativo nº 307/2024, nos termos dos arts. 336, II, e 338, II, do Regimento Interno do Senado Federal.",Não,2024,RQS
5959,163389,"Requer urgência para o Projeto de Lei nº 1.144/2024, nos termos dos arts. 336, III, e 338, III, do Regimento Interno do Senado Federal.",Não,2024,RQS
5959,164217,"Requer urgência para o Projeto de Lei Complementar nº 125/2022, nos termos dos arts. 336, II, e 338, II, do Regimento Interno do Senado Federal.",Não,2024,RQS
5959,164216,"Requer urgência para o Projeto de Lei Complementar nº 124/2022, nos termos dos arts. 336, II, e 338, II, do Regimento Interno do Senado Federal.",Não,2024,RQS
5959,163966,"Requer realização de Sessão de Debates Temáticos destinada a discutir o procedimento de assistolia fetal previamente aos procedimentos de interrupção da gravidez, nos casos de aborto previsto em lei, quando houver probabilidade de sobrevida do feto em idade gestacional acima de 22 semanas, e a Resolução nº 2.378/24, do Conselho Federal de Medicina (CFM).",Não,2024,RQS
5959,163950,"Requer urgência para o Projeto de Lei Complementar nº 146/2021, nos termos dos arts. 336, III, e 338, III, do Regimento Interno do Senado Federal.",Não,2024,RQS
5959,164607,"Requer urgência para o Projeto de Decreto Legislativo nº 266/2024, nos termos dos arts. 336, II, e 338, II, do Regimento Interno do Senado Federal.",Não,2024,RQS
5959,163988,"Requer realização de Sessão de Debates Temáticos destinada a discutir a Proposta de Emenda à Constituição nº 3, de 2022, que revoga o inciso VII do caput do art. 20 da Constituição Federal e o § 3º do art. 49 do Ato das Disposições Constitucionais Transitórias; e dá outras providências.",Não,2024,RQS
5959,163235,"Requer urgência para o Projeto de Lei nº 1026/2024, nos termos dos arts. 336, II, e 338, II, do Regimento Interno do Senado Federal.",Não,2024,RQS
5959,159756,"Requer destaque para votação em separado da Emenda n° 2 ao Projeto de Lei 3.026, de 2022.",Sim,2023,RQS
5959,163673,"Altera o § 12 do art. 198 da Constituição Federal, para determinar que o piso salarial dos enfermeiros, técnicos de enfermagem, auxiliares de enfermagem e das parteiras refere-se a uma jornada máxima de trabalho de trinta horas semanais.",Não,2024,PEC
5959,164463,"Torna impositiva a execução das emendas apresentadas pelas comissões permanentes da Câmara dos Deputados, do Senado Federal e do Congresso Nacional.",Não,2024,PEC
5959,164288,Requer licença das atividades da Casa.,Sim,2024,REQ
5959,162681,Requer a inclusão em Ordem do Dia do PL 2099/2023.,Não,2024,RQS
5959,162836,"Estabelece a política de valorização permanente dos benefícios da Previdência Social, pela alteração do caput do art. 41-A da Lei nº 8.213, de 24 de julho de 1991.",Sim,2024,PL
5959,163090,Altera o Regimento Comum do Congresso Nacional para ajustar o período de escolha do Líder da Minoria no Congresso Nacional.,Não,2024,PRN
5959,163369,Solicita que a Emenda n° 4-CCJ ao PLP 233/2023 seja apreciada em Plenário.,Não,2024,R.S
5959,162730,Requer licença das atividades da Casa,Sim,2024,REQ
5959,162819,"Modifica o art. 231 da Constituição Federal, para permitir aos índios produzir e comercializarem livremente sua produção e prever a obrigação da União de prestar-lhes auxílio técnico.",Não,2024,PEC
5959,163043,"Altera o art. 146, § 3º, II, da Constituição Federal para corrigir o tratamento injusto concedido pela reforma tributária às microempresas, às empresas de pequeno porte e aos microempreendedores individuais.",Não,2024,PEC
5959,163547,Interposição de Recurso contra decisão terminativa de Comissão sobre o Projeto de Lei n° 1958/2021.,Não,2024,R.S
5959,162066,"Requer a realização de Sessão de Debates Temáticos destinada a discutir o objeto da Proposta de Emenda Constitucional (PEC) 42/2023, que trata das condições de elegibilidade por militares da ativa das Forças Armadas.",Não,2024,RQS
5959,163300,"Autoriza regime extraordinário fiscal, financeiro e de contratações para atender necessidades decorrentes de calamidade pública ambiental regional ou local.",Não,2024,PEC
5959,162284,"Cria a Comissão Mista Permanente para Proteção de Dados, Inteligência Artificial e Segurança Cibernética (CMCIBER) e dá outras providências.",Não,2024,PRN
5959,163613,Requer a oitiva da Comissão de Segurança Pública sobre o Projeto de Lei nº 421/2023.,Sim,2024,RQS
5959,162776,"Revoga a competência concorrente para legislar sobre direito penitenciário, atribuindo-a aos Estados.",Não,2024,PEC
5959,163187,"Requer, nos termos dos arts. 336, II, e 338, IV, do Regimento Interno do Senado Federal, urgência para o PL 4088/2023, que ""altera o art. 26 da Lei nº 9.394, de 20 de dezembro de 1996 (Lei de Diretrizes e Bases da Educação Nacional), para incluir educação política e direito a cidadania como componente curricular obrigatório da educação básica.""",Sim,2024,REQ
5959,163411,Solicita que a Emenda 27-U ao PLP 233/2023 seja apreciada em Plenário.,Não,2024,R.S
5959,162140,Requer voto de solidariedade ao Estado de Israel e ao povo judeu em face das declarações distorcidas e cruéis do Presidente Lula.,Não,2024,RQS
5959,162695,Requer voto de louvor à Assembleia Legislativa do Espírito Santo pela soltura do Deputado Estadual Capitão Assumção.,Não,2024,RQS
5959,162113,Altera o art. 53 da Constituição Federal para dispor sobre as inviolabilidades parlamentares dos Deputados e Senadores.,Não,2024,PEC
5959,163452,"Altera a Lei nº 13.146, de 6 de julho de 2015, para incluir a obrigatoriedade de empresas com sede ou representação comercial no país e de órgãos do governo disponibilizarem endereço de correio eletrônico para o atendimento de pessoas surdas.",Sim,2024,PL
5959,163663,Dá nova redação ao § 4º do art. 225 da Constituição Federal para incluir entre os patrimônios nacionais o Pantanal Sul-Mato-Grossense.,Não,2024,PEC
5959,162106,"Requer voto de repúdio ao Presidente da República, Luís Inácio Lula da Silva, pela declaração que comparou a ação militar de Israel contra o Hamas na Faixa de Gaza ao assassinato em massa de judeus liderado por Adolf Hitler durante a 2ª Guerra Mundial.",Não,2024,RQS
5959,162059,"Requer, em aditamento ao Requerimento nº 1.046, de 2023, a inclusão de convidados na Sessão de Debates Temáticos com o objetivo de discutir a obrigatoriedade de vacinação contra Covid-19 em crianças, em virtude de inclusão da vacina no Programa Nacional de Imunização – PNI.",Não,2024,RQS
5959,164104,Requer realização de Sessão de Debates Temáticos destinada a discutir as Políticas Públicas para prevenção e tratamento do câncer de pulmão.,Não,2024,RQS
5959,162888,Requer a realização de Sessão Especial destinada a celebrar os 200 anos da igreja luterana no Brasil.,Não,2024,RQS
5959,162103,"Altera o art. 14, da Constituição Federal, para dispor que, na votação e apuração de eleições, plebiscitos e referendos, seja obrigatória a expedição de cédulas físicas, conferíveis pelo eleitor, a serem depositadas em urnas indevassáveis, para fins de auditoria.",Não,2024,PEC
5959,162896,"Requer a realização de Sessão Especial destinada a celebrar o Dia Nacional da Inovação, celebrado em 19 de outubro.",Não,2024,RQS
5959,162500,"Requer criação de Comissão Parlamentar de Inquérito, composta de 11 membros titulares e 7 membros suplentes, para, no prazo de 180 dias, apurar fatos relacionados às denúncias e suspeitas de manipulação de resultados no futebol brasileiro, envolvendo jogadores, dirigentes e empresas de apostas.",Não,2024,RQS
5959,161942,Altera o art. 228 da Constituição Federal para alterar para 16 anos a idade de inimputabilidade penal para os crimes hediondos.,Não,2024,PEC
5959,162022,"Altera a Lei nº 9.503, de 23 de setembro de 1997, para dispor sobre a infração de passagem em faixa de cobrança automática de pedágio sem o devido equipamento.",Sim,2024,PL
5959,161999,"Requer, nos termos do inciso II do art. 93 do Regimento Interno do Senado Federal, a realização de audiência pública nesta Comissão de Assuntos Sociais, com a participação da Senhora Nísia Verônica Trindade Lima, Ministra de Estado da Saúde, para prestar esclarecimentos sobre as medidas adotadas no âmbito da sua pasta com relação à epidemia de dengue instalada no país.",Sim,2024,REQ
5959,161786,Requer a realização de Sessão Especial destinada a celebrar o Dia Internacional da Mulher.,Não,2023,RQS
5959,161785,Requer a realização de Sessão Especial destinada a celebrar o Dia Mundial da Água.,Não,2023,RQS
5959,161782,Requer a realização de Sessão Especial destinada a celebrar o Dia Mundial da Conscientização do Autismo.,Não,2023,RQS
5959,161772,Altera os arts. 47 e 52 da Constituição Federal para vedar o voto secreto em todas as deliberações do Poder Legislativo.,Não,2023,PEC
5959,161787,Requer a realização de Sessão Especial destinada a celebrar o Dia Internacional da Mulheres e Meninas na Ciência.,Não,2023,RQS
5959,161778,Requer a realização de Sessão Especial destinada a celebrar o Dia da Polícia Militar do Distrito Federal.,Não,2023,RQS
5959,161781,Requer a realização de Sessão Especial destinada a celebrar o Dia Nacional do Líder Comunitário.,Não,2023,RQS
5959,161780,Requer a realização de Sessão Especial destinada a celebrar o Dia do Contabilista.,Não,2023,RQS
5959,161725,"Altera o inciso V do § 3º do art. 14 e acrescenta o art. 17-A da Constituição Federal, possibilitando o lançamento de candidaturas avulsas, independentemente de filiação partidária.",Não,2023,PEC
5959,161820,Altera o art. 155 da Constituição Federal para conceder imunidade do Imposto sobre a Propriedade de Veículos Automotores a veículos terrestres de passageiros com vinte anos ou mais de fabricação.,Não,2023,PEC
5959,161685,"Altera o inciso V do art. 7º da Constituição Federal para prever a impossibilidade de redução do piso salarial, por meio de convenção ou acordo coletivo, quando ele for fixado em lei específica.",Não,2023,PEC
5959,161755,Altera o Ato das Disposições Constitucionais Transitórias para conceder anistia aos envolvidos nos atos de 8 de janeiro de 2023 e restaurar os direitos políticos dos cidadãos declarados inelegíveis em face de atos relacionados às Eleições de 2022.,Não,2023,PEC
5959,161318,Requer oitiva da Comissão de Segurança Pública sobre o PL 2234/2022.,Não,2023,RQS
5959,161317,Requer oitiva da Comissão de Assuntos Sociais sobre o PL 2234/2022.,Não,2023,RQS
5959,161316,Requer oitiva da Comissão de Assuntos Econômicos sobre o PL 2234/2022.,Não,2023,RQS
5959,161269,Dispõe sobre o regime jurídico aplicável ao Banco Central.,Não,2023,PEC
5959,161494,Acrescenta o § 7º ao art. 220 da Constituição Federal para dispor sobre a proteção da liberdade de imprensa.,Não,2023,PEC
5959,161363,Requer licença das atividades da Casa,Sim,2023,REQ
5959,161373,"Requer voto de repúdio à Venezuela pelo escalonamento da tensão ora existente entre a Venezuela e a Guiana por força da disputa territorial envolvendo região de Essequibo, buscando respeito aos tratados internacionais, à integridade territorial da Guiana e clamando por uma solução política, consensual, pacífica e duradoura para o conflito.",Não,2023,RQS
5959,161307,Abre novo prazo de parcelamento especial de débitos dos municípios com seus Regimes Próprios de Previdência Social dos Servidores Públicos e com o Regime Geral de Previdência Social.,Não,2023,PEC
5959,160960,"Acrescenta o inciso XIX ao art. 49; modifica o §4º e acrescenta o §8º, ambos no Art. 231, da Constituição Federal.",Não,2023,PEC
5959,160771,"Requer inserção em ata de voto de repúdio à Secretária Nacional de Planejamento e Finanças do Partido dos Trabalhadores, nomeada para o Conselho de Administração da Itaipu Binacional, Gleide Andrade de Oliveira, pelas mensagens publicadas em rede social alegando que Israel é ""uma vergonha para humanidade"" e não merece ser Estado.",Não,2023,RQS
5959,160956,"Altera os incisos XVIII e XIX do art. 7° da Constituição Federal, para ampliar a duração da licença-maternidade, licença paternidade e adotante.",Não,2023,PEC
5959,160724,"Altera a Lei nº 13.260, de 16 de março de 2016, a Lei nº 13.445 de 24 de maio de 2017, a Lei nº 9.096 de 19 de setembro de 1995, e a Lei nº 7.716, de 5 de janeiro de 1989, para criminalizar a apologia a atos terroristas, e dá outras providências.",Sim,2023,PL
5959,160684,Acrescenta o inciso LXXX ao art. 5º da Constituição Federal para tornar imprescritível o crime de tráfico de crianças e adolescentes.,Não,2023,PEC
5959,160735,Requer a realização de Sessão Especial destinada a comemorar o Dia Nacional do Delegado de Polícia.,Não,2023,RQS
5959,160933,Altera as regras e o rito das súmulas vinculantes.,Não,2023,PEC
5959,160275,"Institui a Frente Parlamentar Mista da Inteligência Artificial, Tecnologia da Informação, Segurança Cibernética e Combate à Desinformação (Frente Parlamentar da Segurança Digital).",Não,2023,PRS
5959,160430,"Requer inserção em ata de voto de solidariedade ao Estado de Israel e, ao mesmo tempo, de repúdio ao ataque do Hamas sofrido desde o dia 07 de outubro de 2023.",Não,2023,RQS
5959,160374,Atribui mandato de quinze anos e exigência de idade mínima de cinquenta anos aos Ministros do Supremo Tribunal Federal e promove modificações no processo de escolha dos membros dessa Corte e dos Tribunais Superiores.,Não,2023,PEC
5959,160557,Requer voto de aplauso à jovem israelense Inbar Lieberman.,Não,2023,RQS
5959,160593,Altera o art. 159 da Constituição Federal para instituir compensação financeira em prol do Fundo de Participação dos Municípios no intuito de assegurar a esse Fundo participação percentual no produto interno bruto igual à observada no exercício de 2022.,Não,2023,PEC
5959,160411,"Requer, nos termos do art. 58, § 2°, II e V, da Constituição Federal, que seja convidada a Exma. Sra. Simone Tebet, Ministra de Estado do Planejamento e Orçamento, a comparecer a esta Comissão, a fim de prestar informações sobre sua fala na Comissão de Mista de Orçamento (CMO), no Congresso Nacional (CN), referente à liberação de empréstimo de US$ 1 bilhão à Argentina pela CAF.",Não,2023,REQ
5959,160148,Altera o §1º do art. 231 da Constituição Federal para definir marco temporal de demarcação das terras tradicionalmente ocupadas pelos povos indígenas.,Não,2023,PEC
5959,160042,"Requer, nos termos do art. 199 do Regimento Interno do Senado Federal, a realização de Sessão Especial, a ser realizada em data oportuna, a fim de comemorar os 20 anos do Serviço de Atendimento Móvel de Urgência - SAMU.",Não,2023,RQS
5959,159952,"Modifica o art. 40 do Decreto-lei nº 3.365, de 21 de junho de 1941, para facultar ao poder público instituir servidões administrativas em casos de interesse público, tendo em vista a função social da propriedade.",Sim,2023,PL
5959,160128,"Altera a Lei nº 9.294, de 15 de julho de 1996, para proibir a venda de produtos de tabaco nos locais que especifica.",Sim,2023,PL
5959,160040,"Altera a Lei nº 6.202, de 17 de abril de 1975, para assegurar a oferta de ensino remoto às estudantes gestantes, lactantes e adotantes de crianças de até seis meses de idade.",Sim,2023,PL
5959,160544,"Requer, nos termos do art. 58, § 3º, da Constituição Federal e do §1° do art. 76, combinado com o art. 152, do Regimento Interno do Senado Federal, a prorrogação por mais 57 (cinquenta e sete) dias da duração da Comissão Parlamentar de Inquérito criada a partir do Requerimento nº 292/2023 destinada a investigar a liberação, pelo Governo Federal, de recursos públicos para ONGs, e OSCIPs, bem como a utilização, por essas entidades, desses recursos e de outros por elas recebidos do exterior, a partir do ano de 2002 até a data de 1º de janeiro de 2023, a concentração desses recursos em atividades-meio, de forma a descumprir os objetivos para os quais esses recursos foram destinados originalmente, o desvirtuamento dos objetivos da ação dessas entidades, operando inclusive contra interesses nacionais, casos de abuso de poder, com intromissão dessas entidades em funções institucionais do poder público e a aquisição, a qualquer título, de terras por essas entidades.",Não,2023,RQS
5959,159960,"Requer a realização de Sessão Especial, no dia 06/10/2023, a fim de comemorar o Dia Mundial do Algodão.",Não,2023,RQS
5959,159933,"Altera o art. 101 da Constituição Federal, para determinar a realização de arguição pública, pelo Senado Federal, dos Ministros do Supremo Tribunal Federal a cada oito anos.",Sim,2023,PEC
5959,160011,"Altera o art. 5º da Constituição Federal, para prever como mandado de criminalização a posse e o porte de entorpecentes e drogas afins sem autorização ou em desacordo com determinação legal ou regulamentar.",Não,2023,PEC
5959,160083,"Altera o inciso IV do art. 8º da Constituição Federal, para vedar, salvo prévia aquiescência individual dos membros das categorias profissionais e econômicas, a cobrança de contribuições de trabalhadores ou empregadores não filiados ao respectivo sindicato.",Não,2023,PEC
5959,160099,Cria o Programa de Desenvolvimento do Sistema Brasileiro de Posicionamento Global.,Sim,2023,PL
5959,160194,Dispõe sobre a realização de plebiscito para decidir sobre a legalização do aborto.,Não,2023,PDL
5959,160031,"Requer a realização de Sessão de Debates Temáticos com o objetivo de discutir o acordo de livre comércio Mercosul/UE, bem como debater sobre as medidas unilaterais protecionistas sob a égide de políticas ambientais e de mudanças climáticas que a União Europeia informou que submeteria a um protocolo adicional ao acordo.",Não,2023,RQS
5959,159966,"Modifica o art. 95 da Constituição Federal, para dispor sobre a vedação dos magistrados de atuar em processos patrocinados direta ou indiretamente por cônjuges, companheiros ou parentes até o segundo grau.",Não,2023,PEC
5959,159900,"Altera a Lei nº 9.507, de 12 de novembro de 1997, para estabelecer novo prazo para deferimento ou indeferimento de requerimento de informações.",Sim,2023,PL
5959,159924,Acrescenta o art. 124 ao Ato das Disposições Constitucionais Transitórias para aumentar temporariamente a parcela do produto da arrecadação dos impostos sobre renda e proventos de qualquer natureza e sobre produtos industrializados devida ao Fundo de Participação dos Municípios.,Não,2023,PEC
5959,159668,"Altera a Lei nº 9.610, de 19 de fevereiro de 1998, para dispensar da arrecadação de direitos autorais a veiculação de obras musicais e literomusicais pelas prestadoras do serviço de radiodifusão comunitária.",Sim,2023,PL
5959,159180,Requer a realização de Sessão Especial em homenagem a Sukyo Mahikari do Brasil.,Não,2023,RQS
5959,159537,"Requer, nos termos do art. 199 do Regimento Interno do Senado Federal, a realização de Sessão Especial, no dia 30/10/2023, a fim de celebrar o 40º Aniversário da Associação Brasileira de Automação - GS1 Brasil.",Não,2023,RQS
5959,159325,"Altera a Constituição Federal, para disciplinar a tramitação de projetos de resolução referentes ao regimento interno das Casas Legislativas.",Não,2023,PEC
5959,159788,"Requer, nos termos dos arts. 336, III, e 338, III, do Regimento Interno do Senado Federal, urgência para o PRS 11/2019.",Não,2023,RQS
5959,159327,"Requer, nos termos dos arts. 336, II, e 338, II, do Regimento Interno do Senado Federal, urgência para o PL 2801/2022.",Não,2023,RQS
5959,159095,"Acrescenta o § 12 ao art. 14, da Constituição Federal, dispondo que, na votação e apuração de eleições seja obrigatória a expedição de cédulas físicas, conferíveis pelo eleitor, a serem depositadas em urnas, para fins de auditoria.",Não,2023,PEC
5959,159040,Requer a realização de Sessão Especial a fim de comemorar o Dia da Educação Profissional e Tecnológica.,Não,2023,RQS
5959,158997,"Requer nos termos do art. 199 do Regimento Interno do Senado Federal, a realização de Sessão Especial, em setembro, a fim de celebrar os 120 anos das Igrejas Batistas no Estado do Espírito Santo.",Não,2023,RQS
5959,158950,"Requer a realização de Sessão de Debates Temáticos no dia 17/08/2023, a fim de debater a retomada da indústria no Brasil.",Não,2023,RQS
5959,159094,Altera o art. 244 da Constituição Federal para assegurar gratuidade nos transportes coletivos urbanos às pessoas com deficiência de baixa renda.,Não,2023,PEC
5959,159092,"Requer a realização de Sessão de Debates Temáticos a fim de  debater a ""Reinvenção do Brasil pelas estratégias regionais de desenvolvimento"".",Não,2023,RQS
5959,159093,Altera o Sistema Tributário Nacional.,Não,2023,PEC
5959,158965,Requer a realização de Sessão Especial no dia 05/09/2023 (Dia da Amazônia).,Não,2023,RQS
5959,158884,"Requer realização de sessão especial a fim de comemorar o Dia Mundial dos Animais, bem como homenagear as instituições e pessoas que se dedicam ao cuidado, à proteção e ao resgate dos animais domésticos.",Sim,2023,RQS
5959,158928,"Requer realização, pela Comissão de Comunicação e Direito Digital, de estudo sobre as atividades de entidade autodenominada Sleeping Giants Brasil, que vem realizando ações de clara interferência na liberdade de imprensa garantida pela Constituição da República Federativa do Brasil, e da proposição de medidas que visem conter essas atividades.",Não,2023,REQ
5959,158350,"Altera a Lei nº 13.636, de 20 de março de 2018, para aprimorar e fomentar o microcrédito e as microfinanças.",Não,2023,PL
5959,158574,"Altera o art. 62 da Constituição Federal, para dispor sobre o procedimento de apreciação de medidas provisórias pelo Congresso Nacional.",Não,2023,PEC
5959,158235,Requer a realização de Sessão Especial em homenagem ao Dia do Maçom,Não,2023,RQS
5959,158306,Altera a Constituição Federal para prever o estabelecimento do Plano Nacional de Segurança Alimentar e Nutricional.,Não,2023,PEC
5959,158659,Requer licença para tratamento de saúde,Sim,2023,REQ
5959,158319,"Altera o art. 5º da Lei Complementar nº 89, de 18 de fevereiro de 1997, que institui o Fundo para Aparelhamento e Operacionalização das Atividades-fim da Polícia Federal (Funapol), para destinar as taxas cobradas para emissão de passaporte exclusivamente para a prestação desse serviço.",Sim,2023,PL
5959,158095,"Altera a Constituição Federal para incluir, entre os direitos e garantias fundamentais, a proteção à integridade mental e à transparência algorítmica.",Não,2023,PEC
5959,157989,"Requer, nos termos do art. 58, § 2º, II, da Constituição Federal e do art. 93, II, do Regimento Interno do Senado Federal, que na Audiência Pública objeto do REQ 47/2023 - CAS, seja incluído, como convidado, o Senhor Zé Haroldo Cathedral,
Deputado Federal.",Sim,2023,REQ
5959,158047,"Altera a Lei nº 13.756, de 12 de dezembro de 2018, que dispõe sobre a modalidade lotérica denominada apostas de quota fixa, para vedar ações de comunicação, publicidade e propaganda.",Sim,2023,PL
5959,157153,Altera o art. 103-B da Constituição Federal para incluir um desembargador do Tribunal de Justiça do Distrito Federal e dos Territórios na composição do Conselho Nacional de Justiça.,Não,2023,PEC
5959,157535,Requer a retirada de tramitação do PL 2698/2023.,Sim,2023,RQS
5959,157408,"Susta a aplicação da Resolução nº 487, de 15 de fevereiro de 2023, do Conselho Nacional de Justiça – CNJ.",Sim,2023,PDL
5959,157131,"Requer a criação de Comissão Parlamentar Mista de Inquérito, composta de 15 (quinze) Senadores e 15 (quinze) deputados, e igual número de suplentes, para, no prazo de 180 (cento e oitenta) dias, investigar os atos de ação e omissão ocorridos no dia 08 de janeiro de 2023 nas Sedes dos Três Poderes da República, em Brasília, nos termos dos arts. 58 da Constituição Federal e 21 do Regimento Comum do Congresso Nacional.",Não,2023,RQN
5959,157382,"Altera a Lei nº 9.504, de 30 de setembro de 1997, para determinar a devolução ao Tesouro Nacional dos recursos do Fundo Especial de Financiamento de Campanha – FEFC, nos casos de cassação de registro, diploma ou mandato que especifica.",Sim,2023,PL
5959,157447,"Requer, nos termos dos arts. 336, III, e 338, III, do Regimento Interno do Senado Federal, urgência para o PRS 11/2023.",Não,2023,RQS
5959,157372,"Acrescenta o art. 149-B à Constituição Federal, para criar a contribuição em restituição ao financiamento estudantil, espécie de tributo que poderá ser instituído por lei específica e destinada a viabilizar sistemas de financiamento com pagamentos vinculados à renda futura.",Não,2023,PEC
