codigoParlamentar,CodigoMateria,Ementa,IndicadorAutorPrincipal,AnoMateria,AutoriasSigla
5783,143802,Voto de solidariedade à República do Líbano em decorrência do acidente ocorrido na zona portuária de Beirute no dia 04/08/2020.,Não,2020,RQS
5783,143838,Adição de assinatura ao RQS nº 1641/2020.,Sim,2020,RQS
5783,143509,Adição de assinatura ao RQS nº 1475/2020.,Sim,2020,RQS
5783,143550,Adição de assinatura à INS nº 53/2020.,Sim,2020,RQS
5783,143451,Adição de assinatura ao RQS nº 1454/2020.,Sim,2020,RQS
5783,146125,"Adição de assinatura à Emenda nº 76 - PLEN, apresentada à PEC nº 187/2019.",Sim,2020,RQS
5783,142971,"Altera o art. 225 da Constituição Federal para incluir, entre as incumbências do Poder Público, o estímulo a práticas de pagamento por serviços ambientais e a oferta de incentivos para a geração de empregos e formação de recursos humanos em atividades que contribuam para a qualidade ambiental.",Não,2020,PEC
5783,143115,"Realização de Sessão de Debates Temáticos, a fim de debater sobre o PL nº 2630/2020.",Não,2020,RQS
5783,146115,Convite do presidente da caixa para videoconferência em sessão remota do SF. (Debate Temático),Não,2020,RQS
5783,143080,Adição de assinatura ao Requerimento nº 3088/2020.,Sim,2020,RQS
5783,143153,Adição de assinatura ao RQS nº 1250/2020.,Sim,2020,RQS
5783,142943,"Adição de assinatura à Emenda n º 70, apresentada ao PL 4162/2019.",Sim,2020,RQS
5783,142670,Adição de assinatura ao PL nº 3434/2020.,Sim,2020,RQS
5783,143192,"Susta a Portaria nº 340, de 22 de junho de 2020, do Ministério da Justiça e Segurança Pública.",Sim,2020,PDL
5783,142705,Adia para o mês de dezembro a realização das eleições municipais previstas para outubro de 2020.,Não,2020,PEC
5783,143091,Adição de assinatura ao RQS nº 1220/2020.,Sim,2020,RQS
5783,143052,"Altera o art. 4º da I da Lei nº 8.935, de 18 de novembro de 1994 (Lei dos Cartórios), para prever a prestação remota dos serviços notariais e de registro.",Sim,2020,PL
5783,143186,Retirada de tramitação do PL nº 3541/2020.,Sim,2020,RQS
5783,143126,"Convite ao novo Ministro da Educação, Carlos Alberto Decotelli, para comparecer por meio de videoconferência a sessão remota do Plenário do Senado Federal, destinada ao debate temático sobre suas propostas e planos para a educação de nosso país.",Não,2020,RQS
5783,143020,Adição de assinatura ao RQS nº 1207/2020.,Sim,2020,RQS
5783,143316,"Adição de assinatura à proposta de emenda à Constituição registrada no SEDOL nº SF/20927.58734-06, tendo como primeiro signatário o Senador Fabiano Contarato.",Sim,2020,RQS
5783,143344,"Devolução ao  Presidente da República da MPV nº 927/2020, com o consequente arquivamento do PLV nº 18/2020, dela proveniente.",Sim,2020,RQS
5783,143363,"Devolução do PLV nº 18/2020, proveniente da MPV nº 927/2020.",Sim,2020,RQS
5783,142647,"Dispõe sobre a obrigatoriedade de implementação de políticas afirmativas destinadas à reserva de vagas para negros (as), indígenas e pessoas com deficiência em seus programas de pós - graduação.",Não,2020,PL
5783,143167,"Realização de sessão especial, em data oportuna, destinada a celebrar os 100 anos de nascimento de Celso Furtado.",Não,2020,RQS
5783,142964,Adição de assinatura ao PL 3462/2020.,Sim,2020,RQS
5783,142919,Adição de assinatura a emenda (s) relacionada (s) à PEC 18/2020.,Sim,2020,RQS
5783,142134,"Altera a Lei nº 13.982, de 2 de abril de 2020, para prorrogar o período de concessão do auxílio emergencial previsto na mesma Lei.",Sim,2020,PL
5783,142021,"Introduz dispositivos ao Ato das Disposições Constitucionais Transitórias, a fim de tornar coincidentes os mandatos eletivos.",Não,2020,PEC
5783,142368,"Susta a Portaria nº 13.474, de 2 de junho de 2020, da Secretaria Especial de Fazenda, do Ministério da Economia, que abre ao Orçamento Fiscal da União, em favor da Presidência da República, crédito suplementar no valor de R$ 83.904.162,00, para reforço de dotação constante da Lei Orçamentária vigente.",Não,2020,PDL
5783,142310,"Adição de assinatura a Proposta de Emenda à Constituição n. 24, de 2020, de autoria do Senador Jaques Wagner.",Sim,2020,RQS
5783,142016,"Acrescenta o art. 115 ao Ato das Disposições Constitucionais Transitórias (ADCT) para dispor sobre o adiamento das eleições municipais para Prefeito, Vice-Prefeito e Vereador, previstas para 4 de outubro de 2020, para o dia 6 de dezembro do mesmo ano, em decorrência das medidas para o enfrentamento da pandemia da Covid-19 declarada pela Organização Mundial da Saúde.",Não,2020,PEC
5783,141980,"Autoriza o Tribunal Superior Eleitoral a adiar as eleições municipais de outubro de 2020, em caso de necessidade e fixa o mandato dos Prefeitos, Vice-Prefeitos e Vereadores a serem eleitos nessas eleições, a fim de que haja a coincidência de todos os pleitos a partir de 2026.",Não,2020,PEC
5783,142374,"Adição de assinatura ao Projeto de Decreto Legislativo nº 257/2020, de autoria do Senador Rogério Carvalho.",Sim,2020,RQS
5783,142493,"Adição de assinatura ao PDL nº 270/2020, de autoria do Senador Rogério Carvalho.",Sim,2020,RQS
5783,142291,"Informações ao Ministro da Ciência, Tecnologia, Inovações e Comunicações, Marcos Pontes, sobre o acordo realizado entre este Ministério e a empresa estadunidense Cisco.",Sim,2020,RQS
5783,142573,"Adição de assinatura ao PL 3369, de 2020, de autoria do Senador Paulo Rocha.",Sim,2020,RQS
5783,142618,Adição de assinatura ao PDL nº 287/2020.,Sim,2020,RQS
5783,142501,"Altera a Lei nº 8.213, de 24 de junho de 1991, que dispõe sobre os Planos de Benefícios da Previdência Social e dá outras providências, para dispensar do cumprimento de carência para a concessão de aposentadoria por invalidez e de auxílio-doença os segurados do Regime Geral da Previdência Social acometidos pela doença de Crohn ou pela retocolite ulcerativa.",Sim,2020,PL
5783,142500,"Acresce Título II-A ao Livro I da Parte Geral do Código Civil (Lei nº 10.406, de 10 de janeiro de 2002), para disciplinar os entes despersonalizados.",Sim,2020,PL
5783,142074,"Altera a Lei nº 10.833, de 29 de dezembro de 2003, para estabelecer regime diferenciado da Contribuição para o Financiamento da Seguridade Social (COFINS) incidente sobre a receita bruta auferida pelas pessoas jurídicas com elevada receita que utilizam plataformas digitais.",Sim,2020,PLP
5783,142602,"Susta a Portaria nº 545, de 16 de junho de 2020, do Ministério da Educação, que revoga a Portaria Normativa MEC nº 13, de 11 de maio de 2016.",Não,2020,PDL
5783,142486,"Susta, nos termos do art. 49, V, da Constituição Federal, as Portarias nºs 1.266 a 1.579, todas de 5 de junho de 2020 e assinadas pela da Sra. Damares Regina Alves, Ministra de Estado da Mulher, da Família e dos Direitos Humanos, que anulam as Portarias editadas principalmente nos anos de 2003 e 2004 e que declaram a condição de anistiado político a diversos brasileiros vítimas dos regimes totalitários que vigeram na República Federativa do Brasil, ante a ausência de comprovação da existência de perseguição exclusivamente política no ato concessivo.",Não,2020,PDL
5783,142311,"Adição de assinatura ao proposta de emenda à constituição registrado no SEDOL nº SF/2069126832-26, de autoria do Senador Jaques Wagner.",Sim,2020,RQS
5783,142307,"Adição de assinatura à Proposta de Emenda à Constituição nº 24, de 2020, de autoria do Senador Jaques Wagner.",Sim,2020,RQS
5783,142277,"Altera a Lei nº 8.313, de 23 de dezembro de 1991, para incluir o apoio a apresentações de espetáculos ao vivo, com interação popular via internet.",Sim,2020,PL
5783,143419,"Realização de sessão especial, em data oportuna, a fim de
celebrar os 120 anos de nascimento do educador Anísio Teixeira",Não,2020,RQS
5783,142458,"Altera a Lei nº 11.340, de 7 de agosto de 2006 (Lei Maria da Penha), para prever o direito de as mulheres em situação de violência doméstica e familiar optarem pelo ajuizamento de ações de família nos Juizados de Violência Doméstica e Familiar.",Sim,2020,PL
5783,142213,"Adição de assinatura à proposta de emenda à constituição registrada no SEDOL nº SF/205661950966, de autoria do Senador Telmário Mota.",Sim,2020,RQS
5783,141987,"Acrescenta art. 20-A à Lei nº 8.212, de 24 de julho de 1991, para dispensar recolhimentos de contribuições previdenciárias, a cargo dos empregados domésticos, durante o período de calamidade pública, reconhecido pelo Decreto Legislativo nº 6, de 20 de março de 2020, e da emergência de saúde pública de importância internacional de pandemia do coronavírus (covid-19), e dá outras providências.",Sim,2020,PL
5783,141983,Altera o Ato das Disposições Constitucionais Transitórias para modificar regras fiscais em decorrência do surto de COVID-19.,Sim,2020,PEC
5783,141754,"Susta a Instrução Normativa nº 9, de 16 de abril de 2020, que disciplina o requerimento, análise e emissão da Declaração de Reconhecimento de Limites em relação a imóveis privados.",Não,2020,PDL
5783,141756,"Altera a Lei nº 13.979, de 6 de fevereiro de 2020, para dispor sobre uso compulsório de leitos privados disponíveis, de qualquer espécie, pelos entes federativos para a internação de pacientes acometidos de Síndrome Aguda Respiratória Grave ou com suspeita ou diagnóstico de COVID-19, e dá outras providências.",Não,2020,PL
5783,141752,"Altera a Lei nº 13.979, de 6 de fevereiro de 2020, para dispor sobre uso compulsório de leitos privados disponíveis, de qualquer espécie, pelos entes federativos para a internação de pacientes acometidos de Síndrome Aguda Respiratória Grave ou com suspeita ou diagnóstico de COVID-19, e dá outras providências.",Não,2020,PL
5783,141904,Retirada do RQS 355/2020.,Sim,2020,RQS
5783,141744,Altera o art. 155 da Constituição Federal para vedar a instituição do ITCD sobre as transmissões e doações às organizações da sociedade civil e aos institutos de pesquisa sem fins lucrativos.,Não,2020,PEC
5783,141892,"Tramitação conjunta do PL 2101/2020 com o PL 1542/2020, por tratarem da mesma matéria.",Sim,2020,RQS
5783,141878,"Susta o Despacho nº 4.410/2020 do Ministério do Meio Ambiente com efeito vinculante ao Ministério e entidades a ele vinculadas, publicado no Diário Oficial da União de 06 de abril de 2020, que dispõe que o regime de uso consolidado das Áreas de Preservação Permanente (APP) instituído pelo Código Florestal de 2012 (Lei 12.651/12), nos termos dos arts. 61-A e 61-B, incide sobre o Bioma Mata Atlântica.",Não,2020,PDL
5783,141829,"Cria o Programa Brasil Solidário (PBS) com a finalidade de prover recursos humanos de caráter solidário e temporário, para o enfrentamento da emergência de saúde pública e de economia decorrente da pandemia internacional de coronavírus de 2019.",Não,2020,PL
5783,141889,"Voto de congratulações à Irmã Ananília Regina, pela passagem dos 90 anos de seu nascimento.",Sim,2020,RQS
5783,141865,"Voto de congratulações à Irmã Ananília, fundadora da Casa dos Pobres em Currais Novos-RN, pela passagem dos 90 anos de seu nascimento, transcorrido em 9 de abril de 2020.",Sim,2020,RQS
5783,141897,"Susta o Decreto n° 10.344, de 11 de maio de 2020, que altera o Decreto nº 10.282, de 20 de março de 2020, que regulamenta a Lei nº 13.979, de 6 de fevereiro de 2020, para definir os serviços públicos e as atividades essenciais.",Não,2020,PDL
5783,141874,"Susta a Portaria Interministerial n° 1.634/GM-MD, de 22 de abril de 2020, que estabelece os quantitativos máximos de munições passíveis de aquisição pelos integrantes dos órgãos e instituições previstos nos incisos I a VII e X do caput art. 6º da Lei nº 10.826, de 2003, pelas pessoas físicas autorizadas a adquirir ou portar arma de fogo, e pelos demais agentes autorizados por legislação especial a portar arma de fogo.",Não,2020,PDL
5783,141670,"Altera a Lei nº 13.979, de 6 de fevereiro de 2020, que dispõe sobre as medidas para enfrentamento da emergência de saúde pública de importância internacional decorrente do coronavírus responsável pelo surto de 2019, para dispor sobre o reajuste das contraprestações pecuniárias de planos privados de assistência à saúde coletivos.",Sim,2020,PL
5783,141638,Voto de repúdio ao Presidente da República.,Não,2020,RQS
5783,141577,"Altera o art. 66 da Constituição Federal, para estabelecer o prazo de até dois dias uteis para a sanção em caso de situação de emergência e calamidade.",Não,2020,PEC
5783,141425,"Autoriza a prorrogação do vencimento das prestações de financiamento imobiliário do Sistema Financeiro de Habitação (SFH), do Sistema Financeiro Imobiliário (SFI) ou de quaisquer outras modalidades de financiamentos destinados à aquisição da casa própria no período que especifica e dá outras providências.",Sim,2020,PL
5783,141440,"Dispõe sobre medidas emergenciais de amparo aos agricultores familiares do Brasil para mitigar os impactos socioeconômicos da pandemia do COVID19, durante o período de vigor do estrado de calamidade pública no país, e dá outras providências.",Não,2020,PL
5783,141426,"Altera a Lei nº 7.689, de 15 de dezembro de 1988, para instituir adicional temporário de alíquota da contribuição social sobre o lucro líquido incidente sobre o resultado das instituições financeiras e das empresas de mineração, a vigorar durante os exercícios de 2020 a 2030.",Sim,2020,PL
5783,141286,"Declaração de prejudicialidade da alteração ao art. 20, § 3º, da LOAS, constante do art. 1º, do PL 1066/2020.",Sim,2020,RQS
5783,146459,Requer a apreciação do PLS 232/2016 pelo Plenário do Senado Federal.,Não,2020,R.S
5783,141096,"Altera o art. 5º da Constituição Federal, para incluir o acesso à internet entre os direitos fundamentais.",Não,2020,PEC
5783,141101,"Acrescenta o art. 169-A à Constituição Federal, para vedar cortes e contingenciamentos nos orçamentos das instituições de educação superior mantidas pela União.",Não,2020,PEC
5783,141087,"Instituição de Comissão Externa Mista para averiguar os critérios de distribuição dos benefícios e a efetividade, acesso e suporte do Programa Bolsa Família aos seus beneficiários legais, com prazo de duração de 180 dias e composta de 10 Senadores e 10 Deputados Federais titulares e igual número de suplentes.",Não,2020,RQN
5783,141202,"Altera a Lei Complementar nº 101, de 4 de maio de 2000, para instituir medidas de preservação de benefícios assistenciais e decorrentes de programas de transferência de renda enquanto subsistir estado de calamidade pública.",Sim,2020,PLP
5783,141203,"Dispõe sobre a utilização de recursos do Fundo de Amparo do Trabalhador (FAT) e do Fundo de Garantia do Tempo de Serviço (FGTS) para subsidiar a renda mínima da cidadania, durante o período de calamidade pública reconhecido pelo Decreto Legislativo nº6, de 20 de março de 2020, causado pela pandemia da COVID-19.",Sim,2020,PL
5783,141284,"Destaque para votação em separado do texto que altera o artigo 20, § 3º, da LOAS, constante do PL 1066/2020.",Sim,2020,RQS
5783,140876,Requer Sessão Especial para comemorar do Dia Internacional da Mulher,Não,2020,RQS
5783,140872,"Realização de Sessão de debates temáticos, em data oportuna, para discutir a criação do Conselho Nacional da Amazônia Legal.",Não,2020,RQS
5783,140976,"Realização de sessão especial, em 9 de março de 2020, para celebrar o Dia Internacional da Mulher",Não,2020,RQS
5783,140567,"Requer, nos termos do art. 58, § 2º, II da Constituição Federal e do art. 93, II do Regimento Interno do Senado Federal, a realização de audiência pública, com o objetivo de debater os ataques armados e incêndios criminosos perpetrados contra a população de Laranjeira Nhanderu, comunidade indígena da etnia Kaiowá localizada no município de Rio Brilhante/MS em 1º de janeiro de 2020.",Não,2020,REQ
5783,140808,Altera o art. 45 da Constituição para conceder ao brasileiro residente no exterior o direito de votar nas eleições majoritárias.,Não,2020,PEC
5783,141082,"Requer, nos termos do art. 93, I do Regimento Interno do Senado Federal, a realização de audiência pública, com o objetivo de instruir o PL 5961/2019, que altera a Lei nº 9.394, de 20 de dezembro de 1996, que estabelece as diretrizes e bases da educação nacional, para incluir, nos currículos do ensino fundamental e do ensino médio, para todos os alunos, conteúdos relativos à Língua Brasileira de Sinais (Libras). Proponho para a audiência a presença dos seguintes convidados: Representante do Ministério da Mulher, da Família e dos Direitos Humanos; Representante do Ministério da Educação; e Representante da Associação Nacional dos Surdos Oralizados - ANASO.",Sim,2020,REQ
5783,141070,"Realização de sessão especial, em data oportuna, destinada a homenagear o Dia Nacional da Imigração Judaica.",Não,2020,RQS
5783,141027,"Requer, nos termos do art. 93, I do Regimento Interno do Senado Federal, a realização de audiência pública, com o objetivo de instruir o PLP 275/2019, que declara a passagem de linhas de transmissão de energia elétrica por terras indígenas de relevante interesse público da União, na forma do § 6º do art. 231 da Constituição Federal.",Sim,2020,REQ
5783,140974,Oitiva da CMA sobre o Projeto de Lei nº 2.506/2019.,Sim,2020,RQS
5783,140985,"Sugere que o Brasil inclua a expressão ''meninas e mulheres com deficiência"" nos debates e textos concernentes aos fóruns da Organização das Nações Unidas durante os eventos alusivos aos 25 anos da Quarta Conferência Mundial sobre a Mulher e da Plataforma de Ação de Pequim (1995).",Não,2020,INS
5783,140994,"Realização de sessão de debates temáticos destinada a debater sobre o Tema: "" Proteção de Dados e Autoridade Nacional de Proteção de Dados (ANPD)"".",Não,2020,RQS
5783,140749,"Realização de Sessão Especial, em 04/12/2020, destinada a comemorar o Dia do Perito Criminal.",Não,2020,RQS
5783,140854,Solicita recurso para que o PL 3113/2019 (exame toxicológico para porte e posse de arma) tramite no Plenário,Não,2020,R.S
5783,140983,"Sugere que o Brasil inclua a expressão ""meninas e mulheres com deficiência"" nos debates e textos concernentes aos fóruns da Organização das Nações Unidas durante eventos  alusivos aos 25 anos da Quarta Conferência Mundial sobre a Mulher e da Plataforma de Ação de Pequim (1995).",Não,2020,INS
5783,140754,"Susta o Decreto nº 10.235, de 11 de fevereiro de 2020, que altera o Decreto nº 4.703, de 21 de maio de 2003, que dispõe sobre o Programa Nacional da Diversidade Biológica - PRONABIO e a Comissão Nacional da Biodiversidade e revoga o caput, inciso III, alíneas “a” a “e” do inciso X, incisos XII, XV, XVII do art. 6º e incisos VI a XX do caput do art. 7º do Decreto nº 4.703/2003.",Não,2020,PDL
5783,140639,"Altera o inciso XXVIII do art. 22 e acrescenta dispositivos aos arts. 23 e 24 da Constituição Federal, para dispor sobre o regime de competência para legislar sobre defesa e segurança cibernética e fixar a competência comum dos entes federados para zelar pela segurança cibernética dos serviços públicos.",Não,2020,PEC
5783,140619,"Susta o Decreto nº 10.224, de 5 de fevereiro de 2020, que revoga o Decreto nº 3.524, de 26 de junho de 2000 e o Decreto nº 6.985, de 20 de outubro de 2009, que regulamenta a Lei nº 7.797, de 10 de julho de 1989, que cria o Fundo Nacional do Meio Ambiente.",Não,2020,PDL
5783,140696,"Realização de sessão especial, em data oportuna, destinada a rememorar o Dia Internacional de Combate à Violência Contra a Mulher.",Não,2020,RQS
5783,140982,"Sugere que o Brasil inclua a expressão ""meninas e mulheres com deficiência"" nos debates e textos concernentes aos fóruns da Organização das Nações Unidas durante eventos  alusivos aos 25 anos da Quarta Conferência Mundial sobre a Mulher e da Plataforma de Ação de Pequim (1995).",Não,2020,INS
5783,140748,"Realização de Sessão Especial, em 21/09/2020, destinada a comemoração ao Dia Nacional de Luta da Pessoa com Deficiência.",Não,2020,RQS
5783,141084,"Susta a Instrução Normativa nº 7, de 21 de Fevereiro de 2020 do Instituto Brasileiro do Meio Ambiente e do Recursos Naturais Renováveis (IBAMA) que estabelece controle a posteriori para a exportação de madeiras, indicadas no Anexo II.",Não,2020,PDL
5783,140955,Realizar audiência pública para discutir o impacto do corte do Fundo de Manutenção e Desenvolvimento da Educação Básica e de Valorização dos Profissionais da Educação (Fundeb) na vida das mulheres.,Sim,2020,REQ
5783,140954,Realizar Audiência Pública para discutir as propostas de Reforma Tributária na perspectiva de gênero.,Sim,2020,REQ
5783,140680,Informações ao Ministro de Estado da Saúde.,Não,2020,REQ
5783,140620,Estabelece regras de recolhimento compulsório sobre recursos das instituições do Sistema Financeiro Nacional,Não,2020,PL
5783,140577,Realização de sessão especial destinada a homenagear o Dia do Profissional de Educação Física.,Não,2020,RQS
5783,140579,"Realização de Sessão Especial, em 22 de junho de 2020, destinada a homenagear o Dia Olímpico.",Não,2020,RQS
5783,140199,"Susta, nos termos do inciso V do art. 49 da Constituição Federal, o Decreto nº 10.147, de 2 de dezembro de 2019, que dispõe sobre a qualificação de unidades de conservação no âmbito do Programa de Parcerias de Investimentos da Presidência da República e sobre a sua inclusão no Programa Nacional de Desestatização.",Não,2019,PDL
5783,140185,Solicita urgência para o PL 5815/2019.,Não,2019,RQS
5783,140276,"Solicitamos, nos termos do art. 58, § 2º, I, da Constituição Federal e do art. 91, § 3º, do Regimento Interno do Senado Federal, que o PLS 166/2018, que altera o Código de Processo Penal para disciplinar a prisão após a condenação em segunda instância, deliberado terminativamente pela Comissão de Constituição, Justiça e Cidadania, seja apreciado pelo Plenário do Senado Federal.",Não,2019,R.S
5783,140205,Veda concessão e majoração de isenções e benefícios previdenciários na vigência do regime definido no art. 106 do ADCT.,Não,2019,PEC
5783,140578,Realização de Sessão Especial destinada a  homenagear o Dia da Defensoria Pública.,Não,2020,RQS
5783,140184,"Altera o art. 39 da Constituição Federal para vedar o pagamento de auxílio, ajuda ou qualquer outra forma de retribuição a título de reembolso de despesas efetuadas com moradia a senador, deputado federal, deputado estadual, deputado distrital e vereador.",Não,2019,PEC
5783,140340,Acrescenta o inciso X ao art. 170 e o inciso VIII ao § 1º do art. 225 da Constituição Federal.,Não,2019,PEC
5783,140240,"Altera os arts. 28, 29 e 77 da Constituição Federal, para definir as datas de realização do primeiro e segundo turno das eleições.",Não,2019,PEC
5783,140410,Requer Apreciação de Matéria pelo Plenário do PLS 166/2018,Não,2019,R.S
5783,140122,"Requeiro, nos termos do art. 58, § 2º, II, da Constituição Federal e do art.
93, II, do Regimento Interno do Senado Federal, a realização de audiência pública, com o objetivo de debater a PEC 188/19 no que tange à proposta de extinção de municípios brasileiros.",Não,2019,REQ
5783,140015,"Realização de Sessão Especial, em 24 de abril de 2020, destinada a celebração  do Aniversário do jornal Correio Braziliense.",Não,2019,RQS
5783,139995,"Convocação do Exmo. Sr. Ministro de Estado da Economia, Paulo Roberto Nunes Guedes, para que compareça ao Plenário, a fim de prestar informações sobre declarações dadas em entrevista coletiva na cidade de Washington/EUA, no dia 25 de novembro de 2019, relacionadas a medidas antidemocráticas (AI-5).",Não,2019,RQS
5783,140173,"Altera a Constituição Federal para disciplinar a apreciação dos vetos, separadamente, em cada Casa do Congresso Nacional.",Não,2019,PEC
5783,140131,Retificação do objeto do RQS 932/2019.,Não,2019,RQS
5783,140114,"Requer, nos termos do art. 96-B do Regimento Interno do Senado Federal, que a Comissão de Direitos Humanos e Legislação Participativa avalie a Política Pública de concessão de incentivos fiscais ao setor de produção e comercialização de defensivos agrícolas (agrotóxicos) , no exercício de 2019.",Sim,2019,REQ
5783,139916,Altera os arts. 49 e 225 da Constituição Federal para que o Congresso Nacional decida previamente sobre o corte e a supressão de vegetação da Floresta Amazônica.,Não,2019,PEC
5783,140134,Informações ao Ministro de Estado da Economia.,Sim,2019,RQS
5783,139917,"Insere o § 3o no art. 20 e o inciso VIII no § 1º do art. 225 da Constituição Federal, para instituir o Fundo Nacional para Emergências Ambientais, e acrescenta o art. 115 no Ato das Disposições Constitucionais Transitórias, para estabelecer a fonte de recursos para o Fundo.",Não,2019,PEC
5783,140153,Altera a Constituição Federal para instituir o Sistema Parlamentarista de Governo.,Não,2019,PEC
5783,140115,"Requer ...nos termos do art. 96-B do Regimento Interno do Senado Federal, que a Comissão de Assuntos Econômicos avalie a Política Pública de concessão de incentivos fiscais ao setor de produção e comercialização de defensivos agrícolas (agrotóxicos), no exercício de 2019.",Não,2019,REQ
5783,140016,"Realização de sessão especial, em 18 maio de 2020, destinada a rememorar e promover as ações relativas ao Dia Nacional de Combate ao Abuso e à Exploração Sexual de Crianças e Adolescentes.",Não,2019,RQS
