codigoParlamentar,TipoUsoPalavra,DataPronunciamento,LocalPronunciamento,TextoResumo,CodigoPronunciamento
5895,DIS,2019-04-30,Senado Federal,"Comentários sobre alterações promovidas pelo Senado na Medida Provisória nº 863, de 2018, com vistas a exigir a franquia de bagagem no valor das passagens aéreas.",453171
5895,PL,2019-04-24,Senado Federal,Apoio ao projeto apresentado pelo Senador Jayme Campos que legisla sobre as fronteiras do Brasil.,452842
5895,DIS,2019-04-24,Senado Federal,"Preocupação com notícia veiculada pelo jornal Folha de São Paulo sobre jantar realizado na residência oficial do Presidente da Câmara dos Deputados, onde líderes partidários teriam negociado com o Ministro-Chefe da Casa Civil o apoio à reforma da previdência.",452837
5895,DIS,2019-04-24,Senado Federal,"Comentários sobre a sessão ocorrida na CCJ, da Câmara dos Deputados, acerca da proposta de reforma da previdência. Preocupação com reportagem veiculada pelo jornal Folha de São Paulo que relata suposto oferecimento de R$ 40 milhões em emendas parlamentares para Deputados Federais que votarem a favor da reforma da previdência. Manifestação negativa à proposta de inserçãodo modelo de capitalização da previdência.",452829
5895,DIS,2019-04-23,Senado Federal,Explicações pessoais sobre a decisão do Tribunal Regional Eleitoral (TRE) de Mato Grosso de cassar o mandato de S. Exª por abuso de poder econômico e de prática de caixa dois.,452727
5895,DIS,2019-04-22,Senado Federal,"Registro da sessão especial, ocorrida nesta data, destinada a comemorar os 59 anos de Brasília, celebrado no dia 21 de abril.",453146
5895,DIS,2019-04-17,Senado Federal,"Breve histórico da importância do escritor Monteiro Lobato na valorizaçãoe exploração do petróleo, durante o governo do ex-Presidente Getúlio Vargas. Defesa da suspensão do reajuste do preço do diesel pelo Presidente Jair Bolsonaro. Posicionamento favorável à ação do Governo Federal para diminuir o impacto do ICMS nos Estados, o que tornaria os impostos sobre os combustíveis mais justos.",452929
5895,DIS,2019-04-16,Senado Federal,Apelo ao Presidente do Senado Federal para instalação da Comissão Parlamentar de Inquérito (CPI) dos Tribunais Superiores diante da decisão do Supremo Tribunal Federal (STF) que impôs a retirada de reportagem da revista Crusoé e do site O Antagonista.,452958
5895,DIS,2019-04-16,Senado Federal,"Expectativa em torno das políticas públicas do Governo Federal, em especial a valorização do salário mínimo.",452956
5895,DIS,2019-04-11,Senado Federal,Cobrança ao Senado de esclarecimentos quanto à fraude detectada na urna da eleição para a Presidência da Casa.,452706
5895,DIS,2019-04-10,Senado Federal,Manifestação em prol da redução das desigualdades sociais existentes no Brasil.,452433
5895,DIS,2019-04-10,Senado Federal,"Comentários sobre a XXII Marcha a Brasília em Defesa dos Municípios e sobre a importância da reformulação do pacto federativo, em prol de melhorias aos Municípios.",452417
5895,DIS,2019-04-05,Senado Federal,"Leitura e análise do Manifesto dos Pioneiros da Educação Nova, de 1932. Reflexão sobre a importância do desenvolvimento da educação e da cultura para o progresso do País",452008
5895,DIS,2019-04-02,Senado Federal,Considerações sobre o volume de recursos destinados ao funcionamento das instituições brasileiras em detrimento da carestia em que vive a população. Apresentação de proposição legislativa que visa promover a economia de recursos no âmbito do Senado Federal.,452272
5895,DIS,2019-03-25,Senado Federal,Destaque à importância de se dar andamento à Reforma da Previdência e críticas à crise de articulação envolvendo o Congresso e a Presidência da República acerca desta pauta.,451744
5895,DIS,2019-03-25,Senado Federal,Comentários sobre a crise institucional entre os Poderes da República.,451742
5895,DIS,2019-02-22,Senado Federal,Preocupação com o aumento do desemprego no País e destaque para o encerramento de atividades na unidade da Ford em São Bernardo-SP.,451106
5895,PL,2019-02-21,Senado Federal,Prestação de contas da atuação de S.Exª a respeito da Comissão Parlamentar de Inquérito das cortes superiores.,451134
5895,DIS,2019-02-20,Senado Federal,Expectativa com os desafios do Parlamento brasileiro no início da legislatura.,451060
5895,DIS,2019-02-20,Senado Federal,Apelo aos parlamentares para que seja realizada uma reforma política e destaque ao conjunto de propostas apresentadas por S. Exª  para a renovação do sistema político.,451055
5895,DIS,2019-02-20,Senado Federal,Preocupação com os efeitos da reforma da previdência no que tange ao Benefício de Prestação Continuada (BPC).,451054
5895,DIS,2019-02-20,Senado Federal,Manifestação favorável à harmonia entre os Poderes da República.,451053
5895,DIS,2019-02-20,Senado Federal,"Considerações e defesa da aprovação da reforma da previdência, que foi entregue ao Congresso Nacional pelo Presidente da República, Jair Bolsonaro.",451052
5895,DIS,2019-02-15,Senado Federal,Destaque ao potencial de exploração das reservas minerais para crescimento da economia no Estado de Roraima. Defesa da regulamentação do garimpo artesanal.,450941
5895,DIS,2019-02-15,Senado Federal,"Agradecimentos aos parlamentares pelo apoio na recriação da Frente Parlamentar de Logística, Transporte e Armazenagem.",450936
5895,DIS,2019-02-15,Senado Federal,Anúncio de mobilização pela liberação de recursos para a duplicação da BR-290.,450934
5895,DIS,2019-02-14,Senado Federal,"Satisfação por ter sido escolhido presidente da Comissão de Ciência, Tecnologia, Inovação, Comunicação e Informática (CCT) e agradecimentos ao partido de S. Exª, o Partido Progressista (PP), pela indicação. Destaque para a importância da ciência, da tecnologia e da inovação para o avanço econômico do País.",450946
5895,DIS,2019-02-14,Senado Federal,Considerações acerca dos benefícios que o recurso da telemedicina pode trazer à sociedade. Sugestão de audiência pública na Comissão de Assuntos Sociais (CAS) para o debate e o esclarecimento desta tecnologia.,450945
5895,DIS,2019-02-13,Senado Federal,Críticas ao conjunto de medidas anticrime recentemente apresentado pelo Ministério da Justiça e Segurança Pública.,450816
5895,DIS,2019-02-13,Senado Federal,Satisfação com a escolha de S. Exª. para presidir a Comissão de Direitos Humanos (CDH).,450814
5895,DIS,2019-02-11,Senado Federal,Destaque à renovação dos parlamentares do Congresso Nacional.,450753
5895,DIS,2019-02-11,Senado Federal,Manifestação de condolências às famílias do jornalista Ricardo Boechat e do piloto Ronaldo Quattrucci.,450751
5895,CIN,2019-02-11,Senado Federal,Indignação contra o Governo Federal por não ter realizado a correção dos limites da tabela de isenção do Imposto de Renda e destaque ao projeto de lei apresentado pela S. Exª que prevê a correção anual dos limites.,450748
5895,DIS,2019-02-08,Senado Federal,"Reflexão sobre a importância do Parlamento e da vocação política para o País.
      ",450737
5895,DIS,2019-02-08,Senado Federal,Críticas à suposta proposta do Governo Federal de reforma da previdência.,450736
5895,DIS,2019-02-07,Senado Federal,Breve histórico da vida pessoal e profissional de S. Exª.,450694
5895,DIS,2019-02-07,Senado Federal,Discurso de posse de S. Exa. Breve histórico de vida e atuação política de S. Exa.,450690
5895,DIS,2019-02-07,Senado Federal,"Breve histórico da trajetória de vida de S. Exª.  Cumprimentos ao Governador do Maranhão, Flávio Dino, pelos feitos realizados no último mandato. Destaque para a atuação de S. Exª como Deputada Estadual no Maranhão,Deputada Federal e para os pontos fundamentais de atuação parlamentar de S. Exª como Senadora. Reflexão sobre a necessidade da melhoria qualitativa da política brasileira. Leitura de poema de autoria da ex-Senadora Marina Silva.",450685
5895,DIS,2019-02-07,Senado Federal,"Breve histórico da vida de S. Exª.  Manifestação a favor do pacote anticrime apresentado pelo Ministro Sérgio Moro e da CPI de Brumadinho. Defesa da CPI do Poder Judiciário, proposta por S. Exª.",450684
5895,DIS,2019-02-07,Senado Federal,"Breve histórico sobre a vida pessoal, social, profissional e política de S. Exª.  Expectativas quanto a atuação parlamentar de S. Exª para a melhoria do País.",450682
5895,PL,2019-02-07,Senado Federal,Exposição da grave situação social e econômica enfrentada por grande parte da população brasileira. Argumentação sobre quais devem ser as prioridades do Congresso Nacional para o benefício do País.,450680
5895,DIS,2019-02-07,Senado Federal,Satisfação com a renovação política do Senado Federal e cumprimento aos Senadores que iniciaram seus mandatos na 56ª Legislatura.,450678
5895,DIS,2019-02-07,Senado Federal,Reflexão sobre o início do mandato de S. Exª como Senador pelo Estado de Roraima. Expectativas quanto à nova Legislatura para o desenvolvimento do País.,450676
5895,DIS,2019-02-07,Senado Federal,Discurso de posse de S. Exa.,450672
