codigoParlamentar,TipoUsoPalavra,DataPronunciamento,LocalPronunciamento,TextoResumo,CodigoPronunciamento
631,DIS,2024-04-10,Senado Federal,Indignação contra a atuação supostamente enviesada da Justiça Eleitoral em desfavor de políticos conservadores. Cobrança de uma ação institucional do Senado Federal em resposta aos alegados abusos cometidos em decisões do STF e do TSE.,505052
631,DIS,2024-04-10,Senado Federal,Alerta para a importância do respeito ao princípio da separação dos poderes. Críticas ao possível retorno do pagamento do seguro obrigatório DPVAT. Inconformismo com o peso da carga tributária sobre a população brasileira. Considerações sobre os gastos do Governo Federal.,505049
631,DIS,2024-04-10,Senado Federal,Discurso de posse de S. Exa.,505004
631,DIS,2024-04-09,Senado Federal,"Indignação com a disparidade na atuação do Judiciário em casos semelhantes, porém de classes sociais distintas. Necessidade de aprovar proposições que aumentem a pena para crimes contra a ordem tributária, o sistema financeiro, bem como corrupção, estelionato e tráfico de drogas.",505345
631,DIS,2024-03-21,Senado Federal,Cumprimentos ao Senador Romário pela realização da sessão especial em homenagem ao Dia Internacional da Síndrome de Down. Defesa da conscientização e inclusão das pessoas com Transtorno do Déficit de Atenção com Hiperatividade-TDAH e Transtorno do Espectro Autista-TEA.,504769
631,DIS,2024-02-20,Senado Federal,"Comemoração pela aprovação do Projeto de Lei (PL) n° 2253, de 2022, que ""Altera a Lei nº 7.210, de 11 de julho de 1984 (Lei de Execução Penal), para dispor sobre a monitoração eletrônica do preso, prever a realização de exame criminológico para progressão de regime e extinguir o benefício da saída temporária"". Congratulações ao relator do projeto, Senador Flávio Bolsonaro.",504032
631,CIN,2024-02-07,Senado Federal,"Celebração da aprovação da urgência ao Projeto de Lei no. 2253/2022, que aborda as saídas temporárias de presos e ênfase para a importância do devido processo legal no País.",503831
631,DIS,2024-02-07,Senado Federal,"Manifestação favorável ao Projeto de Lei no. 2253/2022, que limita a concessão do benefício da saída temporária para presos do regime semiaberto.",503826
631,DIS,2024-02-07,Senado Federal,Indignação com edital de processo seletivo publicado pela Universidade Federal de Santa Catarina (UFSC) em que é reservado percentual de vagas para pessoas trans.,503824
631,DIS,2023-12-06,Senado Federal,"Satisfação com a aprovação do Requerimento no.1005/2023, para realização de Sessão de Debates Temáticos em que se discutirá o conflito entre Israel e Hamas.",502977
631,DIS,2023-11-28,Senado Federal,"Apelo ao Governo Lula para a adoção de medidas urgentes em auxílio ao Estado de Santa Catarina, que se encontra em situação de calamidade pública devido às enchentes.",502710
631,DIS,2023-10-10,Senado Federal,"Preocupação com as enchentes que assolam o Estado de Santa Catarina. Manifestação de apoio à população de Israel em razão dos recentes ataques praticados pelo Hamas e críticas a políticos de esquerda que, supostamente, assinaram manifesto em favor do referido grupo palestino.",501220
631,DIS,2023-10-10,Senado Federal,"Solidariedade ao povo israelense. Anúncio da apresentação do Requerimento no. 899/2023, com pedido de informações ao Itamaraty acerca do posicionamento do Governo brasileiro sobre os ataques do grupo palestino Hamas contra Israel.",501218
631,DIS,2023-08-30,Senado Federal,"Indignação com a fala do Ministro da Justiça, Sr.  Flávio Dino, sobre o não armazenamento de imagens internas do respectivo ministério durante os ataques do dia 8 de janeiro. Exposição de projetos protocolados por S. Exa. que beneficiam a população mais pobre.",500073
631,DIS,2023-08-29,Senado Federal,"Defesa de Projeto de Lei nº 4283/2023, de autoria de S. Exa., que possibilitará a substituição da pena privativa de liberdade por restritiva de direitos nos crimes cometidos mediante violência ou grave ameaça, se não houver estabelecimento adequado para o cumprimento da pena em regime aberto.",500159
631,DIS,2023-08-29,Senado Federal,"Manifestação contrária à PEC nº 10/2022, que trata sobre as condições e os requisitos para a coleta e o processamento de plasma humano, uma vez que a proposta contempla a possibilidade de comercialização do plasma. Preocupação com as mortes decorrentes da diminuição das
      doações de sangue e a hiperinflação dos hemoderivados. Defesa da melhoria dos bancos de sangue e hemocentros.",500150
631,DIS,2023-06-13,Senado Federal,Indignação com a atuação de parlamentares da base do Governo na CPMI destinada a investigar os atos de 8 de janeiro pela não aprovação de diversos requerimentos de autoria de membros da oposição.,498258
631,DIS,2023-06-06,Senado Federal,"Registro sobre o Dia Nacional da Adoção e justificação do Projeto de Lei no. 2959/2023, que visa estabelecer o prazo máximo de 18 meses para a conclusão do processo de adoção após o início do estágio de convivência.",498232
631,DIS,2023-05-24,Senado Federal,"Críticas ao suposto ativismo judicial do STF e do Ministro Edson Fachin, em razão de decisão da Corte Suprema que rejeitou pedido formulado pelo Partido Podemos de suspensão da Resolução nº 487 do CNJ, que institui a política antimanicomial do Poder Judiciário. Preocupação com o julgamento no Supremo da descriminalização da posse de drogas para uso pessoal.",497898
631,DIS,2023-05-16,Senado Federal,"Inconformidade com a Resolução nº 487/2023, publicada pelo Conselho Nacional de Justiça (CNJ), que institui a Política Antimanicomial do Poder Judiciário, pois supostamente resultará em uma convivência da sociedade com condenados por crimes graves, aumentando a insegurança.",497478
631,DIS,2023-05-03,Senado Federal,"Críticas ao STF em razão da operação da Polícia Federal de buscas e apreensões realizadas no domicílio do ex-Presidente Jair Bolsonaro, devido a uma suposta falsificação de cartões de vacina.",497219
631,DIS,2023-04-25,Senado Federal,"Alerta para a votação, na Câmara dos Deputados, de Requerimento de Urgência ao Projeto de Lei nº. 2630/2020, que institui a Lei Brasileira de Liberdade, Responsabilidade e Transparência na Internet.",496993
631,PL,2023-04-25,Senado Federal,Preocupação com as ocupações de terras pelo Movimento dos Trabalhadores Rurais Sem Terra (MST) em propriedades privadas rurais.,496989
631,DIS,2023-04-25,Senado Federal,Apoio à leitura do requerimento e instauração da CPMI que busca investigar os atos do dia 8 de janeiro de 2023.,496985
631,DIS,2023-04-19,Senado Federal,Expectativa com a instalação de CPMI para investigar os atos do dia 8 de janeiro.,496815
631,DIS,2023-04-18,Senado Federal,"Necessidade de investigação dos atos de 8 de janeiro de 2023 por meio de CPMI ou CPI. Preocupação com possíveis retiradas de assinaturas que inviabilizem a instalação dessas comissões. Convite aos Senadores para visitar o pátio da Polícia Federal a fim de averiguar os ônibus utilizados nos atos de 8 de janeiro. Solidariedade com o Senador Sérgio Moro, denunciado pela PGR em virtude de supostas falas contra o Ministro do STF Gilmar Mendes.",496794
631,DIS,2023-04-18,Senado Federal,"Defesa da criação da CPMI destinada a investigar os atos antidemocráticos do dia 8 de janeiro. Críticas ao Presidente do Congresso Nacional, Senador Rodrigo Pacheco, pelo cancelamento da sessão conjunta agendada para esta data. Questionamento sobre as motivações de supostos atos de membros do Governo Federal para impedir a instalação da CPMI.",496780
631,DIS,2023-04-13,Senado Federal,Observações a respeito da posse e porte de armas de fogo.,496655
631,DIS,2023-04-13,Senado Federal,Considerações sobre o histórico dos ataques às escolas no Brasil. Defesa da gestão do Presidente Bolsonaro e da correlação entre o armamento da população e a redução da violência. Críticas ao atual Governo.,496654
631,DIS,2023-04-11,Senado Federal,Preocupação com os 174 presos preventivamente que estão no Complexo da Papuda devido aos atentados do dia 8 de janeiro de 2023 e defesa da abertura da Comissão Parlamentar Mista de Inquérito para apuração dos responsáveis pelos atos.,496637
631,DIS,2023-04-11,Senado Federal,Críticas à possível participação da ONG WWF na implementação da política nacional de gestão territorial e ambiental de terras indígenas.,496636
631,DIS,2023-04-11,Senado Federal,"Cumprimentos aos Prefeitos do Brasil pela comemoração, nesta data, do Dia do Prefeito.",496612
631,DIS,2023-03-22,Senado Federal,"Preocupação com a descoberta de possível plano de organização criminosa para cometer ataques contra S. Exa. e sua família e com a escalada do crime organizado no País. Agradecimentos às autoridades públicas e às forças policiais pela atuação no caso. Defesa do Projeto de Lei nº 1307, de 2023 , de autoria de S. Exa., que visa em especial ampliar a proteção dos agentes públicos ou processuais envolvidos no combate ao crime organizado.",496377
631,DIS,2023-03-21,Senado Federal,"Celebração do Dia Internacional da Síndrome de Down, comemorado em 21 de março, com destaque para os desafios na inclusão e aceitação de pessoas com a síndrome.",496318
631,DIS,2023-03-16,Senado Federal,"Preocupação com a paralisação de obras de escolas e creches por todo o Brasil. Destaque para a importância da educação infantil. Registro da criação de comissão, na CE, destinada a discutir sobre a reforma do ensino médio. Necessidade de o Senado Federal atualizar as metas contidas no Plano Nacional de Educação e discutir o piso salarial do magistério. Comentários acerca do Dia da Autonomia de Tocantins, celebrado em 18 de março.",496079
631,DIS,2023-03-16,Senado Federal,"Defesa da continuidade da Lei de Cotas, a Lei nº 12711/2012, que garante a reserva de vagas para negros, pardos, indígenas, pessoas com deficiência, alunos de baixa renda e estudantes de escolas públicas em universidades públicas e institutos federais. Destaque à Sessão Especial pelo Dia Internacional da Luta pela Eliminação da Discriminação Racial, que acontecerá na próxima segunda-feira, dia 20 de março.",496066
631,DIS,2023-03-14,Senado Federal,"Defesa do combate à corrupção no País, especialmente a Operação Lava Jato. Elogios ao Ministro do STF André Mendonça, por pedir vista em uma ação que questiona a constitucionalidade da Lei nº 13303/2016, chamada de Lei das Estatais. Pedido para aprofundar a discussão sobre a aprovação do Projeto de Lei nº 2896/2022, que revoga parcialmente a Lei das Estatais.",496014
631,DIS,2023-03-14,Senado Federal,"Preocupação com o índice de mortalidade materna no País, especialmente com a suposta retirada do País do Consenso de Genebra. Repúdio à prática do aborto e defesa do Projeto de Lei nº 478/2007, conhecido como Estatuto do Nascituro, e do Projeto de Lei nº 2313/2022, que dispõe sobre o amparo da gestante.",496011
631,DIS,2023-03-09,Senado Federal,"Elogios à ação da Polícia Civil do Estado do Rio Grande do Norte, que investiga supostos desvios, ocorridos em 2020, praticados por servidores públicos da Controladoria-Geral do Estado. Críticas à qualidade da gestão de recursos públicos realizada pela atual Governadora do Estado Fátima Bezerra, com destaque para o uso do Fundo Nacional de Segurança Pública (FNSP).",495926
631,DIS,2023-03-09,Senado Federal,"Preocupação com o aumento da violência no Estado do Ceará e no restante da Região Nordeste, de acordo com dados constatados em relatórios anuais divulgados pelo Fórum Brasileiro de Segurança Pública, pelo Núcleo de Estudos da Violência da USP e também pela ONU.",495924
631,DIS,2023-03-09,Senado Federal,"Insatisfação com o aumento das alíquotas de impostos e taxas no País, principalmente com a proposta de retorno de cobrança do ICMS na conta de energia elétrica.",495921
631,DIS,2023-02-28,Senado Federal,"Considerações quanto à necessidade de se implementar reformas estruturantes, a exemplo da reforma tributária, como forma de alavancar o desenvolvimento econômico do País.",495722
631,DIS,2018-05-28,Senado Federal,Destaque ao alerta feito por S. Exa sobre a necessidade de se discutir a política de preços praticada pela Petrobras sobre os combustíveis.,445921
631,PL,2018-05-28,Senado Federal,Críticas ao oportunismo de alguns indivíduos diante da crise instalada no País.,445917
631,DIS,2018-05-28,Senado Federal,"Questionamento sobre a política de preços da Petrobras e apresentação de propostas para a possível solução da greve dos caminhoneiros.
      ",445816
631,DIS,2018-05-28,Senado Federal,Defesa dos caminhoneiros e críticas à política de preços da Petrobras.,445815
631,DIS,2018-04-17,Senado Federal,Expectativa quanto à deliberação do STF sobre o foro especial por prerrogativa de função.,444055
631,DIS,2018-03-28,Senado Federal,Considerações sobre a Proposta de Emenda à Constituição de autoria de S. Exª que visa legitimar a prisão após condenação em segunda instância.,442821
631,DIS,2018-03-21,Senado Federal,"Discurso de despedida de S. Exª, Suplente do Senador Antônio Carlos Valadares, devido ao retorno do titular.",442701
631,DIS,2018-02-27,Senado Federal,"Registro de preocupação com a situação por que passa o Estado do Maranhão  (MA), em razão dos prejuízos causados pelas chuvas.",441822
631,DIS,2018-02-05,Senado Federal,Comentários sobre a necessidade de preservação das instituições e dos valores democráticos do País.,440961
631,PL,2017-11-23,Senado Federal,Defesa da aprovação do projeto de lei que institui o Dia Nacional do Krav Maga.,438322
631,DIS,2017-09-27,Senado Federal,Considerações acerca da decisão do Supremo Tribunal Federal (STF) de afastar o Senador Aécio Neves do mandato.,435615
631,DIS,2017-09-26,Senado Federal,Críticas ao Governo do Presidente Michel Temer pela proposta orçamentária enviada ao Congresso prevendo o contingenciamento de recursos para áreas sociais.,435313
631,DIS,2017-09-12,Senado Federal,Defesa da continuidade das investigações no âmbito da operação Lava Jato.,434626
631,DIS,2017-05-10,Senado Federal,"Leitura de documento de autoria do economista Luiz Carlos Bresser-Pereira, intitulado ""O Projeto Brasil Nação"".",431298
631,DIS,2017-05-09,Senado Federal,Defesa da rejeição das reformas previdenciária e trabalhista propostas pelo governo federal.,431051
631,DIS,2017-05-02,Senado Federal,"Resposta ao pronunciamento da Senadora Fátima Bezerra acerca do Decreto Presidencial de 26 de abril de 2017, que dispõe sobre a convocação da Conferência Nacional de Educação, Conae.",430944
631,PL,2017-05-02,Senado Federal,Críticas ao Governo Federal por desrespeitar os direitos humanos.,430941
631,DIS,2017-04-25,Senado Federal,"Leitura de carta de autoria da Associação Comercial do Paraná e da União Geral dos Trabalhadores, com manifestação contrária à aprovação da lei contra o abuso de autoridade.",430541
631,DIS,2017-04-11,Senado Federal,Defesa da aprovação do projeto de lei de abuso de autoridade e do fim do foro especial; e de rejeição da proposta de reforma eleitoral quanto à votação em lista fechada.,430369
631,PL,2017-04-05,Senado Federal,Defesa das medidas adotadas pelo Ministério da Educação no Governo Temer.,430135
631,DIS,2017-04-04,Senado Federal,"Comentários sobre a situação da BR-158, que liga o Vale do Araguaia aos portos dos Estados do Pará e Maranhão.",430070
631,PL,2017-04-04,Senado Federal,Comentários sobre as melhorias que visam o desenvolvimento do Estado do Espírito Santo.,430062
631,DIS,2017-03-14,Senado Federal,Crítica á compra do livro infantil “A Máquina de Brincar” para as escolas do País.,429446
631,PL,2016-11-30,Senado Federal,Críticas às alterações ocorridas na Câmara dos Deputados ao Projeto de Lei “Dez Medidas Contra a Corrupção”.,428006
631,DIS,2016-11-08,Senado Federal,"Considerações sobre a reunião conjunta da Comissão de Constituição, Justiça e Cidadania e da Comissão de Assuntos Econômicos, para debater a Proposta de Emenda Constitucional do teto dos gastos públicos.",427022
631,DIS,2016-10-25,Senado Federal,"Manifestação contrária à decisão do STF de proibir a vaquejada, defendendo a regulamentação da mesma.",426776
631,DIS,2016-10-25,Senado Federal,"Defesa da rejeição do Projeto de Lei do Senado 280, de 2016, que define os crimes de abuso de autoridade e dá outras providências.",426775
631,DIS,2016-10-19,Senado Federal,Preocupação com o desemprego no Brasil e referência aos ajustes efetuados pelo IBGE na metodologia de cálculo do desemprego; e outros assuntos.,426465
631,CIN,2016-10-19,Senado Federal,"Questionamentos acerca do Projeto de Lei do Congresso Nacional nº 08/2016, que abre crédito suplementar no Orçamento Fiscal da União em favor do Ministério da Educação, para o pagamento das pendências relativas ao Fies, tendo como fonte de recursos o superávit de 2015.",426461
631,DIS,2016-08-08,Senado Federal,"Crítica à decisão do Ministro de Minas e Energia, Senhor Fernando Bezerra Filho, de cancelar a concessão da Companhia Energética de Roraima (CERR), e anúncio de convocação do Ministro para a Comissão de Direitos Humanos e a de Comissão de Infraestrutura, a fim de obter explicações acerca da atitude tomada.",424497
631,PL,2016-08-08,Senado Federal,"Críticas ao Projeto de Lei do Senado nº 280/2016, de autoria do Senador Renan Calheiros, que define os crimes de abuso de autoridade incluindo, no tipo penal, diversas condutas de agentes públicos dos poderes de Estado.",424496
631,DIS,2016-08-08,Senado Federal,"Defesa da honestidade da Presidente Dilma Rousseff e crítica ao seu processo de impeachment, devido ao não cometimento de crime de responsabilidade.",424493
631,DIS,2016-07-11,Senado Federal,Defesa da realização de reformas político-administrativas no País e destaque para proposições de autoria de S. Exª que têm como objetivo o aprimoramento do sistema político brasileiro.,424094
631,DIS,2016-07-07,Senado Federal,Defesa da aprovação de projeto de resolução que prevê a unificação nacional da alíquota do ICMS incidente sobre querosene para aviação.,424084
631,DIS,2016-06-09,Senado Federal,Comentários sobre a situação econômica do País; e outros assuntos.,423029
631,PL,2016-06-01,Senado Federal,"Registro da realização de audiência com o Senhor Alexandre de Moraes, Ministro da Justiça do Governo interino, sobre o combate ao narcotráfico e a situação precária da segurança pública no Estado do Acre.",423039
631,DIS,2016-06-01,Senado Federal,"Elogio ao Senado pela aprovação de proposições voltadas ao combate à violência contra a mulher, e defesa da votação do projeto de lei, de autoria de S. Exª, que criminaliza a conduta de assédio sexual em transportes coletivos conhecida como “encoxamento”.",422986
631,CIN,2016-05-10,Senado Federal,"Pesar pelo falecimento de Luiz Henrique da Silveira, ex-Senador por Santa Catarina, falecido em 10 de maio 2015.",422395
631,PL,2016-04-26,Senado Federal,Explicações sobre decisão do Supremo Tribunal Federal que autoriza a quebra dos sigilos bancário e fiscal de S. Exª.,422447
631,DIS,2016-04-25,Senado Federal,Apoio à denúncia de que a Presidente da República cometeu crime de responsabilidade.,422126
631,DIS,2016-04-20,Senado Federal,Preocupação com o cenário político no Brasil e repercussão de matérias veiculadas pela mídia internacional acerca do processo de impeachment da Presidente Dilma Rousseff.,421905
631,DIS,2016-04-19,Senado Federal,"Críticas ao Presidente do PDT, Carlos Lupi, reprovando a declaração de que o mesmo expulsará do partido os parlamentares que votarem a favor da admissibilidade do processo de impeachment da Presidente Dilma Rousseff.",422037
631,PL,2016-04-18,Senado Federal,"Críticas a parlamentares governistas por tentarem promover uma dicotomia na sociedade entre os favoráveis e os contrários ao impeachment de Dilma Rousseff, Presidente da República.",421854
631,DIS,2016-04-14,Senado Federal,"Defesa da rejeição do impeachment da Presidente da República Dilma Rousseff, em razão da ausência da prática de crime de responsabilidade.",422109
631,DIS,2016-04-14,Senado Federal,"Defesa da aprovação do impeachment da Presidente da República Dilma Rousseff, em razão da edição de decretos presidenciais abrindo créditos suplementares violando o Orçamento e a Lei de Responsabilidade Fiscal.",422108
631,DIS,2016-04-12,Senado Federal,"Defesa da aprovação do 'impeachment' da Senhora Dilma Rousseff, Presidente da República, e solicitação de transcrição nos Anais do Senado de editorial, publicado pela Folha de São Paulo, sobre o legado negativo deixado pela Presidente Dilma Rousseff.",421813
631,DIS,2016-03-30,Senado Federal,Defesa da decisão do PMDB de sair do Governo Dilma Rousseff.,421454
631,DIS,2016-03-22,Senado Federal,"Leitura de nota do Diretório Estadual do PMDB do Mato Grosso do Sul, defendendo o imediato rompimento do partido com o Governo Federal e criticando a nomeação do senhor Luiz Inácio Lula da Silva para o cargo de Ministro Chefe da Casa Civil.",421340
631,PL,2016-03-17,Senado Federal,Indignação com a suposta tentativa da Presidente Dilma Rousseff de obstruir a Justiça ao nomear o ex-Presidente Lula para o cargo de Ministro de Estado.,421495
631,POR,2015-10-28,Senado Federal,Homenagem pelo transcurso do Dia do Servidor Público; e outro assunto.,417861
631,DIS,2015-10-27,Senado Federal,Defesa da regulamentação dos jogos de azar no País; e outros assuntos.,418094
631,DIS,2015-10-07,Senado Federal,Críticas ao Ministro do TCU Augusto Nardes por ter supostamente antecipado o voto no julgamento das contas da Presidência da República referentes ao ano de 2014; e outros assuntos.,417244
631,DIS,2015-09-23,Senado Federal,Esclarecimentos acerca do procedimento de votação dos vetos presidenciais e lamento pela manutenção de veto aposto a projeto de autoria de S. Exª.,417451
631,DIS,2015-07-13,Senado Federal,Registro da participação de S. Exª em debate no Acre acerca da judicialização e reforma política; e outros assuntos.,414671
631,DIS,2015-06-09,Senado Federal,Críticas à forma como foi conduzida a Parada Gay em São Paulo.,414145
631,DIS,2015-06-08,Senado Federal,Críticas ao atual modelo do sistema penitenciário nacional; e outro assunto.,414270
631,DIS,2015-06-02,Senado Federal,Defesa da sanção de projeto de lei de conversão que flexibiliza o fator previdenciário; e outros assuntos.,414192
631,DIS,2015-05-27,Senado Federal,"Crítica ao pronunciamento do ex-Presidente da República, Luiz Inácio Lula da Silva, em que teria ofendido os evangélicos.",413855
631,DIS,2015-04-29,Senado Federal,Manifestação contrária ao projeto de lei que dispõe sobre a terceirização tal como proposto pela Câmara dos Deputados; e outros assuntos.,413032
631,DIS,2015-03-25,Senado Federal,Alerta ao Congresso Nacional quanto à necessidade de um plano completo capaz de retirar o País da crise que enfrenta.,411677
631,PL,2015-02-24,Senado Federal,Preocupação com a greve dos caminhoneiros.,411138
631,DIS,2015-02-24,Senado Federal,Apelo para que o Governo Federal se posicione em relação à crise na Venezuela.,411137
631,DIS,2015-02-11,Senado Federal,Comentários sobre a trajetória e a área de atuação parlamentar de S. Exª; e outro assunto.,411021
631,DIS,2014-12-16,Senado Federal,Comentários sobre os recentes casos de corrupção envolvendo o governo do Estado de Rondônia; e outro assunto.,410414
631,DIS,2014-12-16,Senado Federal,Discurso de despedida de S. Exª do Senado Federal.,410389
631,DIS,2014-12-10,Senado Federal,Discurso de despedida do Senado Federal e reflexão sobre a trajetória política de S.Exª ao longo dos últimos sessenta anos.,410296
631,DIS,2014-12-09,Senado Federal,Considerações sobre a atuação parlamentar de S. Exª.,410264
631,DIS,2014-11-12,Senado Federal,Necessidade de rediscussão do sistema penal brasileiro; e outro assunto.,409952
631,PL,2014-11-11,Senado Federal,Defesa da extinção da cobrança de taxas dos ocupantes de terrenos da Marinha.,409900
631,DIS,2014-11-05,Senado Federal,Posicionamento acerca da atuação de S. Exª e da oposição na próxima Legislatura; e outros assuntos.,409754
631,DIS,2014-05-13,Senado Federal,Preocupação com o problema de abastecimento de água no Estado de São Paulo; e outros assuntos.,407323
631,DIS,2014-05-06,Senado Federal,Insatisfação com o pedido de vista a projeto de lei de autoria de S.Exª que estabelece regras para a aposentadoria de pescadores; e outros assuntos.,408049
631,DIS,2014-04-03,Senado Federal,Preocupação com as dificuldades enfrentadas pela população do Acre em virtude de enchente que ocorre nesta localidade; e outro assunto.,406773
631,DIS,2014-04-02,Senado Federal,"Cobrança de mais investimento na Zona Franca de Guajará-Mirim, no Estado de Rondônia; e outro assunto.",406761
631,PL,2014-03-12,Senado Federal,Defesa de reforma do setor de segurança pública do País e de valorização da Polícia Federal.,406254
631,PL,2013-12-18,Senado Federal,Registro das atividades legislativas desenvolvidas por S. Exª no ano corrente.,405623
631,PL,2013-12-03,Senado Federal,Irresignação com a tentativa de vinculação da família de S. Exª com rumorosa apreensão de drogas realizada pela Polícia Federal.,404748
631,DIS,2013-10-09,Senado Federal,Reflexões acerca do fuso horário do Acre; e outros assuntos.,404063
