codigoParlamentar,TipoUsoPalavra,DataPronunciamento,LocalPronunciamento,TextoResumo,CodigoPronunciamento
4560,DIS,2024-02-06,Senado Federal,"Satisfação com a aprovação, no âmbito da CSP, do Projeto de Lei nº 2253/2022, que limita a concessão do benefício da saída temporária para presos do regime semiaberto",503759
4560,DIS,2023-09-20,Senado Federal,"Insatisfação com o serviço prestado pelas companhias aéreas nacionais, especialmente no Estado do Mato Grosso.",500699
4560,DIS,2022-12-21,Senado Federal,Discurso de despedida de S. Exa. do mandato de Senador da República.,495137
4560,DIS,2019-05-22,Senado Federal,"Breve histórico da criação, em 2011, da Rondônia Rural Show, feira de tecnologia voltada ao agronegócio, atualmente em sua oitava edição, e comentários sobre a importância do evento para a região.",453802
4560,DIS,2019-03-21,Senado Federal,Destaque para a importância da criação de consórcios de Governadores e apoio à criação do consórcio da Amazônia com o objetivo de superar as crises econômicas de determinados estados brasileiros.,451763
4560,DIS,2018-12-13,Senado Federal,Prestação de contas da atuação parlamentar e expectativas em torno do mandado de S. Exª. no Governo do estado do Acre (AC).,450302
4560,DIS,2017-10-31,Senado Federal,Insatisfação com a crescente violência que atinge o País.,437621
4560,PL,2017-03-21,Senado Federal,Repercussão sobre matéria publicada pela Folha de S. Paulo relativa à Operação Carne Fraca.,429634
4560,DIS,2017-03-07,Senado Federal,Críticas à qualidade das estradas de Rondônia e ao atraso na licitação que busca promover melhorias na BR-364.,429167
4560,DIS,2016-11-10,Senado Federal,"Registro da importância do programa de conclusão de obras inacabadas do Governo Federal, enfatizando a execução do programa no Mato Grosso (MT), e a relação do mesmo com seu trabalho  como relator da Lei de Diretrizes Orçamentárias (LDO).",427189
4560,PL,2016-11-10,Senado Federal,"Registro de artigo de imprensa publicado na edição de 9 de novembro último da revista Exame, acerca do novo modelo de concessões para o setor elétrico apresentado pelo Governo Federal, com destaque a linhas de transmissão a serem licitadas em Rondônia.",427188
4560,DIS,2016-09-12,Senado Federal,"Críticas aos resultados do Índice de Desenvolvimento da Educação Básica (Ideb) e defesa da rediscussão de todo o sistema educacional do País.
      ",425697
4560,DIS,2016-07-12,Senado Federal,Homenagem à Igreja Batista do Estado do Espírito Santo pelo aniversário de cem anos.,424262
4560,PL,2016-06-01,Senado Federal,"Repúdio aos parlamentares da oposição pelas exigências e reclamações feitas ao Governo Interino após 15 dias de sua posse, e crítica ao Partido dos Trabalhadores (PT) pelas suas políticas sociais progressistas à frente do Governo Federal.",423038
4560,DIS,2016-05-10,Senado Federal,"Crítica ao Presidente interino da Câmara dos Deputados, Waldir Maranhão, pela sua decisão de anular a sessão de votação da admissibilidade do impeachment da Presidente Dilma Rousseff naquela Casa.",422397
4560,CIN,2016-05-10,Senado Federal,"Pesar pelo falecimento de Luiz Henrique da Silveira, ex-Senador por Santa Catarina, falecido em 10 de maio 2015.",422395
4560,DIS,2016-04-27,Senado Federal,"Defesa de uma mudança no modelo de governo caso o Vice-Presidente da República, Michel Temer, assuma a Presidência da República.",422175
4560,DIS,2016-04-05,Senado Federal,Registro da assunção de S. Exª ao cargo de Presidente Nacional do PMDB e defesa da decisão do partido de sair da base de apoio ao Governo.,421884
4560,DIS,2016-03-22,Senado Federal,"Elogio à atuação dos governos federal, estadual e municipal em relação a obras rodoviárias no Acre.",421328
4560,DIS,2016-03-17,Senado Federal,Críticas ao Governo Federal pelos recentes episódios envolvendo a nomeação do Ex-Presidente Lula para o cargo de Ministro de Estado.,421492
4560,DIS,2016-03-17,Senado Federal,Indignação com o Ex-Presidente Lula por supostamente vincular o nome de S. Exª ao episódio da apreensão de helicóptero com drogas em 2013.,421487
4560,CIN,2016-03-15,Senado Federal,Registro da recriação da Frente Parlamentar Mista em Defesa da Previdência Social.,421218
4560,DIS,2016-03-01,Senado Federal,"Defesa da sustação da Portaria Interministerial nº 192, que suspendeu o pagamento do seguro-defeso a pescadores.",420928
4560,DIS,2015-11-26,Senado Federal,Comentários sobre a votação que manteve a prisão do Senador Delcídio do Amaral.,419419
4560,CIN,2015-11-11,Senado Federal,Registro de PEC da qual S. Exª é signatário que regulamenta o orçamento impositivo e a transferência de recursos provenientes de emendas parlamentares aos Estados e Municípios; e outros assuntos.,418304
4560,DIS,2015-11-03,Senado Federal,Apelo ao Governo Federal pelo asfaltamento da BR-319; e outros assuntos.,418017
4560,POR,2015-10-28,Senado Federal,Homenagem pelo transcurso do Dia do Servidor Público; e outro assunto.,417861
4560,CIN,2015-10-21,Senado Federal,Repúdio ao gesto do governo venezuelano de sugerir à Unasul a troca do ex-ministro da Justiça Nelson Jobim pelo ex-chanceler argentino Jorge Taiana para chefiar os observadores das eleições parlamentares da Venezuela.,418107
4560,DIS,2015-10-20,Senado Federal,"Repúdio ao veto do governo venezuelano à indicação de Nelson Jobim, ex-Ministro da Justiça e ex-Ministro do STF, à função de observador nas eleições legislativas daquele país.
      ",417906
4560,DIS,2015-10-13,Senado Federal,Defesa da obediência ao devido processo legal para a eventual instalação do processo de impeachment da Presidente da República.,417720
4560,DIS,2015-10-07,Senado Federal,Anúncio de que medidas serão adotadas para o combate aos ataques criminosos ocorridos em Rio Branco - AC.,417247
4560,PL,2015-09-23,Senado Federal,"Apoio a projeto de lei que regulamenta os jogos de azar, como forma de aumentar a arrecadação dos cofres públicos e modernizar a economia brasileira.",417470
4560,DIS,2015-09-17,Senado Federal,"Indignação com a suspensão das obras de ponte sobre o Rio Madeira, no Acre; e outros assuntos.",416765
4560,DIS,2015-08-24,Senado Federal,"Comentários acerca de entrevista dada pelo presidente do Banco Itaú Unibanco, o Sr. Setubal.",415944
4560,PL,2015-08-24,Senado Federal,Comparação dos mandatos do PT e do PSDB no comando do Governo Federal,415943
4560,PL,2015-08-20,Senado Federal,Registro da instalação da Frente Parlamentar Mista Brasil-Peru-China Pró Ferrovia Bioceânica; e outro assunto.,415832
4560,DIS,2015-06-23,Senado Federal,Críticas à recepção oferecida pelo Governo venezuelano à comitiva de Senadores que viajaram ao País em missão oficial.,414554
4560,PL,2015-06-19,Senado Federal,Relato dos fatos ocorridos com a comitiva de Senadores brasileiros em visita oficial à Venezuela.,414320
4560,PL,2015-06-17,Senado Federal,Apoio ao fortalecimento dos Municípios no Pacto Federativo; e outro assunto.,415578
4560,DIS,2015-06-17,Senado Federal,"Críticas à implementação de bandeiras tarifárias na cobrança de energia elétrica em estados que não estão completamente integrados ao Sistema Interligado Nacional, em especial o Acre; e outros assuntos.",415575
4560,DIS,2015-05-05,Senado Federal,"Apelo ao Governo Federal para a instalação de infraestrutura alfandegária entre Assis Brasil, no Acre e Iñapari, no Peru, para facilitar o comércio internacional na região.",412899
4560,DIS,2015-04-08,Senado Federal,Apelo às instituições públicas e privadas para que reestabeleçam seus serviços no Município de Brasiléia/AC; e outro assunto.,412201
4560,CIN,2015-03-10,Senado Federal,Preocupação com a questão das enchentes no Estado do Acre.,411502
4560,DIS,2015-03-10,Senado Federal,Indignação por o nome de S. Exª constar em lista encaminhada pelo Procurador- Geral da República ao STF para abertura de inquérito relativo à “Operação Lava Jato”.,411495
4560,PL,2015-02-24,Senado Federal,Preocupação com a greve dos caminhoneiros.,411138
4560,DIS,2015-02-24,Senado Federal,Apelo para que o Governo Federal se posicione em relação à crise na Venezuela.,411137
4560,DIS,2015-02-11,Senado Federal,Comentários sobre a trajetória e a área de atuação parlamentar de S. Exª; e outro assunto.,411021
4560,DIS,2014-12-16,Senado Federal,Discurso de despedida de S. Exª do Senado Federal.,410389
4560,DIS,2014-12-16,Senado Federal,Discurso de despedida de S. Exª do Senado Federal.,410385
4560,DIS,2014-12-02,Senado Federal,Alegria pela aprovação de S. Exª para o Tribunal de Contas da União.,410157
4560,DIS,2014-11-25,Senado Federal,Desilusão com o desenvolvimento da atividade legislativa no Congresso Nacional.,410092
4560,DIS,2014-11-06,Senado Federal,"Indignação com a demora da Justiça Eleitoral em julgar candidatos tempestivamente, de modo a não lhes causar prejuízo nas eleições que disputam; e outros assuntos.",409812
4560,DIS,2014-11-05,Senado Federal,Posicionamento acerca da atuação de S. Exª e da oposição na próxima Legislatura; e outros assuntos.,409754
4560,DIS,2014-08-06,Senado Federal,"Registro do transcurso do aniversário do início da Revolução Acriana, que resultou na conquista de território anteriormente pertencente a Bolívia; e outro assunto.",409288
4560,DIS,2014-05-27,Senado Federal,Satisfação com a criação de quarenta vagas para o curso de medicina na cidade de Araguaína e exigência de providências do governo do estado na área da saúde.,408669
4560,CIN,2014-04-01,Senado Federal,Preocupação com as consequências da cheia do Rio Madeira para o Estado do Acre.,406688
4560,DIS,2014-03-26,Senado Federal,Críticas ao aumento dos preços das passagens aéreas e defesa do aumento de voos tendo como origem ou destino o Estado do Acre; e outros assuntos.,406531
4560,PL,2014-03-12,Senado Federal,Defesa de reforma do setor de segurança pública do País e de valorização da Polícia Federal.,406254
4560,PL,2014-02-18,Senado Federal,Anúncio da intenção de S. Exª de concorrer à Presidência da República e comentários sobre sua trajetória política.,405988
4560,DIS,2013-12-17,Senado Federal,Comentários sobre PEC que estende aos “soldados da borracha” os benefícios concedidos aos ex-combatentes do País; e outro assunto.,405413
4560,DIS,2013-12-03,Senado Federal,Preocupação com a situação dos imigrantes haitianos no Estado do Acre.,404795
4560,DIS,2013-11-20,Senado Federal,Defesa da implementação de mecanismos que tornem as emendas parlamentares mais transparentes à população; e outro assunto.,404582
4560,DIS,2013-10-09,Senado Federal,Reflexões acerca do fuso horário do Acre; e outros assuntos.,404063
4560,DIS,2013-04-23,Senado Federal,Relato das obras na BR-364; e outro assunto.,398780
4560,DIS,2013-03-05,Senado Federal,Cumprimentos ao Governador do Estado do Acre pela implementação do Programa BNDES Fase 5.,397446
4560,DIS,2012-08-29,Senado Federal,Defesa da regularização fundiária de propriedades no Estado de Rondônia; e outros assuntos.,394660
4560,PL,2012-04-18,Senado Federal,"Considerações acerca do superávit da balança comercial do Estado do Mato Grosso. (como Líder)
      ",392545
4560,DIS,2012-04-17,Senado Federal,"Apresentação de requerimentos de votos de aplausos ao sertanista Sr. José Carlos dos Reis Meirelles Júnior e à Comissão Pró-Índio; e outro assunto.
      ",392514
4560,DIS,2012-03-20,Senado Federal,"Anúncio da apresentação de projeto de decreto legislativo que convoca plebiscito sobre a alteração do horário legal dos Estados do Acre, do Amazonas e do Pará.
      ",393508
4560,PL,2012-03-13,Senado Federal,Apelo ao Governo Federal para que trate das carências e necessidades do Estado de Rondônia. (como Líder),391985
4560,DIS,2012-03-06,Senado Federal,Alerta para as condições precárias da BR-364 no Estado de Rondônia; e outro assunto.,391881
4560,PL,2012-02-28,Senado Federal,"Agradecimentos aos gestos de solidariedade com o povo do Acre por ocasião da alagação de rios da Amazônia.
      ",391768
4560,DIS,2011-12-14,Senado Federal,"Satisfação com o lançamento, pelo Governo Federal, do programa Ciência sem Fronteira.
      ",391271
4560,DIS,2011-08-02,Senado Federal,"Prestação de contas sobre os fatos que levaram S.Exa. a renunciar ao cargo de Ministro de Estado dos Transportes.
      	",389158
4560,DIS,2011-04-12,Senado Federal,"Apoio à iniciativa do Presidente José Sarney de realização de um novo plebiscito sobre a proibição de venda de armas no Brasil. (como Líder)
      ",387585
