codigoParlamentar,TipoUsoPalavra,DataPronunciamento,LocalPronunciamento,TextoResumo,CodigoPronunciamento
22,POB,2023-09-27,Senado Federal,"Orientação à bancada, pelo Partido PP, sobre o Projeto de Lei (PL) n° 2903, de 2023, que ""Regulamenta o art. 231 da Constituição Federal, para dispor sobre o reconhecimento, a demarcação, o uso e a gestão de terras indígenas; e altera as Leis nºs 11.460, de 21 de março de 2007, 4.132, de 10 de setembro de 1962, e 6.001, de 19 de dezembro de 1973.""",500874
22,POR,2023-09-26,Senado Federal,"Registro da presença em Plenário do Prefeito de Blumenau/SC, Mário Hildebrandt, e da rainha e princesas da Oktoberfest brasileira.",500798
22,POR,2023-09-19,Senado Federal,Registro da presença em Plenário de diretores de institutos federais do Estado de Santa Catarina.,500584
22,DIS,2023-09-19,Senado Federal,"Homenagem ao engenheiro agrônomo catarinense, Sr. Glauco Olinger, que completou 101 anos no último domingo.",500581
22,POR,2023-09-19,Senado Federal,"Pela ordem sobre o Requerimento (RQS) n° 809, de 2023, que ""Requer, nos termos do inciso IV e § 7º do art. 154 do Regimento Interno do Senado Federal, a realização de Sessão de Debates Temáticos, a ser realizada em data oportuna, a fim de debater os fenômenos climáticos como o 'ELNiño' e os desastres naturais cada vez mais frequentes no País e analisar propostas que tenham capacidade de aprimorar ferramentas de prevenção e reação por parte da sociedade e dos órgãos de Estado e de Defesa Civil, a fim de diminuir os efeitos nefastos e traumáticos causados pelos desastres naturais, como os que aconteceram e ainda assolam nossos irmãos gaúchos"".",500573
22,DIS,2023-09-13,Senado Federal,"Solidariedade ao Estado do Rio Grande do Sul em virtude da destruição causada pela passagem de um ciclone extratropical. Registro da apresentação do Requerimento nº 813, de 2023, que propõe a realização de sessão de debates temáticos sobre mudanças climáticas e medidas de prevenção e redução de danos de perturbações de natureza climática.",500545
22,POR,2023-09-12,Senado Federal,"Pedido de apreciação do Requerimento (RQS) n° 760, de 2023, que ""Requer, nos termos dos arts. 336, III e 338, III, do Regimento Interno do Senado Federal, urgência para o PRS 67/2023"".",500360
22,DIS,2023-09-12,Senado Federal,"Solicitação de assinaturas dos Parlamentares para uma PEC, a ser apresentada por S. Exa., que modifica o art. 95 da Constituição Federal para impedir a atuação dos magistrados em processos ligados, direta ou indiretamente, a cônjuges, companheiros ou parentes até o 2º grau. Ênfase à proteção da integridade do sistema judicial e dos operadores de direito, decorrente dessa Proposta.",500352
22,PEN,2023-08-30,Senado Federal,"Encaminhamento sobre o destaque para votação em separado constante do Requerimento nº 766, de 2023, (Requer destaque para votação em separado da Emenda nº 22-CAE.) ao Projeto de Lei (PL) n° 2384, de 2023, que ""Disciplina a proclamação de resultados de julgamentos na hipótese de empate na votação no âmbito do Conselho Administrativo de Recursos Fiscais (Carf); dispõe sobre a autorregularização de débitos e a conformidade tributária no âmbito da Secretaria Especial da Receita Federal do Brasil do Ministério da Fazenda, sobre o contencioso administrativo fiscal e sobre a transação na cobrança de créditos da Fazenda Pública; altera o Decreto nº 70.235, de 6 de março de 1972, e as Leis nºs 6.830, de 22 de setembro de 1980 (Lei de Execução Fiscal), 9.430, de 27 de dezembro de 1996, 13.988, de 14 de abril de 2020, 5.764, de 16 de dezembro de 1971, 9.249, de 26 de dezembro de 1995, e 10.150, de 21 de dezembro de 2000; e revoga dispositivo da Lei nº 10.522, de 19 de julho de 2002"".",500061
22,POR,2023-08-30,Senado Federal,"Pela ordem sobre o Projeto de Lei (PL) n° 2384, de 2023, que ""Disciplina a proclamação de resultados de julgamentos na hipótese de empate na votação no âmbito do Conselho Administrativo de Recursos Fiscais (Carf); dispõe sobre a autorregularização de débitos e a conformidade tributária no âmbito da Secretaria Especial da Receita Federal do Brasil do Ministério da Fazenda, sobre o contencioso administrativo fiscal e sobre a transação na cobrança de créditos da Fazenda Pública; altera o Decreto nº 70.235, de 6 de março de 1972, e as Leis nºs 6.830, de 22 de setembro de 1980 (Lei de Execução Fiscal), 9.430, de 27 de dezembro de 1996, 13.988, de 14 de abril de 2020, 5.764, de 16 de dezembro de 1971, 9.249, de 26 de dezembro de 1995, e 10.150, de 21 de dezembro de 2000; e revoga dispositivo da Lei nº 10.522, de 19 de julho de 2002"".",500038
22,POR,2023-08-30,Senado Federal,"Entrega ao Presidente Rodrigo Pacheco, por deliberação da Diretoria do Avaí Futebol Clube, em agradecimento à sessão solene em comemoração aos cem anos do time.",500027
22,POB,2023-08-29,Senado Federal,"Orientação à bancada, pelo Partido PP, sobre o Projeto de Lei Complementar (PLP) n° 257, de 2019, que ""Altera a Lei Complementar nº 101, de 04 de maio de 2000, e a Lei n° 12.340, de 1º de dezembro de 2010, para aperfeiçoar os meios técnicos e financeiros de resposta da União a calamidades públicas.""",500124
22,DIS,2023-08-29,Senado Federal,Sessão de Debates Temáticos destinada a debater a Reforma Tributária.,500085
22,NID,2023-08-28,Senado Federal,Encerramento da Sessão Especial destinada a comemorar o Centenário do Avaí Futebol Clube.,500008
22,NID,2023-08-28,Senado Federal,Apresentação de pêsames pelo falecimento da avó do Senador Jorge Seif.,500006
22,NID,2023-08-28,Senado Federal,Sessão Especial destinada a comemorar o Centenário do Avaí Futebol Clube.,500004
22,FP,2023-08-28,Senado Federal,Abertura da Sessão Especial destinada a comemorar o Centenário do Avaí Futebol Clube.,499997
22,PDI,2023-08-24,Senado Federal,"Discussão sobre a Medida Provisória (MPV) n° 1172, de 2023, Reajuste do valor do salário mínimo, que ""Dispõe sobre o valor do salário mínimo a vigorar a partir de 1º de maio de 2023.""",499846
22,PIC,2023-08-17,Senado Federal,Sessão de Debates Temáticos destinada a debater o tema da descriminalização do porte de drogas para consumo pessoal.,499819
22,POR,2023-08-16,Senado Federal,"Voto de pesar pelo falecimento do Prefeito de São José, Germano João Vieira, e do empresario Ademar Cassol.",499873
22,PIM,2023-08-10,Senado Federal,"Interpelação ao Presidente do Banco Central do Brasil, Roberto Campos Neto, sobre microcrédito e cooperativismo.",499634
22,POR,2023-08-09,Senado Federal,"Pela ordem sobre a Mensagem (SF) (MSF) n° 35, de 2023, que ""Submete à apreciação do Senado Federal, de conformidade com o art. 52, inciso III, alínea ""f"", da Constituição, combinado com o art. 6° da Lei Complementar nº 80, de 12 de Janeiro de 1994, o nome do Senhor IGOR ROBERTO ALBUQUERQUE ROQUE, Defensor Público Federal, para exercer o cargo de Defensor Público-Geral Federal da Defensoria Pública da União, na vaga decorrente do término do mandato de Daniel de Macedo Alves Pereira"".",499517
22,DIS,2023-08-03,Senado Federal,"Manifestação de pesar pelo falecimento do Sr. Miguel Livramento, jornalista esportivo catarinense.",499329
22,POR,2023-08-02,Senado Federal,"Elogio à manifestação do Presidente do Senado, Rodrigo Pacheco, sobre decisão proferida pelo Supremo Tribunal Federal a respeito do piso nacional da enfermagem, bem como sobre o julgamento em que se discute a descriminalização do porte de maconha para consumo próprio. Defesa do exercício da competência de sustar, por decreto legislativo, atos do Poder Judiciário que extrapolem competência normativa.",499405
22,DIS,2023-08-01,Senado Federal,"Pesar pelo falecimento do Sr. Hélio da Silva Winckler, Prefeito de Xanxerê-SC. Considerações sobre a necessidade de investimentos em infraestrutura no Estado de Santa Catarina, especialmente nos portos, aeroportos e rodovias.",499319
22,POR,2023-08-01,Senado Federal,"Defesa de que a descriminalização do porte de drogas para consumo próprio, em votação no Supremo Tribunal Federal, seja deliberada pelo Congresso Nacional.",499312
